,,,
Champ,Type prioritaire,Intitulé,Description
ID_REALISATRICE,Numérique,Identifiant,Identifiant de la réalisatrice dans la base de données incrémentale de Réalisatrices équitables
PRENOM_REALISATRICE,Texte,Prénom,Prénom de la réalisatrice du film
NOM_REALISATRICE,Texte,Nom,Nom de la réalisatrice du film
TITRE_ORIGINAL,Texte,Titre original,Titre original de la production
ANNEE,Numérique,Année de production,Année de production du film
TYPE,Texte,Type,"Type de production (documentaire, fiction, animation, etc.)"
GENRE,Texte,Genre,Genre du film de fiction
FORMAT,Texte,Format,"Durée approximative de la production, selon un classement par formats (courts, moyens, longs métrages)"
LANGUE_ORIGINALE,Texte,Langue originale,Langue principale parlée dans la production
LANGUE_AUTRE,Texte,Autre langue,Autres langues parlées dans la production et langue des sous-titres
EPISODES,Numérique,Épisodes,"Nombre d'épisodes, dans les cas de séries"