﻿NUMERO_ENTENTE,TYPE_ENTENTE,DESCRIPTION_ENTENTE,NOM_FOURNISSEUR,NUMERO_APPEL,DATE_CREATION,DATE_DEBUT,DATE_FERMETURE,MONTANT_INITIAL,MONTANT_DEPENSE,MONTANT_RESTANT;;;
24203189,Entente d'achat contractuelle,ACQUISITION D'UNE LICENCE ET ABONNEMENT,EDILEX INC.,GG-24-017,20240215090026,20240212000000,20270228000000,76385.43,21687.5,54697.93;;;
24203190,Entente d'achat contractuelle,ENTENTE D'EVALUATION TRAVAUX MAJEURES,HYDRO QUEBEC,GG-23-135,20240215092721,20240213000000,20290315000000,394878,394877.99,0.01;;;
24203261,Entente d'achat contractuelle,FOURNITURE ET LA LIVRAISON DE BALISES FLEXIBLES ET DE DÉLINÉATEURS,DEVELOTECH INC,APP-23-169,20240216133238,20240213000000,20250430000000,165253,0,165253;;;
24203472,Entente d'achat contractuelle,PARUTION DE CHRONIQUES ET PAGES PROMOTIONNELLES,GRAVITE MEDIA,GG-24-003,20240220141559,20240215000000,20250115000000,92969,0,92969;;;
24203491,Entente d'achat contractuelle,ENTRETIEN PREVENTIF ET CORRECTIF DES GROUPES ELECTROGENES ET MOTOPOMPES STATIONNAIRES,ENTREPRISES ELECTRIQUES L M INC. (LES),APP-22-115,20240220193329,20240219000000,20260228000000,132442.94,0,132442.94;;;
24203504,Entente d'achat contractuelle,DEVERROUILLAGE ET ANALYSE DE CELLULAIRE,CELLEBRITE USA INC,GG-24-007,20240221094037,20240216000000,20250131000000,39760,0,39760;;;
24203509,Entente d'achat contractuelle,NETTOYAGE DES BASSINS DE FILTRATION 1 ET 2 USINE LOUISE-GRAVEL,VEOLIA ES CANADA SERVICES,GG-23-103,20240221101906,20230213000000,20240628000000,28112.73,17753.73,10359;;;
24203525,Entente d'achat contractuelle,ACQUISITION D UN CAMION NAUTIQUE,PRECISIONS PROVENCAL INC,APP-23-137,20240221112627,20240216000000,20251231000000,355637.04,0,355637.04;;;
24203693,Entente d'achat contractuelle,MAINTENANCE ET ACTIVITES DE GESTION AU MARCHE PUBLIC,SINDE DOUAN MATHIAS,GG-24-024,20240222160214,20240221000000,20250331000000,43600,0,43600;;;
24201083,Entente d'achat contractuelle,ACQUISITION DE DEUX UNITÉS DE CLIMATISATION EN PRÉACHAT POUR LA FUTURE SALLE DES SERVEURS DE LA CENTRALE 9-1-1,ENERTRAK INC,APP-23-163,20240122090726,20240118000000,20270131000000,101910,101910,0;;;
"24201211,Entente d'achat contractuelle,""SERVICE D'OUVERTURE, FERMETURE ET ENTRETIEN DE FILETS ARRET-BALLES SUR TERRAINS DE BASEBALL / 2 ANS"",FILETS NAD S NETS,DP-24-001,20240123093919,20240222000000,20251231000000,56028,0,56028";;;
24201224,Entente d'achat contractuelle,LOCATION D'IMPRIMANTES MULTIFONCTIONS,COPICOM SOLUTION INC,GG-23-162,20240123103049,20240118000000,20290131000000,1328602.53,0,1328602.53;;;
24201229,Entente d'achat contractuelle,MAINTIEN DU SERVICE MICROSOFT 365,MICROSOFT CANADA INC,GG-23-166,20240123105837,20240118000000,20270130000000,4956180.36,0,4956180.36;;;
24201250,Entente d'achat contractuelle,FOURNITURE ET LIVRAISON DE POLYMERES ANIONIQUES ET CATIONIQUES AU CENTRE D'EPURATION RIVE-SUD,KEMIRA CHEMICALS CANADA INC,APP-23-148,20240123130850,20240123000000,20241231000000,661440,661440,0;;;
"24201272,Commande permanente,""FOURNITURE ET LIVRAISON D'HUILE, D'UREE ET DE LAVE-GLACE EN VRAC APP-23-135 (EQ-22-205) SD-2023-3628, CO-240116-6.2"",HARNOIS GROUPE PETROLIER.,APP-23-135 (EQ-22-205),20240123143323,20240116000000,20280116000000,394798,9980,384818";;;
24201339,Entente d'achat contractuelle,TRANSPORT ET DISPOSITION DE MATERIAUX ET SOLS SITES TRANSBORDEMENT,EXCAVATIONS DARCHE INC,GG-23-173,20240124101215,20240124000000,20241231000000,86141.47,83141.48,2999.99;;;
24201378,Entente d'achat contractuelle,REPARATION D'UN CHARGEUR SUR ROUES 16071,LONGUS EQUIPEMENT INC,GG-24-011,20240124125459,20240124000000,20240331000000,45019.48,45019.48,0;;;
"24201470,Entente d'achat contractuelle,SERVICE MEDECIN-CONSEIL,""CONSULTANTS MHD, EXPERTS EN MEDECINE"",GG-24-012,20240125090336,20240118000000,20251231000000,381720.37,0,381720.37";;;
24201505,Entente d'achat contractuelle,ENLEVEMENT D'OBJETS SUR TERRAINS ET BATIMENTS PRIVÉS,1-800-GOT JUNK,DP-23-115,20240125110000,20240125000000,20260409000000,57699,0,57699;;;
"24201544,Entente d'achat contractuelle,""CA-240118-6.14, APP-23-151, CONTRAT CADRE POUR DEVELOPPEURS"",CONSEILLERS EN GESTION ET,APP-23-151,20240125135944,20240118000000,20290117000000,712925,35520,677405";;;
"24201549,Entente d'achat contractuelle,""CA-240118-6.15, APP-23-152, CONTRAT CADRE POUR ANALYSTES INFORMATIQUES"",CONSEILLERS EN GESTION ET,APP-23-152,20240125140820,20240118000000,20250114000000,1505000,0,1505000";;;
"24201560,Entente d'achat contractuelle,""SERVICES PROFESSIONNELS POUR LA REALISATION DU SUIVI ENVIRONNEMENTAL DES EAUX SOUTERRAINES ET DE SURFACE DES LIEUX D'ELIMINATION DE NEIGE ARMAND-FRAPPIER, DU TREMBLAY ET MARIE-VICTORIN (ENV-00563)"",AVIZO EXPERTS-CONSEILS INC,APP-23-154,20240125151426,20240129000000,20261231000000,122760.03,40920.01,81840.02";;;
24201822,Entente d'achat contractuelle,CEINTURONS INTERNES ET EXTERNES,CUIRS MARIO INC (LES),DP-23-098,20240129194420,20240129000000,20270120000000,27287,3729,23558;;;
24201919,Entente d'achat contractuelle,LOCATION D'ESPACES DE STATIONNEMENT,SOCIETE PARC-AUTO DU QUEBEC,GG-23-176,20240131100959,20240126000000,20250130000000,25598.77,25598.76,0.01;;;
24201928,Entente d'achat contractuelle,CA-240118-6.7 APP-23-131 RAPPEL D'EFFECTIFS,TELUS COMMUNICATIONS INC,APP-23-131,20240131105127,20240118000000,20290117000000,92274.5,92274.5,0;;;
24201932,Entente d'achat contractuelle,ACQUISITION DE COUPE-FEU FORTIGATE AVEC CONTRAT DE MAINTENANCE / 5 ANS,PRECICOM TECHNOLOGIES INC,DP-23-131,20240131110246,20240131000000,20290131000000,84678,84678,0;;;
24201933,Entente d'achat contractuelle,REHAUSSEMENT DES LIENS DE TELEPHONIE,MINISTERE DE LA CYBERSECURITE ET DU NUMERIQUE,GG-24-006,20240131110409,20240131000000,20270115000000,46991.22,11623.32,35367.9;;;
24201942,Entente d'achat contractuelle,TRAVAUX D'ENTRETIEN DES SYSTEMES D'AVERTISSEMENT,CANADIEN NATIONAL,GG-24-010,20240131113054,20240131000000,20250131000000,88296.23,88296.23,0;;;
24201955,Entente d'achat contractuelle,SERVICES PROFESSIONNELS DE CONCILIATION ET D'ENQUETES DOSSIER DEONTOLOGIE POLICIERE,MINISTRE DES FINANCES DU QUEBEC,GG-23-159,20240131133600,20240130000000,20250130000000,55000,3675.7,51324.3;;;
"24201982,Entente d'achat contractuelle,SERVICES DACCOMPAGNEMENT POUR L'ÉLABORATION DU PLAN RÉGIONAL DES MILIEUX HUMIDES ET HYDRIQUES,""DEL DEGAN, MASSE ET ASSOCIES INC"",APP-22-067,20240131153632,20220720000000,20270131000000,62835,49366.4,13468.6";;;
24202025,Entente d'achat contractuelle,RENOUVELLEMENT DE L'ENTRETIEN AUX LOGICIELS DU MANUFACTURUER AUTODESK,GRAITEC INC,DP-23-134,20240201113439,20240201000000,20250228000000,38559.3,38559.3,0;;;
24202027,Entente d'achat contractuelle,CA-240118-6.8  APP-23-104 REMPLACEMENT DEBITMETRE USINE LE ROYER,HYDRO-MEC HP INC,APP-23-104,20240201114816,20240118000000,20240731000000,160686.9,160686.9,0;;;
24202086,Entente d'achat contractuelle,FOURNITURE ESTIVALE ENROBE BITUMINEUX ROUTIER ET DE LIANT ACCROCHAGE EN VRAC,PAVAGES METROPOLITAIN INC,APP-23-099,20240201161534,20240315000000,20251231000000,8149401,0,8149401;;;
24202088,Entente d'achat contractuelle,REMPLACEMENT DES TUBES DE LA CHAUDIERE K ET TRAVAUX CONNEXES AU CERS,GROUPE SIMONEAU INC,APP-23-158,20240201163228,20240201000000,20251231000000,1737882.31,1737882.3,0.01;;;
24202135,Entente d'achat contractuelle,ABONNEMENT BASE DE DONNES,SOCIETE CENTRIS INC,GG-24-018,20240202134534,20240115000000,20241231000000,29953.75,14976.88,14976.87;;;
"24202255,Entente d'achat contractuelle,""SUPPORT, ENTRETIEN ET EVOLUTION DES BASES DE DONNEES ORACLE ACTIVE DATAGUARD"",ORACLE CANADA ULC,GG-23-130,20240205094632,20240202000000,20250310000000,26069.88,26069.88,0";;;
24202349,Entente d'achat contractuelle,CONTRAT CADRE POUR SERVICES ET TRAVAUX SOUS MARINS,INDY-CO INC,APP-23-145,20240205144129,20240205000000,20270331000000,542383.5,0,542383.5;;;
"24202354,Entente d'achat contractuelle,""CO-240116-6.4, APP-23-107, TRAVAUX PAVAGE MANUEL ET MECANISE"",PAVAGES CEKA INC (LES),APP-23-107,20240205145229,20240116000000,20281231000000,4379978.74,0,4379978.74";;;
24202358,Entente d'achat contractuelle,SURVEILLANCE A DISTANCE USINE LOUISE-GRAVEL,SECURITE XGUARD INC,GG-24-019,20240205152122,20240131000000,20240831000000,35328,35328,0;;;
24202457,Entente d'achat contractuelle,TRAVAUX DE SCIAGE DE TROTTOIRS ET BORDURES,CONSTRUCTION S R B  SCC,DP-23-133,20240206134655,20240206000000,20241231000000,29720.5,0,29720.5;;;
24202560,Entente d'achat contractuelle,MUNITIONS DE PRATIQUE CALIBRE .300 BLACKOUT,KORTH GROUP,DP-23-127,20240207114112,,,76419,76419,0;;;
24202766,Entente d'achat contractuelle,SERVICES DE L'ASSOCIATION DESD POMPIERS AUXILIAIRES DE LA MONTEREGIE,APAM - ASS  DES POMPIERS AUXILIAIRES,GG-24-014,20240209091032,20240207000000,20250131000000,25850,25850,0;;;
24202829,Entente d'achat contractuelle,TRAVAUX DE RÉPARATION DE CLÔTURES,KSG INC,APP-23-140,20240209124308,20240124000000,20270405000000,268800,40262.22,228537.78;;;
24202905,Entente d'achat contractuelle,ABONNEMENT A DES RESSOURCES NUMERIQUES POUR LES USAGERS BIBLIOTHEQUES,BIBLIOPRESTO.CA,GG-24-015,20240212093900,20240212000000,20250131000000,85235.92,29847.16,55388.76;;;
24202908,Entente d'achat contractuelle,CONTRAT #1 CAMIONETTE DOMPTEUR - LOCATION DE VÉHICULES LEGERS AVEC EQUIPEMENTS,LOCATION SAUVAGEAU,,20240212094233,20240207000000,20241231000000,31980,31980,0;;;
24202912,Entente d'achat contractuelle,REPARATION CAMION ECUREUR POUR EGOUTS # 07050,EQUIPEMENTS C M INC (LES),GG-24-016,20240212101447,20240209000000,20240630000000,38161.24,38161.24,0;;;
"24202973,Entente d'achat contractuelle,""CA-231019-6.3, APP-23-094, ENTRETIEN COURS D EAU RIVIERE AU TRESOR ET RUISSEAU MASSE"",DRAINAGE RICHELIEU,APP-23-094,20240212151921,20231019000000,20241231000000,110376.53,0,110376.53";;;
24203023,Entente d'achat contractuelle,ACQUISITION ET LIVRAISON ARMES DE SERVICE ET ACCESSOIRES,RAMPART INTERNATIONAL CORP,APP-23-090,20240213114934,20240213000000,20250331000000,767355,0,767355;;;
24203064,Entente d'achat contractuelle,POLICE D'ASSURANCES - RESPONSABILITE CIVILE DES FIDUCIAIRES DES REGIMES DE RETRAITE,UNIVESTA,GG-24-020,20240213151311,20240213000000,20250131000000,34560,34560,0;;;
23220661,Entente d'achat contractuelle,REMPLACEMENT ECLAIRAGE ET SURFACE SYNTHETIQUE DU TERRAIN DE SOCCER AU PARC MARCEL SIMARD,EXCAVATION E S M INC,APP-23-098,20231213092356,20231207000000,20250930000000,1980215.91,1980215.91,0;;;
23220662,Entente d'achat contractuelle,REAMENAGEMENT TERRAINS DE TENNIS AU PARC CATHERINE PRIMOT,EXCAVATION E S M INC,APP-23-101,20231213094055,20231207000000,20250930000000,2182369.2,2182369.2,0;;;
23220665,Entente d'achat contractuelle,FOURNITURE ET LIVRAISON DE MELANGES DE TERRE ET PAILLIS / 2 ANS,MATERIAUX PAYSAGERS SAVARIA LTEE,DP-23-121,20231213104528,20240101000000,20251231000000,58663.35,29023.85,29639.5;;;
"23220666,Entente d'achat contractuelle,""SUPPORT, ENTRETIEN ET EVOLUTION DES SYSTEMES DE GESTION DES BASES DE DONNEES ORACLE"",MINISTERE DE LA CYBERSECURITE ET DU NUMERIQUE,GG-23-138,20231213104623,20231207000000,20241231000000,234046.08,0,234046.08";;;
23220670,Entente d'achat contractuelle,ACQUISITION D'UN VEHICULE UTILITAIRE,AUBIN ET ST PIERRE INC,DP-23-128,20231213112630,20231213000000,20240615000000,53918,53918,0;;;
23220757,Entente d'achat contractuelle,DEUX SUPPORTS DE TOITS TEMPORAIRES POUR LA CASERNE 22,GROUPE C & G BEAULIEU INC,GG-23-155,20231214112830,20231213000000,20240630000000,33836,33836,0;;;
23220797,Commande permanente,FOURNITURE ET LIVRAISON DE CONSTATS D'INFRACTION EN ROULEAU POUR IMPRIMANTE ELECTRONIQUE - SERVICE DE POLICE DE L'AGGLO LONGUEUIL,GESTION DES COMMUNICATIONS DATA CORP,APP-23-147 (EQ-23-214),20231214152439,20231208000000,20261208000000,168900,17900,151000;;;
23220889,Entente d'achat contractuelle,CA-231207-6.9 CONTRAT CADRE (ENVV-682) SP ETUDES GEOTECHNIQUES,GROUPE ABS INC,APP-23-133,20231215143552,20231207000000,20261206000000,2935287.5,0,2935287.5;;;
23220953,Entente d'achat contractuelle,ACHAT DE DOCUMENTS POUR LES BIBLIOTHEQUES,LIBRAIRIE BERTRAND,GG-23-171,20231218132103,20231218000000,20241231000000,90500,86200.74,4299.26;;;
23220956,Entente d'achat contractuelle,ACHAT DE DOCUMENTS POUR LES BIBLIOTHEQUES,LIBRAIRIE RENAUD BRAY,GG-23-172,20231218134750,20231218000000,20241231000000,79000,75247.05,3752.95;;;
"23220973,Entente d'achat contractuelle,""CEA-231108-6.2, APP-23-112, CONTRAT 1, ASSURANCE COLLECTIVE COLS BLANCS"",BENEVA INC,APP-23-112,20231218162207,20240101000000,20281231000000,27387252.88,0,27387252.88";;;
"23220995,Entente d'achat contractuelle,""CEA-231108-6.4, APP-23-113, CONTRAT 1, ASSURANCE COLLECTIVE DES POMPIERS"",BENEVA INC,APP-23-113,20231219094712,20240101000000,20281231000000,14750371.82,0,14750371.82";;;
"23220999,Entente d'achat contractuelle,""CEA-231108-6.5,APP-23-113, CONTRAT 2, ASSURANCES DECES ET MUTILATION POMPIERS"",BENEVA INC,APP-23-113,20231219095908,20240101000000,20281231000000,137862.14,0,137862.14";;;
23221008,Entente d'achat contractuelle,REVUE DE PRESSE ELECTRONIQUE,NOUVELLES MELTWATER CANADA INC,DP-23-125,20231219105346,20231219000000,20251231000000,39000,39000,0;;;
"23221009,Entente d'achat contractuelle,""CA-231116-6.7, APP-23-127, OPTION 2, VALORISATION DES RESIDUS DE CRD"",GFL ENVIRONMENTAL INC,APP-23-127,20231219110008,20240101000000,20261231000000,233700,0,233700";;;
23221014,Entente d'achat contractuelle,SERVICES EN ARCHITECTURE POUR LA REALISATION D'UNE ETUDE DE FAISABILITE- RENOVATION MAJEURE DE LA PISCINE DU CENTRE ROSANNE0LAFLAMME,PATRIARCHE ARCHITECTURE INC,DP-23-126,20231219132038,20231219000000,20240331000000,80987.5,80987.5,0;;;
"23221015,Entente d'achat contractuelle,""CEA-231108-6.3, APP-23-112, CONTRAT 2, ASS. COLLECTIVE DECES ET MUTILATION COLS BLANCS"",INDUSTRIELLE ALLIANCE ASSURANCE,APP-23-112,20231219132306,20240101000000,20281231000000,64825.4,0,64825.4";;;
23221019,Commande permanente,FOURNITURE ET LIVRAISON DE PIECES DE DEGRILLEURS POUR LES INCINERATEURS DU C.E.R.S. GG-23-150 (EQ-23-223),VEOLIA WATER TECHNOLOGIES CANADA INC,GG-23-150 (EQ-23-223),20231219134652,20231207000000,20241207000000,59318.54,7746.66,51571.88;;;
23221058,Entente d'achat contractuelle,TRAVAUX CORRECTIFS DE PLANTATION BOULEVARD EDOUARD,PEPINIERE JARDIN 2000 INC,DP-23-122,20231220111945,20231220000000,20240715000000,35772,35772,0;;;
24200084,Entente d'achat contractuelle,CA-231207-6.8 CONTRAT CADRE (ENV-681) SP ETUDES GEOTECHNIQUES,ENGLOBE CORP,,20240108104614,20231207000000,20261206000000,2854708.75,96954.74,2757754.01;;;
24200232,Entente d'achat contractuelle,TRAVAUX SPÉCIALISÉS D'EXCAVATION ET DE RÉPARATION DE CONDUITES D'AQUEDUC ET D'ÉGOUTS,EXCAVATION JONDA INC,APP-23-126,20240109133039,20231205000000,20270228000000,1590225,491271.7,1098953.3;;;
24200350,Entente d'achat contractuelle,SERVICES JURIDIQUES EN MATIERE DE RELATIONS DE TRAVAIL ET SANTE,DUNTON RAINVILLE SENCRL,GG-23-165,20240111093015,20231208000000,20240630000000,61500,0,61500;;;
24200425,Entente d'achat contractuelle,ENFOUISSMENT D'UN SERVICE D'UTILITE PUBLIQUE,BELL CANADA,GG-23-136,20240111133527,20240110000000,20240630000000,78016.35,78016.35,0;;;
24200682,Entente d'achat contractuelle,SERVICE DE NETTOYAGE OU DE POMPAGE AVEC CAMION ECUREUR ET UNITE SOUS VIDE AUX INSTALLATIONS DE PRODUCTION D'EAU POTABLE ET D'ASSAINISSEMENT DES EAUX USEES (OPTION 2),BEAUREGARD ENVIRONNEMENT LTEE,APP-23-118,20240116092253,20240116000000,20251018000000,722175,102000,620175;;;
24200698,Entente d'achat contractuelle,ACQUISITION D'ORDINATEURS PORTABLES,MICRO LOGIC SAINTE-FOY LTEE,GG-24-002,20240116101445,20240115000000,20240531000000,31015.8,31015.8,0;;;
24200851,Entente d'achat contractuelle,SERVICES TECHNIQUES POUR LA RÉALISATION D¿INSPECTION D¿ÉQUIPEMENT PÉTROLIER,LALONDE MARC,DP-23-117,20240117141635,20231218000000,20270131000000,56020,0,56020;;;
24200868,Entente d'achat contractuelle,TRAVAUX DE REMISE A NIVEAU / PANNEAU POMPE P26,MOTEURS ELECTRIQUES LAVAL LTEE,DP-23-123,20240117153050,20240117000000,20241231000000,44331.1,44331.1,0;;;
24200922,Entente d'achat contractuelle,CONTRAT 2 REBOISEMENT DANS DIVERS PARCS ET PARCS NATURE,TERRASSEMENTS ATLANTICO (LES),APP-23-114,20240118094337,20231205000000,20251231000000,114641.89,114641.89,0;;;
24200927,Entente d'achat contractuelle,CONTRAT 1 TRAVAUX DE REBOISEMENT DE DIVERS PARCS ET PARCS NATURE,TERRASSEMENT TECHNIQUE SYLVAIN,APP-23-117,20240118101928,20231205000000,20251231000000,163315.96,163315.96,0;;;
24200928,Entente d'achat contractuelle,ELABORATION DU PLAN D'ACTION DU DEPLOIEMENT BIM,DETEO INC,GG-24-008,20240118102752,20240117000000,20240731000000,26180,26180,0;;;
24200976,Entente d'achat contractuelle,ENTRETIEN DES SYSTEMES D'AVERTISSEMENT AVEC OU SANS BARRIERE AUX PASSAGES A NIVEAU,CANADIEN NATIONAL,GG-24-009,20240119090655,20240118000000,20240229000000,26337,26337,0;;;
24200981,Entente d'achat contractuelle,GESTION D'OPERATION ET ENTRETIEN DU PARC MICHEL-CHARTRAND ET DE LA CITE,CENTRE COMMUNAUTAIRE LE TRAIT D UNION,GG-23-154,20240119094737,20240116000000,20290430000000,6898628.5,1096237.5,5802391;;;
24200985,Entente d'achat contractuelle,FOURNITURE D'UNE APPLICATION DE GESTION ET SERVICE D'ENTRETIEN DES HORODATEURS,PRECISE PARKLINK INC,FU-23-009,20240119102116,20240119000000,20260119000000,189346,0,189346;;;
"24200997,Entente d'achat contractuelle,""CE-240110-4.3, CE-240110-4.4, CE-240110-4.5, APP-23-155, CAMP DE JOUR"",GROUPE DOMISA INC,APP-23-155,20240119120920,20240110000000,20261231000000,3976442,257300,3719142";;;
24201000,Entente d'achat contractuelle,ACQUISITION DE LIVRES,LIBRAIRIE LE FURETEUR,GG-23-168,20240119131406,20240116000000,20241231000000,197000,187641.39,9358.61;;;
24201002,Entente d'achat contractuelle,TRAVAUX D'ENTRETIEN DE L'APPAREILLAGE DE DISTRIBUTION ELECTRIQUE ET TRAVAUX ELECTRIQUES DPECIALISES AUX OUVRAGES DE PRODUCTION ET DISTRIBUTION D'EAU POTABLE,SIMAC ELECTROTECHNIQUE INC,DP-23-124,20240119133025,20240119000000,20241231000000,78458,3680,74778;;;
24201008,Entente d'achat contractuelle,ACQUISITION DE LIVRES,LIBRAIRIE ALIRE INC,GG-23-169,20240119133209,20240116000000,20241231000000,554500,475770.92,78729.08;;;
24201010,Entente d'achat contractuelle,ACQUISITION DE LIVRES,LIBRAIRIE COOPERATIVE EDOUARD-MONTPETIT,GG-23-170,20240119140021,20240116000000,20241231000000,96000,90839.46,5160.54;;;
23219148,Entente d'achat contractuelle,PRISE EN CHARGE LORS DU SINISTRE RUE VILLENEUVE,CROIX-ROUGE CANADIENNE,GG-23-132,20231121094619,20231120000000,20231229000000,76488.77,76488.77,0;;;
"23219190,Entente d'achat contractuelle,""SUPPORT, ENTRETIEN ET EVOLUTION DU PROGICIEL RAO"",SOLUTIONS EMERGENSYS INC,GG-23-127,20231121132625,20231116000000,20241231000000,252066.9,252066.9,0";;;
"23219217,Entente d'achat contractuelle,""CO-231114-6.2, APP-23-100, TRAVAUX DE THERMORAPIECAGE"",ENVIRONNEMENT ROUTIER NRJ INC,APP-23-100,20231121152416,20231114000000,20261231000000,523430,164000,359430";;;
23219218,Entente d'achat contractuelle,MODIFICATION DU TRANSFERT ENTRE ICO CONSEIL SANS PAPIER ET CONSTELLIO,ICO TECHNOLOGIES INC,GG-23-140,20231121160722,20231121000000,20240131000000,37000,37000,0;;;
23219339,Entente d'achat contractuelle,AMENAGEMENT D'EQUIPEMENT DE DENEIGEMENT POUR 4 CAMIONNETTES,INNOVATION SPREADTEK INC,APP-23-109,20231122160729,20231122000000,20241122000000,124711.38,124711.38,0;;;
23219553,Entente d'achat contractuelle,DROIT D'UTILISATION DU LOGICIEL WONDERWARE,WONDERWARE CANADA EST,GG-23-125,20231128110847,20231123000000,20261231000000,65532.36,65532.35,0.01;;;
23219600,Entente d'achat contractuelle,TRAVAUX DE MODIFICATION DE LA LIGNE SOUTERRAINE-RECONFIGURATION GEOMETRIQUE DE LA RUE DE SERIGNY,HYDRO QUEBEC,GG-23-153,20231129090256,20231127000000,20241127000000,46546,0,46546;;;
23219652,Entente d'achat contractuelle,FOURNITURE ET LIVRAISON DE PASS-10,KEMIRA WATER SOLUTION CANADA INC,APP-23-124,20231129142751,20231129000000,20251231000000,380343.59,102060,278283.59;;;
23219657,Entente d'achat contractuelle,ENTRETIEN SANITAIRE DES ESPACES COMMUNS DU MARCHE PUBLIC DE LONGUEUIL,SERVICE D'ENTRETIEN MENAGER VIMONT INC,APP-23-130,20231129143921,20231130000000,20271130000000,380690,75325,305365;;;
23219695,Entente d'achat contractuelle,AFFECTATION D'UN INTERVENANT A L'EQUIPE GROUPE CONTACT,CISSS DE LA MONTEREGIE EST,GG-23-156,20231130095242,,,454527,0,454527;;;
23219751,Entente d'achat contractuelle,SERVICES PROFESSIONNELS POUR ETUDE ARC ELECTRIQUE ET MISE A JOUR ET DEVIS POUR CORRECTIFS INSTALLATIONS DE LA GDE,SERVICES EXP INC (LES),APP-23-084,20231130134707,20231123000000,20251231000000,768170.07,0,768170.07;;;
23219762,Entente d'achat contractuelle,FOURNITURE ET LIVRAISON HYPOCHLORITE DE SODIUM,UBA INC,APP-23-123,20231130142530,20231130000000,20251231000000,1897330,483935,1413395;;;
23219776,Entente d'achat contractuelle,CHEMISES A DOSSIER DE FORMAT LEGAL IDENTIFIEES POUR LE SERVICE DE POLICE DE AGGLOMERATION,GROUPE MAGNITUDE INC,APP-23-091,20231130145013,20231130000000,20270228000000,116220.07,38528.26,77691.81;;;
23219813,Entente d'achat contractuelle,FORMATION EN IDENTITE JUDICIAIRE,RECEVEUR GENERAL DU CANADA,GG-23-158,20231201090350,20231123000000,20240302000000,31400.4,0,31400.4;;;
"23219853,Entente d'achat contractuelle,""CA-231116-6-7, APP-23-127-OPTION 2, RECEPTION ET VALORISATION AUX ECOCENTRES"",GFL ENVIRONMENTAL INC,APP-23-127,20231201142549,20240101000000,20261231000000,233700,0,233700";;;
23219981,Entente d'achat contractuelle,REFECTION DU TERRAIN DE VOLLEYBALL DE PLAGE AU PARC DES GLAIEULS (2023-PAR-619),9032-2454 QUEBEC INC. (TECHNIPARC),APP-23-132,20231204163324,20231204000000,20241231000000,122752.55,122752.55,0;;;
23220024,Entente d'achat contractuelle,FOURNITURE DE TROIS PANNEAUX D'AFFICHAGE PANEL VIEW,LUMEN DIVISION DE SONEPAR CANADA INC,GG-23-147,20231205110534,20231204000000,20241231000000,31844.23,31844.23,0;;;
23220033,Entente d'achat contractuelle,ACQUISITION DU MODULE EPROPRIETE,PG SOLUTIONS INC,GG-23-160,20231205132556,20231214000000,20261231000000,60280,14640,45640;;;
23220056,Entente d'achat contractuelle,ACQUISITION D'UN RECEPTEUR GNSS LEICA PRECISION ARPENTAGE,AB TECH SERVICES,GG-23-161,20231205144842,20231201000000,20240131000000,32360.01,32360,0.01;;;
23220057,Entente d'achat contractuelle,FOURNITURE ET LIVRAISON D'HYDROXYDE DE SODIUM 50% (BASE SECHE) / 2023-GDE-504,PRODUITS CHIMIQUES SODROX,APP-23-143,20231205145920,20231205000000,20250228000000,69400,27600,41800;;;
23220098,Entente d'achat contractuelle,SEL DE DEGLACAGE 2023-2024 - REGROUPEMENT UMQ,SEL WINDSOR LTEE,,20231206102141,20231206000000,20241206000000,1735800,381008.1,1354791.9;;;
23220134,Entente d'achat contractuelle,UNITE AUTONOME - TRAVAUX CONNEXES,INDUSTRIES FOURNIER INC (LES),GG-23-157,20231206115814,20231206000000,20240206000000,36920,36920,0;;;
"23220224,Entente d'achat contractuelle,""CA-231116-6.8, APP-23-128, MAIN D OEUVRE ENTRETIEN INSTALLATION PETROLIERE"",CONSTRUCTION PETRO HITECH,APP-23-128,20231207110218,20240101000000,20261231000000,140370,0,140370";;;
23220236,Entente d'achat contractuelle,SUPPORT ET ENTRETIEN DU SYSTEME DE GESTION INTEGREE DES BIBLIOTHEQUES,SIRSIDYNIX (CANADA) INC,GG-23-144,20231207113811,20231205000000,20241231000000,70395.27,70395.27,0;;;
"23220246,Entente d'achat contractuelle,""RENOUVELLEMENT / CONTRAT DE SUPPORT, ENTRETIEN ET EVOLUTION DU PROGICIEL CONSTELLIO / 2024"",CONSTELLIO INC,GG-23-151,20231207133815,20231207000000,20241231000000,38000,38000,0";;;
23220251,Entente d'achat contractuelle,SERVICE DE COURTAGE POUR CAMIONNAGE DE NEIGE EN VRAC,POSTE DE CAMIONNAGE EN VRAC REGION 06,GG-23-164,20231207135042,20231101000000,20240430000000,1043705.15,784855.34,258849.81;;;
23220327,Entente d'achat contractuelle,FOURNITURE D'UN COMPRESSEUR A AIR A VITESSE VARIABLE,ENTREPRISES LARRY INC,GG-23-163,20231208094034,20231207000000,20241207000000,62778.66,62778.66,0;;;
"23220336,Entente d'achat contractuelle,""CA-171207-6.1 CONTRAT CADRE APP-17-191 (2017-BAT-902) POUR LA FOURNITURE DE SERVICES PROFESSIONNELS EN ARCHITECTURE POUR DES ETUDES PREPARATOIRES, LA PREPARATION DE PLANS ET DEVIS, LA SURVEILLANCE DE TRAVAUX DE CONSTRUCTION ET SERVICES"",CARDIN JULIEN INC,APP-17-191,20231208102350,20231001000000,20240430000000,428615.48,2000,426615.48";;;
23220342,Entente d'achat contractuelle,SUPPORT ET ENTRETIEN DES SYSTEMES GUIDE TI,COGEP INC,GG-23-143,20231208103933,20231205000000,20241231000000,67615,67615,0;;;
23220365,Entente d'achat contractuelle,SUPPORT ET ENTRTIEN DU SYSTEME HORAIRE ET DES HORODATEURS COLS BLEUS,ICO TECHNOLOGIES INC,GG-23-131,20231208112446,20231207000000,20241231000000,41400,41400,0;;;
23220373,Entente d'achat contractuelle,RENOUVELLEMENT ABONNEMENT AUX LOGICIELS D'EDITION GRAPHIQUE DU MANUFACTURIER ADOBE,SOLUTIONS INFORMATIQUES INSO INC,DP-23-120,20231208114155,20231218000000,20241231000000,52128.77,49357.81,2770.96;;;
23220375,Entente d'achat contractuelle,TRAVAUX CORRECTIFS SUR LE LIEN PIETONNIER DES MOLENES (2023-PAR-632),EXCAVATION JONDA INC,APP-23-129,20231208115347,20231208000000,20241231000000,90933.7,90933.7,0;;;
23220499,Entente d'achat contractuelle,PROCESSUS DE SELECTION DES FONCTIONS DE POLICIERS,ECOLE NATIONALE DE POLICE DU QUEBEC,GG-23-146,20231211110944,20231207000000,20241231000000,83300.72,83300.72,0;;;
"23220508,Entente d'achat contractuelle,""SUPPORT, ENTRETIEN ET EVOLUTION DES PROGICIELS DE GEOMATIQUE"",ESRI CANADA LIMITEE,GG-23-133,20231211114652,20231207000000,20241231000000,283555.46,283555.46,0";;;
23220509,Entente d'achat contractuelle,CA-231207-6.6 VÊTEMENTS ET CHAUSSURES COLS BLEUS,EQUIPEUR (L'),APP-23-018,20231211114831,20240101000000,20241231000000,286331.46,265619.13,20712.33;;;
23220526,Entente d'achat contractuelle,CHARGEMENT ET TRANSPORT DE TERRE RECUPEREE AUX ECOCENTRES,TRANSPORT MAURICE RACICOT ET FILS INC,GG-23-167,20231211143210,20231211000000,20240131000000,28337.64,28337.64,0;;;
