﻿NUMERO_ENTENTE,TYPE_ENTENTE,DESCRIPTION_ENTENTE,NOM_FOURNISSEUR,NUMERO_APPEL,DATE_CREATION,DATE_DEBUT,DATE_FERMETURE,MONTANT_INITIAL,MONTANT_DEPENSE,MONTANT_RESTANT;;;21214581,Entente d'achat contractuelle,FOURNITURE ET INSTALLATION DE UNE AIRE HABILETE - PARC MICHEL-CHARTRAND,ATMOSPHARE,DP-21-083,20210930164106,20210928000000,20220930000000,56534.03,56534.03,0;;;
21214586,Entente d'achat contractuelle,LOCATION DE DEUX TRACTEURS SANS OPERATEUR,9115-7883 QUEBEC INC,DP-21-089,20211001075405,20210930000000,20220414000000,68000,61200,6800;;;
21214645,Entente d'achat contractuelle,APP-21-043 - CO-210914-6.1 - FOURNITURE DE LUMINAIRES ROUTIERS DEL,WESCO DISTRIBUTION CANADA LP,APP-21-043,20211004091740,20210914000000,20251031000000,3024465.58,3024465.58,0;;;
21214750,Entente d'achat contractuelle,FOURNITURE ET LIVRAISON D'EQUIPEMENT D'ETANCONNEMENT,TOROMONT INDUSTRIES LTD,DP-21-102,20211005090704,20211004000000,20221004000000,26598.38,26598.38,0;;;
"21214765,Entente d'achat contractuelle,""FOURNITURE DE PAPETERIE, IMPRESSION, MISE SOUS PLI ET MISE A LA POSTE DES COMPTES DE TAXES"",IMPRIMES ADMINISTRATIFS CONTINUUM LTEE,DP-21-100,20211005105848,20211005000000,20240831000000,67779,65392.41,2386.59";;;
21214858,Entente d'achat contractuelle,FOURNITURE ET LIVRAISON DE GANTS D'HIVER,SPORTS EXPERTS,DP-21-106,20211006110438,20211006000000,20241015000000,42339.5,21684.35,20655.15;;;
21214990,Entente d'achat contractuelle,REHABILITATION ENVIRONNEMENTALE 550 RUE DU PARC INDUSTRIEL (OPTION 1- DISPOSITION DEBRIS DE VERRE),SANEXEN SERVICES ENVIRONNEMENTAUX INC,APP-21-112,20211008100517,20211005000000,20240331000000,2768332.24,2768332.24,0;;;
21211657,Entente d'achat contractuelle,SD-2021-2256 / DP-21-082 (2021-GEN-306) /  CONTROLE QUALITATIF DES MATERIAUX DANS LE CADRE DU PROJET DE REFECTION DE LA RUE DE L'ENA ET DU PROLONGEMENT DU BOUL. BELIVEAU,DEC ENVIRO,,20210722103832,20210721000000,20220331000000,61369.6,61369.6,0;;;
21211664,Entente d'achat contractuelle,RENOUVELLEMENT CONTRAT D'ENTRETIEN ET EVOLUTION / SYSTEME IFIX SCADA / 14 AOUT 2021 AU 13 AOUT 2024,GRAY MATTER SYSTEMS CANADA,GG-21-067,20210722112305,20210728000000,20240814000000,39039.46,39039.46,0;;;
21211708,Entente d'achat contractuelle,SD-2021-1958 / DP-21-069 (EQ-20-12) / LOCATION D'UNE PELLE HYDRAULIQUE SANS OPERATEUR,EQUIPEMENT ST-GERMAIN INC,,20210722144955,20210722000000,20220331000000,85400,85400,0;;;
21211745,Entente d'achat contractuelle,APP-21-071 - CO-210706-6.13 - DISPOSITION DE SOLS ET LE TRANSPORT DE MATÉRIAUX SUR LE SITE JULIEN-LORD,175784 CANADA INC,APP-21-071,20210723100644,20210706000000,20230706000000,3348980.91,3070739.31,278241.6;;;
21211882,Entente d'achat contractuelle,SD-2021-2315 / DP-21-084 / SERVICES PROFESSIONNELS DE LABORATOIRE POUR LE CONTROLE DE ;A QUALITE DES MATERIAUX POUR LES TRAVAUX DE RESURFACAGE LOT II (2021-GEN-129),DEC ENVIRO,,20210728083138,20210727000000,20220228000000,38882.1,33303.38,5578.72;;
21211894,Entente d'achat contractuelle,APP-21-075 - CO-210706-6.14 - RÉHABILITATION ENVIRONNEMENTALE D'UNE PARTIE DU LOT 6 395 618 DU CADASTRE DU QUÉBEC,SANEXEN SERVICES ENVIRONNEMENTAUX INC,APP-21-075,20210728120132,20210706000000,20230731000000,112613.6,98416.17,14197.43;;;
21211967,Entente d'achat contractuelle,FOURNITURE ET LIVRAISON DE HYDROXYDE DE SODIUM,BRENNTAG CANADA INC,,20210729163847,20210722000000,20230331000000,71000,71000,0;;;
21212059,Entente d'achat contractuelle,SD-2021-2313 / GG-21-071 / RENOUVELLEMENT DE L'ENTRETIEN DU SYSTEME UFED 4PC ULTIMATE,CELLEBRITE USA INC,,20210803083959,20210803000000,20241030000000,25831.7,22200,3631.7;;;
21212074,Entente d'achat contractuelle,SERVICES EN AUTOMATISATION / OUVRAGES ASSAINISSEMENT EAUX USÉES,WSP CANADA INC,DP-21-062,20210803101845,20210803000000,20240803000000,74110.8,37204.68,36906.12;;;
21212106,Entente d'achat contractuelle,FOURNITURE ET LIVRAISON DE MEDIA A CERTAINS OUVRAGES D¿ASSAINISSEMENT DES EAUX USEES,GROUPE CARBONE CONTINENTAL INC,APP-21-092,20210803145630,20210722000000,20220721000000,72936,60204,12732;;;
21212117,Entente d'achat contractuelle,ETUDE DEMOGRAPHIQUE,BC2 GROUPE CONSEIL INC,DP-21-091,20210804091837,20210804000000,20220630000000,36600,36600,0;;;
21212146,Entente d'achat contractuelle,FOURNITURE ET LIVRAISON DE SILICATE DE SODIUM,UNIVAR CANADA LTEE,APP-21-077,20210804170823,20210715000000,20221231000000,59845.5,40662.14,19183.36;;;
21212236,Entente d'achat contractuelle,ÉLABORATION D'UN BRANDING / QUESTIONNAIRE / MICROSITE / CONSULTATION JEUNESSE 2021,YANKEE MEDIA INC,GG-21-072,20210809094938,20210805000000,20220831000000,25570,25570,0;;;
"21212243,Entente d'achat contractuelle,""APP-21-069 - CO-210706-6.12 - RÉHABILITATION D'UN ABRI À SEL SITUÉ AU 6355, BOULEVARD MARICOURT"",CONSTRUCTION ARCADE (9140-2594),APP-21-069,20210809105236,20210706000000,20230831000000,216425,167867.23,48557.77";;;
"21212298,Entente d'achat contractuelle,""CONTROLE QUALITATIF DES MATERIAUX / AMENAGEMENT ET REFECTION DE PARCS, VOIES CYCLABLES ET ESPACES PUBLICS"",GROUPE ABS INC,DP-21-088,20210810093300,20210803000000,20220810000000,47471.4,45161.9,2309.5";;;
21212308,Entente d'achat contractuelle,ACQUISITION DE DEGRILLEURS ET EQUIPEMENTS CONNEXES POUR LE CERS,VEOLIA WATER TECHNOLOGIES CANADA INC,FU-21-003,20210810134047,20210708000000,20230930000000,1545112.98,1545112.98,0;;;
21212312,Entente d'achat contractuelle,SERVICES INTERVENTION EN CAS URGENCE LORS DE LA PENURIE DE LOGEMENTS,CROIX-ROUGE CANADIENNE,GG-21-044,20210810165555,20210615000000,20211231000000,300000,0,300000;;;
21212313,Entente d'achat contractuelle,SURVEILLANCE / ENTRETIEN / AFFICHAGE AUX SITES APPORT VOLONTAIRE DE VERRE,GVE CONTENEUR INC,GG-21-068,20210811093618,20210802000000,20230228000000,35400,28050,7350;;;
21212389,Entente d'achat contractuelle,FOURNITURE DES ELEMENTS D'ENTRAINEMENT DES MELANGEURS RAPIDES,MOTION INDUSTRIES (CANADA) INC,,20210812131613,20210811000000,20220811000000,72172.08,57999.06,14173.02;;;
21212392,Entente d'achat contractuelle,GG-21-070GG-21-070 - CA-210422-6.4 - FORMATION AUX POLICIERS DU SERVICE DE POLICE,ECOLE NATIONALE DE POLICE DU QUEBEC,,20210812134652,20210422000000,20220131000000,200043.49,98049.98,101993.51;;;
21212393,Entente d'achat contractuelle,ENTRETIEN SANITAIRE DU MARCHE PUBLIC,SERVICES D'ENTRETIEN ALPHANET INC,DP-21-073,20210812135301,20210812000000,20220430000000,53810,53060,750;;;
21212412,Entente d'achat contractuelle,SERVICES INTERVENTION EN CAS URGENCE LORS DE LA PENURIE DE LOGEMENTS,CROIX-ROUGE CANADIENNE,GG-21-044,20210812163733,20210615000000,20230301000000,300000,108703.7,191296.3;;;
"21212491,Entente d'achat contractuelle,""CO-210615-6.3, CA-210617-6.6, APP-21-031, AMENAGEMENT SALLE SERVEUR 699 C.POIRIER"",RENOVATION ALEXANDRE LEVEILLE INC,APP-21-031,20210816144042,20210617000000,20230630000000,377781.78,377781.78,0";;;
21212512,Entente d'achat contractuelle,DEMOLITION D UN ANCIEN BATIMENT INDUSTRIEL,DEMOLITION ET EXCAVATION DEMEX INC,APP-21-078,20210816163951,20210706000000,20220706000000,856225.7,856225.7,0;;;
21212534,Entente d'achat contractuelle,ENTRETIEN ET REPARATION DE VEHICULES D'URGENCE,GARAGE MAX,GG-21-069,20210817101252,20210805000000,20220731000000,84176.4,40343.26,43833.14;;;
"21212601,Entente d'achat contractuelle,""CO-210706-6.11, APP-21-068_2021-PAR-606, FOURNITURE INSTALLATION BASE BETON"",NOVOTECH TECHNOLOGIES CORPORATION,APP-21-068,20210818101731,20210706000000,20211231000000,256696,0,256696";;;
"21212691,Entente d'achat contractuelle,""CO-210706-6.7, APP-21-065_2021-PAR-605, AIRES DE JEU ET PLANCHODROMES PARC PIERRE-ET-BERNARD-LUCAS"",AMENAGEMENTS SUD-OUEST,APP-21-065,20210819141607,20210706000000,20220430000000,1015301.1,1015301.1,0";;;
21212864,Entente d'achat contractuelle,SEL DE DÉGLACAGE  2021-2022  / APPEL OFFRES DU REGROUPEMENT UMQ CS-20212022,SEL WINDSOR LTEE,,20210824163148,20210825000000,20220531000000,1693720,1480080.05,213639.95;;;
"21212878,Entente d'achat contractuelle,""CO-210706-6.3, APP-21-026, AMENAGEMENTS PAYSAGERS GRANDE -ALLEE"",PEPINIERE JACQUES-CARTIER (1984) INC,APP-21-026,20210825100912,20210706000000,20221231000000,879006.61,350990.94,528015.67";;;
21212972,Entente d'achat contractuelle,ACQUISITION D'UNE STATION TOTALE ROBOTISÉE,AB TECH SERVICES,GG-21-059,20210826133106,20210826000000,20211231000000,26065,26065,0;;;
21213008,Entente d'achat contractuelle,GESTION DES BERNACHES,ARTEMIS FAUNE INC,DP-21-080,20210827115418,20210827000000,20221231000000,33577.95,12425.15,21152.8;;;
21213025,Entente d'achat contractuelle,ACQUISITION ROUTER VOIX,SOFTCHOICE LP,DP-21-086,20210830094802,20210830000000,20211231000000,26543.56,26543.56,0;;;
"21213070,Entente d'achat contractuelle,""CO-210706-6.11, APP-21-068_2021-PAR-606, FOURNITURE INSTALLATION BASE BETON"",CONSTRUCTION NOVOTEK INC,APP-21-068,20210830161815,20210706000000,20220228000000,256696,251386.44,5309.56";;;
21213082,Entente d'achat contractuelle,INVENTAIRE / SURVEILLANCE ARCHEOLOGIQUE / PARC ST-MARK,ARTEFACTUEL COOP DE TRAVAIL,GG-21-074,20210831083809,20210831000000,20221231000000,65517.5,47880,17637.5;;;
21213124,Entente d'achat contractuelle,APP-20-221 (2021-TP256) - VL-210202-6.1 GP-210705-6.2 - SH-210705-6.2 - COLLECTE ET LE TRANSPORT DES RÉSIDUS VERTS POUR LA VILLE DE LONGUEUIL,SERVICES RICOVA INC,APP-20-221,20210831153125,20210202000000,20260531000000,6964595.63,5471714.34,1492881.29;;;
"21213182,Entente d'achat contractuelle,""CO-210824-6.5, APP-21-070, BALAYEUR LASER TERRESTRE"",AB TECH SERVICES,APP-21-070,20210901151954,20210824000000,20211231000000,129139.95,129139.35,0.6";;;
21213251,Entente d'achat contractuelle,APP-21-097 - SH-210823-6.1 - VL-210817-6.1 - TRANSPORT DES CONTENEURS TRANSROULIERS (ROLL-OFF),GFL ENVIRONMENTAL INC,APP-21-097,20210902160430,20210901000000,20230930000000,113497.2,42295.6,71201.6;;;
21213271,Entente d'achat contractuelle,REFECTION DU CENTRE RENE VEILLET,TREMPRO CONSTRUCTION INC.,APP-21-062,20210903090151,20210824000000,20220823000000,4659037.14,4659037.14,0;;;
21210902,Entente d'achat contractuelle,FOURNITURE ET INSTALLATION DE STRUCTURES RECREATIVES DANS DES AIRES DE JEUX POUR ENFANTS DE DIVERS PARCS CONTRAT 1,EQUIPEMENTS RECREATIFS JAMBETTE INC,APP-21-042,20210707131747,20210615000000,20230615000000,133977.24,130977.24,3000;;;
21210949,Entente d'achat contractuelle,SERVICES D'ACCOMPAGNEMENT / MISE EN OEUVRE PLAN D'ACTION - CHANGEMENTS DE COLLECTES,NATURE-ACTION QUEBEC,GG-21-058,20210708091223,20210709000000,20220709000000,95349.2,95349.2,0;;;
21210963,Entente d'achat contractuelle,CONTRAT 1 - INSPECTION PAR CAMÉRA À TÉLÉOBJECTIF DES REGARDS DU RÉSEAU D'ÉGOUTS,SIMO MANAGEMENT INC,APP-21-029,20210708101354,20210615000000,20211231000000,226553.8,146095.5,80458.3;;;
21210966,Entente d'achat contractuelle,TRAVAUX DE REPARATION DE TROTTOIRS ET BORDURES,ENVIRONNEMENT ROUTIER NRJ INC,DP-21-057,20210708105556,20210708000000,20220422000000,61410,59129.25,2280.75;;;
21210972,Entente d'achat contractuelle,PLANAGE ET RESURFAÇAGE DES CHAUSSÉES AINSI QUE LA RÉFECTION DES TROTTOIRS,ENTREPRISES MICHAUDVILLE INC,APP-21-058,20210708133120,20210615000000,20230731000000,1586692.76,1570351.8,16340.96;;;
21210974,Entente d'achat contractuelle,FOURNITURE ET INSTALLATION DE STRUCTURES RECREATIVES DANS LES AIRES DE JEUX POUR ENFANTS DE DIVERS PARCS CONTRAT 2 2021-PAR-600,TECHSPORT INC,APP-21-042,20210708140415,20210615000000,20230615000000,170876.45,170876.45,0;;;
21210976,Entente d'achat contractuelle,FOURNITURE ET INSTALLATION DE STRUCTURES RECREATIVES DANS LES AIRES DE JEUX POUR ENFANTS DE DIVERS PARCS CONTRAT 3 2021-PAR-600,TECHSPORT INC,APP-21-042,20210708141928,20210615000000,20230615000000,176120.15,176120.15,0;;;
21210977,Entente d'achat contractuelle,MISE A NIVEAU TERRAINS SOCCER PARCS BOISVERT ET CHAMPVERT_2021-PAR-643,9032-2454 QUEBEC INC. (TECHNIPARC),APP-21-050,20210708141929,20210615000000,20220228000000,285953.82,268374.82,17579;;;
21210978,Entente d'achat contractuelle,CONTINGENCE - MISE A NIVEAU TERRAIN SOCCER PARC BOISVERT ET CHAMPVERT,9032-2454 QUEBEC INC. (TECHNIPARC),APP-21-050,20210708142233,20210615000000,20211231000000,25995.8,0,25995.8;;;
21211005,Entente d'achat contractuelle,CONTINGENCE - EC - 21210972 - PLANAGE ET DE RESURFAÇAGE DES CHAUSSÉES,ENTREPRISES MICHAUDVILLE INC,APP-21-058,20210709093457,20210615000000,20230731000000,144244.8,0,144244.8;;;
21211023,Entente d'achat contractuelle,CONTRAT 2 INSPECTION PAR CAMÉRA À TÉLÉOBJECTIF DES REGARDS DU RÉSEAU,AQUA DATA,APP-21-029,20210709120319,20210615000000,20211231000000,214693.27,178875.45,35817.82;;;
21211024,Entente d'achat contractuelle,TRAVAUX D'ENFOUISSEMENT DES UTILITÉS PUBLIQUES DANS LES RUES SAINT-SYLVESTRE ET DE LONGUEUIL,ENVIRONNEMENT ROUTIER NRJ INC,APP-21-024,20210709121042,20210615000000,20230615000000,2111325.7,2111325.7,0;;;
21211025,Entente d'achat contractuelle,CONTINGENCES TRAVAUX D'ENFOUISSEMENT DES UTILITÉS PUBLIQUES DANS LES RUES SAINT-SYLVESTRE ET DE LONGUEUIL,ENVIRONNEMENT ROUTIER NRJ INC,APP-21-024,20210709121509,20210615000000,20230615000000,191938.7,0,191938.7;;;
21211109,Entente d'achat contractuelle,CONTROLE QUALITATIF DES MATERIAUX - TRAVAUX DE REFECTION DE LA RUE METROPOLE,ENGLOBE CORP,GG-21-060,20210713091028,20210721000000,20220720000000,43292.8,37656.4,5636.4;;;
21211112,Entente d'achat contractuelle,CONTROLE QUALITATIF DES MATERIAUX - REHABILITATION DES CONDUITES D'EAU POTABLE PAR CHEMISAGE,ENGLOBE CORP,GG-21-061,20210713091615,20210721000000,20220121000000,32951.4,27489.4,5462;;;
21211114,Entente d'achat contractuelle,AIRES DE JEUX RENE VEILLET ET WATSON (2021-PAR-604),AMENAGEMENTS SUD-OUEST,APP-21-045,20210713091900,20210615000000,20220614000000,799466.8,799466.8,0;;;
21211117,Entente d'achat contractuelle,CONTINGENCES AIRES DE JEUX RENE VEILLET WATSON (2021-PAR-604),AMENAGEMENTS SUD-OUEST,APP-21-045,20210713092544,20210615000000,20220614000000,72678.8,0,72678.8;;;
21211137,Entente d'achat contractuelle,AMENAGEMENT D'UNE FOURGONNETTE,AMTECH,DP-21-075,20210713111814,20210713000000,20220630000000,35142.93,35142.93,0;;;
21211178,Entente d'achat contractuelle,TRAVAUX DE NETTOYAGE ET D'INSPECTION TÉLÉVISÉE DES RÉSEAUX D'ÉGOUTS DE 900MM ET MOINS,SIMO MANAGEMENT INC,APP-21-034,20210713155109,20210618000000,20211218000000,622854.38,388617.08,234237.3;;;
21211183,Entente d'achat contractuelle,CONTINGENCE: TRAVAUX DE NETTOYAGE ET D'INSPECTION TÉLÉVISÉE DES RÉSEAUX D'ÉGOUTS DE 900MM ET MOINS,SIMO MANAGEMENT INC,APP-21-034,20210713160637,20210618000000,20211218000000,56623.13,0,56623.13;;;
21211211,Entente d'achat contractuelle,TRAVAUX DE DEVIATION D'UNE CONDUITE D'EAU POTABLE DE 750MM SUR LA RUE RIVERSIDE,EXCAVATIONS DARCHE INC,APP-21-035,20210714100032,20210617000000,20220714000000,708152.5,46438.2,661714.3;;;
21211214,Entente d'achat contractuelle,CONTINGENCE: TRAVAUX DE DEVIATION D'UNE CONDUITE D'EAU POTABLE DE 750 MM SUR LA RUE RIVERSIDE,EXCAVATIONS DARCHE INC,APP-21-035,20210714101538,20210617000000,20220714000000,64377.5,0,64377.5;;;
21211380,Entente d'achat contractuelle,ENTRETIEN SANITAIRE ET SERVICES D'UN PREMIER INTERVENANT / 100 PLACE CHARLES-LEMOYNE ET SES PASSERELLES,SERVICES D'ENTRETIEN ALPHANET INC,DP-21-060,20210716085511,20210716000000,20211231000000,86250,73750,12500;;;
"21211427,Entente d'achat contractuelle,""CO-210706-6.6, APP-21-061_2021-PAR-655, TERRAINS TENNIS PARC JEAN-DE-LALANDE"",PAVAGE DES MOULINS INC,APP-21-061,20210719113041,20210706000000,20221231000000,299029.5,273595,25434.5";;;
21211429,Entente d'achat contractuelle,TRAVAUX DE BOUCLAGE D¿AQUEDUC DANS LA RUE BORD-DE-L¿EAU EST ET AFFECTATION DE SOMMES EN PROVENANCE DU FONDS DE DEVELOPPEMENT IMMOBILIER 2021-GEN-121,EXCAVATION CIVILPRO INC,APP-21-060,20210719115216,20210706000000,20230706000000,398886.37,398886.37,0;;;
21211442,Entente d'achat contractuelle,LOCATION DE POMPES - STATION DE POMPAGE VMSL,SOCIETE XYLEM CANADA,GG-21-066,20210719145404,20210721000000,20210930000000,35028.46,30134.77,4893.69;;;
21207819,Entente d'achat contractuelle,FOURNITURE ET LIVRAISON D'EQUIPEMENTS DE JEUX D'EAU AU PARC ARMAND-BRUNO 2021-PAR-648,TESSIER RECREO-PARC INC,APP-21-010,20210506112221,20210427000000,20220506000000,47836.49,47836.49,0;;;
21207834,Entente d'achat contractuelle,LOCATION DE TOILETTES MOBILES (CHIMIQUES),GFL ENVIRONMENTAL INC,DP-21-031,20210506144607,20210421000000,20220630000000,104906.33,103670.46,1235.87;;;
21207854,Entente d'achat contractuelle,COLLECTE ET TRANSPORT DES ORDURES - SH-200511-6.1 - VL-200505-6.1 - GP-200504-6.1,GFL ENVIRONMENTAL INC,APP-19-251,20210506194241,20210401000000,20260531000000,13147805.31,9431861.13,3715944.18;;;
"21207859,Entente d'achat contractuelle,""RÉFECTION DE LA VOIE DE SERVICE DU BOULEVARD TASCHEREAU, ENTRE LA RUE SAINT-ROCH ET LE BOULEVARD MANSEAU"",EXCAVATION CIVILPRO INC,APP-21-006,20210506195431,20210420000000,20230531000000,3708772.1,3708772.1,0";;;
"21207860,Entente d'achat contractuelle,""CONTINGENCE RÉFECTION DE LA VOIE DE SERVICE DU BOULEVARD TASCHEREAU, ENTRE LA RUE SAINT-ROCH ET LE BOULEVARD MANSEAU"",EXCAVATION CIVILPRO INC,APP-21-006,20210506201951,20210420000000,20230531000000,370877.21,0,370877.21";;;
21207867,Entente d'achat contractuelle,TRAVAUX CORRECTIFS - AGRILE DU FRENE DANS LES PARCS-NATURE,PAYSAGISTE RIVE-SUD LTEE,DP-21-048,20210507085500,20210506000000,20220506000000,65017.5,63912.86,1104.64;;;
"21207881,Entente d'achat contractuelle,""TRAVAUX DE DÉBOISEMENT, DE TERRASSEMENT ET D'ENSEMENCEMENT DE DIVERS SITES SITUÉS SUR LE TERRITOIRE DE LA VILLE 2020-PAR-691"",EXCAVATION JRD,APP-20-209,20210507101926,20210216000000,20220216000000,255075.79,255075.79,0";;;
21207895,Entente d'achat contractuelle,SERVICES PROFESSIONNELS POUR UNE ETUDE DE STATIONNEMENT ET DE CIRCULTATION POUR LE PROJET DU COMPLEXE CULTUREL,CIMA+ S.E.N.C.,GG-21-038,20210507104554,20210507000000,20220228000000,27445,24950,2495;;;
21207913,Entente d'achat contractuelle,CARACTERISATION PHYSIQUE ET CHIMIQUE DU BETON DES RESERVOIRS D'EAU POTABLE R2 ET R3 DE L'USINE REGIONALE,ENGLOBE CORP,DP-21-023,20210510083501,20210507000000,20220507000000,33697.4,33631.93,65.47;;;
21208027,Entente d'achat contractuelle,TRAVAUX D ENTRETIEN DU PAVAGE (2021-TP403),ENTREPRISES NORD CONSTRUCTION(1962) INC,APP-21-001,20210511101756,20210511000000,20231231000000,1418395.85,1291787.44,126608.41;;;
21204794,Entente d'achat contractuelle,SD-2021-0133 DP-20-109 (2019-BAT-807) ÉTUDE PATRIMONIALE,ATELIERS BEAUPRE MICHAUD S E N C,DP-20-109,20210311130615,20210311000000,20220415000000,32231,32231,0;;;
21204843,Entente d'achat contractuelle,SD-2021-0472 / APP-21-002 (2021-TP617-1) / FAUCHAGE DES HAUTES HERBES DANS LES FOSSES MAJEURS,DENEX INC,APP-21-002,20210312112905,20210312000000,20251231000000,42501.62,24744.51,17757.11;;;
21204848,Entente d'achat contractuelle,SD-2020-2761 / SD-2021-0575 / GG-20-085 / SERVICES D INVESTIGATION,INVESTIGATION TRAK INC,,20210312132107,20210312000000,20211231000000,43245,21730,21515;;;
21205005,Entente d'achat contractuelle,CO-210116-6.11 / SD-2020-3708 / APP-20-198 (2021-TP602-1) OPTION 2 / TRAVAUX D'ENTRETIEN DES PLATEAUX SPORTIFS EN GAZON NATUREL DANS LES ARRONDISSEMENTS DU VIEUX-LONGUEUIL ET DE GREENFIELD PARK,9032-2454 QUEBEC INC. (TECHNIPARC),APP-20-198,20210316140618,20210216000000,20250228000000,639188.55,422897.44,216291.11;;;
21205009,Entente d'achat contractuelle,CO-210216-6.12 / APP-20-198 (2021-TP602-2) / OPTION 2 / TRAVAUX D'ENTRETIEN DES PLATEAUX SPORTIFS EN GAZON NATUREL DANS L'ARRONDISSEMENT DE SAINT-HUBERT,9032-2454 QUEBEC INC. (TECHNIPARC),APP-20-198,20210316141511,20210216000000,20250228000000,788515.03,394701.37,393813.66;;;
21205048,Entente d'achat contractuelle,GL-210201-6.1 - (SD-2021-0238) - SH-210208-6.1 - (SD-2021-0240) - VL-210202-6.2 - (SD-2021-0043) - APP-20-213 (2021-TP265) COLLECTE ET TRANSPORT DES ENCOMBRANTS SUR LE TERRITOIRE DE LA VILLE DE LONGUEUIL,DERICHEBOURG CANADA,APP-20-213,20210316154534,20210316000000,20260331000000,6205200.88,4668073.33,1537127.55;;;
21205060,Entente d'achat contractuelle,APP-20-199 (2021-TP601) - CO-210216-6.13 - TRAVAUX DE PLANTATION ET D'ENTRETIEN DE JEUNES ARBRES,PAYSAGISTE RIVE-SUD LTEE,APP-20-199,20210316223059,20210216000000,20260228000000,1276285.4,1118990.18,157295.22;;;
21205066,Entente d'achat contractuelle,DP-21-014 / SD-2021-0654 / AMENAGEMENT VEHICULES BANALISES,1VSS INC,,20210317100039,20210316000000,20211231000000,27758.24,27532.24,226;;;
"21205099,Entente d'achat contractuelle,""CA-210219-6,2 - SD-2021-0091 - APP-20-208 (2020-GDE-539) OPTION 2 ANS - ÉVACUATION, TRANSPORT ET DISPOSITION DES CENDRES DU CERS"",GEOCYCLE CANADA INC,APP-20-208,20210317134624,20210301000000,20231231000000,200750,143198.04,57551.96";;;
21205171,Entente d'achat contractuelle,DP-21-011 / SD-2021-0503 / ACQUISITION DE SERVICES DE TELECOMMUNICATION,TELUS COMMUNICATIONS INC,,20210318133818,20210318000000,20240318000000,43461.6,41641.68,1819.92;;;
21205201,Entente d'achat contractuelle,APP-19-260 (2021-TP253) - GP-201102-6.3 SH-201109-6.3 VL-201103-6.3 COLLECTE ET TRANSPORT DES MATIÈRES RECYCLABLES,ENVIRONNEMENT ROUTIER NRJ INC,APP-19-260,20210318164545,20201102000000,20260531000000,16172820.77,11911404.26,4261416.51;;;
21205225,Entente d'achat contractuelle,SD-2021-0371 / GG-21-023 / FAIRE DANSER LONGUEUIL,FAIRE DANSER UN VILLAGE S E N C,,20210319094903,20210319000000,20211231000000,35000,0,35000;;;
21205243,Entente d'achat contractuelle,GG-21-027 / SD-2021-0382 / REALISATION PARCOURS DE FORMATION DE GESTION EN TELETRAVAIL,UNIVERSITE DE SHERBROOKE,,20210319144037,20210319000000,20211231000000,39600,39600,0;;;
21205517,Entente d'achat contractuelle,N/A TAXES REALISATION D'UN PLAN DE GESTION DU BOISÉ DU TREMBLAY 2021-PAR-705,CIEL ET TERRE,GG-21-030,20210324151449,20210324000000,20221231000000,50000,50000,0;;;
21205531,Entente d'achat contractuelle,APP-20-218 (2021-TP223) - CA-210218-6.9 - TRAITEMENT DES ORDURES DE LA VILLE,RCI ENVIRONNEMENT DIVISION WM QC INC,APP-20-218,20210324155738,20210218000000,20240731000000,18371636.03,16549299.75,1822336.28;;;
21205532,Entente d'achat contractuelle,DP-21-006 / SD-2021-0647 / MACHINERIE ET MAIN D'OEUVRE - AGRILE DU FRENE,PAYSAGISTE RIVE-SUD LTEE,,20210324162624,20210325000000,20220325000000,75611,75607.6,3.4;;;
21205584,Entente d'achat contractuelle,SD-2021-0702 / DP-21-018 / 2021-TP450-3 / LIANT D'ACCROCHAGE EN CONTENANTS DE 20 LITRES,EMULSIONS BOURGET INC (LES),,20210325132727,20210325000000,20230625000000,44580,32841.05,11738.95;;;
21205691,Entente d'achat contractuelle,SD-2021-0697 GG-21-029 FOURNITURE D'UNE TURBINE ASSEMBLÉE POUR UN CAMION VIDE-PUISARD,EQUIPEMENTS C M INC (LES),,20210329100707,20210329000000,20211231000000,36198.77,36198.77,0;;;
21205809,Entente d'achat contractuelle,SD-2021-0617 DP-21-013 PLANS D'AMÉNAGEMENT DANS LE CORRIDOR DE LA BIODIVERSITE DE LONGUEUIL,ECOGENIE INC,DP-21-013,20210330153433,20210330000000,20240620000000,98115,98115,0;;;
21205819,Entente d'achat contractuelle,SD-2021-0745 - GG-21-026 (2021-PAR-704) - COUPE D'ARBRES - PARC MICHEL-CHARTRAND,PAYSAGISTE ROGER MARTEL INC,,20210330162503,20210329000000,20210531000000,81120,81039.25,80.75;;;
21205820,Entente d'achat contractuelle,CA-210325-6.7 APP-20-210 CHEMISES ET PANTALONS SPAL,M D CHARLTON CO,APP-20-210,20210330162934,20210325000000,20251231000000,809000,775991,33009;;;
21205875,Entente d'achat contractuelle,GG-21-028 / SD-2021-0831 / ACQUISITION D'ANALYSEUR PALINTEST KEMIO METAUX LOURDS ET ELECTRODES,ATERA ENVIRO INC,GG-21-028,20210331154959,20210407000000,20220331000000,37150,35175,1975;;;
21205894,Entente d'achat contractuelle,SD-2021-0847 / GG-21-032 / SERVICES PROFESSIONNELS - TABLE DE CONCERTATION - MAINTIENT DE L'EQUILIBRE ECOLOGIQUE ET LA PRESERVATION DU PARC-NATURE MICHEL-CHARTRAND,HILL + KNOWLTON STRATEGIES,,20210401083134,20210401000000,20211231000000,67500,67500,0;;;
21205990,Entente d'achat contractuelle,APP-20-214 (2021-TP310) - CO-210323-6.7 - CONSTRUCTION DE BRANCHEMENTS DE SERVICES D'EAU POTABLE ET D'ÉGOUTS (OPTION 2B) (SD-2021-0079),MARIUS MORIER ET FILS LTEE,APP-20-214,20210406095539,20210323000000,20260531000000,22398624.84,7672034.62,14726590.22;;;
"21206045,Entente d'achat contractuelle,""CO-210323-6.9, APP-21-003_2021-GEN-116, TRAVAUX REHABILITATION CONDUITES EAU"",FORACTION INC,APP-21-003,20210407090902,20210323000000,20221231000000,3209393.35,2794175.05,415218.3";;;
"21206060,Entente d'achat contractuelle,""CA-210325-6.5, APP-20-217_2020-BAT-817, EQUIPEMENTS MULTIMEDIAS POUR 600 CH DU LAC"",CBCI TELECOM CANADA INC,APP-20-217,20210407103312,20210325000000,20220228000000,178876.91,172612.54,6264.37";;;
21206062,Entente d'achat contractuelle,CO-210322-6.8 - SD-2021-0212 - APP-20-219 (2021-TP631-2) - ENTRETIEN PLATEAUX SPORTIFS EN GAZON SYNTHÉTIQUE - CONTRAT DE 5 ANS,SURFACES CARPELL,APP-20-219,20210407112846,20210401000000,20251231000000,136385.1,65931.54,70453.56;;;
21206088,Entente d'achat contractuelle,SD-2021-0371 / GG-21-023 / FAIRE DANSER LONGUEUIL,FAIRE DANSER UN VILLAGE,,20210407161824,20210319000000,20211231000000,35000,35000,0;;;
21206093,Entente d'achat contractuelle,SD-21-0881 DP-21-033 LOCATION D'UN REFROIDISSEUR AU CERS,LOUE FROID INC.,,20210407180649,20210412000000,20211231000000,48367,47967,400;;;
21206134,Entente d'achat contractuelle,CO-210323-6.11 APP-20-211 SERVICE DE RELIURE POUR BIBLIOTHEQUES,RELIURES CARON ET LETOURNEAU LTEE (LES),APP-20-211,20210408140454,20210323000000,20240301000000,139458.9,134049.38,5409.52;;;
21206168,Entente d'achat contractuelle,CO-200825-6.7 - APP-20-136 (2020-TP925-1) POUR LA FOURNITURE ET LA LIVRAISON DE PLAQUETTES DE RUE (SD-2020-2067),MARTECH SIGNALISATION INC,APP-20-136,20210408160240,20210101000000,20230228000000,327989.03,288326.11,39662.92;;;
