Nom Bibliothèque	Secteur	Titre	Nombre de prêt	Nombre de document	Lien URL
Bibliothèque d'Ahuntsic	Inconnu	Sur le chemin des contes[ensemble multi-supports] /Oro Anahory-Librowicz ... [et al.].	12	12	https://nelligandecouverte.ville.montreal.qc.ca/iii/encore/record/C__Rb1432621?lang=frc
Bibliothèque d'Ahuntsic	Adultes - Nouveautés	Le chardonneret :[roman] /Donna Tartt ; traduit de l'anglais (États-Unis) par Édith Soonckindt.	9	11	https://nelligandecouverte.ville.montreal.qc.ca/iii/encore/record/C__Rb2424289?lang=frc
Bibliothèque d'Ahuntsic	Adultes - Nouveautés	Les héritiers du fleuve.4,1931-1939 /Louise Tremblay-D'Essiambre.	9	9	https://nelligandecouverte.ville.montreal.qc.ca/iii/encore/record/C__Rb2476200?lang=frc
Bibliothèque d'Ahuntsic	Adultes - DVD	Divergence[enregistrement vidéo] =Divergent /réalisation, Neil Burger ; scénario, Evan Daugherty, Vanessa Taylor.	9	3	https://nelligandecouverte.ville.montreal.qc.ca/iii/encore/record/C__Rb2462977?lang=frc
Bibliothèque d'Ahuntsic	Adultes - Nouveautés	Deux veuves pour un testament /Donna Leon ; traduit de l'anglais (États-Unis) par William Olivier Desmond.	8	5	https://nelligandecouverte.ville.montreal.qc.ca/iii/encore/record/C__Rb2444082?lang=frc
Bibliothèque d'Ahuntsic	Jeunes - Nouveautés	Nelson.14,Définitivement nuisible /Bertschy.	8	5	https://nelligandecouverte.ville.montreal.qc.ca/iii/encore/record/C__Rb2441280?lang=frc
Bibliothèque d'Ahuntsic	Adultes - Nouveautés	La promesse :roman /Michèle Ouimet.	8	4	https://nelligandecouverte.ville.montreal.qc.ca/iii/encore/record/C__Rb2468302?lang=frc
Bibliothèque d'Ahuntsic	Adultes - Nouveautés	Le siècle.3,Aux portes de l'éternité :roman /Ken Follett ; traduit de l'anglais par Jean-Daniel Brèque ... [et al.].	8	8	https://nelligandecouverte.ville.montreal.qc.ca/iii/encore/record/C__Rb2467415?lang=frc
Bibliothèque d'Ahuntsic	Adultes - Documentaires	Guide de la route /[publication réalisée par la Société de l'assurance automobile du Québec].	8	13	https://nelligandecouverte.ville.montreal.qc.ca/iii/encore/record/C__Rb2448995?lang=frc
Bibliothèque d'Ahuntsic	Adultes - Nouveautés	Violence à l'origine /Martin Michaud.	8	6	https://nelligandecouverte.ville.montreal.qc.ca/iii/encore/record/C__Rb2477972?lang=frc
Bibliothèque d'Ahuntsic	Inconnu	Des larmes aux rires :les émotions et les sentiments dans l'art /Claire d'Harcourt.	8	7	https://nelligandecouverte.ville.montreal.qc.ca/iii/encore/record/C__Rb1456454?lang=frc
Bibliothèque d'Ahuntsic	Inconnu	Accommodante Montréal :regard d'une immigrante sur Montréal /Gisèle Kayata-Eid.	7	6	https://nelligandecouverte.ville.montreal.qc.ca/iii/encore/record/C__Rb1751103?lang=frc
Bibliothèque d'Ahuntsic	Adultes - Nouveautés	Une main encombrante : roman	7	4	https://nelligandecouverte.ville.montreal.qc.ca/iii/encore/record/C__Rb2476900?lang=frc
Bibliothèque d'Ahuntsic	Adultes - Nouveautés	Les héritiers du fleuve.3,1918-1929 /Louise Tremblay-D'Essiambre.	7	7	https://nelligandecouverte.ville.montreal.qc.ca/iii/encore/record/C__Rb2441946?lang=frc
Bibliothèque d'Ahuntsic	Adultes - Romans québécois	La fiancée américaine :roman /Éric Dupont.	7	11	https://nelligandecouverte.ville.montreal.qc.ca/iii/encore/record/C__Rb2352535?lang=frc
Bibliothèque d'Ahuntsic	Jeunes - BD - Fiction	Max et Lili veulent éduquer leurs parents /[texte de] Dominique de Saint Mars ; [illustrations de] Serge Bloch.	7	4	https://nelligandecouverte.ville.montreal.qc.ca/iii/encore/record/C__Rb1941461?lang=frc
Bibliothèque d'Ahuntsic	Jeunes - Mangas	Naruto.57,Naruto part en guerre--!! /Masashi Kishimoto ; [traduit et adapté en français par Frédéric Malet].	7	5	https://nelligandecouverte.ville.montreal.qc.ca/iii/encore/record/C__Rb2363295?lang=frc
Bibliothèque d'Ahuntsic	Jeunes - BD - Fiction	Max veut être délégué de classe /[texte de] Dominique de Saint Mars ; [illustrations de] Serge Bloch.	7	3	https://nelligandecouverte.ville.montreal.qc.ca/iii/encore/record/C__Rb1409987?lang=frc
Bibliothèque d'Ahuntsic	Jeunes - BD - Fiction	Max se fait insulter à la récré /[texte de] Dominique de Saint Mars ; [illustrations de] Serge Bloch [avec la collaboration de Renaud de Saint Mars].	7	3	https://nelligandecouverte.ville.montreal.qc.ca/iii/encore/record/C__Rb1376090?lang=frc
Bibliothèque d'Ahuntsic	Adultes - Nouveautés	Jean-François Lépine :sur la ligne de feu.	7	7	https://nelligandecouverte.ville.montreal.qc.ca/iii/encore/record/C__Rb2475761?lang=frc
Bibliothèque de Cartierville	Adultes - Collection multilingue	Gibran Khalil Gibran	11	10	https://nelligandecouverte.ville.montreal.qc.ca/iii/encore/record/C__Rb1273476?lang=frc
Bibliothèque de Cartierville	Adultes - Documentaires	Conduire un véhicule de promenade /[publication réalisée par la Société de l'assurance automobile du Québec ; recherche et rédaction, Michèle Jean et Micheline Briand avec la collaboration de Diane Hamel... et al.]	8	17	https://nelligandecouverte.ville.montreal.qc.ca/iii/encore/record/C__Rb1427841?lang=frc
Bibliothèque de Cartierville	Adultes - Documentaires	Guide de la route /[recherche et rédaction de la mise à jour, Sandra Gauthier avec la collaboration du personnel du Service des usagers de la route ; réalisé par la Société de l'assurance automobile du Québec en collaboration avec le Service de l'exploitation du Ministère des transports ; illustrations, Jean-Michel Girard].	7	12	https://nelligandecouverte.ville.montreal.qc.ca/iii/encore/record/C__Rb1821505?lang=frc
Bibliothèque de Cartierville	Adultes - Documentaires	Driving a passenger vehicle /[publication prepared by the Société de l'assurance automobile du Québec ; researched and written by Michèle Jean and Micheline Briand with the cooperation of Diane Hamel ... et al. ; English translation, Elizabeth Doyle].	6	9	https://nelligandecouverte.ville.montreal.qc.ca/iii/encore/record/C__Rb1435747?lang=frc
Bibliothèque de Cartierville	Adultes - Documentaires	Guide de la route /[recherche et rédaction, Micheline Briand avec la collaboration de Claude Nazair ; réalisé par la Société de l'assurance automobile du Québec en collaboration avec le Service des technologies d'exploitation du Ministère des transports].	6	11	https://nelligandecouverte.ville.montreal.qc.ca/iii/encore/record/C__Rb1492968?lang=frc
Bibliothèque de Cartierville	Adultes - Nouveautés	Les années de plomb.3,Le choix de Thalie :roman historique /Jean-Pierre Charland.	5	6	https://nelligandecouverte.ville.montreal.qc.ca/iii/encore/record/C__Rb2462872?lang=frc
Bibliothèque de Cartierville	Jeunes - DVD	Clochette et le trésor perdu[enregistrement vidéo] =Tinker Bell and the lost treasure /réalisation, Klay Hall ; scénario, Evan Spiliotopoulos.	5	1	https://nelligandecouverte.ville.montreal.qc.ca/iii/encore/record/C__Rb1908743?lang=frc
Bibliothèque de Cartierville	Jeunes - DVD	Les pingouins de Madagascar.Opération[enregistrement vidéo] :première sur DVD = The penguins of Madagascar.Operation : DVD première.	5	2	https://nelligandecouverte.ville.montreal.qc.ca/iii/encore/record/C__Rb1921595?lang=frc
Bibliothèque de Cartierville	Adultes - Nouveautés	La faiseuse d'anges	4	4	https://nelligandecouverte.ville.montreal.qc.ca/iii/encore/record/C__Rb2454752?lang=frc
Bibliothèque de Cartierville	Jeunes - BD	Quelle chouchoute! /dessins, William ; scénario, Cazenove & William.	4	3	https://nelligandecouverte.ville.montreal.qc.ca/iii/encore/record/C__Rb2067970?lang=frc
Bibliothèque de Cartierville	Adultes - DVD	Elysium[enregistrement vidéo] /scénario et réalisation, Neill Blomkamp.	4	1	https://nelligandecouverte.ville.montreal.qc.ca/iii/encore/record/C__Rb2431755?lang=frc
Bibliothèque de Cartierville	Jeunes - DVD	Diary of a wimpy kid.Rodrick rules[enregistrement vidéo] =Journal d'un déglonflé.Rodrick fait sa loi /directed by David Bowers ; screenplay by Gabe Sachs & Jeff Judah. Diary of a wimpy kid.My summer vacation : fun pack.	4	2	https://nelligandecouverte.ville.montreal.qc.ca/iii/encore/record/C__Rb2245935?lang=frc
Bibliothèque de Cartierville	Adultes - Documentaires	Panoram@th.Mathématique, 1er cycle du secondaire /Richard Cadieux, Isabelle Gendron, Antoine Ledoux.	4	4	https://nelligandecouverte.ville.montreal.qc.ca/iii/encore/record/C__Rb1443506?lang=frc
Bibliothèque de Cartierville	Jeunes - DVD	La flûte à six Schtroumpfs[enregistrement vidéo] =The Smurfs and the magic flute /adaptation, Peyo et Yvan Delporte ; animation sous le contrôle d'Eddie Lateste.	4	2	https://nelligandecouverte.ville.montreal.qc.ca/iii/encore/record/C__Rb2273451?lang=frc
Bibliothèque de Cartierville	Jeunes - DVD	Cendrillon II.La magie des rêves[enregistrement vidéo] =Cinderella II.Dreams come true /réalisation, John Kafka ; scénario, Jill Blotevogel, Tom Rogers, Jue Selbo. Cendrillon III.Les hasards du temps = Cinderella III.A twist in time / directed by Frank Nissen.	4	1	https://nelligandecouverte.ville.montreal.qc.ca/iii/encore/record/C__Rb2361352?lang=frc
Bibliothèque de Cartierville	Jeunes - DVD	Voilà Fraisinette[enregistrement vidéo] /écrit par Judy Rothman Rofé.	4	1	https://nelligandecouverte.ville.montreal.qc.ca/iii/encore/record/C__Rb1449550?lang=frc
Bibliothèque de Cartierville	Jeunes - DVD	Les Câlinours.À vos souhaits[enregistrement vidéo] =Care Bears.Big wish movie /réalisation, Larry Jacobs, Ron Pitts ; scénario, Jeffrey Alan Schechter.	4	1	https://nelligandecouverte.ville.montreal.qc.ca/iii/encore/record/C__Rb1434112?lang=frc
Bibliothèque de Cartierville	Jeunes - BD	Les légendaires.7,Aube et crépuscule /Patrick Sobral.	4	3	https://nelligandecouverte.ville.montreal.qc.ca/iii/encore/record/C__Rb1432955?lang=frc
Bibliothèque de Cartierville	Adultes - DVD	Le parrain[enregistrement vidéo] :la restauration de Coppola = The godfather : the Coppola restoration.	4	2	https://nelligandecouverte.ville.montreal.qc.ca/iii/encore/record/C__Rb1769804?lang=frc
Bibliothèque de Cartierville	Adultes - DVD	5 x 2[enregistrement vidéo] :cinq fois deux = five times two /réalisation, François Ozon ; scénario, François Ozon, Emmanuèle Bernheim.	4	1	https://nelligandecouverte.ville.montreal.qc.ca/iii/encore/record/C__Rb1754771?lang=frc
Bibliothèque De Salaberry	Jeunes - Documentaires	Vie sauvage [Salaberry] :encyclopédie Larousse des animaux	10	77	https://nelligandecouverte.ville.montreal.qc.ca/iii/encore/record/C__Rb1193937?lang=frc
Bibliothèque De Salaberry	Jeunes - DVD	Les Simpson.L'intégrale de la huitième saison[enregistrement vidéo] =The Simpsons.The complete eighth season /créé par Matt Groening ; développé par James L. Brooks, Matt Groening, Sam Simon.	9	8	https://nelligandecouverte.ville.montreal.qc.ca/iii/encore/record/C__Rb1509989?lang=frc
Bibliothèque De Salaberry	Jeunes - DVD	Contes pour tous.Coffret collection 1[enregistrement vidéo].	5	12	https://nelligandecouverte.ville.montreal.qc.ca/iii/encore/record/C__Rb1432452?lang=frc
Bibliothèque De Salaberry	Jeunes - BD	Les nombrils.1,Pour qui tu te prends? /[illustrations de] Delaf ; [texte de] Dubuc.	5	3	https://nelligandecouverte.ville.montreal.qc.ca/iii/encore/record/C__Rb1418076?lang=frc
Bibliothèque De Salaberry	Jeunes - DVD	La mariée cadavérique[enregistrement vidéo] :l'oeuvre de Tim Burton = Tim Burton's Corpse bride /réalisation, Tim Burton, Mike Johnson ; scénario, John August, Caroline Thompson, Pamela Pettler.	5	2	https://nelligandecouverte.ville.montreal.qc.ca/iii/encore/record/C__Rb1451269?lang=frc
Bibliothèque De Salaberry	Jeunes - DVD	Les Simpson.L'intégrale de la dixième saison[enregistrement vidéo] =The Simpsons.The complete tenth season /créé par Matt Groening ; développé par James L. Brooks, Matt Groening, Sam Simon.	5	8	https://nelligandecouverte.ville.montreal.qc.ca/iii/encore/record/C__Rb1511923?lang=frc
Bibliothèque De Salaberry	Jeunes - DVD	Les Simpson.L'intégrale de la seconde saison[enregistrement vidéo] =The Simpsons.The complete second season /créé par Matt Groening ; réalisé par David Silverman ... [et al.] ; développé par James L. Brooks, Matt Groening, Sam Simon.	5	8	https://nelligandecouverte.ville.montreal.qc.ca/iii/encore/record/C__Rb1509441?lang=frc
Bibliothèque De Salaberry	Jeunes - DVD	Les aventures de Tintin[enregistrement vidéo] /réalisation, Stéphane Bernasconi.	5	14	https://nelligandecouverte.ville.montreal.qc.ca/iii/encore/record/C__Rb1393483?lang=frc
Bibliothèque De Salaberry	Jeunes - DVD	Benjamin fête l'Halloween[enregistrement vidéo] =Franklin's Halloween /réalisation, John Van Bruggen.	4	2	https://nelligandecouverte.ville.montreal.qc.ca/iii/encore/record/C__Rb1414232?lang=frc
Bibliothèque De Salaberry	Jeunes - BD	Les nombrils.3,Les liens de l'amitié /[illustrations de] Delaf ; [texte de] Dubuc.	4	2	https://nelligandecouverte.ville.montreal.qc.ca/iii/encore/record/C__Rb1577718?lang=frc
Bibliothèque De Salaberry	Jeunes - Jeux vidéo sur console	FIFA soccer 12[electronic resource (Xbox 360)].	4	3	https://nelligandecouverte.ville.montreal.qc.ca/iii/encore/record/C__Rb2345596?lang=frc
Bibliothèque De Salaberry	Jeunes - Jeux vidéo sur console	LEGO Harry Potter.Years 5-7[ressource électronique (Wii)].	4	1	https://nelligandecouverte.ville.montreal.qc.ca/iii/encore/record/C__Rb2269754?lang=frc
Bibliothèque De Salaberry	Jeunes - Romans pré-ado	Harry Potter et le prince de Sang-Mêlé /J. K. Rowling ; traduit de l'anglais par Jean-François Ménard.	4	3	https://nelligandecouverte.ville.montreal.qc.ca/iii/encore/record/C__Rb1404314?lang=frc
Bibliothèque De Salaberry	Jeunes - Romans pré-ado	Harry Potter et les reliques de la mort /J. K. Rowling ; traduit de l'anglais par Jean-François Ménard.	4	2	https://nelligandecouverte.ville.montreal.qc.ca/iii/encore/record/C__Rb1470893?lang=frc
Bibliothèque De Salaberry	Jeunes - BD	Pink diary	4	8	https://nelligandecouverte.ville.montreal.qc.ca/iii/encore/record/C__Rb1586538?lang=frc
Bibliothèque De Salaberry	Jeunes - DVD	Les Simpson.L'intégrale de la sixième saison[enregistrement vidéo] =The Simpsons.The complete sixth season /créé par Matt Groening ; réalisé par David Silverman ... [et al.] ; développé par James L. Brooks, Matt Groening, Sam Simon.	4	8	https://nelligandecouverte.ville.montreal.qc.ca/iii/encore/record/C__Rb1431574?lang=frc
Bibliothèque De Salaberry	Tout-petits - BD	Le tonton de Max et Lili est en prison /[texte de] Dominique de Saint Mars ; [illustrations de] Serge Bloch.	3	4	https://nelligandecouverte.ville.montreal.qc.ca/iii/encore/record/C__Rb2068558?lang=frc
Bibliothèque De Salaberry	Jeunes - BD	Carnage total /scénario et dessin, Midam.	3	3	https://nelligandecouverte.ville.montreal.qc.ca/iii/encore/record/C__Rb1212079?lang=frc
Bibliothèque De Salaberry	Tout-petits - BD	Max est fou de jeux vidéo /Dominique de Saint Mars ; [illustrations de] Serge Bloch ; [inspiré par Astrapi].	3	2	https://nelligandecouverte.ville.montreal.qc.ca/iii/encore/record/C__Rb1286628?lang=frc
Bibliothèque De Salaberry	Jeunes - DVD	My little pony.Equestria girls[enregistrement vidéo] /Hasbro ; producer, Brian Ward.	3	1	https://nelligandecouverte.ville.montreal.qc.ca/iii/encore/record/C__Rb2410734?lang=frc
Bibliothèque Saul-Bellow	Jeunes - DVD	Retour vers le futur.La trilogie complète[enregistrement vidéo] =Back to the future.The complete trilogy /scénario, Robert Zemeckis, Bob Gale ; réalisation, Robert Zemeckis.	7	5	https://nelligandecouverte.ville.montreal.qc.ca/iii/encore/record/C__Rb1754404?lang=frc
Bibliothèque Saul-Bellow	Adultes - DVD	Sol[enregistrement vidéo] :4 spectacles.	6	3	https://nelligandecouverte.ville.montreal.qc.ca/iii/encore/record/C__Rb1395189?lang=frc
Bibliothèque Saul-Bellow	Jeunes - Documentaires	Animaux en pâte à modeler /Rony Oren.	4	1	https://nelligandecouverte.ville.montreal.qc.ca/iii/encore/record/C__Rb2251588?lang=frc
Bibliothèque Saul-Bellow	Adultes - DVD	L'Artiste[enregistrement vidéo] =The Artist /scénario et réalisation, Michel Hazanavicius.	4	2	https://nelligandecouverte.ville.montreal.qc.ca/iii/encore/record/C__Rb2334445?lang=frc
Bibliothèque Saul-Bellow	Adultes - Romans	La veuve du boulanger :roman /Denis Monette.	4	4	https://nelligandecouverte.ville.montreal.qc.ca/iii/encore/record/C__Rb2466496?lang=frc
Bibliothèque Saul-Bellow	Adultes - DVD	Cloutier / Obom[enregistrement vidéo]	4	1	https://nelligandecouverte.ville.montreal.qc.ca/iii/encore/record/C__Rb2484776?lang=frc
Bibliothèque Saul-Bellow	Jeunes - BD	Lou!.5,Laser Ninja /Julien Neel.	4	2	https://nelligandecouverte.ville.montreal.qc.ca/iii/encore/record/C__Rb1914865?lang=frc
Bibliothèque Saul-Bellow	Adultes - Disques compacts	15 souvenirs inoubliables de Noël[enregistrement sonore].	4	1	https://nelligandecouverte.ville.montreal.qc.ca/iii/encore/record/C__Rb2266694?lang=frc
Bibliothèque Saul-Bellow	Adultes - Documentaires	Le guide de l'enfant hyperactif :[tous les conseils et solutions] /Marie-Astrid Roy.	4	1	https://nelligandecouverte.ville.montreal.qc.ca/iii/encore/record/C__Rb2322179?lang=frc
Bibliothèque Saul-Bellow	Jeunes - Livres d'images (Albums)	The sandcastle contest /Robert Munsch ; illustrated by Michael Martchenko	4	2	https://nelligandecouverte.ville.montreal.qc.ca/iii/encore/record/C__Rb2051959?lang=frc
Bibliothèque Saul-Bellow	Adultes - DVD	La fête du Travail[enregistrement vidéo] = Labor Day / Jason Reitman.	4	1	https://nelligandecouverte.ville.montreal.qc.ca/iii/encore/record/C__Rb2484119?lang=frc
Bibliothèque Saul-Bellow	Adultes - Documentaires	Warman's antiques & collectibles.2015 /Noah Fleisher.	4	1	https://nelligandecouverte.ville.montreal.qc.ca/iii/encore/record/C__Rb2452860?lang=frc
Bibliothèque Saul-Bellow	Jeunes - BD	Toujours dans les pattes! /dessins, William ; scénario, Cazenove & William.	4	1	https://nelligandecouverte.ville.montreal.qc.ca/iii/encore/record/C__Rb2481502?lang=frc
Bibliothèque Saul-Bellow	Jeunes - DVD	Les enfants du wagon[enregistrement vidéo] =The boxcar children /producers, Dan Chuba, Maureen Gordon, Michael Liberty ; directors, Dan Chuba, Mark A.Z. Dippe.	3	1	https://nelligandecouverte.ville.montreal.qc.ca/iii/encore/record/C__Rb2469699?lang=frc
Bibliothèque Saul-Bellow	Jeunes - Romans	Un coeur à prendre /de Jeff Kinney ; traduit de l'anglais (États-Unis) par Natalie Zimmermann.	3	1	https://nelligandecouverte.ville.montreal.qc.ca/iii/encore/record/C__Rb2439335?lang=frc
Bibliothèque Saul-Bellow	Adultes - Gros caractères - Fiction	Le cachot de Hautefaille[texte (gros caractères)] /Marie-Bernadette Dupuy.	3	1	https://nelligandecouverte.ville.montreal.qc.ca/iii/encore/record/C__Rb2435872?lang=frc
Bibliothèque Saul-Bellow	Adultes - DVD	Oldboy[enregistrement vidéo] :le jour de la vengeance = Oldboy /réalisation, Spike Lee ; scénario, Mark Protosevich.	3	1	https://nelligandecouverte.ville.montreal.qc.ca/iii/encore/record/C__Rb2444456?lang=frc
Bibliothèque Saul-Bellow	Jeunes - DVD	Rio[enregistrement vidéo] /réalisation, Carlos Saldanha ; scénario, Don Rhymer ... [et al.].	3	1	https://nelligandecouverte.ville.montreal.qc.ca/iii/encore/record/C__Rb2251429?lang=frc
Bibliothèque Saul-Bellow	Adolescents - Documentaires	Attention : estime de soi en construction /Stéphanie Deslauriers ; illustrations de Frédéric Boudreault.	3	1	https://nelligandecouverte.ville.montreal.qc.ca/iii/encore/record/C__Rb2412043?lang=frc
Bibliothèque Saul-Bellow	Adultes - DVD	Spring breakers[enregistrement vidéo] /director and writer, Harmony Korine.	3	1	https://nelligandecouverte.ville.montreal.qc.ca/iii/encore/record/C__Rb2414555?lang=frc
Bibliothèque de Saint-Pierre	Jeunes - Livres d'images (Albums)	C'est loin la Norvège? demande le bonhomme de neige /[texte de] Mira Lobe ; [illustrations de] Winfried Opgenoorth ; traduit et adapté par Sylvia Gehlert.	4	1	https://nelligandecouverte.ville.montreal.qc.ca/iii/encore/record/C__Rb1920991?lang=frc
Bibliothèque de Saint-Pierre	Adultes - Documentaires	Le TDAH, une force à rééquilibrer :le trouble de l'attention avec ou sans hyperactivité /Diane Dulude.	3	1	https://nelligandecouverte.ville.montreal.qc.ca/iii/encore/record/C__Rb2438218?lang=frc
Bibliothèque de Saint-Pierre	Adultes - DVD / Blu-Ray	Les Avengers de Marvel[enregistrement vidéo] =The Marvel's Avengers /scénario et réalisation, Joss Whedon ; histoire de Zak Penn et Joss Whedon.	3	1	https://nelligandecouverte.ville.montreal.qc.ca/iii/encore/record/C__Rb2457675?lang=frc
Bibliothèque de Saint-Pierre	Adultes - DVD	Men in black II[enregistrement vidéo] =[Hommes en noir II] /direction, Barry Sonnenfeld ; screenplay, Robert Gordon, Barry Fanaro.	3	1	https://nelligandecouverte.ville.montreal.qc.ca/iii/encore/record/C__Rb1908413?lang=frc
Bibliothèque de Saint-Pierre	Adultes - DVD	L'Artiste[enregistrement vidéo] =The Artist /scénario et réalisation, Michel Hazanavicius.	3	1	https://nelligandecouverte.ville.montreal.qc.ca/iii/encore/record/C__Rb2334445?lang=frc
Bibliothèque de Saint-Pierre	Adultes - DVD	La couleur des sentiments[enregistrement vidéo] =The help /scénario et réalisation, Tate Taylor.	3	1	https://nelligandecouverte.ville.montreal.qc.ca/iii/encore/record/C__Rb2274244?lang=frc
Bibliothèque de Saint-Pierre	Jeunes - DVD	Alice au pays des merveilles[enregistrement vidéo] =Alice in wonderland /réalisation, Clyde Geronimi, Hamilton Luske, Wilfred Jackson.	3	1	https://nelligandecouverte.ville.montreal.qc.ca/iii/encore/record/C__Rb1926021?lang=frc
Bibliothèque de Saint-Pierre	Jeunes - DVD	Amis pour la vie[enregistrement vidéo] =Best friends forever /réalisation, Peter Svatek.	3	2	https://nelligandecouverte.ville.montreal.qc.ca/iii/encore/record/C__Rb2435705?lang=frc
Bibliothèque de Saint-Pierre	Jeunes - Jeux vidéo sur console	NHL 12[electronic resource (PlayStation 3)].	3	3	https://nelligandecouverte.ville.montreal.qc.ca/iii/encore/record/C__Rb2345852?lang=frc
Bibliothèque de Saint-Pierre	Adultes - DVD	Le quatuor[enregistrement vidéo] =Quartet /réalisation, Dustin Hoffman ; scénario, Ronald Harwood.	3	1	https://nelligandecouverte.ville.montreal.qc.ca/iii/encore/record/C__Rb2400343?lang=frc
Bibliothèque de Saint-Pierre	Adultes - Romans	L'enfant qui savait parler la langue des chiens :roman /Joanna Gruda	3	1	https://nelligandecouverte.ville.montreal.qc.ca/iii/encore/record/C__Rb2374042?lang=frc
Bibliothèque de Saint-Pierre	Adultes - DVD	Casse-tête chinois[enregistrement vidéo] =Chinese puzzle /scénario et réalisation, Cédric Klapisch.	3	1	https://nelligandecouverte.ville.montreal.qc.ca/iii/encore/record/C__Rb2475789?lang=frc
Bibliothèque de Saint-Pierre	Adultes - Documentaires	Oui, je peux[ensemble multi-supports] :comment les affirmations peuvent changer votre vie /Louise L. Hay.	3	1	https://nelligandecouverte.ville.montreal.qc.ca/iii/encore/record/C__Rb1383111?lang=frc
Bibliothèque de Saint-Pierre	Jeunes - Jeux vidéo sur console	Mario & Sonic at the London 2012 Olympic games[ressource électronique (Wii)]	3	1	https://nelligandecouverte.ville.montreal.qc.ca/iii/encore/record/C__Rb2319893?lang=frc
Bibliothèque de Saint-Pierre	Adultes - DVD	Ocean's twelve[enregistrement vidéo] =[Le retour de Danny Ocean] /direction, Steven Soderbergh ; screenplay, George Nolfi.	3	1	https://nelligandecouverte.ville.montreal.qc.ca/iii/encore/record/C__Rb1459277?lang=frc
Bibliothèque de Saint-Pierre	Jeunes - DVD	Le papillon bleu[enregistrement vidéo] =The blue butterfly /réalisation, Léa Pool ; scénario, Pete McCormack.	3	1	https://nelligandecouverte.ville.montreal.qc.ca/iii/encore/record/C__Rb1374761?lang=frc
Bibliothèque de Saint-Pierre	Adultes - DVD / Blu-Ray	Gravité[enregistrement vidéo] =Gravity /réalisation, Alfonso Cuarón ; scénario, Alfonso Cuarón, Jonás Cuarón.	2	1	https://nelligandecouverte.ville.montreal.qc.ca/iii/encore/record/C__Rb2442077?lang=frc
Bibliothèque de Saint-Pierre	Jeunes - BD	Aventures électroniques /par Roger Leloup.	2	2	https://nelligandecouverte.ville.montreal.qc.ca/iii/encore/record/C__Rb1177400?lang=frc
Bibliothèque de Saint-Pierre	Jeunes - DVD	Transfromer :the movie[enregistrement vidéo]	2	1	https://nelligandecouverte.ville.montreal.qc.ca/iii/encore/record/C__Rb2456701?lang=frc
Bibliothèque de Saint-Pierre	Jeunes - DVD	Curious George takes a job and more monkey business[videorecording] /Toon City, Inc. ; Universal Cartoon Studios.	2	1	https://nelligandecouverte.ville.montreal.qc.ca/iii/encore/record/C__Rb1799882?lang=frc
Bibliothèque Benny	Inconnu	Une année en Provence :roman /Peter Mayle ; traduit de l'anglais par Jean Rosenthal.	12	14	https://nelligandecouverte.ville.montreal.qc.ca/iii/encore/record/C__Rb1196329?lang=frc
Bibliothèque Benny	Jeunes - DVD	Rebelle[enregistrement vidéo] =Brave /réalisation, Mark Andrews, Brenda Chapman ; scénario, Mark Andrews ... [et al.] ; histoire, Brenda Chapman.	6	1	https://nelligandecouverte.ville.montreal.qc.ca/iii/encore/record/C__Rb2358830?lang=frc
Bibliothèque Benny	Jeunes - DVD	Happily n'ever after[enregistrement vidéo] =[Au royaume désenchanté] /réalisation, Paul J. Bolger ; scénario, Rob Moreland. Happily n'ever after 2 : Snow White, another bite @ the apple / written by Chris Denk ; directed by Steven E. Gordon, Boyd Kirkland.	5	1	https://nelligandecouverte.ville.montreal.qc.ca/iii/encore/record/C__Rb2338931?lang=frc
Bibliothèque Benny	Adultes - DVD	Identity thief[enregistrement vidéo] /Universal Pictures in association with Relativity Media ; a Bluegrass Films, Aggregate Films production ; produced by Scott Stuber, Jason Bateman, Pamela Abdy ; story by Jerry Eeten, Craig Mazin ; screenplay by Craig Mazin ; directed by Seth Gordon.	5	1	https://nelligandecouverte.ville.montreal.qc.ca/iii/encore/record/C__Rb2416556?lang=frc
Bibliothèque Benny	Adultes - Cours de langue	Using French.[Advanced level][ensemble multi-supports] :le francais en pratique /by Anthony Bulger ; with the editorial assistance of Jean-Loup Cherel ; illustrations by J.-L. Goussé.	5	5	https://nelligandecouverte.ville.montreal.qc.ca/iii/encore/record/C__Rb1351406?lang=frc
