Nom Bibliothèque	Secteur	Titre	Nombre de prêt	Nombre de document	Lien URL
Bibliothèque du Haut-Anjou	Adultes - Documentaires	Les clés pour lâcher prise :libérez-vous des liens qui vous retiennent /Guy Finley ; traduit de l'américain par Louise Drolet.	3	1	https://nelligandecouverte.ville.montreal.qc.ca/iii/encore/record/C__Rb1169982?lang=frc
Bibliothèque du Haut-Anjou	Adultes - Documentaires	Un bureau feng shui pour les nuls /Holly Ziegler, Jennifer Lawler ; [traduction, Emmanuelle Clément].	3	1	https://nelligandecouverte.ville.montreal.qc.ca/iii/encore/record/C__Rb1375906?lang=frc
Bibliothèque du Haut-Anjou	Adultes - Documentaires	Guide de la route /[publication réalisée par la Société de l'assurance automobile du Québec].	3	10	https://nelligandecouverte.ville.montreal.qc.ca/iii/encore/record/C__Rb2448995?lang=frc
Bibliothèque du Haut-Anjou	Adultes - Romans	Madame Tout-le-monde.1,Cap-aux-Brumes :roman historique /Juliette Thibault.	3	2	https://nelligandecouverte.ville.montreal.qc.ca/iii/encore/record/C__Rb2257850?lang=frc
Bibliothèque du Haut-Anjou	Adultes - Romans	Lit double.2 :roman /Janette Bertrand.	3	2	https://nelligandecouverte.ville.montreal.qc.ca/iii/encore/record/C__Rb2381520?lang=frc
Bibliothèque du Haut-Anjou	Adultes - Romans	Dark-hunters.1,L'homme maudit /Sherrilyn Kenyon ; traduit de l'américain par Jacques Penel.	3	1	https://nelligandecouverte.ville.montreal.qc.ca/iii/encore/record/C__Rb1991741?lang=frc
Bibliothèque du Haut-Anjou	Adultes - Nouveautés	La veuve du boulanger :roman /Denis Monette.	3	5	https://nelligandecouverte.ville.montreal.qc.ca/iii/encore/record/C__Rb2466496?lang=frc
Bibliothèque du Haut-Anjou	Adultes - Romans	Les héritiers du fleuve.2,1898-1914 /Louise Tremblay-D'Essiambre.	3	5	https://nelligandecouverte.ville.montreal.qc.ca/iii/encore/record/C__Rb2410973?lang=frc
Bibliothèque L’Octogone	Adultes - Littérature canadienne	Les héritiers du fleuve.4,1931-1939 /Louise Tremblay-D'Essiambre.	15	19	https://nelligandecouverte.ville.montreal.qc.ca/iii/encore/record/C__Rb2476200?lang=frc
Bibliothèque L’Octogone	Adultes - Tablettes numériques	Tablette iPad 2 [L'Octogone]	12	4	https://nelligandecouverte.ville.montreal.qc.ca/iii/encore/record/C__Rb2429720?lang=frc
Bibliothèque L’Octogone	Adultes - DVD	Upstairs, downstairs : the complete series[enregistrement vidéo].	9	12	https://nelligandecouverte.ville.montreal.qc.ca/iii/encore/record/C__Rb1840225?lang=frc
Bibliothèque L’Octogone	Adultes - Littérature canadienne	Les héritiers du fleuve.2,1898-1914 /Louise Tremblay-D'Essiambre.	9	11	https://nelligandecouverte.ville.montreal.qc.ca/iii/encore/record/C__Rb2410973?lang=frc
Bibliothèque L’Octogone	Adultes - DVD	Six feet under.The complete first season[enregistrement vidéo] =[Six pieds sous terre.L'intégrale de la première saison] /created by Alan Ball.	8	5	https://nelligandecouverte.ville.montreal.qc.ca/iii/encore/record/C__Rb1451730?lang=frc
Bibliothèque L’Octogone	Adultes - DVD	RED 2[enregistrement vidéo] =R.E.D. 2 /réalisation, Dean Parisot ; scénario Jon Hoeber, Erich Hoeber.	8	3	https://nelligandecouverte.ville.montreal.qc.ca/iii/encore/record/C__Rb2430188?lang=frc
Bibliothèque L’Octogone	Adultes - Littérature canadienne	Mensonges sur le Plateau Mont-Royal.1,Un mariage de raison : roman historique /Michel David.	8	15	https://nelligandecouverte.ville.montreal.qc.ca/iii/encore/record/C__Rb2403174?lang=frc
Bibliothèque L’Octogone	Adultes - Romans	La vérité sur l'affaire Harry Quebert :roman /Joël Dicker.	8	8	https://nelligandecouverte.ville.montreal.qc.ca/iii/encore/record/C__Rb2357828?lang=frc
Bibliothèque L’Octogone	Adultes - Littérature canadienne	Les héritiers du fleuve.3,1918-1929 /Louise Tremblay-D'Essiambre.	8	10	https://nelligandecouverte.ville.montreal.qc.ca/iii/encore/record/C__Rb2441946?lang=frc
Bibliothèque L’Octogone	Adultes - Documentaires	Guide de la route /[publication réalisée par la Société de l'assurance automobile du Québec].	8	13	https://nelligandecouverte.ville.montreal.qc.ca/iii/encore/record/C__Rb2448995?lang=frc
Bibliothèque L’Octogone	Adultes - DVD	Evolve[enregistrement vidéo] /produced by Optomen Productions, Inc. for History ; executive producer for History, Charles Nordlander ; series producers, Neil Laird, Jonathan Grupper ; executive producer, Beth Hoppe.	8	4	https://nelligandecouverte.ville.montreal.qc.ca/iii/encore/record/C__Rb2204545?lang=frc
Bibliothèque L’Octogone	Adultes - DVD	The Essential Charlie Chaplin collection[enregistrement vidéo].	8	12	https://nelligandecouverte.ville.montreal.qc.ca/iii/encore/record/C__Rb2204093?lang=frc
Bibliothèque L’Octogone	Adultes - DVD	Star Trek Voyager.Season two[videorecording] /producer Merri Howard ... [et al.] ; teleplay by Michael Piller ... [et al.] ; directed by Winrich Kolbe ... [et al.].	8	7	https://nelligandecouverte.ville.montreal.qc.ca/iii/encore/record/C__Rb1842601?lang=frc
Bibliothèque L’Octogone	Jeunes - Romans	Lire-Tôt :[série A-B] /Thérèse Daignault ; [illustrations, Chantal Gagnon].	8	10	https://nelligandecouverte.ville.montreal.qc.ca/iii/encore/record/C__Rb1452441?lang=frc
Bibliothèque L’Octogone	Adultes - DVD	Pompei[enregistrement vidéo] =Pompéii /réalisation, Paul W. S. Anderson ; scéanario, Janet Scott Batchler, Lee Batchler, Michael Robert Johnson.	7	2	https://nelligandecouverte.ville.montreal.qc.ca/iii/encore/record/C__Rb2455361?lang=frc
Bibliothèque L’Octogone	Adultes - DVD	Arnaque américaine[enregistrement vidéo] =American hustle /réalisation, David O. Russell ; scénario, Eric Warren Singer, David O. Russell.	7	3	https://nelligandecouverte.ville.montreal.qc.ca/iii/encore/record/C__Rb2446637?lang=frc
Bibliothèque L’Octogone	Jeunes - DVD	Hot wheels Battle Force 5.La première saison complète[enregistrement vidéo] =Hot wheels Battle Force 5.The complete first season /[created by Andrew Duncan].	7	7	https://nelligandecouverte.ville.montreal.qc.ca/iii/encore/record/C__Rb1935047?lang=frc
Bibliothèque L’Octogone	Adultes - DVD	Star trek Voyager.Season four[videorecording] /written by Lisa Klink ... [et al.] ; directed by Marvin V. Rush ... [et al.].	7	7	https://nelligandecouverte.ville.montreal.qc.ca/iii/encore/record/C__Rb1842826?lang=frc
Bibliothèque L’Octogone	Adultes - DVD	Les contes d'Avonlea.L'intégrale de la troisième saison[enregistrement vidéo] =Road to Avonlea.The complete third season.	7	4	https://nelligandecouverte.ville.montreal.qc.ca/iii/encore/record/C__Rb1979087?lang=frc
Bibliothèque L’Octogone	Jeunes - DVD	Barbie et les Trois Mousquetaires[enregistrement vidéo] =Barbie and the Three Musketeers /Mattel Entertainment presents a Rainmaker Animation production ; written by Amy Wolfram ; produced by Shelly Dvi-Vardhana, Pat Link, Shawn McCorkindale ; director, William Lau.	7	3	https://nelligandecouverte.ville.montreal.qc.ca/iii/encore/record/C__Rb1838136?lang=frc
Bibliothèque Henri-Bourassa	Jeunes - DVD	Dragon Ball.Complete collection movie 4 pack[enregistrement vidéo] /produced by Toei Animation Co. Ltd.	9	4	https://nelligandecouverte.ville.montreal.qc.ca/iii/encore/record/C__Rb2465981?lang=frc
Bibliothèque Henri-Bourassa	Adultes - Nouveautés	Les héritiers du fleuve.4,1931-1939 /Louise Tremblay-D'Essiambre.	8	7	https://nelligandecouverte.ville.montreal.qc.ca/iii/encore/record/C__Rb2476200?lang=frc
Bibliothèque Henri-Bourassa	Adultes - Documentaires	La Bonne chanson[musique] :un foyer où l'on chante est un foyer heureux.	6	10	https://nelligandecouverte.ville.montreal.qc.ca/iii/encore/record/C__Rb1144297?lang=frc
Bibliothèque Henri-Bourassa	Adultes - DVD	Hunger games[enregistrement vidéo] :l'embrasement = The Hunger games : catching fire /réalisation, Francis Lawrence ; scénario, Simon Beaufoy, Michael de Bruyn.	6	3	https://nelligandecouverte.ville.montreal.qc.ca/iii/encore/record/C__Rb2440675?lang=frc
Bibliothèque Henri-Bourassa	Adultes - DVD	Battlestar Galactica.Season 2.0[enregistrement vidéo].	6	3	https://nelligandecouverte.ville.montreal.qc.ca/iii/encore/record/C__Rb1799299?lang=frc
Bibliothèque Henri-Bourassa	Jeunes - DVD	Rio[enregistrement vidéo] /réalisation, Carlos Saldanha ; scénario, Don Rhymer ... [et al.].	6	3	https://nelligandecouverte.ville.montreal.qc.ca/iii/encore/record/C__Rb2251429?lang=frc
Bibliothèque Henri-Bourassa	Adultes - DVD	Bones.Season three[enregistrement vidéo] /created by Hart Hanson.	6	3	https://nelligandecouverte.ville.montreal.qc.ca/iii/encore/record/C__Rb1816046?lang=frc
Bibliothèque Henri-Bourassa	Jeunes - BD	Lili fait sa commandante /[texte de] Dominique de Saint Mars ; [illustrations de] Serge Bloch.	6	3	https://nelligandecouverte.ville.montreal.qc.ca/iii/encore/record/C__Rb1830776?lang=frc
Bibliothèque Henri-Bourassa	Adultes - Romans	Le journal de Sophie Clarency /Guy Rachet.	6	3	https://nelligandecouverte.ville.montreal.qc.ca/iii/encore/record/C__Rb1313232?lang=frc
Bibliothèque Henri-Bourassa	Adultes - DVD	Cobaye[enregistrement vidéo] =Crawlspace /réalisation, Justin Dix ; scénario, Justin Dix, Adam Patrick Foster, Eddie Baroo.	5	1	https://nelligandecouverte.ville.montreal.qc.ca/iii/encore/record/C__Rb2419888?lang=frc
Bibliothèque Henri-Bourassa	Jeunes - DVD	Princesse Sofia[enregistrement vidéo] :il était une fois une princesse = Sofia the First : once upon a princess /réalisation, Jamie Mitchell ; scénario, Craig Gerber.	5	2	https://nelligandecouverte.ville.montreal.qc.ca/iii/encore/record/C__Rb2388746?lang=frc
Bibliothèque Henri-Bourassa	Adultes - DVD	[Dre Grey, leçons d'anatomie.L'intégrale de la cinquième saison][enregistrement vidéo] =Grey's anatomy.Complete fifth season /created by Shonda Rhimes.	5	4	https://nelligandecouverte.ville.montreal.qc.ca/iii/encore/record/C__Rb1842683?lang=frc
Bibliothèque Henri-Bourassa	Adultes - DVD	Smallville.L'intégrale de la troisième saison[enregistrement vidéo] =Smallville.The complete third season /directed by Greg Beeman ; written by Alfred Gough.	5	3	https://nelligandecouverte.ville.montreal.qc.ca/iii/encore/record/C__Rb1812169?lang=frc
Bibliothèque Henri-Bourassa	Jeunes - DVD	Dora et la forêt enchantée[enregistrement vidéo] =Dora's enchanted forest adventures.	5	4	https://nelligandecouverte.ville.montreal.qc.ca/iii/encore/record/C__Rb2281195?lang=frc
Bibliothèque Henri-Bourassa	Adultes - DVD	Heroes.Season 1[enregistrement vidéo] /created by Tim Kring.	5	4	https://nelligandecouverte.ville.montreal.qc.ca/iii/encore/record/C__Rb1514033?lang=frc
Bibliothèque Henri-Bourassa	Jeunes - Nouveautés	L'automne est arrivé[enregistrement vidéo] =Autumn's here /réalisation, Steve Moltzen.	5	1	https://nelligandecouverte.ville.montreal.qc.ca/iii/encore/record/C__Rb2477784?lang=frc
Bibliothèque Henri-Bourassa	Adultes - DVD	Quitte ou double[enregistrement vidéo] =2 guns /réalisation, Baltasar Kormakur ; scénario, Blake Masters.	4	1	https://nelligandecouverte.ville.montreal.qc.ca/iii/encore/record/C__Rb2428787?lang=frc
Bibliothèque Henri-Bourassa	Adultes - DVD	La peur dans la peau[enregistrement vidéo] :l'héritage de Bourne = The Bourne legacy /réalisation, Tony Gilroy ; scénario, Tony Gilroy, Dan Gilroy.	4	1	https://nelligandecouverte.ville.montreal.qc.ca/iii/encore/record/C__Rb2367662?lang=frc
Bibliothèque Henri-Bourassa	Jeunes - DVD	Jack de la jungle[enregistrement vidéo] =Amazon Jack /réalisation, Jorgen Lerdam, Flemming Quist Moller ; scénario, Flemming Quist Moller.	4	2	https://nelligandecouverte.ville.montreal.qc.ca/iii/encore/record/C__Rb2466547?lang=frc
Bibliothèque Henri-Bourassa	Adultes - DVD	Chop shop[videorecording] /produced by Jeb Brody, Lisa Muskat, Marc Turtletaub ; written by Bahareh Azimi, Ramin Bahrani ; directed by Ramin Bahrani.	4	1	https://nelligandecouverte.ville.montreal.qc.ca/iii/encore/record/C__Rb1757586?lang=frc
Bibliothèque de Belleville	Adultes - DVD	Les dossiers Bourne[enregistrement vidéo] =The Bourne files.	6	2	https://nelligandecouverte.ville.montreal.qc.ca/iii/encore/record/C__Rb1466018?lang=frc
Bibliothèque de Belleville	Adultes - DVD	Gravité[enregistrement vidéo] =Gravity /réalisation, Alfonso Cuarón ; scénario, Alfonso Cuarón, Jonás Cuarón.	4	1	https://nelligandecouverte.ville.montreal.qc.ca/iii/encore/record/C__Rb2441487?lang=frc
Bibliothèque de Belleville	Jeunes - DVD	Le chat potté[enregistrement vidéo] =Puss in boots /réalisation, Chris Miller ; scénario, Tom Wheeler ; histoire, Bryan Lynch, Will Davies, Tom Wheeler.	4	2	https://nelligandecouverte.ville.montreal.qc.ca/iii/encore/record/C__Rb2287771?lang=frc
Bibliothèque de Belleville	Adultes - DVD	La grande beauté[enregistrement vidéo] =The great beauty = [La grande bellezza] /réalisation, Paolo Sorrentino ; scénario, Paolo Sorrentino, Umberto Contarello.	4	1	https://nelligandecouverte.ville.montreal.qc.ca/iii/encore/record/C__Rb2449702?lang=frc
Bibliothèque de Belleville	Jeunes - BD	Lou!.1,Journal infime /Julien Neel.	4	2	https://nelligandecouverte.ville.montreal.qc.ca/iii/encore/record/C__Rb1371939?lang=frc
Bibliothèque de Belleville	Jeunes - DVD	Les Schtroumpfs.2[enregistrement vidéo] =The Smurfs.2 /réalisation, Raja Gosnell ; scénario, J. David Stem ... [et al.].	4	2	https://nelligandecouverte.ville.montreal.qc.ca/iii/encore/record/C__Rb2427967?lang=frc
Bibliothèque de Belleville	Adultes - Romans	Clair-obscur.1,La beauté du mal /Wendy Higgins ; traduit de l'anglais par Sébastien Arviset et Sophie Beaume.	3	1	https://nelligandecouverte.ville.montreal.qc.ca/iii/encore/record/C__Rb2473286?lang=frc
Bibliothèque de Belleville	Jeunes - DVD	Dora aime Babouche[enregistrement vidéo] =Dora loves Boots.	3	2	https://nelligandecouverte.ville.montreal.qc.ca/iii/encore/record/C__Rb2372524?lang=frc
Bibliothèque de Belleville	Jeunes - DVD	Dora au pays des merveilles[enregistrement vidéo] =Dora in Wonderland.	3	2	https://nelligandecouverte.ville.montreal.qc.ca/iii/encore/record/C__Rb2446627?lang=frc
Bibliothèque de Belleville	Jeunes - DVD	Il pleut des hamburgers[enregistrement vidéo] =Cloudy with a chance of meatballs /réalisation et scénario, Phil Lord, Chris Miller.	3	2	https://nelligandecouverte.ville.montreal.qc.ca/iii/encore/record/C__Rb1918854?lang=frc
Bibliothèque de Belleville	Jeunes - DVD	Les Schtroumpfs[enregistrement vidéo] :la légende du cavalier fantôme = The Smurfs : the legend of smurfy hollow /réalisation, Stephan Franck ; scénario, Todd Berger.	3	2	https://nelligandecouverte.ville.montreal.qc.ca/iii/encore/record/C__Rb2412870?lang=frc
Bibliothèque de Belleville	Jeunes - DVD	Harry Potter.Années 1 à 5[enregistrement vidéo] =Harry Potter.Years 1-5.	3	5	https://nelligandecouverte.ville.montreal.qc.ca/iii/encore/record/C__Rb1803814?lang=frc
Bibliothèque de Belleville	Jeunes - DVD	Fuyons la planète Terre[enregistrement vidéo] =Escape from planet Earth /réalisation, Cal Brunker ; scénario, Bob Barlen et Cal Brunker ; d'après une histoire de Cory Edwards et Tony Leech.	3	2	https://nelligandecouverte.ville.montreal.qc.ca/iii/encore/record/C__Rb2398275?lang=frc
Bibliothèque de Belleville	Jeunes - DVD	Barbie et la magie des perles[enregistrement vidéo] =Barbie, the pearl princess /réalisation, Zeke Norton ; scénario, Cydne Clark et Steve Granat.	3	2	https://nelligandecouverte.ville.montreal.qc.ca/iii/encore/record/C__Rb2446848?lang=frc
Bibliothèque de Belleville	Jeunes - Romans	Hackerboy /Julie Champagne.	3	2	https://nelligandecouverte.ville.montreal.qc.ca/iii/encore/record/C__Rb2263500?lang=frc
Bibliothèque de Belleville	Jeunes - Romans	Planches d'enfer.1,Annabelle : 180° /Chloé Varin ; d'après une idée de Michel Brûlé.	3	2	https://nelligandecouverte.ville.montreal.qc.ca/iii/encore/record/C__Rb2314122?lang=frc
Bibliothèque de Belleville	Adultes - DVD	Prison break.Season one[enregistrement vidéo] /created by Paul Scheuring.	3	3	https://nelligandecouverte.ville.montreal.qc.ca/iii/encore/record/C__Rb1515454?lang=frc
Bibliothèque de Belleville	Jeunes - DVD	La fée pirate[enregistrement vidéo] =The pirate fairy /réalisation, Peggy Holmes.	3	2	https://nelligandecouverte.ville.montreal.qc.ca/iii/encore/record/C__Rb2449640?lang=frc
Bibliothèque de Belleville	Adultes - DVD	Bad words (Film)	3	1	https://nelligandecouverte.ville.montreal.qc.ca/iii/encore/record/C__Rb2461888?lang=frc
Bibliothèque de Belleville	Adultes - DVD	Et si le ciel existait?[enregistrement vidéo] =Heaven is for real /réalisation, Randall Wallace ; scénario, Randall Wallace, Christopher Parker.	3	1	https://nelligandecouverte.ville.montreal.qc.ca/iii/encore/record/C__Rb2464042?lang=frc
Bibliothèque de Charleroi	Jeunes - DVD	Les contes de l'histoire sans fin[enregistrement vidéo] =Tales from the neverending story /scénario, David Preston, Leila Basen, Karin Howard ; réalisation, Giles Walker, Adam Weissman.	8	4	https://nelligandecouverte.ville.montreal.qc.ca/iii/encore/record/C__Rb1395167?lang=frc
Bibliothèque de Charleroi	Jeunes - DVD	Le réveil des gardiens[enregistrement vidéo] =Rise of the guardians /réalisation, Peter Ramsey ; scénario, David Lindsay-Abaire.	6	2	https://nelligandecouverte.ville.montreal.qc.ca/iii/encore/record/C__Rb2384896?lang=frc
Bibliothèque de Charleroi	Adultes - Documentaires	La boîte à lunch familiale :[préparer les lunchs en famille] /Sophie Tremblay.	5	1	https://nelligandecouverte.ville.montreal.qc.ca/iii/encore/record/C__Rb2256801?lang=frc
Bibliothèque de Charleroi	Jeunes - Nouveautés	Jack et la mécanique du coeur[enregistrement vidéo] =Jack and the cuckoo-clock heart /réalisation, Stéphane Berla, Mathias Malzieu ; scénario, Mathias Malzieu.	5	1	https://nelligandecouverte.ville.montreal.qc.ca/iii/encore/record/C__Rb2474543?lang=frc
Bibliothèque de Charleroi	Jeunes - Nouveautés	La Belle au bois dormant[enregistrement vidéo] =Sleeping beauty /animation, Milt Kahl ... [et al.] ; réalisation, Clyde Geronimi.	5	2	https://nelligandecouverte.ville.montreal.qc.ca/iii/encore/record/C__Rb2474718?lang=frc
Bibliothèque de Charleroi	Jeunes - DVD	Les Schtroumpfs.2[enregistrement vidéo] =The Smurfs.2 /réalisation, Raja Gosnell ; scénario, J. David Stem ... [et al.].	4	2	https://nelligandecouverte.ville.montreal.qc.ca/iii/encore/record/C__Rb2427967?lang=frc
Bibliothèque de Charleroi	Jeunes - DVD	Scooby-Doo!.Aventures en Transylvanie[enregistrement vidéo] =Scooby-Doo!.Frankencreepy /written by Jim Krieg ; produced and directed by Paul McEvoy.	4	2	https://nelligandecouverte.ville.montreal.qc.ca/iii/encore/record/C__Rb2468758?lang=frc
Bibliothèque de Charleroi	Jeunes - DVD	Barbie et la magie des perles[enregistrement vidéo] =Barbie, the pearl princess /réalisation, Zeke Norton ; scénario, Cydne Clark et Steve Granat.	4	2	https://nelligandecouverte.ville.montreal.qc.ca/iii/encore/record/C__Rb2446848?lang=frc
Bibliothèque de Charleroi	Jeunes - BD	Les bleues de Rio de Janeiro /[illustrations de] Maxim Cyr & [texte de] Karine Gottot.	4	2	https://nelligandecouverte.ville.montreal.qc.ca/iii/encore/record/C__Rb2412581?lang=frc
Bibliothèque de Charleroi	Jeunes - DVD	Ramona et Beezus[enregistrement vidéo] =Ramona and Beezus /réalisation, Elizabeth Allen ; scénario, Laurie Craig, Nick Pustay.	4	1	https://nelligandecouverte.ville.montreal.qc.ca/iii/encore/record/C__Rb2115334?lang=frc
Bibliothèque de Charleroi	Jeunes - DVD	Dreamworks classiques des fêtes[enregistrement vidéo] =Dreamworks holiday classics.	4	1	https://nelligandecouverte.ville.montreal.qc.ca/iii/encore/record/C__Rb2360414?lang=frc
Bibliothèque de Charleroi	Jeunes - DVD	Mission dindons[enregistrement vidéo] =Free birds /réalisation, Jimmy Hayward ; scénario, Scott Mosier, Jimmy Hayward.	4	2	https://nelligandecouverte.ville.montreal.qc.ca/iii/encore/record/C__Rb2438026?lang=frc
Bibliothèque de Charleroi	Jeunes - Romans	La revanche du myope /Marc-André Pilon.	4	2	https://nelligandecouverte.ville.montreal.qc.ca/iii/encore/record/C__Rb2112473?lang=frc
Bibliothèque de Charleroi	Jeunes - DVD	Dora aime Babouche[enregistrement vidéo] =Dora loves Boots.	4	2	https://nelligandecouverte.ville.montreal.qc.ca/iii/encore/record/C__Rb2372524?lang=frc
Bibliothèque de Charleroi	Jeunes - DVD	Rio[enregistrement vidéo] /réalisation, Carlos Saldanha ; scénario, Don Rhymer ... [et al.].	4	3	https://nelligandecouverte.ville.montreal.qc.ca/iii/encore/record/C__Rb2251429?lang=frc
Bibliothèque de Charleroi	Adultes - DVD	Louis Cyr, l'homme le plus fort du monde[enregistrement vidéo] =Louis Cyr, the strongest man in the world /réalisation, Daniel Roby ; scénario, Sylvain Guy.	4	2	https://nelligandecouverte.ville.montreal.qc.ca/iii/encore/record/C__Rb2427871?lang=frc
Bibliothèque de Charleroi	Jeunes - BD	L'école des vannes /scénario et dessin, Thierry Coppée.	4	3	https://nelligandecouverte.ville.montreal.qc.ca/iii/encore/record/C__Rb1360360?lang=frc
Bibliothèque de Charleroi	Jeunes - Nouveautés	Les aventuriers du timbre perdu[enregistrement vidéo] ;Le retour des aventuriers du timbre perdu /scénario et réalisation, Michael Rubbo.	4	1	https://nelligandecouverte.ville.montreal.qc.ca/iii/encore/record/C__Rb2477509?lang=frc
Bibliothèque de Charleroi	Jeunes - Nouveautés	Monster High.Fusion monstreuse[enregistrement vidéo] =Monster High.Freaky fusion.	4	1	https://nelligandecouverte.ville.montreal.qc.ca/iii/encore/record/C__Rb2473000?lang=frc
Bibliothèque de Charleroi	Jeunes - Nouveautés	Au pays du miroir magique[enregistrement vidéo] /réalisation, Maxim Sveshnikov et Vlad Barbe ; scénario, Vadim Svesnikov Vladbarbe... [et al.].	4	1	https://nelligandecouverte.ville.montreal.qc.ca/iii/encore/record/C__Rb2478962?lang=frc
Bibliothèque de la Maison culturelle et communautaire	Jeunes - Jeux vidéo sur console	FIFA soccer 13[ressource électronique (PlayStation 3)].	7	4	https://nelligandecouverte.ville.montreal.qc.ca/iii/encore/record/C__Rb2352548?lang=frc
Bibliothèque de la Maison culturelle et communautaire	Jeunes - DVD	Turbo[enregistrement vidéo] /directed by David Soren ; screenplay by David Soren and Darren Lemke and Robert Siegel.	6	2	https://nelligandecouverte.ville.montreal.qc.ca/iii/encore/record/C__Rb2424698?lang=frc
Bibliothèque de la Maison culturelle et communautaire	Jeunes - DVD	Histoire de jouets.Angoisse au motel[enregistrement vidéo] =Toy story of terror! /scénario et réalisation, Angus MacLane.	5	2	https://nelligandecouverte.ville.montreal.qc.ca/iii/encore/record/C__Rb2466906?lang=frc
Bibliothèque de la Maison culturelle et communautaire	Jeunes - DVD	Caillou imagine[enregistrement vidéo] =Caillou's imagination.	5	2	https://nelligandecouverte.ville.montreal.qc.ca/iii/encore/record/C__Rb2374713?lang=frc
Bibliothèque de la Maison culturelle et communautaire	Adultes - DVD	Mission: impossible.The second TV season[videorecording] /created by Bruce Geller.	5	4	https://nelligandecouverte.ville.montreal.qc.ca/iii/encore/record/C__Rb1971142?lang=frc
Bibliothèque de la Maison culturelle et communautaire	Jeunes - DVD	Caillou.Caillou joue au baseball[enregistrement vidéo] =Caillou.Caillou plays baseball.	5	2	https://nelligandecouverte.ville.montreal.qc.ca/iii/encore/record/C__Rb2467250?lang=frc
Bibliothèque de la Maison culturelle et communautaire	Adultes - DVD	Les psychopathes[enregistrement vidéo] =Seven psychopaths /scénario et réalisation, Martin McDonagh.	4	1	https://nelligandecouverte.ville.montreal.qc.ca/iii/encore/record/C__Rb2378380?lang=frc
Bibliothèque de la Maison culturelle et communautaire	Adultes - DVD	Mama[enregistrement vidéo] /réalisation, Andy Muschietti ; histoire, Andy Muschietti, Barbara Muschietti ; scénario, Neil Cross, Andy Muschietti, Barbara Muschietti.	4	1	https://nelligandecouverte.ville.montreal.qc.ca/iii/encore/record/C__Rb2398329?lang=frc
Bibliothèque de la Maison culturelle et communautaire	Adultes - DVD	Arbitrage[enregistrement vidéo] /réalisé par Nicholas Jarecki.	4	1	https://nelligandecouverte.ville.montreal.qc.ca/iii/encore/record/C__Rb2373027?lang=frc
Bibliothèque de la Maison culturelle et communautaire	Adultes - DVD	Charmed : the complete first season[enregistrement vidéo] /created by Constance M. Burge.	4	4	https://nelligandecouverte.ville.montreal.qc.ca/iii/encore/record/C__Rb1951477?lang=frc
Bibliothèque de la Maison culturelle et communautaire	Adultes - DVD	Blanche[enregistrement vidéo] :coffret de collection /réalisation, Charles Binamé ; scénario, Louise Pelletier, Andrée Pelletier.	4	2	https://nelligandecouverte.ville.montreal.qc.ca/iii/encore/record/C__Rb1434103?lang=frc
Bibliothèque de la Maison culturelle et communautaire	Jeunes - Jeux vidéo sur console	FIFA soccer 13[ressource électronique (Wii U)].	4	2	https://nelligandecouverte.ville.montreal.qc.ca/iii/encore/record/C__Rb2369053?lang=frc
Bibliothèque de la Maison culturelle et communautaire	Jeunes - DVD	Opération noisettes[enregistrement vidéo] =The nut job /réalisation, Peter Lepeniotis ; histoire, Daniel Woo, Peter Lepeniotis ; scénario, Lorne Cameron, Peter Lepeniotis.	4	2	https://nelligandecouverte.ville.montreal.qc.ca/iii/encore/record/C__Rb2444888?lang=frc
Bibliothèque de la Maison culturelle et communautaire	Adolescents - Mangas	Alice au royaume de Coeur.2 /[texte de] QuinRose ; [illustrations de] Soumei Hoshino ; [traduction, Fédoua Lamodière].	4	1	https://nelligandecouverte.ville.montreal.qc.ca/iii/encore/record/C__Rb1983292?lang=frc
Bibliothèque de la Maison culturelle et communautaire	Jeunes - Jeux vidéo sur console	Driver.San Francisco[ressource électronique (Xbox 360)]	4	1	https://nelligandecouverte.ville.montreal.qc.ca/iii/encore/record/C__Rb2350288?lang=frc
Bibliothèque de la Maison culturelle et communautaire	Adultes - DVD	Heroes.Season 1[enregistrement vidéo] /created by Tim Kring.	4	5	https://nelligandecouverte.ville.montreal.qc.ca/iii/encore/record/C__Rb1514033?lang=frc
