Nom Bibliothèque	Secteur	Titre	Nombre de prêt	Nombre de document	Lien URL
Bibliothèque du Haut-Anjou	Adultes - Romans	Angélique :roman /Christine Lamer.	3	1	https://nelligandecouverte.ville.montreal.qc.ca/iii/encore/record/C__Rb2468294?lang=frc
Bibliothèque du Haut-Anjou	Adultes - Nouveautés	Love's reckoning.Français	2	1	https://nelligandecouverte.ville.montreal.qc.ca/iii/encore/record/C__Rb2457037?lang=frc
Bibliothèque du Haut-Anjou	Adultes - Nouveautés	Love's awakening.Français	2	1	https://nelligandecouverte.ville.montreal.qc.ca/iii/encore/record/C__Rb2457026?lang=frc
Bibliothèque du Haut-Anjou	Jeunes - Documentaires	Le grand livre des copains :pour en avoir plein et faire plein de choses ensemble /Pierre Lecarme, Laurent Audoin.	2	1	https://nelligandecouverte.ville.montreal.qc.ca/iii/encore/record/C__Rb1349550?lang=frc
Bibliothèque du Haut-Anjou	Jeunes - Nouveautés	Nage, Babouche! /écrit par Phoebe Beinstein ; illustré par Robert Roper ; [traductrice, Emie Vallée].	2	1	https://nelligandecouverte.ville.montreal.qc.ca/iii/encore/record/C__Rb2465410?lang=frc
Bibliothèque du Haut-Anjou	Jeunes - Nouveautés	Le spectacle de danse de Dora /adapté par Xanna Eve Chown selon le scénario télé original de Teri Weiss ; illustré par Artful Doodlers ; [traductrice, Emie Vallée].	2	1	https://nelligandecouverte.ville.montreal.qc.ca/iii/encore/record/C__Rb2434041?lang=frc
Bibliothèque du Haut-Anjou	Jeunes - BD	L'homme de Washington /dessin, Achdé ; scénario, Laurent Gerra & Achdé ; d'après Morris.	2	1	https://nelligandecouverte.ville.montreal.qc.ca/iii/encore/record/C__Rb1800595?lang=frc
Bibliothèque du Haut-Anjou	Adultes - Nouveautés	Dear John.Français	2	1	https://nelligandecouverte.ville.montreal.qc.ca/iii/encore/record/C__Rb2480129?lang=frc
Bibliothèque du Haut-Anjou	Jeunes - DVD	Les Schtroumpfs.Le Bébé Schtroumpf[enregistrement vidéo].	2	1	https://nelligandecouverte.ville.montreal.qc.ca/iii/encore/record/C__Rb2462505?lang=frc
Bibliothèque du Haut-Anjou	Jeunes - DVD	Les avions.Les pompiers du ciel[enregistrement vidéo] =Planes.Fire & rescue /réalisation, Roberts Gannaway ; scénario, Roberts Gannaway, Jeffrey M. Howard.	2	1	https://nelligandecouverte.ville.montreal.qc.ca/iii/encore/record/C__Rb2479299?lang=frc
Bibliothèque du Haut-Anjou	Jeunes - DVD	Aventures à Zambézie[enregistrement vidéo] =Adventures in Zambezia /réalisation, Wayne Thornley ; scénario, Andrew Cook ... [et al.].	2	1	https://nelligandecouverte.ville.montreal.qc.ca/iii/encore/record/C__Rb2406399?lang=frc
Bibliothèque L’Octogone	Adultes - Tablettes numériques	Tablette iPad 2 [L'Octogone]	21	4	https://nelligandecouverte.ville.montreal.qc.ca/iii/encore/record/C__Rb2429720?lang=frc
Bibliothèque L’Octogone	Adultes - Littérature canadienne	Les héritiers du fleuve.4,1931-1939 /Louise Tremblay-D'Essiambre.	10	19	https://nelligandecouverte.ville.montreal.qc.ca/iii/encore/record/C__Rb2476200?lang=frc
Bibliothèque L’Octogone	Jeunes - DVD	ThunderCats, Season 1, volume 1[enregistrement vidéo] =CosmoCats, saison 1, volume 1. --	9	6	https://nelligandecouverte.ville.montreal.qc.ca/iii/encore/record/C__Rb2236509?lang=frc
Bibliothèque L’Octogone	Adultes - DVD	Star trek, Deep Space Nine.Season 1[videorecording] /created by Rick Berman & Michael Pillar ; teleplay by Michael Piller ... [et al.] ; story by Rick Berman ... [et al.] ; directed by David Carson ... [et al.].	9	5	https://nelligandecouverte.ville.montreal.qc.ca/iii/encore/record/C__Rb2234113?lang=frc
Bibliothèque L’Octogone	Adultes - DVD	La voleuse de livres[enregistrement vidéo] =The book thief /réalisation, Brian Percival ; scénario, Michael Petroni.	8	4	https://nelligandecouverte.ville.montreal.qc.ca/iii/encore/record/C__Rb2444810?lang=frc
Bibliothèque L’Octogone	Adultes - CD-ROM	Auto-réussite[ressource électronique] :le logiciel du Code de la route du Québec = Auto-réussite : High-way code of Québec /LogiRéussite.	7	15	https://nelligandecouverte.ville.montreal.qc.ca/iii/encore/record/C__Rb1434676?lang=frc
Bibliothèque L’Octogone	Adultes - DVD	Noé[enregistrement vidéo] =Noah /réalisation, Darren Aronofsky ; scénario, Darren Aronofsky, Ari Handel.	7	3	https://nelligandecouverte.ville.montreal.qc.ca/iii/encore/record/C__Rb2464597?lang=frc
Bibliothèque L’Octogone	Jeunes - DVD	La reine des neiges[enregistrement vidéo] =Frozen /réalisation, Chris Buck, Jennifer Lee ; scénario, Jennifer Lee ; histoire, Chris Buck, Jennifer Lee, Shane Morris.	7	4	https://nelligandecouverte.ville.montreal.qc.ca/iii/encore/record/C__Rb2446490?lang=frc
Bibliothèque L’Octogone	Jeunes - Documentaires	Tam-tam. --	7	7	https://nelligandecouverte.ville.montreal.qc.ca/iii/encore/record/C__Rb2235420?lang=frc
Bibliothèque L’Octogone	Adultes - DVD	Les hauts et les bas de Sophie Paquin.Saison 2[enregistrement vidéo] /réalisation, Claude Desrosiers, Richard Lahaie ; auteur, Richard Blaimert.	6	3	https://nelligandecouverte.ville.montreal.qc.ca/iii/encore/record/C__Rb1760663?lang=frc
Bibliothèque L’Octogone	Adultes - DVD	Capitaine America.Le soldat de l'hiver[enregistrement vidéo] =Captain America.The winter soldier /réalisation, Anthony Russo, Joe Russo ; scénario, Christopher Markus, Stephen McFeely.	6	4	https://nelligandecouverte.ville.montreal.qc.ca/iii/encore/record/C__Rb2471101?lang=frc
Bibliothèque L’Octogone	Adultes - Romans	Central Park :roman /Guillaume Musso.	6	10	https://nelligandecouverte.ville.montreal.qc.ca/iii/encore/record/C__Rb2440321?lang=frc
Bibliothèque L’Octogone	Adultes - DVD	The twilight zone[videorecording] :the complete definitive collection.Season 4 /[created by Rod Serling].	6	6	https://nelligandecouverte.ville.montreal.qc.ca/iii/encore/record/C__Rb1802371?lang=frc
Bibliothèque L’Octogone	Adultes - DVD	Friends, [season four][enregistrement vidéo] /directed by Kevin S. Bright ... [et al.] ; written by Andrew Reich ... [et al.].	6	4	https://nelligandecouverte.ville.montreal.qc.ca/iii/encore/record/C__Rb2207006?lang=frc
Bibliothèque L’Octogone	Adultes - DVD	Star trek, Enterprise.Season 3[videorecording] /created by Rick Berman & Brannon Braga ; written by Rick Berman & Brannon Braga ... [et al.] ; directed by Allan Kroeker  ... [et al.].	6	6	https://nelligandecouverte.ville.montreal.qc.ca/iii/encore/record/C__Rb2362479?lang=frc
Bibliothèque L’Octogone	Jeunes - DVD	Toopy and Binoo. Spring showers[enregistrement vidéo] = Toupie et Binou. Pluie pritanière	6	2	https://nelligandecouverte.ville.montreal.qc.ca/iii/encore/record/C__Rb2501427?lang=frc
Bibliothèque L’Octogone	Adultes - Littérature canadienne	Les héritiers du fleuve.1,1887-1893 /Louise Tremblay-D'Essiambre.	6	11	https://nelligandecouverte.ville.montreal.qc.ca/iii/encore/record/C__Rb2404543?lang=frc
Bibliothèque L’Octogone	Adultes - DVD	Judge (Film)	6	3	https://nelligandecouverte.ville.montreal.qc.ca/iii/encore/record/C__Rb2489213?lang=frc
Bibliothèque L’Octogone	Jeunes - DVD	L'ère de glace.L'aube des dinosaures[enregistrement vidéo] =Ice age.Dawn of the dinosaurs /réalisation, Carlos Saldanha, Mike Thurmeier ; scénario, Michael Berg ... [et al.].	6	4	https://nelligandecouverte.ville.montreal.qc.ca/iii/encore/record/C__Rb1842859?lang=frc
Bibliothèque L’Octogone	Jeunes - DVD	Hot wheels Battle Force 5.La première saison complète[enregistrement vidéo] =Hot wheels Battle Force 5.The complete first season /[created by Andrew Duncan].	6	6	https://nelligandecouverte.ville.montreal.qc.ca/iii/encore/record/C__Rb1935047?lang=frc
Bibliothèque Henri-Bourassa	Adultes - DVD - Coffret	Les belles histoires des Pays-d'en-Haut[enregistrement vidéo] /[texte] de Claude-Henri Grignon ; réalisation, Fernand Quirion, Yvon Trudel, Bruno Paradis.	7	4	https://nelligandecouverte.ville.montreal.qc.ca/iii/encore/record/C__Rb1407821?lang=frc
Bibliothèque Henri-Bourassa	Jeunes - BD	Le sot à ski /scénario et dessin, Thierry Coppée.	7	5	https://nelligandecouverte.ville.montreal.qc.ca/iii/encore/record/C__Rb2371243?lang=frc
Bibliothèque Henri-Bourassa	Jeunes - DVD	Dora et la forêt enchantée[enregistrement vidéo] =Dora's enchanted forest adventures.	6	4	https://nelligandecouverte.ville.montreal.qc.ca/iii/encore/record/C__Rb2281195?lang=frc
Bibliothèque Henri-Bourassa	Adultes - DVD	Bones.Season three[enregistrement vidéo] /created by Hart Hanson.	6	3	https://nelligandecouverte.ville.montreal.qc.ca/iii/encore/record/C__Rb1816046?lang=frc
Bibliothèque Henri-Bourassa	Adultes - DVD	Les experts :Miami.L'intrégrale de la saison trois[enregistrement vidéo] =CSI, Miami.The complete season three /créé par Anthony E. Zuiker, Ann Donahue, Carol Mendelsohn.	6	6	https://nelligandecouverte.ville.montreal.qc.ca/iii/encore/record/C__Rb1514044?lang=frc
Bibliothèque Henri-Bourassa	Adultes - DVD	Duplessis[enregistrement vidéo] /réalisation, Mark Blandford ; texte, Denys Arcand.	6	3	https://nelligandecouverte.ville.montreal.qc.ca/iii/encore/record/C__Rb1450342?lang=frc
Bibliothèque Henri-Bourassa	Jeunes - Documentaires	Plus de 30 tests pour se préparer et réussir!.Mathématique /Colette Laberge, Stéphane Vallée ; [illustrations, Agathe Bray-Bourret et Julien Del Busso].	5	6	https://nelligandecouverte.ville.montreal.qc.ca/iii/encore/record/C__Rb2251891?lang=frc
Bibliothèque Henri-Bourassa	Jeunes - Documentaires	Je lis! :exercices de compréhension de lecture /Pierrette Tranquille et Françoise Tchou.	5	6	https://nelligandecouverte.ville.montreal.qc.ca/iii/encore/record/C__Rb1743378?lang=frc
Bibliothèque Henri-Bourassa	Jeunes - DVD	Mulan[enregistrement vidéo] /réalisation, Barry Cook, Tony Bancroft ; scénario, Rita Hsiao... [et al.]. Mulan II / réalisation, Darrell Rooney, Lynne Southerland.	5	2	https://nelligandecouverte.ville.montreal.qc.ca/iii/encore/record/C__Rb2382099?lang=frc
Bibliothèque Henri-Bourassa	Adultes - Gros caractères	La saga des Stanislaski[texte (gros caractères)] /Nora Roberts ; traduction française de Lionel Evrard.	4	6	https://nelligandecouverte.ville.montreal.qc.ca/iii/encore/record/C__Rb1359970?lang=frc
Bibliothèque Henri-Bourassa	Jeunes - DVD	Princesse Sofia.Les fêtes à Enchancia[enregistrement vidéo] =Sofia the First.Holiday in Enchancia /[réalisateur, Jamie Mitchell].	4	2	https://nelligandecouverte.ville.montreal.qc.ca/iii/encore/record/C__Rb2479311?lang=frc
Bibliothèque Henri-Bourassa	Jeunes - DVD	Joyeux anniversaire Dora[enregistrement vidéo] =Dora's big birthday adventure.	4	2	https://nelligandecouverte.ville.montreal.qc.ca/iii/encore/record/C__Rb2081179?lang=frc
Bibliothèque Henri-Bourassa	Adultes - Nouveautés	Les héritiers du fleuve.4,1931-1939 /Louise Tremblay-D'Essiambre.	4	6	https://nelligandecouverte.ville.montreal.qc.ca/iii/encore/record/C__Rb2476200?lang=frc
Bibliothèque Henri-Bourassa	Jeunes - DVD	Barbie et la porte secrète[enregistrement vidéo] =Barbie and the secret door /réalisation, Karen J. Lloyd ; scénario, Brian Hohlfeld.	4	2	https://nelligandecouverte.ville.montreal.qc.ca/iii/encore/record/C__Rb2471993?lang=frc
Bibliothèque Henri-Bourassa	Jeunes - DVD	Animaux & cie[enregistrement vidéo] =Animals united /réalisation, Reinhard Klooss, Holger Tappe ; scénario, Oliver Huzly, Reinhard Klooss.	4	3	https://nelligandecouverte.ville.montreal.qc.ca/iii/encore/record/C__Rb2315356?lang=frc
Bibliothèque Henri-Bourassa	Adultes - DVD	La mine de la mort[enregistrement vidéo] =Dead mine /un film de Steven Sheil.	4	1	https://nelligandecouverte.ville.montreal.qc.ca/iii/encore/record/C__Rb2405966?lang=frc
Bibliothèque Henri-Bourassa	Jeunes - DVD	Dragonball.Évolution[enregistrement vidéo] =Dragonball.Evolution /réalisation, James Wong ;scénario, Ben Ramsey.	4	2	https://nelligandecouverte.ville.montreal.qc.ca/iii/encore/record/C__Rb1908247?lang=frc
Bibliothèque Henri-Bourassa	Jeunes - BD	Le maître blagueur /scénario et dessin, Thierry Coppée.	4	4	https://nelligandecouverte.ville.montreal.qc.ca/iii/encore/record/C__Rb1462248?lang=frc
Bibliothèque Henri-Bourassa	Jeunes - Nouveautés	Le meilleur de Fraisinette[enregistrement vidéo]	4	2	https://nelligandecouverte.ville.montreal.qc.ca/iii/encore/record/C__Rb2485969?lang=frc
Bibliothèque Henri-Bourassa	Adultes - DVD	Casino, la série complète[enregistrement vidéo] /réalisation, François Gingras ; scénario, Réjean Tremblay.	4	3	https://nelligandecouverte.ville.montreal.qc.ca/iii/encore/record/C__Rb1456776?lang=frc
Bibliothèque de Belleville	Jeunes - DVD	Les avions[enregistrement vidéo] =Planes /réalisation, Klay Hall ; histoire de John Lasseter, Klay Hall, Jeffrey M. Howard ; scénario, Jeffrey M. Howard.	4	2	https://nelligandecouverte.ville.montreal.qc.ca/iii/encore/record/C__Rb2413924?lang=frc
Bibliothèque de Belleville	Jeunes - DVD	This is where I leave you (Film)	4	1	https://nelligandecouverte.ville.montreal.qc.ca/iii/encore/record/C__Rb2485326?lang=frc
Bibliothèque de Belleville	Jeunes - DVD	Spring fling[enregistrement vidéo] /[created by Katharine Holabird, Helen Craig].	4	2	https://nelligandecouverte.ville.montreal.qc.ca/iii/encore/record/C__Rb2446628?lang=frc
Bibliothèque de Belleville	Jeunes - DVD	Barbie et la porte secrète[enregistrement vidéo] =Barbie and the secret door /réalisation, Karen J. Lloyd ; scénario, Brian Hohlfeld.	4	2	https://nelligandecouverte.ville.montreal.qc.ca/iii/encore/record/C__Rb2471993?lang=frc
Bibliothèque de Belleville	Jeunes - Romans	Destination étoiles /Téa Stilton ; [illustrations de Alessandro Battan ... et al. ; traduction de Lili Plumedesouris].	4	4	https://nelligandecouverte.ville.montreal.qc.ca/iii/encore/record/C__Rb1923415?lang=frc
Bibliothèque de Belleville	Adultes - Documentaires	Conduire un véhicule de promenade /[publication réalisée par la Société de l'assurance automobile du Québec ; recherche et rédaction, Michèle Jean et Micheline Briand avec la collaboration de Diane Hamel... et al.]	3	3	https://nelligandecouverte.ville.montreal.qc.ca/iii/encore/record/C__Rb1427841?lang=frc
Bibliothèque de Belleville	Jeunes - Mangas	Les félins /[Rumiko Takahashi ; traduction, Kiyoko Chappe].	3	1	https://nelligandecouverte.ville.montreal.qc.ca/iii/encore/record/C__Rb1332241?lang=frc
Bibliothèque de Belleville	Jeunes - Mangas	L'épreuve de force /[Rumiko Takahashi ; traduction, Kiyoko Chappe].	3	1	https://nelligandecouverte.ville.montreal.qc.ca/iii/encore/record/C__Rb1267608?lang=frc
Bibliothèque de Belleville	Jeunes - BD	L'élève dépasse le mètre /scénario et dessin, Thierry Coppée.	3	2	https://nelligandecouverte.ville.montreal.qc.ca/iii/encore/record/C__Rb2077381?lang=frc
Bibliothèque de Belleville	Jeunes - BD	L'école des vannes /scénario et dessin, Thierry Coppée.	3	2	https://nelligandecouverte.ville.montreal.qc.ca/iii/encore/record/C__Rb1360360?lang=frc
Bibliothèque de Belleville	Jeunes - Mangas	L'affront /[Rumiko Takahashi ; traduction, Kiyoko Chappe].	3	1	https://nelligandecouverte.ville.montreal.qc.ca/iii/encore/record/C__Rb1332239?lang=frc
Bibliothèque de Belleville	Jeunes - BD	Max et Lili ont des pouvoirs magiques /[texte de] Dominique de Saint Mars ; [illustrations de] Serge Bloch.	3	2	https://nelligandecouverte.ville.montreal.qc.ca/iii/encore/record/C__Rb2361983?lang=frc
Bibliothèque de Belleville	Jeunes - Romans	Les aventures de Michel Lenoir.1,L'arrivée des Inactifs /Denis Côté.	3	1	https://nelligandecouverte.ville.montreal.qc.ca/iii/encore/record/C__Rb1400233?lang=frc
Bibliothèque de Belleville	Jeunes - BD	Max et Lili fêtent Noël en famille /[texte de] Dominique de Saint Mars ; [illustrations de] Serge Bloch.	3	2	https://nelligandecouverte.ville.montreal.qc.ca/iii/encore/record/C__Rb1592018?lang=frc
Bibliothèque de Belleville	Jeunes - BD	Lili trouve sa maîtresse méchante /[texte de] Dominique de Saint Mars ; [illustrations de] Serge Bloch [avec la collaboration de Renaud de Saint Mars].	3	2	https://nelligandecouverte.ville.montreal.qc.ca/iii/encore/record/C__Rb1296954?lang=frc
Bibliothèque de Belleville	Adultes - DVD	Un grand mariage[enregistrement vidéo] =The big wedding /scénario et réalisation, Justin Zackman.	3	1	https://nelligandecouverte.ville.montreal.qc.ca/iii/encore/record/C__Rb2406579?lang=frc
Bibliothèque de Belleville	Jeunes - BD	Lili veut de l'argent de poche /[texte de] Dominique de Saint Mars ; [illustrations de] Serge Bloch ; [inspiré par Astrapi].	3	2	https://nelligandecouverte.ville.montreal.qc.ca/iii/encore/record/C__Rb1210206?lang=frc
Bibliothèque de Belleville	Jeunes - Romans	La cité secrète /Téa Stilton ; [illustrateurs, Alessandro Battan ... et al. ; traduction de Lilli Plumedesouris].	3	4	https://nelligandecouverte.ville.montreal.qc.ca/iii/encore/record/C__Rb1584108?lang=frc
Bibliothèque de Belleville	Adultes - DVD	Damages.The complete first season[enregistrement vidéo].	3	2	https://nelligandecouverte.ville.montreal.qc.ca/iii/encore/record/C__Rb1770596?lang=frc
Bibliothèque de Belleville	Jeunes - DVD	Il pleut des hamburgers 2[enregistrement vidéo] =Cloudy with a chance of meatballs 2 /réalisation, Cody Cameron, Kris Pearn ; scénario, Erica Rivinoja, John Francis Daley, Jonathan Goldstein.	3	3	https://nelligandecouverte.ville.montreal.qc.ca/iii/encore/record/C__Rb2436557?lang=frc
Bibliothèque de Charleroi	Adultes - DVD	4 et demi.Première saison[enregistrement vidéo] /réalisation, Pierre-Jean Cuillerrier, Albert Girard, Christian Martineau ; scénario et dialogues, Sylvie Lussier, Pierre Poirier.	5	2	https://nelligandecouverte.ville.montreal.qc.ca/iii/encore/record/C__Rb1442259?lang=frc
Bibliothèque de Charleroi	Adultes - DVD	L'amour avec un grand A[enregistrement vidéo] :[10 dramatiques de Janette Bertrand].	5	3	https://nelligandecouverte.ville.montreal.qc.ca/iii/encore/record/C__Rb1405694?lang=frc
Bibliothèque de Charleroi	Jeunes - DVD	L'université des monstres[enregistrement vidéo] =Monsters university /réalisation, Dan Scanlon ; scénario, Daniel Gerson, Robert L. Baird, Dan Scanlon.	4	2	https://nelligandecouverte.ville.montreal.qc.ca/iii/encore/record/C__Rb2420670?lang=frc
Bibliothèque de Charleroi	Jeunes - DVD	Histoire de jouets.Angoisse au motel[enregistrement vidéo] =Toy story of terror! /scénario et réalisation, Angus MacLane.	4	2	https://nelligandecouverte.ville.montreal.qc.ca/iii/encore/record/C__Rb2466906?lang=frc
Bibliothèque de Charleroi	Adultes - Documentaires	Guide de la route /[recherche et rédaction de la mise à jour, Sandra Gauthier avec la collaboration du personnel du Service des usagers de la route ; réalisé par la Société de l'assurance automobile du Québec en collaboration avec le Service de l'exploitation du Ministère des transports ; illustrations, Jean-Michel Girard].	4	4	https://nelligandecouverte.ville.montreal.qc.ca/iii/encore/record/C__Rb1821505?lang=frc
Bibliothèque de Charleroi	Adultes - DVD	Louis Cyr, l'homme le plus fort du monde[enregistrement vidéo] =Louis Cyr, the strongest man in the world /réalisation, Daniel Roby ; scénario, Sylvain Guy.	4	2	https://nelligandecouverte.ville.montreal.qc.ca/iii/encore/record/C__Rb2427871?lang=frc
Bibliothèque de Charleroi	Adultes - DVD	How I met your mother.Season one[enregistrement vidéo] /created by Carter Bays, Craig Thomas.	4	2	https://nelligandecouverte.ville.montreal.qc.ca/iii/encore/record/C__Rb1925802?lang=frc
Bibliothèque de Charleroi	Jeunes - DVD	Princesse Sofia.Les fêtes à Enchancia[enregistrement vidéo] =Sofia the First.Holiday in Enchancia /[réalisateur, Jamie Mitchell].	3	2	https://nelligandecouverte.ville.montreal.qc.ca/iii/encore/record/C__Rb2479311?lang=frc
Bibliothèque de Charleroi	Jeunes - Nouveautés	Jack et la mécanique du coeur[enregistrement vidéo] =Jack and the cuckoo-clock heart /réalisation, Stéphane Berla, Mathias Malzieu ; scénario, Mathias Malzieu.	3	1	https://nelligandecouverte.ville.montreal.qc.ca/iii/encore/record/C__Rb2474543?lang=frc
Bibliothèque de Charleroi	Adultes - DVD	Jack Reacher[enregistrement vidéo] /scénario et réalisation, Christopher McQuarrie.	3	1	https://nelligandecouverte.ville.montreal.qc.ca/iii/encore/record/C__Rb2393005?lang=frc
Bibliothèque de Charleroi	Jeunes - DVD	Opération noisettes[enregistrement vidéo] =The nut job /réalisation, Peter Lepeniotis ; histoire, Daniel Woo, Peter Lepeniotis ; scénario, Lorne Cameron, Peter Lepeniotis.	3	2	https://nelligandecouverte.ville.montreal.qc.ca/iii/encore/record/C__Rb2444888?lang=frc
Bibliothèque de Charleroi	Jeunes - BD	Studio danse.4 /dessins, Crip ; scénario, Béka.	3	2	https://nelligandecouverte.ville.montreal.qc.ca/iii/encore/record/C__Rb1921439?lang=frc
Bibliothèque de Charleroi	Jeunes - BD	Studio danse.5 /dessins, Crip ; scénario, Béka.	3	2	https://nelligandecouverte.ville.montreal.qc.ca/iii/encore/record/C__Rb2078345?lang=frc
Bibliothèque de Charleroi	Jeunes - BD	Studio danse.8 /dessins, Crip ; scénario, Béka.	3	2	https://nelligandecouverte.ville.montreal.qc.ca/iii/encore/record/C__Rb2444216?lang=frc
Bibliothèque de Charleroi	Jeunes - DVD	M. Peabody et Sherman[enregistrement vidéo] =Mr. Peabody & Sherman /réalisation, Rob Minkoff ; scénario, Craig Wright.	3	1	https://nelligandecouverte.ville.montreal.qc.ca/iii/encore/record/C__Rb2474680?lang=frc
Bibliothèque de Charleroi	Adultes - DVD	L'extraordinaire Spider-Man 2[enregistrement vidéo] =The amazing Spider-Man 2 /réalisation, Marc Webb ; scénario, Alex Kurtzman, Roberto Orci, Jeff Pinkner.	3	1	https://nelligandecouverte.ville.montreal.qc.ca/iii/encore/record/C__Rb2464588?lang=frc
Bibliothèque de Charleroi	Jeunes - BD	Les p'tits diables.16,La pire des pires soeurs! /scénario & dessin, Olivier Dutto.	3	2	https://nelligandecouverte.ville.montreal.qc.ca/iii/encore/record/C__Rb2427442?lang=frc
Bibliothèque de Charleroi	Adultes - DVD	Star trek.Vers les ténèbres[enregistrement vidéo] =Star trek.Into darkness /réalisation, J. J. Abrams ; scénario, Roberto Orci, Alex Kurtzman, Damon Lindelof.	3	1	https://nelligandecouverte.ville.montreal.qc.ca/iii/encore/record/C__Rb2410987?lang=frc
Bibliothèque de Charleroi	Adultes - DVD	Le journal d'Anne Frank[enregistrement vidéo] /réalisateur, Jon Jones ; adapté pour l'écran par Deborah Moggach.	3	1	https://nelligandecouverte.ville.montreal.qc.ca/iii/encore/record/C__Rb1920622?lang=frc
Bibliothèque de Charleroi	Jeunes - DVD	Hello Kitty.6,Mimmy est de retour et 8 autres histoires[enregistrement vidéo] /réalisation, Hideaki Ôba.	3	1	https://nelligandecouverte.ville.montreal.qc.ca/iii/encore/record/C__Rb2114503?lang=frc
Bibliothèque de la Maison culturelle et communautaire	Adultes - DVD	Fortier :le dossier complet[enregistrement vidéo] /scénario, Fabienne Larouche.	13	15	https://nelligandecouverte.ville.montreal.qc.ca/iii/encore/record/C__Rb1511110?lang=frc
Bibliothèque de la Maison culturelle et communautaire	Adultes - DVD	Temps dur[enregistrement vidéo] /réalisation, Louis Choquette ; scénario, Jean-Marc Dalpé.	6	3	https://nelligandecouverte.ville.montreal.qc.ca/iii/encore/record/C__Rb1427073?lang=frc
Bibliothèque de la Maison culturelle et communautaire	Adultes - DVD	Nos étés.Saison I[enregistrement vidéo] /auteurs, Michel d'Astous, Anne Boyer ; réalisation, Lyne Charlebois, Francis Leclerc.	6	3	https://nelligandecouverte.ville.montreal.qc.ca/iii/encore/record/C__Rb1445868?lang=frc
Bibliothèque de la Maison culturelle et communautaire	Jeunes - DVD	Turbo[enregistrement vidéo] /directed by David Soren ; screenplay by David Soren and Darren Lemke and Robert Siegel.	5	2	https://nelligandecouverte.ville.montreal.qc.ca/iii/encore/record/C__Rb2424698?lang=frc
Bibliothèque de la Maison culturelle et communautaire	Jeunes - DVD	Dragons 2[enregistrement vidéo] =How to train your dragon 2 /scénario et réalisation, Dean DeBlois.	5	2	https://nelligandecouverte.ville.montreal.qc.ca/iii/encore/record/C__Rb2479814?lang=frc
Bibliothèque de la Maison culturelle et communautaire	Jeunes - DVD	Animaux & cie[enregistrement vidéo] =Animals united /réalisation, Reinhard Klooss, Holger Tappe ; scénario, Oliver Huzly, Reinhard Klooss.	4	2	https://nelligandecouverte.ville.montreal.qc.ca/iii/encore/record/C__Rb2315356?lang=frc
Bibliothèque de la Maison culturelle et communautaire	Adultes - Nouveautés	Romans.Extraits.Français	4	1	https://nelligandecouverte.ville.montreal.qc.ca/iii/encore/record/C__Rb2486283?lang=frc
Bibliothèque de la Maison culturelle et communautaire	Jeunes - DVD	Opération noisettes[enregistrement vidéo] =The nut job /réalisation, Peter Lepeniotis ; histoire, Daniel Woo, Peter Lepeniotis ; scénario, Lorne Cameron, Peter Lepeniotis.	4	2	https://nelligandecouverte.ville.montreal.qc.ca/iii/encore/record/C__Rb2444888?lang=frc
Bibliothèque de la Maison culturelle et communautaire	Jeunes - DVD	Détestable moi 2[enregistrement vidéo] =Despicable me 2 /réalisation, Pierre Coffin, Chris Renaud ; scénario, Ken Daurio, Cinco Paul.	4	3	https://nelligandecouverte.ville.montreal.qc.ca/iii/encore/record/C__Rb2430461?lang=frc
Bibliothèque de la Maison culturelle et communautaire	Jeunes - DVD	Le tour du monde de Mickey[enregistrement vidéo] =Around the clubhouse world.	4	2	https://nelligandecouverte.ville.montreal.qc.ca/iii/encore/record/C__Rb2457515?lang=frc
Bibliothèque de la Maison culturelle et communautaire	Jeunes - DVD	Les Schtroumpfs.2[enregistrement vidéo] =The Smurfs.2 /réalisation, Raja Gosnell ; scénario, J. David Stem ... [et al.].	4	2	https://nelligandecouverte.ville.montreal.qc.ca/iii/encore/record/C__Rb2427967?lang=frc
Bibliothèque de la Maison culturelle et communautaire	Jeunes - DVD	Caillou.Caillou joue au baseball[enregistrement vidéo] =Caillou.Caillou plays baseball.	4	2	https://nelligandecouverte.ville.montreal.qc.ca/iii/encore/record/C__Rb2467250?lang=frc
Bibliothèque de la Maison culturelle et communautaire	Jeunes - Jeux vidéo sur console	NHL 15[ressource électronique (Xbox 360)]	4	2	https://nelligandecouverte.ville.montreal.qc.ca/iii/encore/record/C__Rb2471213?lang=frc
