Nom Bibliothèque	Secteur	Titre	Nombre de prêt	Nombre de document	Lien URL
Bibliothèque du Haut-Anjou	Adultes - Documentaires	Guide de la route /[publication réalisée par la Société de l'assurance automobile du Québec].	5	10	https://nelligandecouverte.ville.montreal.qc.ca/iii/encore/record/C__Rb2448995?lang=frc
Bibliothèque du Haut-Anjou	Adultes - Nouveautés	La veuve du boulanger :roman /Denis Monette.	5	5	https://nelligandecouverte.ville.montreal.qc.ca/iii/encore/record/C__Rb2466496?lang=frc
Bibliothèque du Haut-Anjou	Jeunes - DVD	Toupie et Binou.Toupie et la magie de Noël[enregistrement vidéo] :vroom vroom zoom =Toopy and Binoo.Toopy's magic Christmas : vroom vroom zoom.	4	1	https://nelligandecouverte.ville.montreal.qc.ca/iii/encore/record/C__Rb2424821?lang=frc
Bibliothèque du Haut-Anjou	Adultes - Nouveautés	Gravé dans le sable :roman /Michel Bussi.	4	2	https://nelligandecouverte.ville.montreal.qc.ca/iii/encore/record/C__Rb2476896?lang=frc
Bibliothèque du Haut-Anjou	Adultes - Romans	Les héritiers du fleuve.1,1887-1893 /Louise Tremblay-D'Essiambre.	4	3	https://nelligandecouverte.ville.montreal.qc.ca/iii/encore/record/C__Rb2404543?lang=frc
Bibliothèque du Haut-Anjou	Jeunes - DVD	Cendrillon II.La magie des rêves[enregistrement vidéo] =Cinderella II.Dreams come true /réalisation, John Kafka ; scénario, Jill Blotevogel, Tom Rogers, Jue Selbo. Cendrillon III.Les hasards du temps = Cinderella III.A twist in time / directed by Frank Nissen.	4	1	https://nelligandecouverte.ville.montreal.qc.ca/iii/encore/record/C__Rb2361352?lang=frc
Bibliothèque du Haut-Anjou	Adultes - Romans	Cadres noirs :roman /Pierre Lemaitre.	3	1	https://nelligandecouverte.ville.montreal.qc.ca/iii/encore/record/C__Rb2425008?lang=frc
Bibliothèque du Haut-Anjou	Adultes - Nouveautés	Until the end of time.Français	3	2	https://nelligandecouverte.ville.montreal.qc.ca/iii/encore/record/C__Rb2467031?lang=frc
Bibliothèque du Haut-Anjou	Adultes - DVD	La couleur des sentiments[enregistrement vidéo] =The help /scénario et réalisation, Tate Taylor.	3	1	https://nelligandecouverte.ville.montreal.qc.ca/iii/encore/record/C__Rb2274244?lang=frc
Bibliothèque du Haut-Anjou	Adultes - Nouveautés	Secrets dévoilés.2,Celui qui ne voulait pas être duc /Liz Carlyle ; traduit de l'américain par Catherine Berthet.	3	1	https://nelligandecouverte.ville.montreal.qc.ca/iii/encore/record/C__Rb1913917?lang=frc
Bibliothèque du Haut-Anjou	Adultes - Nouveautés	Mésalliance /Liz Carlyle ; traduit de l'américain par Catherine Berthet.	3	1	https://nelligandecouverte.ville.montreal.qc.ca/iii/encore/record/C__Rb2263924?lang=frc
Bibliothèque du Haut-Anjou	Adultes - Romans	Danse noire :roman /Nancy Huston.	3	1	https://nelligandecouverte.ville.montreal.qc.ca/iii/encore/record/C__Rb2403183?lang=frc
Bibliothèque du Haut-Anjou	Jeunes - DVD	Là-haut[enregistrement vidéo] =Up /scénario et réalisation, Pete Docter, Bob Peterson.	3	1	https://nelligandecouverte.ville.montreal.qc.ca/iii/encore/record/C__Rb1907816?lang=frc
Bibliothèque du Haut-Anjou	Jeunes - DVD	Scooby-Doo!. 13 Spooky tales[enregistrement vidéo] :holiday chills and thrills	3	1	https://nelligandecouverte.ville.montreal.qc.ca/iii/encore/record/C__Rb2368678?lang=frc
Bibliothèque du Haut-Anjou	Adultes - DVD	Mamma mia![enregistrement vidéo] /réalisation, Phyllida Lloyd ; scénario, Catherine Johnson.	3	1	https://nelligandecouverte.ville.montreal.qc.ca/iii/encore/record/C__Rb1800578?lang=frc
Bibliothèque du Haut-Anjou	Adultes - Romans	La marque de Windfield :roman /Ken Follett ; traduit de l'anglais par Jean Rosenthal.	3	1	https://nelligandecouverte.ville.montreal.qc.ca/iii/encore/record/C__Rb1146291?lang=frc
Bibliothèque du Haut-Anjou	Adultes - Romans	La nuit est mon royaume :roman /Mary Higgins Clark ; traduit de l'anglais par Anne Damour.	3	1	https://nelligandecouverte.ville.montreal.qc.ca/iii/encore/record/C__Rb1575371?lang=frc
Bibliothèque du Haut-Anjou	Adultes - Romans	Peur blanche :roman /Ken Follett ; traduit de l'anglais par Jean Rosenthal.	3	1	https://nelligandecouverte.ville.montreal.qc.ca/iii/encore/record/C__Rb1384968?lang=frc
Bibliothèque du Haut-Anjou	Jeunes - DVD	Dora et l'esprit de Noël[enregistrement vidéo] =Dora's Christmas carol adventure /créé par Chris Gifford, Valerie Walsh Valdes, Eric Weiner.	3	1	https://nelligandecouverte.ville.montreal.qc.ca/iii/encore/record/C__Rb2272255?lang=frc
Bibliothèque du Haut-Anjou	Adultes - Nouveautés	Le chardonneret :[roman] /Donna Tartt ; traduit de l'anglais (États-Unis) par Édith Soonckindt.	3	3	https://nelligandecouverte.ville.montreal.qc.ca/iii/encore/record/C__Rb2424289?lang=frc
Bibliothèque L’Octogone	Adultes - Littérature canadienne	Les héritiers du fleuve.4,1931-1939 /Louise Tremblay-D'Essiambre.	17	18	https://nelligandecouverte.ville.montreal.qc.ca/iii/encore/record/C__Rb2476200?lang=frc
Bibliothèque L’Octogone	Adultes - DVD	Evolve[enregistrement vidéo] /produced by Optomen Productions, Inc. for History ; executive producer for History, Charles Nordlander ; series producers, Neil Laird, Jonathan Grupper ; executive producer, Beth Hoppe.	12	4	https://nelligandecouverte.ville.montreal.qc.ca/iii/encore/record/C__Rb2204545?lang=frc
Bibliothèque L’Octogone	Adultes - Portables	Ordinateur portable Dell Latitude E6510 [L'Octogone]	11	1	https://nelligandecouverte.ville.montreal.qc.ca/iii/encore/record/C__Rb2353474?lang=frc
Bibliothèque L’Octogone	Adultes - CD-ROM	Auto-réussite[ressource électronique] :le logiciel du Code de la route du Québec = Auto-réussite : High-way code of Québec /LogiRéussite.	10	15	https://nelligandecouverte.ville.montreal.qc.ca/iii/encore/record/C__Rb1434676?lang=frc
Bibliothèque L’Octogone	Adultes - Romans	La liste de mes envies :roman /Grégoire Delacourt.	10	9	https://nelligandecouverte.ville.montreal.qc.ca/iii/encore/record/C__Rb2322028?lang=frc
Bibliothèque L’Octogone	Adultes - DVD	Stargate SG-1.The complete third season[videorecording].	10	5	https://nelligandecouverte.ville.montreal.qc.ca/iii/encore/record/C__Rb1873760?lang=frc
Bibliothèque L’Octogone	Adultes - Littérature canadienne	La veuve du boulanger :roman /Denis Monette.	9	10	https://nelligandecouverte.ville.montreal.qc.ca/iii/encore/record/C__Rb2466496?lang=frc
Bibliothèque L’Octogone	Adultes - Littérature canadienne	Mensonges sur le Plateau Mont-Royal.1,Un mariage de raison : roman historique /Michel David.	9	14	https://nelligandecouverte.ville.montreal.qc.ca/iii/encore/record/C__Rb2403174?lang=frc
Bibliothèque L’Octogone	Adultes - Romans	Central Park :roman /Guillaume Musso.	9	10	https://nelligandecouverte.ville.montreal.qc.ca/iii/encore/record/C__Rb2440321?lang=frc
Bibliothèque L’Octogone	Adultes - Romans	La vérité sur l'affaire Harry Quebert :roman /Joël Dicker.	9	8	https://nelligandecouverte.ville.montreal.qc.ca/iii/encore/record/C__Rb2357828?lang=frc
Bibliothèque L’Octogone	Adultes - Tablettes numériques	Tablette iPad 2 [L'Octogone]	9	4	https://nelligandecouverte.ville.montreal.qc.ca/iii/encore/record/C__Rb2429720?lang=frc
Bibliothèque L’Octogone	Jeunes - Documentaires	Tam-tam. --	9	7	https://nelligandecouverte.ville.montreal.qc.ca/iii/encore/record/C__Rb2235420?lang=frc
Bibliothèque L’Octogone	Jeunes - Romans	Lire-Tôt :[série A-B] /Thérèse Daignault ; [illustrations, Chantal Gagnon].	8	10	https://nelligandecouverte.ville.montreal.qc.ca/iii/encore/record/C__Rb1452441?lang=frc
Bibliothèque L’Octogone	Adultes - Littérature canadienne	Les héritiers du fleuve.1,1887-1893 /Louise Tremblay-D'Essiambre.	8	15	https://nelligandecouverte.ville.montreal.qc.ca/iii/encore/record/C__Rb2404543?lang=frc
Bibliothèque L’Octogone	Adultes - Documentaires	Guide de la route /[publication réalisée par la Société de l'assurance automobile du Québec].	8	13	https://nelligandecouverte.ville.montreal.qc.ca/iii/encore/record/C__Rb2448995?lang=frc
Bibliothèque L’Octogone	Jeunes - BD	Les légendaires.11,Versus inferno /Patrick Sobral.	8	4	https://nelligandecouverte.ville.montreal.qc.ca/iii/encore/record/C__Rb1907824?lang=frc
Bibliothèque L’Octogone	Jeunes - DVD	Barbie présente La petite Poucette[enregistrement vidéo] =Barbie presents Thumbelina /réalisation, Conrad Helten ; scénario, Elise Allen.	8	3	https://nelligandecouverte.ville.montreal.qc.ca/iii/encore/record/C__Rb1933923?lang=frc
Bibliothèque L’Octogone	Adultes - DVD	Sherlock Holmes, the definitive[enregistrement vidéo] :mystery, scandal and crime. --	8	6	https://nelligandecouverte.ville.montreal.qc.ca/iii/encore/record/C__Rb2232391?lang=frc
Bibliothèque L’Octogone	Adultes - Littérature canadienne	Les héritiers du fleuve.3,1918-1929 /Louise Tremblay-D'Essiambre.	8	10	https://nelligandecouverte.ville.montreal.qc.ca/iii/encore/record/C__Rb2441946?lang=frc
Bibliothèque L’Octogone	Jeunes - DVD	Barbie & ses soeurs au club hippique[enregistrement vidéo] =Barbie & her sisters in a pony tale /réalisation, Kyran Kelly ; scénario, Cydne Clark, Steve Granat.	8	2	https://nelligandecouverte.ville.montreal.qc.ca/iii/encore/record/C__Rb2419171?lang=frc
Bibliothèque Henri-Bourassa	Adultes - DVD	Bones.Season three[enregistrement vidéo] /created by Hart Hanson.	9	3	https://nelligandecouverte.ville.montreal.qc.ca/iii/encore/record/C__Rb1816046?lang=frc
Bibliothèque Henri-Bourassa	Adultes - Nouveautés	La veuve du boulanger :roman /Denis Monette.	8	6	https://nelligandecouverte.ville.montreal.qc.ca/iii/encore/record/C__Rb2466496?lang=frc
Bibliothèque Henri-Bourassa	Adultes - DVD	Monk.Season three[videorecording] /created by Andy Breckman ; written by Andy Breckman ... [et al.] ; directed by Randall Zisk ... [et al.].	7	4	https://nelligandecouverte.ville.montreal.qc.ca/iii/encore/record/C__Rb1760747?lang=frc
Bibliothèque Henri-Bourassa	Adultes - DVD	Les experts :Miami.L'intrégrale de la saison deux[enregistrement vidéo] =CSI, Miami.The complete season two /créé par Anthony E. Zuiker, Ann Donahue, Carol Mendelsohn.	7	5	https://nelligandecouverte.ville.montreal.qc.ca/iii/encore/record/C__Rb1957987?lang=frc
Bibliothèque Henri-Bourassa	Jeunes - DVD	Dora et la forêt enchantée[enregistrement vidéo] =Dora's enchanted forest adventures.	6	4	https://nelligandecouverte.ville.montreal.qc.ca/iii/encore/record/C__Rb2281195?lang=frc
Bibliothèque Henri-Bourassa	Adultes - Nouveautés	Les héritiers du fleuve.4,1931-1939 /Louise Tremblay-D'Essiambre.	6	7	https://nelligandecouverte.ville.montreal.qc.ca/iii/encore/record/C__Rb2476200?lang=frc
Bibliothèque Henri-Bourassa	Jeunes - DVD	Détestable moi 2[enregistrement vidéo] =Despicable me 2 /réalisation, Pierre Coffin, Chris Renaud ; scénario, Ken Daurio, Cinco Paul.	6	3	https://nelligandecouverte.ville.montreal.qc.ca/iii/encore/record/C__Rb2430461?lang=frc
Bibliothèque Henri-Bourassa	Jeunes - Documentaires	Croque-anglais /Suzanne Fournier, Charles Côté.	5	6	https://nelligandecouverte.ville.montreal.qc.ca/iii/encore/record/C__Rb1803929?lang=frc
Bibliothèque Henri-Bourassa	Jeunes - BD	Studio danse.1 /dessins, Crip ; scénario, Béka.	5	2	https://nelligandecouverte.ville.montreal.qc.ca/iii/encore/record/C__Rb1582914?lang=frc
Bibliothèque Henri-Bourassa	Jeunes - DVD	L'université des monstres[enregistrement vidéo] =Monsters university /réalisation, Dan Scanlon ; scénario, Daniel Gerson, Robert L. Baird, Dan Scanlon.	5	2	https://nelligandecouverte.ville.montreal.qc.ca/iii/encore/record/C__Rb2420670?lang=frc
Bibliothèque Henri-Bourassa	Adultes - DVD	Le retour de la momie[enregistrement vidéo] =The mummy returns /written and directed by Stephen Sommers.	5	1	https://nelligandecouverte.ville.montreal.qc.ca/iii/encore/record/C__Rb1757211?lang=frc
Bibliothèque Henri-Bourassa	Jeunes - DVD	Fuyons la planète Terre[enregistrement vidéo] =Escape from planet Earth /réalisation, Cal Brunker ; scénario, Bob Barlen et Cal Brunker ; d'après une histoire de Cory Edwards et Tony Leech.	5	2	https://nelligandecouverte.ville.montreal.qc.ca/iii/encore/record/C__Rb2398275?lang=frc
Bibliothèque Henri-Bourassa	Adultes - DVD	Mission impossible[enregistrement vidéo] ;collection missions par excellence = ultimate missions collection /réalisateur by Brian De Palma ; scénario, David Koepp et Robert Towne.	5	3	https://nelligandecouverte.ville.montreal.qc.ca/iii/encore/record/C__Rb1803884?lang=frc
Bibliothèque Henri-Bourassa	Jeunes - DVD	Les Croods[enregistrement vidéo] = The Croods	5	2	https://nelligandecouverte.ville.montreal.qc.ca/iii/encore/record/C__Rb2415992?lang=frc
Bibliothèque Henri-Bourassa	Jeunes - DVD	Barbie et la porte secrète[enregistrement vidéo] =Barbie and the secret door /réalisation, Karen J. Lloyd ; scénario, Brian Hohlfeld.	5	2	https://nelligandecouverte.ville.montreal.qc.ca/iii/encore/record/C__Rb2471993?lang=frc
Bibliothèque Henri-Bourassa	Jeunes - Romans	Opération Hawaï /Téa Stilton ; [illustrations de Sabrina Ariganello ... et al. ; traduction de Titi Plumederat].	5	5	https://nelligandecouverte.ville.montreal.qc.ca/iii/encore/record/C__Rb2394183?lang=frc
Bibliothèque Henri-Bourassa	Jeunes - DVD	Bienvenue à Grognon-ville[enregistrement vidéo] /réalisation, Jeff Gordon ; scénario, Corey Powell.	5	3	https://nelligandecouverte.ville.montreal.qc.ca/iii/encore/record/C__Rb2457179?lang=frc
Bibliothèque Henri-Bourassa	Jeunes - DVD	Les aventures de Tintin[enregistrement vidéo] /réalisation, Stéphane Bernasconi.	5	8	https://nelligandecouverte.ville.montreal.qc.ca/iii/encore/record/C__Rb1393483?lang=frc
Bibliothèque Henri-Bourassa	Jeunes - DVD	Rio[enregistrement vidéo] /réalisation, Carlos Saldanha ; scénario, Don Rhymer ... [et al.].	5	3	https://nelligandecouverte.ville.montreal.qc.ca/iii/encore/record/C__Rb2251429?lang=frc
Bibliothèque Henri-Bourassa	Jeunes - DVD	Fais-moi peur.La 7ième saison complète[enregistrement vidéo] =Are you afraid of the dark?.The complete 7th season.	5	3	https://nelligandecouverte.ville.montreal.qc.ca/iii/encore/record/C__Rb1759018?lang=frc
Bibliothèque de Belleville	Jeunes - DVD	Le film LEGO[enregistrement vidéo] =The LEGO movie /scénario et réalisation, Phil Lord, Christopher Miller ; histoire, Dan Hageman ... [et al.].	6	2	https://nelligandecouverte.ville.montreal.qc.ca/iii/encore/record/C__Rb2457551?lang=frc
Bibliothèque de Belleville	Jeunes - DVD	Barbie et la magie des perles[enregistrement vidéo] =Barbie, the pearl princess /réalisation, Zeke Norton ; scénario, Cydne Clark et Steve Granat.	6	2	https://nelligandecouverte.ville.montreal.qc.ca/iii/encore/record/C__Rb2446848?lang=frc
Bibliothèque de Belleville	Adultes - DVD	L'oubli[enregistrement vidéo] =Oblivion /réalisation, Joseph Kosinski ; scénario, Karl Gadjusek, Michael de Bruyn.	5	1	https://nelligandecouverte.ville.montreal.qc.ca/iii/encore/record/C__Rb2409212?lang=frc
Bibliothèque de Belleville	Jeunes - DVD	L'université des monstres[enregistrement vidéo] =Monsters university /réalisation, Dan Scanlon ; scénario, Daniel Gerson, Robert L. Baird, Dan Scanlon.	5	2	https://nelligandecouverte.ville.montreal.qc.ca/iii/encore/record/C__Rb2420670?lang=frc
Bibliothèque de Belleville	Jeunes - DVD	Princesse Sofia[enregistrement vidéo]  :le festin enchanté = Sofia the First : the enchanted feast /creator, Craig Gerber.	5	2	https://nelligandecouverte.ville.montreal.qc.ca/iii/encore/record/C__Rb2465354?lang=frc
Bibliothèque de Belleville	Jeunes - DVD	Harry Potter.Années 1 à 5[enregistrement vidéo] =Harry Potter.Years 1-5.	5	5	https://nelligandecouverte.ville.montreal.qc.ca/iii/encore/record/C__Rb1803814?lang=frc
Bibliothèque de Belleville	Jeunes - DVD	Scooby-Doo!.Aventures en Transylvanie[enregistrement vidéo] =Scooby-Doo!.Frankencreepy /written by Jim Krieg ; produced and directed by Paul McEvoy.	4	2	https://nelligandecouverte.ville.montreal.qc.ca/iii/encore/record/C__Rb2468758?lang=frc
Bibliothèque de Belleville	Jeunes - DVD	Caillou.Caillou à la rescousse[enregistrement vidéo] =Caillou.Caillou to the rescue.	4	2	https://nelligandecouverte.ville.montreal.qc.ca/iii/encore/record/C__Rb2446484?lang=frc
Bibliothèque de Belleville	Jeunes - DVD	Les avions[enregistrement vidéo] =Planes /réalisation, Klay Hall ; histoire de John Lasseter, Klay Hall, Jeffrey M. Howard ; scénario, Jeffrey M. Howard.	4	2	https://nelligandecouverte.ville.montreal.qc.ca/iii/encore/record/C__Rb2413924?lang=frc
Bibliothèque de Belleville	Adultes - DVD	Prison break.Season one[enregistrement vidéo] /created by Paul Scheuring.	4	3	https://nelligandecouverte.ville.montreal.qc.ca/iii/encore/record/C__Rb1515454?lang=frc
Bibliothèque de Belleville	Jeunes - DVD	Rio 2[enregistrement vidéo] /réalisation, Carlos Saldanha ; scénario, Don Rhymer ... [et al.].	4	2	https://nelligandecouverte.ville.montreal.qc.ca/iii/encore/record/C__Rb2462975?lang=frc
Bibliothèque de Belleville	Adultes - BD	Cat's eye v 05	4	1	https://nelligandecouverte.ville.montreal.qc.ca/iii/encore/record/C__Rb1950908?lang=frc
Bibliothèque de Belleville	Jeunes - DVD	Jack le chasseur de géants[enregistrement vidéo] =Jack the giant slayer /réalisation, Bryan Singer ; scénario, Darren Lemke, Christopher McQuarrie, Dan Studney.	4	1	https://nelligandecouverte.ville.montreal.qc.ca/iii/encore/record/C__Rb2400351?lang=frc
Bibliothèque de Belleville	Jeunes - DVD	The adventures of Mickey Matson and the Copperhead treasure[enregistrement vidéo] =[Mickey Matson et l'ordre secret] /screenplay and direction, Harold Cronk.	4	1	https://nelligandecouverte.ville.montreal.qc.ca/iii/encore/record/C__Rb2439588?lang=frc
Bibliothèque de Belleville	Jeunes - DVD	Donkey X[enregistrement vidéo] =Donkey Xote /réalisation, José Pozo ; scénario, Angel E. Pariente.	4	1	https://nelligandecouverte.ville.montreal.qc.ca/iii/encore/record/C__Rb1838509?lang=frc
Bibliothèque de Belleville	Adultes - BD	Cat's eye v 04	4	1	https://nelligandecouverte.ville.montreal.qc.ca/iii/encore/record/C__Rb1950907?lang=frc
Bibliothèque de Belleville	Jeunes - DVD	Il était une fois-- les découvreurs[enregistrement vidéo] :[à la rencontre des plus grands savants] /auteur et réalisateur, Albert Barillé.	4	2	https://nelligandecouverte.ville.montreal.qc.ca/iii/encore/record/C__Rb1414256?lang=frc
Bibliothèque de Belleville	Jeunes - DVD	Il était une fois-- l'espace[enregistrement vidéo] :[des aventures palpitantes de planètes en planètes] /auteur et réalisateur, Albert Barillé.	4	2	https://nelligandecouverte.ville.montreal.qc.ca/iii/encore/record/C__Rb1414255?lang=frc
Bibliothèque de Belleville	Adultes - Romans	L'ode à la joie :et si la grande mascarade existait? /A. B. Winter.	3	1	https://nelligandecouverte.ville.montreal.qc.ca/iii/encore/record/C__Rb1746765?lang=frc
Bibliothèque de Belleville	Jeunes - Romans	La piste du scarabée bleu /Téa Stilton ; [illustrations de Francesco Bisaro ... et al. ; traduction de Lili Plumedesouris].	3	3	https://nelligandecouverte.ville.montreal.qc.ca/iii/encore/record/C__Rb2183558?lang=frc
Bibliothèque de Charleroi	Adultes - DVD	Juste le meilleur des galas 2006[enregistrement vidéo] :Juste pour rire /réalisation, Mario Rouleau.	4	1	https://nelligandecouverte.ville.montreal.qc.ca/iii/encore/record/C__Rb1427069?lang=frc
Bibliothèque de Charleroi	Jeunes - DVD	Princesse Sofia au Royaume des sirènes[enregistrement vidéo] =Sofia the First : the floating palace /created by Craig Gerber.	4	2	https://nelligandecouverte.ville.montreal.qc.ca/iii/encore/record/C__Rb2453023?lang=frc
Bibliothèque de Charleroi	Jeunes - DVD	Scooby-Doo!.Aventures en Transylvanie[enregistrement vidéo] =Scooby-Doo!.Frankencreepy /written by Jim Krieg ; produced and directed by Paul McEvoy.	4	2	https://nelligandecouverte.ville.montreal.qc.ca/iii/encore/record/C__Rb2468758?lang=frc
Bibliothèque de Charleroi	Adultes - DVD	Un été brûlant[enregistrement vidéo] =A burning hot summer /réalisation, Philippe Garrel ; scénario, Marc Cholodenko, Caroline Deruas-Garrel, Philippe Garrel.	4	1	https://nelligandecouverte.ville.montreal.qc.ca/iii/encore/record/C__Rb2401309?lang=frc
Bibliothèque de Charleroi	Adultes - DVD	Noé[enregistrement vidéo] =Noah /réalisation, Darren Aronofsky ; scénario, Darren Aronofsky, Ari Handel.	4	1	https://nelligandecouverte.ville.montreal.qc.ca/iii/encore/record/C__Rb2464597?lang=frc
Bibliothèque de Charleroi	Jeunes - DVD	En route vers le pôle Nord[enregistrement vidéo] =Polar explorer.	4	1	https://nelligandecouverte.ville.montreal.qc.ca/iii/encore/record/C__Rb2446630?lang=frc
Bibliothèque de Charleroi	Jeunes - DVD	La magie des livres[enregistrement vidéo] =Book magic.	4	2	https://nelligandecouverte.ville.montreal.qc.ca/iii/encore/record/C__Rb2466182?lang=frc
Bibliothèque de Charleroi	Jeunes - Romans	Académie flamenco /Téa Stilton ; [illustrations de Chiara Balleello ; traduction de Lili Plumedesouris].	4	2	https://nelligandecouverte.ville.montreal.qc.ca/iii/encore/record/C__Rb2431589?lang=frc
Bibliothèque de Charleroi	Adultes - DVD	How I met your mother.Season one[enregistrement vidéo] /created by Carter Bays, Craig Thomas.	4	2	https://nelligandecouverte.ville.montreal.qc.ca/iii/encore/record/C__Rb1925802?lang=frc
Bibliothèque de Charleroi	Jeunes - DVD	Détestable moi 2[enregistrement vidéo] =Despicable me 2 /réalisation, Pierre Coffin, Chris Renaud ; scénario, Ken Daurio, Cinco Paul.	4	1	https://nelligandecouverte.ville.montreal.qc.ca/iii/encore/record/C__Rb2430461?lang=frc
Bibliothèque de Charleroi	Adultes - Romans	La diaspora des Desrosiers.[5],Au hasard la chance :roman /Michel Tremblay.	4	2	https://nelligandecouverte.ville.montreal.qc.ca/iii/encore/record/C__Rb2356350?lang=frc
Bibliothèque de Charleroi	Adultes - Romans	La diaspora des Desrosiers.7,Les clefs du Paradise :roman /Michel Tremblay.	4	2	https://nelligandecouverte.ville.montreal.qc.ca/iii/encore/record/C__Rb2422148?lang=frc
Bibliothèque de Charleroi	Jeunes - DVD	Les Schtroumpfs.Le Bébé Schtroumpf[enregistrement vidéo].	4	2	https://nelligandecouverte.ville.montreal.qc.ca/iii/encore/record/C__Rb2462505?lang=frc
Bibliothèque de Charleroi	Adultes - Documentaires	Guide de la route /[recherche et rédaction de la mise à jour, Sandra Gauthier avec la collaboration du personnel du Service des usagers de la route ; réalisé par la Société de l'assurance automobile du Québec en collaboration avec le Service de l'exploitation du Ministère des transports ; illustrations, Jean-Michel Girard].	4	4	https://nelligandecouverte.ville.montreal.qc.ca/iii/encore/record/C__Rb1821505?lang=frc
Bibliothèque de Charleroi	Jeunes - DVD	Tarzan[enregistrement vidéo] /directed by Reinhard Kloos.	3	1	https://nelligandecouverte.ville.montreal.qc.ca/iii/encore/record/C__Rb2473721?lang=frc
Bibliothèque de Charleroi	Adultes - DVD	Esclave pendant douze ans[enregistrement vidéo] =12 years a slave /réalisation, Steve McQueen ; scénario, John Ridley.	3	1	https://nelligandecouverte.ville.montreal.qc.ca/iii/encore/record/C__Rb2443799?lang=frc
Bibliothèque de Charleroi	Adultes - DVD	La voleuse de livres[enregistrement vidéo] =The book thief /réalisation, Brian Percival ; scénario, Michael Petroni.	3	1	https://nelligandecouverte.ville.montreal.qc.ca/iii/encore/record/C__Rb2444810?lang=frc
Bibliothèque de Charleroi	Adultes - Documentaires	Le Coran pour les nuls /Malek Chebel ; [adaptation française de] Sohaib Sultan.	3	1	https://nelligandecouverte.ville.montreal.qc.ca/iii/encore/record/C__Rb2342055?lang=frc
Bibliothèque de Charleroi	Jeunes - DVD	Barbie et la porte secrète[enregistrement vidéo] =Barbie and the secret door /réalisation, Karen J. Lloyd ; scénario, Brian Hohlfeld.	3	2	https://nelligandecouverte.ville.montreal.qc.ca/iii/encore/record/C__Rb2471993?lang=frc
Bibliothèque de Charleroi	Jeunes - DVD	La princesse et la grenouille[enregistrement vidéo] =The princess and the frog /réalisation, Ron Clements, John Musker ; scénario, Ron Clements, John Musker, Rob Edwards.	3	1	https://nelligandecouverte.ville.montreal.qc.ca/iii/encore/record/C__Rb2268355?lang=frc
Bibliothèque de la Maison culturelle et communautaire	Adultes - DVD	Friends.The complete fourth season[enregistrement vidéo] =Friends.La quatrième saison complète] /created by David Crane, Marta Kauffman.	6	2	https://nelligandecouverte.ville.montreal.qc.ca/iii/encore/record/C__Rb1836413?lang=frc
Bibliothèque de la Maison culturelle et communautaire	Adultes - DVD	Les filles de Caleb[enregistrement vidéo] /scénario, Fernand Dansereau ; réalisation, Jean Beaudin.	6	3	https://nelligandecouverte.ville.montreal.qc.ca/iii/encore/record/C__Rb1442040?lang=frc
Bibliothèque de la Maison culturelle et communautaire	Jeunes - Jeux vidéo sur console	NBA 2K13[ressource électronique (Xbox 360)].	5	5	https://nelligandecouverte.ville.montreal.qc.ca/iii/encore/record/C__Rb2352657?lang=frc
Bibliothèque de la Maison culturelle et communautaire	Adultes - DVD	Friends.The complete third season[enregistrement vidéo] =[Friends.La troisième saison complète] /created by David Crane, Marta Kauffman.	5	2	https://nelligandecouverte.ville.montreal.qc.ca/iii/encore/record/C__Rb1836409?lang=frc
Bibliothèque de la Maison culturelle et communautaire	Adultes - DVD	CSI, crime scene investigation.The complete fifth season[videorecording] /created by Anthony E. Zuiker ; producers, Richard J. Lewis, Kenneth Fink.	5	3	https://nelligandecouverte.ville.montreal.qc.ca/iii/encore/record/C__Rb1953885?lang=frc
Bibliothèque de la Maison culturelle et communautaire	Adultes - DVD	Millennium.La première saison complète[enregistrement vidéo] =Millennium.The complete first season /créé par Chris Carter.	5	6	https://nelligandecouverte.ville.montreal.qc.ca/iii/encore/record/C__Rb1754398?lang=frc
Bibliothèque de la Maison culturelle et communautaire	Adultes - DVD	R.I.P.D. département[enregistrement vidéo] =R.I.P.D. rest in peace departement /directed by Robert Schwentke ; screenplay by Phil Hay & Matt Manfredi.	5	1	https://nelligandecouverte.ville.montreal.qc.ca/iii/encore/record/C__Rb2420683?lang=frc
