Nom Bibliothèque	Secteur	Titre	Nombre de prêt	Nombre de document	Lien URL
Bibliothèque du Haut-Anjou	Adultes - Romans	Un tourbillon de neige et de cendres /Diana Gabaldon ; traduit de l'américain par Philippe Safavi.	8	2	https://nelligandecouverte.ville.montreal.qc.ca/iii/encore/record/C__Rb1424570?lang=frc
Bibliothèque du Haut-Anjou	Adultes - DVD	Sept vies[enregistrement vidéo] =Seven pounds /réalisation, Gabriele Muccino ; scénario, Grant Nieporte.	8	1	https://nelligandecouverte.ville.montreal.qc.ca/iii/encore/record/C__Rb1818567?lang=frc
Bibliothèque du Haut-Anjou	Adultes - Romans	Fanette.5,Les ombres du passé :roman /Suzanne Aubry.	8	2	https://nelligandecouverte.ville.montreal.qc.ca/iii/encore/record/C__Rb2348109?lang=frc
Bibliothèque du Haut-Anjou	Adultes - Documentaires	500 breads.Français	7	1	https://nelligandecouverte.ville.montreal.qc.ca/iii/encore/record/C__Rb2448526?lang=frc
Bibliothèque du Haut-Anjou	Jeunes - DVD	Les princesses jumelles du pays de Legendale[enregistrement vidéo] =The princess twins of Legendale /réalisation, Doug Krohn ; scénario, Sindy McKay.	7	1	https://nelligandecouverte.ville.montreal.qc.ca/iii/encore/record/C__Rb2438811?lang=frc
Bibliothèque du Haut-Anjou	Jeunes - DVD	Histoire de jouets 3[enregistrement vidéo] =Toy story 3 /réalisation, Lee Unkrich ; scénario, Michael Arndt ; synopsis, John Lasseter, Andrew Stanton, Lee Unkrich.	7	1	https://nelligandecouverte.ville.montreal.qc.ca/iii/encore/record/C__Rb1942878?lang=frc
Bibliothèque du Haut-Anjou	Adultes - Nouveautés	La faille en toute chose /Louise Penny ; traduit de l'anglais (Canada) par Claire Chabalier et Louise Chabalier.	7	3	https://nelligandecouverte.ville.montreal.qc.ca/iii/encore/record/C__Rb2465392?lang=frc
Bibliothèque du Haut-Anjou	Adultes - Romans	Au bord de la rivière.4,Constant :roman historique /Michel David.	6	2	https://nelligandecouverte.ville.montreal.qc.ca/iii/encore/record/C__Rb2352098?lang=frc
Bibliothèque du Haut-Anjou	Jeunes - DVD	Rio 2[enregistrement vidéo] /réalisation, Carlos Saldanha ; scénario, Don Rhymer ... [et al.].	6	1	https://nelligandecouverte.ville.montreal.qc.ca/iii/encore/record/C__Rb2462975?lang=frc
Bibliothèque du Haut-Anjou	Adultes - Romans	Fifty shades.1,Cinquante nuances de Grey :roman /E. L. James ; traduit de l'anglais par Denyse Beaulieu.	6	3	https://nelligandecouverte.ville.montreal.qc.ca/iii/encore/record/C__Rb2339552?lang=frc
Bibliothèque du Haut-Anjou	Adultes - Nouveautés	Le bleu de tes yeux :roman /Mary Higgins Clark ; traduit de l'anglais (États-Unis) par Anne Damour.	6	2	https://nelligandecouverte.ville.montreal.qc.ca/iii/encore/record/C__Rb2450741?lang=frc
Bibliothèque du Haut-Anjou	Jeunes - Nouveautés	La reine des neiges /traduction, Valérie Ménard.	6	2	https://nelligandecouverte.ville.montreal.qc.ca/iii/encore/record/C__Rb2468354?lang=frc
Bibliothèque du Haut-Anjou	Adultes - Documentaires	L'espagnol pour les nuls /Susana Wald ; [traduction, Anne-Carole Grillot].	6	2	https://nelligandecouverte.ville.montreal.qc.ca/iii/encore/record/C__Rb1393243?lang=frc
Bibliothèque du Haut-Anjou	Jeunes - BD	Blork raider /dessin, Midam et Adam ; scénario, Augustin ... [et al.].	6	1	https://nelligandecouverte.ville.montreal.qc.ca/iii/encore/record/C__Rb1360763?lang=frc
Bibliothèque L’Octogone	Adultes - Tablettes numériques	Tablette iPad 2 [L'Octogone]	50	4	https://nelligandecouverte.ville.montreal.qc.ca/iii/encore/record/C__Rb2429720?lang=frc
Bibliothèque L’Octogone	Adultes - Littérature canadienne	Les héritiers du fleuve.4,1931-1939 /Louise Tremblay-D'Essiambre.	39	19	https://nelligandecouverte.ville.montreal.qc.ca/iii/encore/record/C__Rb2476200?lang=frc
Bibliothèque L’Octogone	Jeunes - DVD	Les aventures de Tintin[enregistrement vidéo] =The adventures of Tintin /réalisation, Steven Spielberg ; scénario, Steven Moffat, Edgar Wright, Joe Cornish.	28	4	https://nelligandecouverte.ville.montreal.qc.ca/iii/encore/record/C__Rb2313662?lang=frc
Bibliothèque L’Octogone	Adultes - DVD	Upstairs, downstairs : the complete series[enregistrement vidéo].	27	12	https://nelligandecouverte.ville.montreal.qc.ca/iii/encore/record/C__Rb1840225?lang=frc
Bibliothèque L’Octogone	Adultes - Documentaires	Guide de la route /[publication réalisée par la Société de l'assurance automobile du Québec].	26	13	https://nelligandecouverte.ville.montreal.qc.ca/iii/encore/record/C__Rb2448995?lang=frc
Bibliothèque L’Octogone	Adultes - Portables	Ordinateur portable Dell Latitude E6510 [L'Octogone]	26	1	https://nelligandecouverte.ville.montreal.qc.ca/iii/encore/record/C__Rb2353474?lang=frc
Bibliothèque L’Octogone	Adultes - DVD	Six feet under.The complete first season[enregistrement vidéo] =[Six pieds sous terre.L'intégrale de la première saison] /created by Alan Ball.	24	5	https://nelligandecouverte.ville.montreal.qc.ca/iii/encore/record/C__Rb1451730?lang=frc
Bibliothèque L’Octogone	Adultes - Littérature canadienne	Mensonges sur le Plateau Mont-Royal.1,Un mariage de raison : roman historique /Michel David.	24	15	https://nelligandecouverte.ville.montreal.qc.ca/iii/encore/record/C__Rb2403174?lang=frc
Bibliothèque L’Octogone	Adultes - DVD	Evolve[enregistrement vidéo] /produced by Optomen Productions, Inc. for History ; executive producer for History, Charles Nordlander ; series producers, Neil Laird, Jonathan Grupper ; executive producer, Beth Hoppe.	24	4	https://nelligandecouverte.ville.montreal.qc.ca/iii/encore/record/C__Rb2204545?lang=frc
Bibliothèque L’Octogone	Adultes - DVD	Ceci n'est pas Einstein[enregistrement vidéo] /un film de Catherine Fol.	23	6	https://nelligandecouverte.ville.montreal.qc.ca/iii/encore/record/C__Rb1366324?lang=frc
Bibliothèque L’Octogone	Adultes - Littérature canadienne	Les héritiers du fleuve.3,1918-1929 /Louise Tremblay-D'Essiambre.	22	10	https://nelligandecouverte.ville.montreal.qc.ca/iii/encore/record/C__Rb2441946?lang=frc
Bibliothèque L’Octogone	Adultes - DVD	Six pieds sous terre.L'intégrale de la deuxième saison[enregistrement vidéo] =Six feet under.The complete second season /création, Alan Ball.	22	5	https://nelligandecouverte.ville.montreal.qc.ca/iii/encore/record/C__Rb1452406?lang=frc
Bibliothèque L’Octogone	Jeunes - Romans	Lire-Tôt :[série A-B] /Thérèse Daignault ; [illustrations, Chantal Gagnon].	22	10	https://nelligandecouverte.ville.montreal.qc.ca/iii/encore/record/C__Rb1452441?lang=frc
Bibliothèque L’Octogone	Adultes - Littérature canadienne	Les héritiers du fleuve.2,1898-1914 /Louise Tremblay-D'Essiambre.	21	11	https://nelligandecouverte.ville.montreal.qc.ca/iii/encore/record/C__Rb2410973?lang=frc
Bibliothèque L’Octogone	Adultes - DVD	Arnaque américaine[enregistrement vidéo] =American hustle /réalisation, David O. Russell ; scénario, Eric Warren Singer, David O. Russell.	21	3	https://nelligandecouverte.ville.montreal.qc.ca/iii/encore/record/C__Rb2446637?lang=frc
Bibliothèque L’Octogone	Jeunes - DVD	Hot wheels Battle Force 5.La première saison complète[enregistrement vidéo] =Hot wheels Battle Force 5.The complete first season /[created by Andrew Duncan].	21	7	https://nelligandecouverte.ville.montreal.qc.ca/iii/encore/record/C__Rb1935047?lang=frc
Bibliothèque L’Octogone	Adultes - Littérature canadienne	Les héritiers du fleuve.1,1887-1893 /Louise Tremblay-D'Essiambre.	20	15	https://nelligandecouverte.ville.montreal.qc.ca/iii/encore/record/C__Rb2404543?lang=frc
Bibliothèque L’Octogone	Jeunes - Collection multilingue	Livre en italien.  Pour la jeunesse.	20	19	https://nelligandecouverte.ville.montreal.qc.ca/iii/encore/record/C__Rb2216775?lang=frc
Bibliothèque L’Octogone	Jeunes - DVD	Barbie & ses soeurs au club hippique[enregistrement vidéo] =Barbie & her sisters in a pony tale /réalisation, Kyran Kelly ; scénario, Cydne Clark, Steve Granat.	19	2	https://nelligandecouverte.ville.montreal.qc.ca/iii/encore/record/C__Rb2419171?lang=frc
Bibliothèque L’Octogone	Adultes - Littérature canadienne	La veuve du boulanger :roman /Denis Monette.	18	10	https://nelligandecouverte.ville.montreal.qc.ca/iii/encore/record/C__Rb2466496?lang=frc
Bibliothèque Henri-Bourassa	Adultes - Nouveautés	Les héritiers du fleuve.4,1931-1939 /Louise Tremblay-D'Essiambre.	24	7	https://nelligandecouverte.ville.montreal.qc.ca/iii/encore/record/C__Rb2476200?lang=frc
Bibliothèque Henri-Bourassa	Jeunes - DVD	Dora et la forêt enchantée[enregistrement vidéo] =Dora's enchanted forest adventures.	19	4	https://nelligandecouverte.ville.montreal.qc.ca/iii/encore/record/C__Rb2281195?lang=frc
Bibliothèque Henri-Bourassa	Adultes - DVD	Bones.Season three[enregistrement vidéo] /created by Hart Hanson.	18	3	https://nelligandecouverte.ville.montreal.qc.ca/iii/encore/record/C__Rb1816046?lang=frc
Bibliothèque Henri-Bourassa	Jeunes - DVD	Dragon Ball.Complete collection movie 4 pack[enregistrement vidéo] /produced by Toei Animation Co. Ltd.	17	4	https://nelligandecouverte.ville.montreal.qc.ca/iii/encore/record/C__Rb2465981?lang=frc
Bibliothèque Henri-Bourassa	Jeunes - DVD	Détestable moi 2[enregistrement vidéo] =Despicable me 2 /réalisation, Pierre Coffin, Chris Renaud ; scénario, Ken Daurio, Cinco Paul.	17	3	https://nelligandecouverte.ville.montreal.qc.ca/iii/encore/record/C__Rb2430461?lang=frc
Bibliothèque Henri-Bourassa	Jeunes - DVD	Rio[enregistrement vidéo] /réalisation, Carlos Saldanha ; scénario, Don Rhymer ... [et al.].	16	3	https://nelligandecouverte.ville.montreal.qc.ca/iii/encore/record/C__Rb2251429?lang=frc
Bibliothèque Henri-Bourassa	Adultes - DVD	Les experts :Miami.L'intrégrale de la saison trois[enregistrement vidéo] =CSI, Miami.The complete season three /créé par Anthony E. Zuiker, Ann Donahue, Carol Mendelsohn.	16	6	https://nelligandecouverte.ville.montreal.qc.ca/iii/encore/record/C__Rb1514044?lang=frc
Bibliothèque Henri-Bourassa	Adultes - DVD	Ghost whisperer.The first season[enregistrement vidéo] /créé par John Gray.	16	3	https://nelligandecouverte.ville.montreal.qc.ca/iii/encore/record/C__Rb1959922?lang=frc
Bibliothèque Henri-Bourassa	Jeunes - DVD	Caillou, le grand frère[enregistrement vidéo] =Big brother Caillou.	16	3	https://nelligandecouverte.ville.montreal.qc.ca/iii/encore/record/C__Rb2388478?lang=frc
Bibliothèque Henri-Bourassa	Adultes - DVD	Hunger games[enregistrement vidéo] :l'embrasement = The Hunger games : catching fire /réalisation, Francis Lawrence ; scénario, Simon Beaufoy, Michael de Bruyn.	14	3	https://nelligandecouverte.ville.montreal.qc.ca/iii/encore/record/C__Rb2440675?lang=frc
Bibliothèque Henri-Bourassa	Jeunes - DVD	Épique[enregistrement vidéo] =Epic /réalisation, Chris Wedge ; scénario, James V. Hart ... [et al.].	14	2	https://nelligandecouverte.ville.montreal.qc.ca/iii/encore/record/C__Rb2409283?lang=frc
Bibliothèque Henri-Bourassa	Adultes - DVD	Six feet under.The complete fifth season[enregistrement vidéo]=[Six pieds sous terre.L'intégrale de la cinquième saison] /created by Alan Ball.	14	3	https://nelligandecouverte.ville.montreal.qc.ca/iii/encore/record/C__Rb1442307?lang=frc
Bibliothèque Henri-Bourassa	Jeunes - BD	Le sot à ski /scénario et dessin, Thierry Coppée.	14	5	https://nelligandecouverte.ville.montreal.qc.ca/iii/encore/record/C__Rb2371243?lang=frc
Bibliothèque Henri-Bourassa	Adultes - Romans	Les héritiers du fleuve.2,1898-1914 /Louise Tremblay-D'Essiambre.	14	5	https://nelligandecouverte.ville.montreal.qc.ca/iii/encore/record/C__Rb2410973?lang=frc
Bibliothèque Henri-Bourassa	Adultes - DVD	Intouchables[enregistrement vidéo] /un film écrit et réalisé par Éric Toledano et Olivier Nakache.	13	3	https://nelligandecouverte.ville.montreal.qc.ca/iii/encore/record/C__Rb2364223?lang=frc
Bibliothèque Henri-Bourassa	Jeunes - Romans	Le collège de Raxford.4,Les reines de la danse /Téa Stilton ; [illustrations de Francesco Castelli ; traduction de Béatrice Didiot].	13	2	https://nelligandecouverte.ville.montreal.qc.ca/iii/encore/record/C__Rb2112867?lang=frc
Bibliothèque Henri-Bourassa	Jeunes - BD	Le maître blagueur /scénario et dessin, Thierry Coppée.	13	4	https://nelligandecouverte.ville.montreal.qc.ca/iii/encore/record/C__Rb1462248?lang=frc
Bibliothèque Henri-Bourassa	Jeunes - DVD	De merveilleuses aventures[enregistrement vidéo] /réalisation, Jeff Gordon.	12	2	https://nelligandecouverte.ville.montreal.qc.ca/iii/encore/record/C__Rb2433578?lang=frc
Bibliothèque Henri-Bourassa	Adultes - DVD	Battlestar Galactica.Season 2.0[enregistrement vidéo].	12	3	https://nelligandecouverte.ville.montreal.qc.ca/iii/encore/record/C__Rb1799299?lang=frc
Bibliothèque Henri-Bourassa	Adultes - Élagage	Nos étés.Saison I[enregistrement vidéo] /auteurs, Michel d'Astous, Anne Boyer ; réalisation, Lyne Charlebois, Francis Leclerc.	12	2	https://nelligandecouverte.ville.montreal.qc.ca/iii/encore/record/C__Rb1445868?lang=frc
Bibliothèque de Belleville	Jeunes - DVD	Harry Potter.Années 1 à 5[enregistrement vidéo] =Harry Potter.Years 1-5.	17	5	https://nelligandecouverte.ville.montreal.qc.ca/iii/encore/record/C__Rb1803814?lang=frc
Bibliothèque de Belleville	Adultes - DVD	Les dossiers Bourne[enregistrement vidéo] =The Bourne files.	14	2	https://nelligandecouverte.ville.montreal.qc.ca/iii/encore/record/C__Rb1466018?lang=frc
Bibliothèque de Belleville	Adultes - Romans	L'élixir d'amour :roman /Eric-Emmanuel Schmitt.	13	1	https://nelligandecouverte.ville.montreal.qc.ca/iii/encore/record/C__Rb2450559?lang=frc
Bibliothèque de Belleville	Jeunes - DVD	Les Schtroumpfs[enregistrement vidéo] :Un chant de Noël = The Smurfs : a Christmas carol /[réalisation, Raja Gosnell ; histoire, J. David Stem, David N. Weiss ; scénario, J. David Stem ... et al.].	11	2	https://nelligandecouverte.ville.montreal.qc.ca/iii/encore/record/C__Rb2412867?lang=frc
Bibliothèque de Belleville	Adultes - DVD	La grande beauté[enregistrement vidéo] =The great beauty = [La grande bellezza] /réalisation, Paolo Sorrentino ; scénario, Paolo Sorrentino, Umberto Contarello.	10	1	https://nelligandecouverte.ville.montreal.qc.ca/iii/encore/record/C__Rb2449702?lang=frc
Bibliothèque de Belleville	Jeunes - DVD	The cat returns[enregistrement vidéo] =Le royaume des chats /réalisation, Hiroyuki Morita ; scénario, Reiko Yoshida.	10	2	https://nelligandecouverte.ville.montreal.qc.ca/iii/encore/record/C__Rb1690027?lang=frc
Bibliothèque de Belleville	Jeunes - DVD	Les Schtroumpfs.2[enregistrement vidéo] =The Smurfs.2 /réalisation, Raja Gosnell ; scénario, J. David Stem ... [et al.].	10	2	https://nelligandecouverte.ville.montreal.qc.ca/iii/encore/record/C__Rb2427967?lang=frc
Bibliothèque de Belleville	Jeunes - BD	Les Simpson.16,Wingding /[d'après Matt Groening ; adaptation française, Céline Petitdidier].	10	2	https://nelligandecouverte.ville.montreal.qc.ca/iii/encore/record/C__Rb2269165?lang=frc
Bibliothèque de Belleville	Jeunes - DVD	Barbie et la magie des perles[enregistrement vidéo] =Barbie, the pearl princess /réalisation, Zeke Norton ; scénario, Cydne Clark et Steve Granat.	9	2	https://nelligandecouverte.ville.montreal.qc.ca/iii/encore/record/C__Rb2446848?lang=frc
Bibliothèque de Belleville	Jeunes - DVD	La fée pirate[enregistrement vidéo] =The pirate fairy /réalisation, Peggy Holmes.	9	2	https://nelligandecouverte.ville.montreal.qc.ca/iii/encore/record/C__Rb2449640?lang=frc
Bibliothèque de Belleville	Adultes - DVD	Perdus.L'intégrale de la troisième saison[enregistrement vidéo] :l'expérience inexplorée = Lost.The complete third season : the unexplored experience /créé par J. J. Abrams, Damon Lindelof.	9	4	https://nelligandecouverte.ville.montreal.qc.ca/iii/encore/record/C__Rb1600040?lang=frc
Bibliothèque de Belleville	Jeunes - DVD	Scooby-Doo!.Aventures en Transylvanie[enregistrement vidéo] =Scooby-Doo!.Frankencreepy /written by Jim Krieg ; produced and directed by Paul McEvoy.	9	2	https://nelligandecouverte.ville.montreal.qc.ca/iii/encore/record/C__Rb2468758?lang=frc
Bibliothèque de Belleville	Adultes - DVD	Sens interdit[enregistrement vidéo] =Perfect sense /IFC Films & BBC Films present ; in association with Zentropa Entertainments5 and Scottish Screen ; with the participation of The Danish Film Institute ... [et al.] ; produced by Malte Grunert, Gillian Berrie ; written by Kim Fupzaakeson ; directed by David Mackenzie.	8	1	https://nelligandecouverte.ville.montreal.qc.ca/iii/encore/record/C__Rb2384753?lang=frc
Bibliothèque de Belleville	Adultes - DVD	Ma vie n'est pas une comédie romantique[enregistrement vidéo] /réalisation, Marc Gibaja ; scénario, Marc Gibaja, Laurent Sarfati.	8	1	https://nelligandecouverte.ville.montreal.qc.ca/iii/encore/record/C__Rb1798346?lang=frc
Bibliothèque de Belleville	Jeunes - DVD	Les Schtroumpfs[enregistrement vidéo] :coffret spécial 50e anniversaire : forever blue!	8	3	https://nelligandecouverte.ville.montreal.qc.ca/iii/encore/record/C__Rb1980079?lang=frc
Bibliothèque de Belleville	Jeunes - DVD	Il pleut des hamburgers 2[enregistrement vidéo] =Cloudy with a chance of meatballs 2 /réalisation, Cody Cameron, Kris Pearn ; scénario, Erica Rivinoja, John Francis Daley, Jonathan Goldstein.	8	3	https://nelligandecouverte.ville.montreal.qc.ca/iii/encore/record/C__Rb2436557?lang=frc
Bibliothèque de Belleville	Adultes - Romans	Une main encombrante : roman	8	2	https://nelligandecouverte.ville.montreal.qc.ca/iii/encore/record/C__Rb2476900?lang=frc
Bibliothèque de Belleville	Adultes - Romans	La boussole :de là où vous êtes-- jusqu'à l'endroit où vous voulez être /Tammy Kling et John Spencer Ellis.	8	1	https://nelligandecouverte.ville.montreal.qc.ca/iii/encore/record/C__Rb1949952?lang=frc
Bibliothèque de Belleville	Adultes - Documentaires	Bosnie :témoin du génocide /Roy Gutman ; préface de Véronique Nahoum-Grappe ; traduction française de Michel Valois.	8	1	https://nelligandecouverte.ville.montreal.qc.ca/iii/encore/record/C__Rb1165377?lang=frc
Bibliothèque de Belleville	Jeunes - DVD	Il pleut des hamburgers[enregistrement vidéo] =Cloudy with a chance of meatballs /réalisation et scénario, Phil Lord, Chris Miller.	7	2	https://nelligandecouverte.ville.montreal.qc.ca/iii/encore/record/C__Rb1918854?lang=frc
Bibliothèque de Charleroi	Jeunes - DVD	Les contes de l'histoire sans fin[enregistrement vidéo] =Tales from the neverending story /scénario, David Preston, Leila Basen, Karin Howard ; réalisation, Giles Walker, Adam Weissman.	16	4	https://nelligandecouverte.ville.montreal.qc.ca/iii/encore/record/C__Rb1395167?lang=frc
Bibliothèque de Charleroi	Jeunes - DVD	Rio[enregistrement vidéo] /réalisation, Carlos Saldanha ; scénario, Don Rhymer ... [et al.].	14	3	https://nelligandecouverte.ville.montreal.qc.ca/iii/encore/record/C__Rb2251429?lang=frc
Bibliothèque de Charleroi	Jeunes - DVD	Le réveil des gardiens[enregistrement vidéo] =Rise of the guardians /réalisation, Peter Ramsey ; scénario, David Lindsay-Abaire.	12	2	https://nelligandecouverte.ville.montreal.qc.ca/iii/encore/record/C__Rb2384896?lang=frc
Bibliothèque de Charleroi	Jeunes - DVD	Mission dindons[enregistrement vidéo] =Free birds /réalisation, Jimmy Hayward ; scénario, Scott Mosier, Jimmy Hayward.	12	2	https://nelligandecouverte.ville.montreal.qc.ca/iii/encore/record/C__Rb2438026?lang=frc
Bibliothèque de Charleroi	Jeunes - Documentaires	Réussis ta 1re [-6e] année!.Français, mathématique /[collection conçue et dirigée par Michel Brindamour ; recherche et rédaction, Françoise Tchou].	12	6	https://nelligandecouverte.ville.montreal.qc.ca/iii/encore/record/C__Rb1432093?lang=frc
Bibliothèque de Charleroi	Jeunes - DVD	Dora aime Babouche[enregistrement vidéo] =Dora loves Boots.	12	2	https://nelligandecouverte.ville.montreal.qc.ca/iii/encore/record/C__Rb2372524?lang=frc
Bibliothèque de Charleroi	Jeunes - DVD	Princesse Sofia[enregistrement vidéo]  :le festin enchanté = Sofia the First : the enchanted feast /creator, Craig Gerber.	11	2	https://nelligandecouverte.ville.montreal.qc.ca/iii/encore/record/C__Rb2465354?lang=frc
Bibliothèque de Charleroi	Jeunes - DVD	Barbie et la porte secrète[enregistrement vidéo] =Barbie and the secret door /réalisation, Karen J. Lloyd ; scénario, Brian Hohlfeld.	11	2	https://nelligandecouverte.ville.montreal.qc.ca/iii/encore/record/C__Rb2471993?lang=frc
Bibliothèque de Charleroi	Jeunes - DVD	La fée pirate[enregistrement vidéo] =The pirate fairy /réalisation, Peggy Holmes.	10	2	https://nelligandecouverte.ville.montreal.qc.ca/iii/encore/record/C__Rb2449640?lang=frc
Bibliothèque de Charleroi	Jeunes - BD	Max et Lili ont des pouvoirs magiques /[texte de] Dominique de Saint Mars ; [illustrations de] Serge Bloch.	10	3	https://nelligandecouverte.ville.montreal.qc.ca/iii/encore/record/C__Rb2361983?lang=frc
Bibliothèque de Charleroi	Jeunes - DVD	La reine des neiges[enregistrement vidéo] =Frozen /réalisation, Chris Buck, Jennifer Lee ; scénario, Jennifer Lee ; histoire, Chris Buck, Jennifer Lee, Shane Morris.	10	2	https://nelligandecouverte.ville.montreal.qc.ca/iii/encore/record/C__Rb2446490?lang=frc
Bibliothèque de Charleroi	Jeunes - DVD	Le tour du monde de Mickey[enregistrement vidéo] =Around the clubhouse world.	10	2	https://nelligandecouverte.ville.montreal.qc.ca/iii/encore/record/C__Rb2457515?lang=frc
Bibliothèque de Charleroi	Jeunes - DVD	Le conte de fées de Minnie[enregistrement vidéo] =Minnie-Rella.	9	2	https://nelligandecouverte.ville.montreal.qc.ca/iii/encore/record/C__Rb2439458?lang=frc
Bibliothèque de Charleroi	Jeunes - BD	L'histoire drôle /scénario et dessin, Thierry Coppée.	9	2	https://nelligandecouverte.ville.montreal.qc.ca/iii/encore/record/C__Rb2436480?lang=frc
Bibliothèque de Charleroi	Adultes - BD	Le secret de l'Espadon /E. P. Jacobs.	9	3	https://nelligandecouverte.ville.montreal.qc.ca/iii/encore/record/C__Rb1008833?lang=frc
Bibliothèque de Charleroi	Adultes - DVD	Colombienne[enregistrement vidéo] =Colombiana /réalisation, Olivier Megaton ; scénario, Luc Besson, Robert Mark Kamen.	9	1	https://nelligandecouverte.ville.montreal.qc.ca/iii/encore/record/C__Rb2286425?lang=frc
Bibliothèque de Charleroi	Jeunes - BD	Le cerveau de l'apocalypse /écrit et illustré par Alex A.	9	3	https://nelligandecouverte.ville.montreal.qc.ca/iii/encore/record/C__Rb2259197?lang=frc
Bibliothèque de Charleroi	Adultes - DVD	Maison Blanche en péril[enregistrement vidéo] =White House down /réalisation, Roland Emmercih ; scénario, James Vanderbilt.	8	1	https://nelligandecouverte.ville.montreal.qc.ca/iii/encore/record/C__Rb2424565?lang=frc
Bibliothèque de Charleroi	Jeunes - DVD	Les Schtroumpfs.2[enregistrement vidéo] =The Smurfs.2 /réalisation, Raja Gosnell ; scénario, J. David Stem ... [et al.].	8	2	https://nelligandecouverte.ville.montreal.qc.ca/iii/encore/record/C__Rb2427967?lang=frc
Bibliothèque de Charleroi	Jeunes - DVD	Scooby-Doo!.Aventures en Transylvanie[enregistrement vidéo] =Scooby-Doo!.Frankencreepy /written by Jim Krieg ; produced and directed by Paul McEvoy.	8	2	https://nelligandecouverte.ville.montreal.qc.ca/iii/encore/record/C__Rb2468758?lang=frc
Bibliothèque de la Maison culturelle et communautaire	Jeunes - DVD	Il pleut des hamburgers 2[enregistrement vidéo] =Cloudy with a chance of meatballs 2 /réalisation, Cody Cameron, Kris Pearn ; scénario, Erica Rivinoja, John Francis Daley, Jonathan Goldstein.	15	2	https://nelligandecouverte.ville.montreal.qc.ca/iii/encore/record/C__Rb2436557?lang=frc
Bibliothèque de la Maison culturelle et communautaire	Jeunes - DVD	Détestable moi 2[enregistrement vidéo] =Despicable me 2 /réalisation, Pierre Coffin, Chris Renaud ; scénario, Ken Daurio, Cinco Paul.	14	3	https://nelligandecouverte.ville.montreal.qc.ca/iii/encore/record/C__Rb2430461?lang=frc
Bibliothèque de la Maison culturelle et communautaire	Jeunes - DVD	Le coq de St-Victor[enregistrement vidéo] =The rooster of St-Victor /réalisation, Pierre Greco ; scénario, Johanne Mercier, Pierre Greco.	13	2	https://nelligandecouverte.ville.montreal.qc.ca/iii/encore/record/C__Rb2459040?lang=frc
Bibliothèque de la Maison culturelle et communautaire	Jeunes - Jeux vidéo sur console	FIFA soccer 13[ressource électronique (PlayStation 3)].	13	4	https://nelligandecouverte.ville.montreal.qc.ca/iii/encore/record/C__Rb2352548?lang=frc
Bibliothèque de la Maison culturelle et communautaire	Jeunes - DVD	Opération noisettes[enregistrement vidéo] =The nut job /réalisation, Peter Lepeniotis ; histoire, Daniel Woo, Peter Lepeniotis ; scénario, Lorne Cameron, Peter Lepeniotis.	12	2	https://nelligandecouverte.ville.montreal.qc.ca/iii/encore/record/C__Rb2444888?lang=frc
Bibliothèque de la Maison culturelle et communautaire	Jeunes - Jeux vidéo sur console	NHL 15[ressource électronique (Xbox 360)]	12	2	https://nelligandecouverte.ville.montreal.qc.ca/iii/encore/record/C__Rb2471213?lang=frc
Bibliothèque de la Maison culturelle et communautaire	Jeunes - Jeux vidéo sur console	NBA 2K13[ressource électronique (Xbox 360)].	12	5	https://nelligandecouverte.ville.montreal.qc.ca/iii/encore/record/C__Rb2352657?lang=frc
Bibliothèque de la Maison culturelle et communautaire	Jeunes - DVD	Mulan[enregistrement vidéo] /réalisation, Barry Cook, Tony Bancroft ; scénario, Rita Hsiao... [et al.]. Mulan II / réalisation, Darrell Rooney, Lynne Southerland.	12	2	https://nelligandecouverte.ville.montreal.qc.ca/iii/encore/record/C__Rb2382099?lang=frc
Bibliothèque de la Maison culturelle et communautaire	Jeunes - DVD	Caillou.Caillou à la rescousse[enregistrement vidéo] =Caillou.Caillou to the rescue.	12	2	https://nelligandecouverte.ville.montreal.qc.ca/iii/encore/record/C__Rb2446484?lang=frc
Bibliothèque de la Maison culturelle et communautaire	Adultes - DVD	Battlestar Galactica.Season three[enregistrement vidéo] /Universal Studios.	12	6	https://nelligandecouverte.ville.montreal.qc.ca/iii/encore/record/C__Rb1770104?lang=frc
