Nom Bibliothèque	Secteur	Titre	Nombre de prêt	Nombre de document	Lien URL
Bibliothèque de La Petite-Patrie	Jeunes - BD	Quel cirque! /par Verron ; d'après Roba.	4	4	https://nelligandecouverte.ville.montreal.qc.ca/iii/encore/record/C__Rb1347729?lang=frc
Bibliothèque de La Petite-Patrie	Adultes - DVD	Les femmes du 6e étage[enregistrement vidéo] =The women on the 6th floor /réalisation, Philippe Le Guay ; scénario et dialogues, Philippe Le Guay, Jérôme Tonnerre.	4	1	https://nelligandecouverte.ville.montreal.qc.ca/iii/encore/record/C__Rb2275219?lang=frc
Bibliothèque de Rosemont	Jeunes - Jeux	Croque-carotte[jeu] :5 à 99 ans, 2 à 4 joueurs	9	1	https://nelligandecouverte.ville.montreal.qc.ca/iii/encore/record/C__Rb1289644?lang=frc
Bibliothèque de Rosemont	Adultes - DVD	Sol et Gobelet.Coffret 2[enregistrement vidéo] /réalisation, Maurice Falardeau.	9	9	https://nelligandecouverte.ville.montreal.qc.ca/iii/encore/record/C__Rb1508979?lang=frc
Bibliothèque de Rosemont	Adultes - DVD - Nouveautés	L'oeuvre cinématographique complète d'Arthur Lamothe.Coffret 4,Chronique des Indiens du Nord-Est du Québec[enregistrement vidéo].	7	5	https://nelligandecouverte.ville.montreal.qc.ca/iii/encore/record/C__Rb2467799?lang=frc
Bibliothèque de Rosemont	Jeunes - Jeux vidéo sur console	Just dance.4[ressource électronique (Wii)] /developed by Ubisoft.	7	3	https://nelligandecouverte.ville.montreal.qc.ca/iii/encore/record/C__Rb2361237?lang=frc
Bibliothèque de Rosemont	Jeunes - Documentaires	Mon atlas du Canada[document cartographique] /[éditeurs, François Fortin, Caroline Fortin ; illustrateurs, Manuela Bertoni, Alain Lemire, Raymond Martin].	7	7	https://nelligandecouverte.ville.montreal.qc.ca/iii/encore/record/C__Rb1424894?lang=frc
Bibliothèque de Rosemont	Jeunes - BD	Les p'tits diables.11,Mon frère, c'est pas un cadeau!!! /scénario & dessin, Olivier Dutto.	6	5	https://nelligandecouverte.ville.montreal.qc.ca/iii/encore/record/C__Rb2077390?lang=frc
Bibliothèque de Rosemont	Jeunes - Albums carton (cartonnés)	Amuse-toi avec Barbapapa! /Annette Tison.	6	3	https://nelligandecouverte.ville.montreal.qc.ca/iii/encore/record/C__Rb2397870?lang=frc
Bibliothèque de Rosemont	Adultes - Documentaires	Guide de la route /[publication réalisée par la Société de l'assurance automobile du Québec].	6	14	https://nelligandecouverte.ville.montreal.qc.ca/iii/encore/record/C__Rb2448995?lang=frc
Bibliothèque de Rosemont	Adultes - Documentaires	Conduire un véhicule de promenade /[publication réalisée par la Société de l'assurance automobile du Québec ; recherche et rédaction, Michèle Jean et Micheline Briand avec la collaboration de Diane Hamel... et al.]	6	19	https://nelligandecouverte.ville.montreal.qc.ca/iii/encore/record/C__Rb1427841?lang=frc
Bibliothèque de Rosemont	Adultes - DVD - Nouveautés	Diego Star[enregistrement vidéo] /scénario et réalisation, Frédérick Pelletier.	6	2	https://nelligandecouverte.ville.montreal.qc.ca/iii/encore/record/C__Rb2449671?lang=frc
Bibliothèque de Rosemont	Adultes - DVD - Nouveautés	La poison[enregistrement vidéo] /scénario et réalisation, Sacha Guitry.	5	2	https://nelligandecouverte.ville.montreal.qc.ca/iii/encore/record/C__Rb2413943?lang=frc
Bibliothèque de Rosemont	Jeunes - BD	Quelle chouchoute! /dessins, William ; scénario, Cazenove & William.	5	6	https://nelligandecouverte.ville.montreal.qc.ca/iii/encore/record/C__Rb2067970?lang=frc
Bibliothèque de Rosemont	Adultes - DVD - Nouveautés	Prisonniers[enregistrement vidéo] =Prisoners /réalisation, Denis Villeneuve ; scénario, Aaron Guzikowski.	5	1	https://nelligandecouverte.ville.montreal.qc.ca/iii/encore/record/C__Rb2431762?lang=frc
Bibliothèque de Rosemont	Adultes - DVD - Nouveautés	L'autre maison[enregistrement vidéo] =Another house /réalisation, Mathieu Roy ; scénario, Mathieu Roy, Michael Ramsey.	5	3	https://nelligandecouverte.ville.montreal.qc.ca/iii/encore/record/C__Rb2429537?lang=frc
Bibliothèque de Rosemont	Jeunes - BD	Lou!.2,Mortebouse /Julien Neel.	5	7	https://nelligandecouverte.ville.montreal.qc.ca/iii/encore/record/C__Rb1398715?lang=frc
Bibliothèque de Rosemont	Jeunes - BD	Les légendaires.15,Amour mortel /Patrick Sobral.	5	4	https://nelligandecouverte.ville.montreal.qc.ca/iii/encore/record/C__Rb2361786?lang=frc
Bibliothèque de Rosemont	Jeunes - Documentaires	Les porcs-épics /Alain M. Bergeron, Michel Quintin, Sampar ; illustrations de Sampar.	5	4	https://nelligandecouverte.ville.montreal.qc.ca/iii/encore/record/C__Rb2262702?lang=frc
Bibliothèque de Rosemont	Jeunes - DVD - Nouveautés	Geronimo Stilton.4[enregistrement vidéo] /réalisation, Guy Vasilovich ; idée originale, Elisabetta Dami.	5	3	https://nelligandecouverte.ville.montreal.qc.ca/iii/encore/record/C__Rb2382135?lang=frc
Bibliothèque de Rosemont	Adultes - Romans	Malphas.2,Torture, luxure et lecture /Patrick Senécal.	5	6	https://nelligandecouverte.ville.montreal.qc.ca/iii/encore/record/C__Rb2341568?lang=frc
Bibliothèque de Rosemont	Jeunes - Documentaires	Ces animaux qui nous étonnent /Jacqui Bailey ; [traduction, Karine Van Butsele].	5	3	https://nelligandecouverte.ville.montreal.qc.ca/iii/encore/record/C__Rb1364563?lang=frc
Bibliothèque Marc-Favreau	Adultes - Tablettes numériques	Tablette iPad [Marc-Favreau]	45	18	https://nelligandecouverte.ville.montreal.qc.ca/iii/encore/record/C__Rb2433402?lang=frc
Bibliothèque Marc-Favreau	Adultes - Documentaires	Mythes et réalités dans l'histoire du Québec /Marcel Trudel.	9	5	https://nelligandecouverte.ville.montreal.qc.ca/iii/encore/record/C__Rb1285801?lang=frc
Bibliothèque Marc-Favreau	Adultes - DVD	Hanna[enregistrement vidéo] /réalisation, Joe Wright ; scénario, Seth Lochhead, David Farr ; histoire, Seth Lochhead.	7	2	https://nelligandecouverte.ville.montreal.qc.ca/iii/encore/record/C__Rb2258237?lang=frc
Bibliothèque Marc-Favreau	Jeunes - BD	Sound of silence /dessin, Midam et Adam ; scénario, Midam et Patelin	6	3	https://nelligandecouverte.ville.montreal.qc.ca/iii/encore/record/C__Rb2117973?lang=frc
Bibliothèque Marc-Favreau	Jeunes - Biblio-parents	L'agressivité chez l'enfant de 0 à 5 ans /Sylvie Bourcier.	6	3	https://nelligandecouverte.ville.montreal.qc.ca/iii/encore/record/C__Rb1745057?lang=frc
Bibliothèque Marc-Favreau	Adultes - DVD	G. I. Joe.Les représailles[enregistrement vidéo] =G. I. Joe.Retaliation /réalisation, Jon M. Chu ; scénario, Rhett Reese, Paul Wernick.	6	2	https://nelligandecouverte.ville.montreal.qc.ca/iii/encore/record/C__Rb2409139?lang=frc
Bibliothèque Marc-Favreau	Adultes - DVD	Dallas Buyers Club[enregistrement vidéo] /réalisation, Jean-Marc Vallée ; scénario, Craig Borten, Melisa Wallack.	6	2	https://nelligandecouverte.ville.montreal.qc.ca/iii/encore/record/C__Rb2438764?lang=frc
Bibliothèque Marc-Favreau	Jeunes - Romans enfants	Mystère à Paris /Téa Stilton ; [illustrations de Maria Abagnale ... et al. ; traduction de Lili Plumedesouris].	6	3	https://nelligandecouverte.ville.montreal.qc.ca/iii/encore/record/C__Rb1610658?lang=frc
Bibliothèque Marc-Favreau	Adultes - DVD	Hunger[enregistrement vidéo] /direction, Steve McQueen ; screenplay, Steve McQueen, Enda Walsh.	5	1	https://nelligandecouverte.ville.montreal.qc.ca/iii/encore/record/C__Rb2338894?lang=frc
Bibliothèque Marc-Favreau	Adultes - DVD - Coffret	Star wars I, II, III[enregistrement vidéo] /screenplay and direction, George Lucas.	5	2	https://nelligandecouverte.ville.montreal.qc.ca/iii/encore/record/C__Rb2423767?lang=frc
Bibliothèque Marc-Favreau	Jeunes - DVD	Le roi lion[enregistrement vidéo] =The lion king /réalisation, Roger Allers, Rob Minkoff ; scénario, Irene Mecchi, Jonathan Roberts, Linda Woolverton.	5	2	https://nelligandecouverte.ville.montreal.qc.ca/iii/encore/record/C__Rb2281042?lang=frc
Bibliothèque Marc-Favreau	Jeunes - Documentaires	Le cheerleading /John Crossingham ; illustrations, Bonna Rouse ; photographies, Marc Crabtree ; traduction, Josée Latulippe.	5	3	https://nelligandecouverte.ville.montreal.qc.ca/iii/encore/record/C__Rb1922101?lang=frc
Bibliothèque Marc-Favreau	Jeunes - Documentaires	Je fais de la-- gym /Véronique Bury ; illustrations de Véronique Bury.	5	3	https://nelligandecouverte.ville.montreal.qc.ca/iii/encore/record/C__Rb1929409?lang=frc
Bibliothèque Marc-Favreau	Jeunes - Albums carton (cartonnés)	Fais ci, fais pas ça :un livre des contraires à taper, embrasser, chatouiller-- /[illustré par Christian Guibbaud].	5	5	https://nelligandecouverte.ville.montreal.qc.ca/iii/encore/record/C__Rb1585575?lang=frc
Bibliothèque Marc-Favreau	Jeunes - DVD	Merlin l'enchanteur[enregistrement vidéo] =The sword in the stone /réalisation, Wolfgang Reitherman ; scénario, Bill Peet.	5	2	https://nelligandecouverte.ville.montreal.qc.ca/iii/encore/record/C__Rb2410384?lang=frc
Bibliothèque Marc-Favreau	Jeunes - DVD	Histoire de jouets2[enregistrement vidéo] =Toy story2 /direction, John Lasseter, Lee Unkrich, Ash Brannon ; screenplay, Andrew Stanton ... [et al.].	5	2	https://nelligandecouverte.ville.montreal.qc.ca/iii/encore/record/C__Rb1834680?lang=frc
Bibliothèque Marc-Favreau	Jeunes - DVD	Le magicien d'Oz[enregistrement vidéo] =The wonderful wizard of Oz /directeur de l'animation, Gérald Potterton.	5	2	https://nelligandecouverte.ville.montreal.qc.ca/iii/encore/record/C__Rb2405486?lang=frc
Bibliothèque Marc-Favreau	Jeunes - Albums carton (cartonnés)	Les formes /Xavier Deneux.	5	2	https://nelligandecouverte.ville.montreal.qc.ca/iii/encore/record/C__Rb2358218?lang=frc
Bibliothèque Marc-Favreau	Adultes - DVD	Philomena[enregistrement vidéo] /réalisation, Stephen Frears ; scénario, Steve Coogan, Jeff Pope.	5	2	https://nelligandecouverte.ville.montreal.qc.ca/iii/encore/record/C__Rb2439075?lang=frc
Bibliothèque Marc-Favreau	Adultes - DVD	La montée de la planète des singes[enregistrement vidéo] =Rise of the planet of the apes /réalisation, Rupert Wyatt ; scénario, Rick Jaffa, Amanda Silver.	5	2	https://nelligandecouverte.ville.montreal.qc.ca/iii/encore/record/C__Rb2284995?lang=frc
Bibliothèque du Vieux-Saint-Laurent	Adultes - Documentaires	Driver's handbook /[prepared by the Société de l'assurance automobile du Québec in cooperation with the Service de l'exploitation of Transport Québec ; researched and written by Sandra Gauthier with the cooperation of Service des usagers de la route ; English translation, Elizabeth Doyle].	9	16	https://nelligandecouverte.ville.montreal.qc.ca/iii/encore/record/C__Rb1821723?lang=frc
Bibliothèque du Vieux-Saint-Laurent	Jeunes - DVD / Blu-Ray	Le réveil des gardiens[enregistrement vidéo] =Rise of the guardians /réalisation, Peter Ramsey ; scénario, David Lindsay-Abaire.	7	4	https://nelligandecouverte.ville.montreal.qc.ca/iii/encore/record/C__Rb2384896?lang=frc
Bibliothèque du Vieux-Saint-Laurent	Jeunes - DVD / Blu-Ray	Là-haut[enregistrement vidéo] =Up /screenplay and direction, Pete Docter, Bob Peterson.	6	2	https://nelligandecouverte.ville.montreal.qc.ca/iii/encore/record/C__Rb1920773?lang=frc
Bibliothèque du Vieux-Saint-Laurent	Adultes - DVD / Blu-Ray	Ghostbusters 1 & 2[enregistrement vidéo] =[S.O.S. fantômes 1 & 2] /direction, Ivan Reitman ; screenplay, Dan Aykroyd, Harold Ramis.	6	2	https://nelligandecouverte.ville.montreal.qc.ca/iii/encore/record/C__Rb1441875?lang=frc
Bibliothèque du Vieux-Saint-Laurent	Adultes - Documentaires	Conduire un véhicule de promenade /[publication réalisée par la Société de l'assurance automobile du Québec ; recherche et rédaction, Michèle Jean et Micheline Briand avec la collaboration de Diane Hamel... et al.]	6	15	https://nelligandecouverte.ville.montreal.qc.ca/iii/encore/record/C__Rb1427841?lang=frc
Bibliothèque du Vieux-Saint-Laurent	Jeunes - Documentaires	Je révise avec mon enfant.Mathématique /Sylvie Benoit... [et al.]	6	13	https://nelligandecouverte.ville.montreal.qc.ca/iii/encore/record/C__Rb1589867?lang=frc
Bibliothèque du Vieux-Saint-Laurent	Jeunes - DVD / Blu-Ray	Opération beurre de pinottes[enregistrement vidéo] /scénario et réalisation, Michael Rubbo.	5	3	https://nelligandecouverte.ville.montreal.qc.ca/iii/encore/record/C__Rb2360712?lang=frc
Bibliothèque du Vieux-Saint-Laurent	Adultes - DVD / Blu-Ray	In a world--[enregistrement vidéo] /scénario et réalisation, Lake Bell.	5	1	https://nelligandecouverte.ville.montreal.qc.ca/iii/encore/record/C__Rb2437729?lang=frc
Bibliothèque du Vieux-Saint-Laurent	Jeunes - DVD / Blu-Ray	Wall-E[enregistrement vidéo] /scénario et réalisation, Andrew Stanton.	5	2	https://nelligandecouverte.ville.montreal.qc.ca/iii/encore/record/C__Rb1757553?lang=frc
Bibliothèque du Vieux-Saint-Laurent	Jeunes - DVD / Blu-Ray	Madagascar.2.La grande évasion[enregistrement vidéo] =Madagascar.2,Escape to Africa /réalisation, Eric Darnell, Tom McGrath ; scénario, Eric Darnell, Tom McGrath, Etan Cohen.	5	3	https://nelligandecouverte.ville.montreal.qc.ca/iii/encore/record/C__Rb1810118?lang=frc
Bibliothèque du Vieux-Saint-Laurent	Adultes - Documentaires	Guide de la route /[recherche et rédaction de la mise à jour, Sandra Gauthier avec la collaboration du personnel du Service des usagers de la route ; réalisé par la Société de l'assurance automobile du Québec en collaboration avec le Service de l'exploitation du Ministère des transports ; illustrations, Jean-Michel Girard].	5	14	https://nelligandecouverte.ville.montreal.qc.ca/iii/encore/record/C__Rb1821505?lang=frc
Bibliothèque du Vieux-Saint-Laurent	Jeunes - DVD / Blu-Ray	Rox et Rouky[enregistrement vidéo] =The fox and the hound /réalisation, Art Stevens, Ted Berman, Richard Rich ; scénario, Larry Clemmons ... [et al.]. Rox et Rouky 2 = The fox and the hound 2 / réalisation, Jim Kammerud ; scénario, Rich Burns, Roger S. H. Schulman.	5	3	https://nelligandecouverte.ville.montreal.qc.ca/iii/encore/record/C__Rb2254706?lang=frc
Bibliothèque du Vieux-Saint-Laurent	Jeunes - DVD / Blu-Ray	Barbie et la magie des perles[enregistrement vidéo] =Barbie, the pearl princess /written by Cydne Clark and Steve Granat ; directed by Zeke Norton.	5	2	https://nelligandecouverte.ville.montreal.qc.ca/iii/encore/record/C__Rb2451777?lang=frc
Bibliothèque du Vieux-Saint-Laurent	Jeunes - DVD / Blu-Ray	Khumba[enregistrement vidéo]	5	2	https://nelligandecouverte.ville.montreal.qc.ca/iii/encore/record/C__Rb2459682?lang=frc
Bibliothèque du Vieux-Saint-Laurent	Jeunes - Documentaires	Je révise avec mon enfant.Français /Sylvie Benoit ... [et al.]	5	21	https://nelligandecouverte.ville.montreal.qc.ca/iii/encore/record/C__Rb1359950?lang=frc
Bibliothèque du Vieux-Saint-Laurent	Adultes - Documentaires	Driver's handbook /[prepared by the Société de l'assurance automobile du Québec ; updated version researched and written by personnel in the Vice présidence à la sécurité routière ;  collaboration with the Ministère des Transports du Québec ; project coordination, Guillaume Beaurivage ; illustrations, Jean-Michel Girard ; updated translation, Donya Gulak, Sarah Lefebvre].	5	10	https://nelligandecouverte.ville.montreal.qc.ca/iii/encore/record/C__Rb2449207?lang=frc
Bibliothèque du Vieux-Saint-Laurent	Jeunes - DVD / Blu-Ray	The Berenstain Bears. Playdates[enregistrement vidéo]	5	4	https://nelligandecouverte.ville.montreal.qc.ca/iii/encore/record/C__Rb2373608?lang=frc
Bibliothèque du Vieux-Saint-Laurent	Jeunes - DVD / Blu-Ray	Le film LEGO[enregistrement vidéo] =The LEGO movie /scénario et réalisation, Phil Lord, Christopher Miller ; histoire, Dan Hageman ... [et al.].	5	2	https://nelligandecouverte.ville.montreal.qc.ca/iii/encore/record/C__Rb2460739?lang=frc
Bibliothèque du Vieux-Saint-Laurent	Jeunes - BD	Génie de l'insomnie /scénario, De Groot ; dessin, Turk.	4	2	https://nelligandecouverte.ville.montreal.qc.ca/iii/encore/record/C__Rb2456370?lang=frc
Bibliothèque du Vieux-Saint-Laurent	Adultes - Documentaires	L'art de conjuguer :dictionnaire de 12 000 verbes /Bescherelle.	4	4	https://nelligandecouverte.ville.montreal.qc.ca/iii/encore/record/C__Rb2325944?lang=frc
Bibliothèque du Boisé	Jeunes - Aide aux devoirs	Pas de problème!.Mathématique, 1re[-6e] année : exercices de résolution de problèmes : 1er[-3e] cycle /Pierrette Tranquille, Françoise Tchou ; [illustrations, Michel Grant].	13	23	https://nelligandecouverte.ville.montreal.qc.ca/iii/encore/record/C__Rb1409837?lang=frc
Bibliothèque du Boisé	Tout-petits - DVD / Blu-Ray	Care-Bears.Super Cuddly[videorecording].	9	12	https://nelligandecouverte.ville.montreal.qc.ca/iii/encore/record/C__Rb2313939?lang=frc
Bibliothèque du Boisé	Jeunes - Aide aux devoirs	Croque-math, 2e, 4e[-5e] année :cahier d'activités mathématiques pour les enfants de 7[-11] ans.	8	6	https://nelligandecouverte.ville.montreal.qc.ca/iii/encore/record/C__Rb1802522?lang=frc
Bibliothèque du Boisé	Jeunes - Aide aux devoirs	Je lis et je comprends :cahier de compréhension de lecture /Lucie Rivest ; collaboration, Hélène Morasse ; [illustrations, Hélène Lafond].	7	12	https://nelligandecouverte.ville.montreal.qc.ca/iii/encore/record/C__Rb1983920?lang=frc
Bibliothèque du Boisé	Jeunes - DVD / Blu-Ray	Le dinosaure[enregistrement vidéo] =Dinosaur /réalisation, Ralph Zondag, Eric Leighton ; scénario, John Harrison, Robert Nelson Jacobs.	7	4	https://nelligandecouverte.ville.montreal.qc.ca/iii/encore/record/C__Rb2265971?lang=frc
Bibliothèque du Boisé	Tout-petits - DVD / Blu-Ray	Thomas & friends.Steam team collection[enregistrement vidéo] /created by Britt Allcroft ; directed by Greg Tiernan.	7	8	https://nelligandecouverte.ville.montreal.qc.ca/iii/encore/record/C__Rb2281486?lang=frc
Bibliothèque du Boisé	Jeunes - BD - Fiction	Lou!.3,Le cimetière des autobus /Julien Neel.	7	4	https://nelligandecouverte.ville.montreal.qc.ca/iii/encore/record/C__Rb1429154?lang=frc
Bibliothèque du Boisé	Jeunes - DVD / Blu-Ray	Le futur peut attendre[enregistrement vidéo] =Time twister /réalisation, Philippe Vidal ; développé par Philippe Vidal, Robert Réa, Steve Balissat.	7	6	https://nelligandecouverte.ville.montreal.qc.ca/iii/encore/record/C__Rb2399791?lang=frc
Bibliothèque du Boisé	Tout-petits - DVD / Blu-Ray	La partie de pêche[enregistrement vidéo] =Fishing trip.	6	3	https://nelligandecouverte.ville.montreal.qc.ca/iii/encore/record/C__Rb2412596?lang=frc
Bibliothèque du Boisé	Tout-petits - DVD / Blu-Ray	La fête des mères[enregistrement vidéo] =Mother bear's special day.	6	4	https://nelligandecouverte.ville.montreal.qc.ca/iii/encore/record/C__Rb2322071?lang=frc
Bibliothèque du Boisé	Adultes - Documentaires	Conduire un véhicule de promenade /[publication réalisée par la Société de l'assurance automobile du Québec ; recherche et rédaction, Michèle Jean et Micheline Briand avec la collaboration de Diane Hamel... et al.]	6	9	https://nelligandecouverte.ville.montreal.qc.ca/iii/encore/record/C__Rb1427841?lang=frc
Bibliothèque du Boisé	Jeunes - BD - Fiction	Parker & Badger.8,Ça t'amuse? /Cuadrado	6	4	https://nelligandecouverte.ville.montreal.qc.ca/iii/encore/record/C__Rb2116550?lang=frc
Bibliothèque du Boisé	Jeunes - Documentaires - Livres d'images	Max va à la pêche avec son père /[texte de] Dominique de Saint Mars ; [illustrations de] Serge Bloch [avec la collaboration de Renaud de Saint Mars].	6	3	https://nelligandecouverte.ville.montreal.qc.ca/iii/encore/record/C__Rb1344788?lang=frc
Bibliothèque du Boisé	Jeunes - DVD / Blu-Ray	Le réveil des gardiens[enregistrement vidéo] =Rise of the guardians /réalisation, Peter Ramsey ; scénario, David Lindsay-Abaire.	6	4	https://nelligandecouverte.ville.montreal.qc.ca/iii/encore/record/C__Rb2384896?lang=frc
Bibliothèque du Boisé	Jeunes - Mangas	Naruto.53,La naissance de Naruto /Masashi Kishimoto ; [traduit et adapté en français par Sébastien Bigini].	6	2	https://nelligandecouverte.ville.montreal.qc.ca/iii/encore/record/C__Rb2250462?lang=frc
Bibliothèque du Boisé	Jeunes - Mangas	Naruto.46,Le retour de Naruto!!! /Masashi Kishimoto ; [traduit et adapté en français par Sébastien Bigini].	6	1	https://nelligandecouverte.ville.montreal.qc.ca/iii/encore/record/C__Rb1920195?lang=frc
Bibliothèque du Boisé	Jeunes - Mangas	Naruto.37,Le combat de Shikamaru! /Masashi Kishimoto ; [traduit et adapté en français par Sébastien Bigini].	6	1	https://nelligandecouverte.ville.montreal.qc.ca/iii/encore/record/C__Rb1609868?lang=frc
Bibliothèque du Boisé	Jeunes - BD - Fiction	Marie-Lune.6,Ne me laisse pas tomber! /scénario, Douyé ; dessin, Yllya.	6	3	https://nelligandecouverte.ville.montreal.qc.ca/iii/encore/record/C__Rb2417071?lang=frc
Bibliothèque du Boisé	Jeunes - BD - Fiction	Sybil, la fée cartable.4,Princesse Nina /scénario, Michel Rodrigue ; dessin, Antonello Dalena, Manuela Razzi.	6	2	https://nelligandecouverte.ville.montreal.qc.ca/iii/encore/record/C__Rb2389662?lang=frc
Bibliothèque du Boisé	Jeunes - DVD / Blu-Ray	Journal d'un dégonflé[enregistrement vidéo] =Diary of a wimpy kid /réalisation, Thor Freudenthal ; scénaristes, Jackie Filgo, Jeff Filgo, Gabe Sachs, Jeff Judah	6	4	https://nelligandecouverte.ville.montreal.qc.ca/iii/encore/record/C__Rb2266220?lang=frc
Bibliothèque de Pointe-aux-Trembles	Adultes - Nouveautés	Les héritiers du fleuve.3,1918-1929 /Louise Tremblay-D'Essiambre.	9	9	https://nelligandecouverte.ville.montreal.qc.ca/iii/encore/record/C__Rb2441946?lang=frc
Bibliothèque de Pointe-aux-Trembles	Adultes - Romans québécois	Les héritiers du fleuve.1,1887-1893 /Louise Tremblay-D'Essiambre.	9	11	https://nelligandecouverte.ville.montreal.qc.ca/iii/encore/record/C__Rb2404543?lang=frc
Bibliothèque de Pointe-aux-Trembles	Jeunes - Jeux	Croque-carotte[jeu] : 4 à 99 ans, 2 à 4 joueurs 	8	2	https://nelligandecouverte.ville.montreal.qc.ca/iii/encore/record/C__Rb2264736?lang=frc
Bibliothèque de Pointe-aux-Trembles	Adultes - Nouveautés	Mensonges sur le Plateau Mont-Royal.2,La biscuiterie : roman historique /Michel David.	7	9	https://nelligandecouverte.ville.montreal.qc.ca/iii/encore/record/C__Rb2436372?lang=frc
Bibliothèque de Pointe-aux-Trembles	Jeunes - Aide aux devoirs	Je lis! :exercices de compréhension de lecture /Pierrette Tranquille et Françoise Tchou.	7	6	https://nelligandecouverte.ville.montreal.qc.ca/iii/encore/record/C__Rb1743378?lang=frc
Bibliothèque de Pointe-aux-Trembles	Jeunes - Jeux vidéo sur console	Just dance 3[ressource électronique (Wii)].	6	3	https://nelligandecouverte.ville.montreal.qc.ca/iii/encore/record/C__Rb2319906?lang=frc
Bibliothèque de Pointe-aux-Trembles	Adultes - Romans québécois	Mensonges sur le Plateau Mont-Royal.1,Un mariage de raison : roman historique /Michel David.	6	6	https://nelligandecouverte.ville.montreal.qc.ca/iii/encore/record/C__Rb2403174?lang=frc
Bibliothèque de Pointe-aux-Trembles	Adultes - Romans québécois	Les héritiers du fleuve.2,1898-1914 /Louise Tremblay-D'Essiambre.	6	7	https://nelligandecouverte.ville.montreal.qc.ca/iii/encore/record/C__Rb2410973?lang=frc
Bibliothèque de Pointe-aux-Trembles	Jeunes - DVD	De grands rêves sous les projecteurs[enregistrement vidéo] :aventures à Fraisi-Paradis.	5	2	https://nelligandecouverte.ville.montreal.qc.ca/iii/encore/record/C__Rb2375260?lang=frc
Bibliothèque de Pointe-aux-Trembles	Jeunes - Jeux	La course aux fromages[jeu] :2 à 4 joueurs : 4 à 8 ans.	5	1	https://nelligandecouverte.ville.montreal.qc.ca/iii/encore/record/C__Rb1379036?lang=frc
Bibliothèque de Pointe-aux-Trembles	Jeunes - BD	Lili veut faire une boum /[texte de] Dominique de Saint Mars ; [illustrations de] Serge Bloch.	4	2	https://nelligandecouverte.ville.montreal.qc.ca/iii/encore/record/C__Rb1381810?lang=frc
Bibliothèque de Pointe-aux-Trembles	Adultes - Nouveautés	Roman d'amour.3,Pour le meilleur... /Sandra Lane.	4	2	https://nelligandecouverte.ville.montreal.qc.ca/iii/encore/record/C__Rb2471784?lang=frc
Bibliothèque de Pointe-aux-Trembles	Jeunes - Jeux vidéo sur console	Mario & Sonic at the London 2012 Olympic games[ressource électronique (Wii)]	4	2	https://nelligandecouverte.ville.montreal.qc.ca/iii/encore/record/C__Rb2319893?lang=frc
Bibliothèque de Pointe-aux-Trembles	Adultes - Romans	Une femme sous la menace /Nora Roberts ; traduit de l'anglais (États-Unis) par Joëlle Touati.	4	3	https://nelligandecouverte.ville.montreal.qc.ca/iii/encore/record/C__Rb2390637?lang=frc
Bibliothèque de Pointe-aux-Trembles	Jeunes - Jeux vidéo sur console	NHL 14[ressource électronique (Xbox 360)].	4	2	https://nelligandecouverte.ville.montreal.qc.ca/iii/encore/record/C__Rb2417832?lang=frc
Bibliothèque de Pointe-aux-Trembles	Jeunes - BD	Les Ripoupons.6,Du nouveau dans le dortoir /scénario, Gégé, Bélom ; dessins, Gégé.	4	2	https://nelligandecouverte.ville.montreal.qc.ca/iii/encore/record/C__Rb1462795?lang=frc
Bibliothèque de Pointe-aux-Trembles	Jeunes - BD	Cold case, affaires glacées /dessin, Midam ... [et al.] ; scénario, Midam et www.gameoverforever.com.	4	4	https://nelligandecouverte.ville.montreal.qc.ca/iii/encore/record/C__Rb2348013?lang=frc
Bibliothèque de Pointe-aux-Trembles	Jeunes - Jeux	Qui est votre ami?[jeu] =Who's your friend? : 2 plateaux de jeu à volets, 3 séries de cartes illustrées.	4	1	https://nelligandecouverte.ville.montreal.qc.ca/iii/encore/record/C__Rb1290400?lang=frc
Bibliothèque de Pointe-aux-Trembles	Jeunes - Jeux	Lego 10662: jouet de construction [jeu] 	4	1	https://nelligandecouverte.ville.montreal.qc.ca/iii/encore/record/C__Rb2450373?lang=frc
Bibliothèque de Pointe-aux-Trembles	Jeunes - BD	Only for your eyes /dessin, Midam et Adam ; scénario, Midam et Thitaume.	4	4	https://nelligandecouverte.ville.montreal.qc.ca/iii/encore/record/C__Rb2282194?lang=frc
Bibliothèque de Rivière-des-Prairies	Jeunes - Nouveautés	Lili invite une copine en vacances /[texte de] Dominique de Saint Mars ; [illustrations de] Serge Bloch.	8	4	https://nelligandecouverte.ville.montreal.qc.ca/iii/encore/record/C__Rb2459559?lang=frc
