Nom Bibliothèque	Secteur	Titre	Nombre de prêt	Nombre de document	Lien URL
Bibliothèque de La Petite-Patrie	Adultes - Documentaires	Conduire un véhicule de promenade /[publication réalisée par la Société de l'assurance automobile du Québec ; recherche et rédaction, Michèle Jean et Micheline Briand avec la collaboration de Diane Hamel... et al.]	10	11	https://nelligandecouverte.ville.montreal.qc.ca/iii/encore/record/C__Rb1427841?lang=frc
Bibliothèque de Rosemont	Jeunes - Jeux	Croque-carotte[jeu] :5 à 99 ans, 2 à 4 joueurs	30	1	https://nelligandecouverte.ville.montreal.qc.ca/iii/encore/record/C__Rb1289644?lang=frc
Bibliothèque de Rosemont	Adultes - Documentaires	Guide de la route /[recherche et rédaction de la mise à jour, Sandra Gauthier avec la collaboration du personnel du Service des usagers de la route ; réalisé par la Société de l'assurance automobile du Québec en collaboration avec le Service de l'exploitation du Ministère des transports ; illustrations, Jean-Michel Girard].	25	12	https://nelligandecouverte.ville.montreal.qc.ca/iii/encore/record/C__Rb1821505?lang=frc
Bibliothèque de Rosemont	Adultes - DVD	Épopée en Amérique[enregistrement vidéo] :une histoire populaire du Québec /scénario, Gilles Carle, Camille Coudari, Jacques Lacoursière ; réalisation, Gilles Carle.	19	8	https://nelligandecouverte.ville.montreal.qc.ca/iii/encore/record/C__Rb1413954?lang=frc
Bibliothèque de Rosemont	Adultes - Documentaires	Conduire un véhicule de promenade /[publication réalisée par la Société de l'assurance automobile du Québec ; recherche et rédaction, Michèle Jean et Micheline Briand avec la collaboration de Diane Hamel... et al.]	19	16	https://nelligandecouverte.ville.montreal.qc.ca/iii/encore/record/C__Rb1427841?lang=frc
Bibliothèque de Rosemont	Jeunes - Jeux	Coco crazy![jeu].	19	1	https://nelligandecouverte.ville.montreal.qc.ca/iii/encore/record/C__Rb1952456?lang=frc
Bibliothèque de Rosemont	Jeunes - DVD - Nouveautés	Le livre de la jungle.Party dans la jungle[enregistrement vidéo] =The jungle book.Jungle party /show director, Tapaas Chakravarti ; written by Jimmy Hibbert, David Richard Fox, Frederic Valion.	16	2	https://nelligandecouverte.ville.montreal.qc.ca/iii/encore/record/C__Rb2457513?lang=frc
Bibliothèque de Rosemont	Adultes - DVD	Le guetteur[enregistrement vidéo] =The lookout /réalisation, Michele Placido ; scénario, Cédric Melon, Denis Brusseaux.	14	1	https://nelligandecouverte.ville.montreal.qc.ca/iii/encore/record/C__Rb2441943?lang=frc
Bibliothèque de Rosemont	Adultes - DVD - Nouveautés	Diego Star[enregistrement vidéo] /scénario et réalisation, Frédérick Pelletier.	14	2	https://nelligandecouverte.ville.montreal.qc.ca/iii/encore/record/C__Rb2449671?lang=frc
Bibliothèque de Rosemont	Adultes - DVD - Nouveautés	Le démantèlement[enregistrement vidéo] =The auction /scénario et réalisation, Sébastien Pilote.	14	2	https://nelligandecouverte.ville.montreal.qc.ca/iii/encore/record/C__Rb2437918?lang=frc
Bibliothèque de Rosemont	Adultes - DVD - Nouveautés	Louis Cyr, l'homme le plus fort du monde[enregistrement vidéo] =Louis Cyr, the strongest man in the world /réalisation, Daniel Roby ; scénario, Sylvain Guy.	14	2	https://nelligandecouverte.ville.montreal.qc.ca/iii/encore/record/C__Rb2427871?lang=frc
Bibliothèque de Rosemont	Jeunes - BD	Waterminator /scénario et dessin, Midam.	14	4	https://nelligandecouverte.ville.montreal.qc.ca/iii/encore/record/C__Rb1289072?lang=frc
Bibliothèque de Rosemont	Adultes - Romans	Fifty shades.3,Cinquante nuances plus claires :roman /E. L. James ; traduit de l'anglais par Denyse Beaulieu.	14	4	https://nelligandecouverte.ville.montreal.qc.ca/iii/encore/record/C__Rb2368798?lang=frc
Bibliothèque de Rosemont	Jeunes - BD	Les légendaires.4,Le réveil du Kréa-Kaos /Patrick Sobral	13	4	https://nelligandecouverte.ville.montreal.qc.ca/iii/encore/record/C__Rb1414019?lang=frc
Bibliothèque de Rosemont	Adultes - DVD	Incendies[enregistrement vidéo] /un film de Denis Villeneuve ; une production Micro_Scope ; scénario et dialogues par Denis Villeneuve avec la collaboration de Valérie Beaugrand-Champagne.	13	3	https://nelligandecouverte.ville.montreal.qc.ca/iii/encore/record/C__Rb2112087?lang=frc
Bibliothèque de Rosemont	Jeunes - BD	Quelle chouchoute! /dessins, William ; scénario, Cazenove & William.	12	6	https://nelligandecouverte.ville.montreal.qc.ca/iii/encore/record/C__Rb2067970?lang=frc
Bibliothèque de Rosemont	Jeunes - DVD	Le renard et l'enfant[enregistrement vidéo] =The fox and the child /réalisation, Luc Jacquet ; scénario, Luc Jacquet, Eric Rognard.	12	2	https://nelligandecouverte.ville.montreal.qc.ca/iii/encore/record/C__Rb1917909?lang=frc
Bibliothèque de Rosemont	Jeunes - BD	Les Schtroumpfs et le livre qui dit tout /scénario, Alain Jost et Thierry Culliford ; dessin, Pascal Garray.	12	5	https://nelligandecouverte.ville.montreal.qc.ca/iii/encore/record/C__Rb1575896?lang=frc
Bibliothèque de Rosemont	Jeunes - DVD	Robin des bois[enregistrement vidéo] =Robin Hood /réalisation, Wolfgang Reitherman ; histoire, Larry Clemmons ; animation, Milt Kahl ... [et al.].	12	2	https://nelligandecouverte.ville.montreal.qc.ca/iii/encore/record/C__Rb1466267?lang=frc
Bibliothèque de Rosemont	Adultes - Études et carrières	Panoram@th.Mathématique, 1er cycle du secondaire /Richard Cadieux, Isabelle Gendron, Antoine Ledoux.	12	12	https://nelligandecouverte.ville.montreal.qc.ca/iii/encore/record/C__Rb1443506?lang=frc
Bibliothèque de Rosemont	Jeunes - Nouveautés	Capitaine Static.6,Mystère et boule de gomme! /[texte de] Alain M. Bergeron et [illustrations de] Sampar.	12	5	https://nelligandecouverte.ville.montreal.qc.ca/iii/encore/record/C__Rb2449552?lang=frc
Bibliothèque Marc-Favreau	Adultes - Tablettes numériques	Tablette iPad [Marc-Favreau]	55	18	https://nelligandecouverte.ville.montreal.qc.ca/iii/encore/record/C__Rb2433402?lang=frc
Bibliothèque Marc-Favreau	Jeunes - Jeux vidéo sur console	Portal 2[ressource électronique (Playstation 3)].	15	2	https://nelligandecouverte.ville.montreal.qc.ca/iii/encore/record/C__Rb2263348?lang=frc
Bibliothèque Marc-Favreau	Jeunes - DVD	Un petit chien là-haut[enregistrement vidéo] =Pup /directed by Francis Nielsen ; script by Angel E. Pariente.	14	2	https://nelligandecouverte.ville.montreal.qc.ca/iii/encore/record/C__Rb2455942?lang=frc
Bibliothèque Marc-Favreau	Adultes - DVD	Prisonniers[enregistrement vidéo] =Prisoners /réalisation, Denis Villeneuve ; scénario, Aaron Guzikowski.	14	2	https://nelligandecouverte.ville.montreal.qc.ca/iii/encore/record/C__Rb2431762?lang=frc
Bibliothèque Marc-Favreau	Adultes - DVD	Ombline[enregistrement vidéo] /scénario et réalisation, Stéphane Cazes.	14	2	https://nelligandecouverte.ville.montreal.qc.ca/iii/encore/record/C__Rb2404473?lang=frc
Bibliothèque Marc-Favreau	Adultes - DVD	Philomena[enregistrement vidéo] /réalisation, Stephen Frears ; scénario, Steve Coogan, Jeff Pope.	13	2	https://nelligandecouverte.ville.montreal.qc.ca/iii/encore/record/C__Rb2439075?lang=frc
Bibliothèque Marc-Favreau	Jeunes - Albums carton (cartonnés)	Chez la sorcière :[théâtre] /Bénédicte Guettier [sur un concept de Catherine Hurtut].	13	5	https://nelligandecouverte.ville.montreal.qc.ca/iii/encore/record/C__Rb1449756?lang=frc
Bibliothèque Marc-Favreau	Jeunes - Jeux vidéo sur console	FIFA soccer 14[ressource électronique (PlayStation 3)].	13	3	https://nelligandecouverte.ville.montreal.qc.ca/iii/encore/record/C__Rb2417795?lang=frc
Bibliothèque Marc-Favreau	Jeunes - Jeux vidéo sur console	Super Mario galaxy[ressource électronique (Wii)].	13	4	https://nelligandecouverte.ville.montreal.qc.ca/iii/encore/record/C__Rb2111864?lang=frc
Bibliothèque Marc-Favreau	Adultes - DVD	Jasmine French[enregistrement vidéo] =Blue Jasmine /scénario et réalisation, Woody Allen.	13	2	https://nelligandecouverte.ville.montreal.qc.ca/iii/encore/record/C__Rb2434662?lang=frc
Bibliothèque Marc-Favreau	Jeunes - DVD	Thomas & friends.Sticky situations[enregistrement vidéo] /based on The Railway Series by The Reverend W. Awdry.	13	4	https://nelligandecouverte.ville.montreal.qc.ca/iii/encore/record/C__Rb2386979?lang=frc
Bibliothèque Marc-Favreau	Adultes - DVD	Divergence[enregistrement vidéo] =Divergent /réalisation, Neil Burger ; scénario, Evan Daugherty, Vanessa Taylor.	13	2	https://nelligandecouverte.ville.montreal.qc.ca/iii/encore/record/C__Rb2462977?lang=frc
Bibliothèque Marc-Favreau	Jeunes - Albums carton (cartonnés)	Fais-toi peur :un livre-surprise à taper, crier, chatouiller-- /[illustré par Christian Guibbaud].	12	7	https://nelligandecouverte.ville.montreal.qc.ca/iii/encore/record/C__Rb1440018?lang=frc
Bibliothèque Marc-Favreau	Adultes - Jeux vidéo sur console	The elder scrolls V.Skyrim[electronic resource (PlayStation 3)] /[developed by Bethesda Game Studios].	12	3	https://nelligandecouverte.ville.montreal.qc.ca/iii/encore/record/C__Rb2329777?lang=frc
Bibliothèque Marc-Favreau	Jeunes - Aide aux devoirs	Réussis ta 1re-6e année!.Français, mathématique /[conception et direction de la collection, Michel Brindamour ; recherche et rédaction, Françoise Tchou]	12	6	https://nelligandecouverte.ville.montreal.qc.ca/iii/encore/record/C__Rb2253809?lang=frc
Bibliothèque Marc-Favreau	Jeunes - DVD	L'ours montagne[enregistrement vidéo] =[Den kaempestore bjorn] /réalisation, Esben Toft Jacobsen ; scénario, Jannik Tai Mosholt, Esben Toft Jacobsen.	12	2	https://nelligandecouverte.ville.montreal.qc.ca/iii/encore/record/C__Rb2468857?lang=frc
Bibliothèque Marc-Favreau	Jeunes - DVD	Le jour des corneilles[enregistrement vidéo] /réalisation, Jean-Christophe Dessaint ; scénario, Amandine Taffin.	12	2	https://nelligandecouverte.ville.montreal.qc.ca/iii/encore/record/C__Rb2379293?lang=frc
Bibliothèque Marc-Favreau	Jeunes - Documentaires - Livres d'images	À poils-- ou à plumes? /Stéphane Frattini.	12	7	https://nelligandecouverte.ville.montreal.qc.ca/iii/encore/record/C__Rb1585016?lang=frc
Bibliothèque Marc-Favreau	Adultes - DVD	Le porte-bonheur[enregistrement vidéo] =The lucky one /réalisation, Scott Hicks ; scénario, Will Fetters.	12	2	https://nelligandecouverte.ville.montreal.qc.ca/iii/encore/record/C__Rb2343699?lang=frc
Bibliothèque Marc-Favreau	Jeunes - DVD	Les pirates![enregistrement vidéo] :bande de nuls = The pirates! : band of misfits /réalisation, Peter Lord, Jeff Newitt ; scénariste, Gideon Defoe	12	2	https://nelligandecouverte.ville.montreal.qc.ca/iii/encore/record/C__Rb2378957?lang=frc
Bibliothèque du Vieux-Saint-Laurent	Adultes - Documentaires	Driving a passenger vehicle /[publication prepared by the Société de l'assurance automobile du Québec ; researched and written by Michèle Jean and Micheline Briand with the cooperation of Diane Hamel ... et al. ; English translation, Elizabeth Doyle].	24	16	https://nelligandecouverte.ville.montreal.qc.ca/iii/encore/record/C__Rb1435747?lang=frc
Bibliothèque du Vieux-Saint-Laurent	Adultes - Documentaires	Conduire un véhicule de promenade /[publication réalisée par la Société de l'assurance automobile du Québec ; recherche et rédaction, Michèle Jean et Micheline Briand avec la collaboration de Diane Hamel... et al.]	17	14	https://nelligandecouverte.ville.montreal.qc.ca/iii/encore/record/C__Rb1427841?lang=frc
Bibliothèque du Vieux-Saint-Laurent	Adultes - DVD / Blu-Ray	Divergence[enregistrement vidéo] =Divergent /réalisation, Neil Burger ; scénario, Evan Daugherty, Vanessa Taylor.	16	2	https://nelligandecouverte.ville.montreal.qc.ca/iii/encore/record/C__Rb2462977?lang=frc
Bibliothèque du Vieux-Saint-Laurent	Jeunes - DVD / Blu-Ray	L'ère de glace.La dérive des continents[enregistrement vidéo] =Ice age. Continental drift /réalisation, Steve Martino, Michael Thurmeier ; scénario, Michael Berg, Jason Fuchs.	16	5	https://nelligandecouverte.ville.montreal.qc.ca/iii/encore/record/C__Rb2366769?lang=frc
Bibliothèque du Vieux-Saint-Laurent	Jeunes - DVD / Blu-Ray	Le conte de fées de Minnie[enregistrement vidéo] =Minnie-Rella.	15	3	https://nelligandecouverte.ville.montreal.qc.ca/iii/encore/record/C__Rb2439458?lang=frc
Bibliothèque du Vieux-Saint-Laurent	Jeunes - DVD / Blu-Ray	L'ère de glace.La dérive des continents[enregistrement vidéo] =Ice age.Continental drift /réalisation, Steve Martino, Michael Thurmeier ; scénario, Michael Berg, Jason Fuchs.	15	4	https://nelligandecouverte.ville.montreal.qc.ca/iii/encore/record/C__Rb2364682?lang=frc
Bibliothèque du Vieux-Saint-Laurent	Jeunes - DVD / Blu-Ray	Scooby-Doo!Et la folie du catch[enregistrement vidéo] :film original = Scooby-Doo!Wrestlemania mystery : original movie /written by  Michael Ryan ; produced and directed by Brandon Vietti.	15	2	https://nelligandecouverte.ville.montreal.qc.ca/iii/encore/record/C__Rb2459359?lang=frc
Bibliothèque du Vieux-Saint-Laurent	Adultes - DVD / Blu-Ray	Hunger games.L'embrasement[enregistrement vidéo] =The Hunger games.Catching fire /réalisation, Francis Lawrence ; scénario, Simon Beaufoy, Michael de Bruyn.	14	2	https://nelligandecouverte.ville.montreal.qc.ca/iii/encore/record/C__Rb2444855?lang=frc
Bibliothèque du Vieux-Saint-Laurent	Jeunes - BD	Les légendaires.16,L'éternité ne dure qu'un temps /Patrick Sobral.	14	4	https://nelligandecouverte.ville.montreal.qc.ca/iii/encore/record/C__Rb2425953?lang=frc
Bibliothèque du Vieux-Saint-Laurent	Jeunes - DVD / Blu-Ray	Chuggington.Les meilleures épisodes[enregistrement vidéo] =Chuggington.The best of! /réalisateurs, Charlie Caminada, Sarah Ball ; scénaristes, Dick Rothkopf, Rob Lawes	14	2	https://nelligandecouverte.ville.montreal.qc.ca/iii/encore/record/C__Rb2364179?lang=frc
Bibliothèque du Vieux-Saint-Laurent	Jeunes - DVD / Blu-Ray	Scooby-Doo!.Camp mystère[enregistrement vidéo] :film original  = Scooby-Doo!.Camp scare : original movie /réalisation, Ethan Spaulding ; scénario, Jed Elinoff, Scott Thomas.	13	2	https://nelligandecouverte.ville.montreal.qc.ca/iii/encore/record/C__Rb2074803?lang=frc
Bibliothèque du Vieux-Saint-Laurent	Jeunes - DVD / Blu-Ray	Détestable moi 2[enregistrement vidéo] =Despicable me 2 /réalisation, Pierre Coffin, Chris Renaud ; scénario, Ken Daurio, Cinco Paul.	13	3	https://nelligandecouverte.ville.montreal.qc.ca/iii/encore/record/C__Rb2430182?lang=frc
Bibliothèque du Vieux-Saint-Laurent	Jeunes - DVD / Blu-Ray	Le livre de la jungle[enregistrement vidéo] =The jungle book /directed by Wolfgang Reitherman.	13	3	https://nelligandecouverte.ville.montreal.qc.ca/iii/encore/record/C__Rb2455975?lang=frc
Bibliothèque du Vieux-Saint-Laurent	Adultes - DVD / Blu-Ray	Hunger games[enregistrement vidéo] :l'embrasement = The Hunger games : catching fire /réalisation, Francis Lawrence ; scénario, Simon Beaufoy, Michael de Bruyn.	12	2	https://nelligandecouverte.ville.montreal.qc.ca/iii/encore/record/C__Rb2440675?lang=frc
Bibliothèque du Vieux-Saint-Laurent	Jeunes - DVD / Blu-Ray	Le légendaire Mickey de cristal[enregistrement vidéo] =Quest for the crystal Mickey.	12	3	https://nelligandecouverte.ville.montreal.qc.ca/iii/encore/record/C__Rb2395627?lang=frc
Bibliothèque du Vieux-Saint-Laurent	Jeunes - DVD / Blu-Ray	La légende de Sarila[enregistrement vidéo] =The legend of Sarila /réalisation, Nancy Florence Savard ; idée originale, Pierre Tremblay ; scénario et dialogues, Pierre Tremblay et Roger Harvey.	12	2	https://nelligandecouverte.ville.montreal.qc.ca/iii/encore/record/C__Rb2425389?lang=frc
Bibliothèque du Vieux-Saint-Laurent	Jeunes - DVD / Blu-Ray	Le réveil des gardiens[enregistrement vidéo] =Rise of the guardians /réalisation, Peter Ramsey ; scénario, David Lindsay-Abaire.	12	4	https://nelligandecouverte.ville.montreal.qc.ca/iii/encore/record/C__Rb2384896?lang=frc
Bibliothèque du Vieux-Saint-Laurent	Jeunes - Romans	Un coeur à prendre /de Jeff Kinney ; traduit de l'anglais (États-Unis) par Natalie Zimmermann.	12	4	https://nelligandecouverte.ville.montreal.qc.ca/iii/encore/record/C__Rb2439335?lang=frc
Bibliothèque du Vieux-Saint-Laurent	Jeunes - Romans	Bienvenue à Kalos! /[rédaction, Natacha Godeau].	12	4	https://nelligandecouverte.ville.montreal.qc.ca/iii/encore/record/C__Rb2476025?lang=frc
Bibliothèque du Vieux-Saint-Laurent	Jeunes - DVD / Blu-Ray	Les petits pieds du bonheur 2[enregistrement vidéo] =Happy feet two /réalisation, George Miller ; scénario, George Miller ... [et al.].	12	3	https://nelligandecouverte.ville.montreal.qc.ca/iii/encore/record/C__Rb2313844?lang=frc
Bibliothèque du Boisé	Adultes - Tablettes numériques	Tablette iPad [Du Boisé]	931	12	https://nelligandecouverte.ville.montreal.qc.ca/iii/encore/record/C__Rb2415133?lang=frc
Bibliothèque du Boisé	Jeunes - Aide aux devoirs	Pas de problème!.Mathématique, 1re[-6e] année : exercices de résolution de problèmes : 1er[-3e] cycle /Pierrette Tranquille, Françoise Tchou ; [illustrations, Michel Grant].	43	23	https://nelligandecouverte.ville.montreal.qc.ca/iii/encore/record/C__Rb1409837?lang=frc
Bibliothèque du Boisé	Tout-petits - DVD / Blu-Ray	Care-Bears.Super Cuddly[videorecording].	33	12	https://nelligandecouverte.ville.montreal.qc.ca/iii/encore/record/C__Rb2313939?lang=frc
Bibliothèque du Boisé	Adultes - Collection multilingue	When I feel angry	22	7	https://nelligandecouverte.ville.montreal.qc.ca/iii/encore/record/C__Rb2342390?lang=frc
Bibliothèque du Boisé	Jeunes - Aide aux devoirs	Je lis et je comprends :cahier de compréhension de lecture /Lucie Rivest ; collaboration, Hélène Morasse ; [illustrations, Hélène Lafond].	20	12	https://nelligandecouverte.ville.montreal.qc.ca/iii/encore/record/C__Rb1983920?lang=frc
Bibliothèque du Boisé	Tout-petits - DVD / Blu-Ray	Let's learn colors[videorecording].	18	4	https://nelligandecouverte.ville.montreal.qc.ca/iii/encore/record/C__Rb2408754?lang=frc
Bibliothèque du Boisé	Tout-petits - DVD / Blu-Ray	Max & Ruby (Émission de télévision)	18	4	https://nelligandecouverte.ville.montreal.qc.ca/iii/encore/record/C__Rb2411536?lang=frc
Bibliothèque du Boisé	Jeunes - DVD / Blu-Ray	J'apprends la magie[enregistrement vidéo] /producteur, Les Productions Prestigo. --	16	4	https://nelligandecouverte.ville.montreal.qc.ca/iii/encore/record/C__Rb2213471?lang=frc
Bibliothèque du Boisé	Jeunes - Aide aux devoirs	Croque-mots :cahier d'activités /France Choquette, Mario Ducharme.	16	9	https://nelligandecouverte.ville.montreal.qc.ca/iii/encore/record/C__Rb1447353?lang=frc
Bibliothèque du Boisé	Adultes - DVD / Blu-Ray	Prince of Persia.The sands of time[enregistrement vidéo] =Prince of Persia.Les sables du temps /scénario de Boaz Yakin, Doug Miro & Carlo Bernard ; un film de Mike Newell.	16	2	https://nelligandecouverte.ville.montreal.qc.ca/iii/encore/record/C__Rb1942856?lang=frc
Bibliothèque du Boisé	Jeunes - DVD / Blu-Ray	Léon, le plus rigolo des cyclopes!.Saison 2[enregistrement vidéo] /réalisé par Ghislain Cyr, Annie Groovie.	16	4	https://nelligandecouverte.ville.montreal.qc.ca/iii/encore/record/C__Rb1912030?lang=frc
Bibliothèque du Boisé	Jeunes - DVD / Blu-Ray	Scooby-Doo!.13 histoires effrayantes autour du monde[enregistrement vidéo] =Scooby-Doo!13 spooky tales around the world.	16	5	https://nelligandecouverte.ville.montreal.qc.ca/iii/encore/record/C__Rb2331858?lang=frc
Bibliothèque du Boisé	Jeunes - Documentaires - Livres d'images	Max va à l'hôpital /Dominique de Saint Mars ; [illustrations de] Serge Bloch ; [inspiré par Astrapi]	15	3	https://nelligandecouverte.ville.montreal.qc.ca/iii/encore/record/C__Rb1286664?lang=frc
Bibliothèque du Boisé	Tout-petits - DVD / Blu-Ray	Thomas & friends.Steam team collection[enregistrement vidéo] /created by Britt Allcroft ; directed by Greg Tiernan.	14	8	https://nelligandecouverte.ville.montreal.qc.ca/iii/encore/record/C__Rb2281486?lang=frc
Bibliothèque du Boisé	Jeunes - BD - Fiction	Geronimo Stilton.11,Le mystère de la tour Eiffel /Geronimo Stilton ; [scénario de Leonardo Favia ; illustrations, Ennio Bufi ; traduction par Claude Dubois].	14	4	https://nelligandecouverte.ville.montreal.qc.ca/iii/encore/record/C__Rb2419148?lang=frc
Bibliothèque du Boisé	Jeunes - BD - Fiction	Yes, I can! /dessin, Midam, Adam et Julien Mariolle ; scénario, Midam et Patelin.	14	4	https://nelligandecouverte.ville.montreal.qc.ca/iii/encore/record/C__Rb2426029?lang=frc
Bibliothèque du Boisé	Jeunes - Documentaires - Livres d'images	Max est fou de jeux vidéo /Dominique de Saint Mars ; [illustrations de] Serge Bloch ; [inspiré par Astrapi].	14	3	https://nelligandecouverte.ville.montreal.qc.ca/iii/encore/record/C__Rb1286628?lang=frc
Bibliothèque du Boisé	Jeunes - DVD / Blu-Ray	L'ère de glace.L'aube des dinosaures[enregistrement vidéo] =Ice age.Dawn of the dinosaurs /réalisation, Carlos Saldanha, Mike Thurmeier ; scénario, Michael Berg ... [et al.].	14	4	https://nelligandecouverte.ville.montreal.qc.ca/iii/encore/record/C__Rb1842859?lang=frc
Bibliothèque du Boisé	Jeunes - DVD / Blu-Ray	Détestable moi 2[enregistrement vidéo] =Despicable me 2 /réalisation, Pierre Coffin, Chris Renaud ; scénario, Ken Daurio, Cinco Paul.	14	3	https://nelligandecouverte.ville.montreal.qc.ca/iii/encore/record/C__Rb2430181?lang=frc
Bibliothèque du Boisé	Jeunes - DVD / Blu-Ray	La princesse des cygnes[enregistrement vidéo] :un conte de Noël = The swan princess : Christmas /story by Richard Rich and Brian Nissen ; screenplay by Brian Nissen ; directed by Richard Rich.	14	2	https://nelligandecouverte.ville.montreal.qc.ca/iii/encore/record/C__Rb2416465?lang=frc
Bibliothèque de Pointe-aux-Trembles	Adultes - Nouveautés	Les héritiers du fleuve.3,1918-1929 /Louise Tremblay-D'Essiambre.	21	9	https://nelligandecouverte.ville.montreal.qc.ca/iii/encore/record/C__Rb2441946?lang=frc
Bibliothèque de Pointe-aux-Trembles	Adultes - Romans québécois	Les héritiers du fleuve.2,1898-1914 /Louise Tremblay-D'Essiambre.	20	8	https://nelligandecouverte.ville.montreal.qc.ca/iii/encore/record/C__Rb2410973?lang=frc
Bibliothèque de Pointe-aux-Trembles	Adultes - Romans québécois	Mensonges sur le Plateau Mont-Royal.1,Un mariage de raison : roman historique /Michel David.	18	8	https://nelligandecouverte.ville.montreal.qc.ca/iii/encore/record/C__Rb2403174?lang=frc
Bibliothèque de Pointe-aux-Trembles	Adultes - Nouveautés	Mensonges sur le Plateau Mont-Royal.2,La biscuiterie : roman historique /Michel David.	18	9	https://nelligandecouverte.ville.montreal.qc.ca/iii/encore/record/C__Rb2436372?lang=frc
Bibliothèque de Pointe-aux-Trembles	Jeunes - Jeux	La course aux fromages[jeu] :2 à 4 joueurs : 4 à 8 ans.	17	1	https://nelligandecouverte.ville.montreal.qc.ca/iii/encore/record/C__Rb1379036?lang=frc
Bibliothèque de Pointe-aux-Trembles	Adultes - Romans québécois	Les héritiers du fleuve.1,1887-1893 /Louise Tremblay-D'Essiambre.	15	10	https://nelligandecouverte.ville.montreal.qc.ca/iii/encore/record/C__Rb2404543?lang=frc
Bibliothèque de Pointe-aux-Trembles	Adultes - Romans	Inferno :roman /Dan Brown ; traduit de l'anglais (États-Unis) par Dominique Defert et Carole Delporte.	15	4	https://nelligandecouverte.ville.montreal.qc.ca/iii/encore/record/C__Rb2379801?lang=frc
Bibliothèque de Pointe-aux-Trembles	Adultes - Romans québécois	La grange d'en haut.1,Faut marier Héléna /Micheline Dalpé.	13	4	https://nelligandecouverte.ville.montreal.qc.ca/iii/encore/record/C__Rb2405824?lang=frc
Bibliothèque de Pointe-aux-Trembles	Adultes - Nouveautés	Violence à l'origine /Martin Michaud.	12	4	https://nelligandecouverte.ville.montreal.qc.ca/iii/encore/record/C__Rb2477972?lang=frc
Bibliothèque de Pointe-aux-Trembles	Adultes - Documentaires	Scott 2014 standard postage stamp catalogue /editor, James E. Kloetzel.	12	6	https://nelligandecouverte.ville.montreal.qc.ca/iii/encore/record/C__Rb2388135?lang=frc
Bibliothèque de Pointe-aux-Trembles	Jeunes - BD	Cold case, affaires glacées /dessin, Midam ... [et al.] ; scénario, Midam et www.gameoverforever.com.	11	4	https://nelligandecouverte.ville.montreal.qc.ca/iii/encore/record/C__Rb2348013?lang=frc
Bibliothèque de Pointe-aux-Trembles	Jeunes - DVD	La princesse du Festifruit[enregistrement vidéo] :aventures à Fraisi-Paradis/réalisation, Karen Hyden.	11	3	https://nelligandecouverte.ville.montreal.qc.ca/iii/encore/record/C__Rb2330579?lang=frc
Bibliothèque de Pointe-aux-Trembles	Jeunes - BD	Les nombrils.6,Un été trop mortel! /[illustrations de] Delaf & [texte de] Dubuc.	11	3	https://nelligandecouverte.ville.montreal.qc.ca/iii/encore/record/C__Rb2423736?lang=frc
Bibliothèque de Pointe-aux-Trembles	Adultes - Romans québécois	La grange d'en haut.2,L'exode de Marianne /Micheline Dalpé.	11	3	https://nelligandecouverte.ville.montreal.qc.ca/iii/encore/record/C__Rb2410972?lang=frc
Bibliothèque de Pointe-aux-Trembles	Jeunes - BD	Les nombrils.1,Pour qui tu te prends? /[illustrations de] Delaf ; [texte de] Dubuc.	10	4	https://nelligandecouverte.ville.montreal.qc.ca/iii/encore/record/C__Rb1418076?lang=frc
Bibliothèque de Pointe-aux-Trembles	Jeunes - DVD	Les avions[enregistrement vidéo] =Planes /réalisation, Klay Hall ; histoire de John Lasseter, Klay Hall, Jeffrey M. Howard ; scénario, Jeffrey M. Howard.	10	2	https://nelligandecouverte.ville.montreal.qc.ca/iii/encore/record/C__Rb2413924?lang=frc
Bibliothèque de Pointe-aux-Trembles	Adultes - Nouveautés	Glamour et faux pas /Herby Moreau en collaboration avec Stéphanie Vallet.	10	2	https://nelligandecouverte.ville.montreal.qc.ca/iii/encore/record/C__Rb2468326?lang=frc
Bibliothèque de Pointe-aux-Trembles	Adultes - Nouveautés	La ferme /Tom Rob Smith ; traduit de l'anglais par Elisabeth Peellaert.	10	2	https://nelligandecouverte.ville.montreal.qc.ca/iii/encore/record/C__Rb2473816?lang=frc
Bibliothèque de Pointe-aux-Trembles	Adultes - Gros caractères	La saga des Stanislaski[texte (gros caractères)] /Nora Roberts ; traduction française de Lionel Evrard.	9	6	https://nelligandecouverte.ville.montreal.qc.ca/iii/encore/record/C__Rb1359970?lang=frc
