Nom Bibliothèque	Secteur	Titre	Nombre de prêt	Nombre de document	Lien URL
Bibliothèque de Rosemont	Adultes - Documentaires	Guide de la route /[publication réalisée par la Société de l'assurance automobile du Québec].	5	14	https://nelligandecouverte.ville.montreal.qc.ca/iii/encore/record/C__Rb2448995?lang=frc
Bibliothèque de Rosemont	Jeunes - BD	Un air de famille /dessins, William ; scénario, Cazenove & William.	5	5	https://nelligandecouverte.ville.montreal.qc.ca/iii/encore/record/C__Rb1586374?lang=frc
Bibliothèque de Rosemont	Jeunes - BD	Les légendaires.4,Le réveil du Kréa-Kaos /Patrick Sobral	5	4	https://nelligandecouverte.ville.montreal.qc.ca/iii/encore/record/C__Rb1414019?lang=frc
Bibliothèque de Rosemont	Adultes - DVD - Nouveautés	Le capital[enregistrement vidéo] =Capital /réalisation, Costa-Gavras ; scénario, Costa-Gavras, Jean-Claude Grumberg, Karim Boukercha.	5	1	https://nelligandecouverte.ville.montreal.qc.ca/iii/encore/record/C__Rb2458969?lang=frc
Bibliothèque de Rosemont	Adultes - Documentaires	Conduire un véhicule de promenade /[publication réalisée par la Société de l'assurance automobile du Québec ; recherche et rédaction, Michèle Jean et Micheline Briand avec la collaboration de Diane Hamel... et al.]	5	16	https://nelligandecouverte.ville.montreal.qc.ca/iii/encore/record/C__Rb1427841?lang=frc
Bibliothèque de Rosemont	Adultes - DVD	Persepolis[enregistrement vidéo] /scénario et réalisation, Vincent Paronnaud, Marjane Satrapi.	5	2	https://nelligandecouverte.ville.montreal.qc.ca/iii/encore/record/C__Rb1742960?lang=frc
Bibliothèque de Rosemont	Jeunes - BD	Les p'tits diables.11,Mon frère, c'est pas un cadeau!!! /scénario & dessin, Olivier Dutto.	5	5	https://nelligandecouverte.ville.montreal.qc.ca/iii/encore/record/C__Rb2077390?lang=frc
Bibliothèque de Rosemont	Jeunes - Jeux	Dobble[jeu] :jeu d'ambiance et de réflexes.	5	1	https://nelligandecouverte.ville.montreal.qc.ca/iii/encore/record/C__Rb2372445?lang=frc
Bibliothèque de Rosemont	Adultes - Nouveautés	Serge Fiori[enregistrement sonore].	5	5	https://nelligandecouverte.ville.montreal.qc.ca/iii/encore/record/C__Rb2444457?lang=frc
Bibliothèque de Rosemont	Adultes - DVD	Incendies[enregistrement vidéo] /un film de Denis Villeneuve ; une production Micro_Scope ; scénario et dialogues par Denis Villeneuve avec la collaboration de Valérie Beaugrand-Champagne.	5	3	https://nelligandecouverte.ville.montreal.qc.ca/iii/encore/record/C__Rb2112087?lang=frc
Bibliothèque de Rosemont	Adultes - DVD	La fiancée du pirate[enregistrement vidéo] /réalisation, Nelly Kaplan ; scénario et dialogues, Nelly Kaplan, Claude Makovski.	5	2	https://nelligandecouverte.ville.montreal.qc.ca/iii/encore/record/C__Rb1908788?lang=frc
Bibliothèque de Rosemont	Adultes - DVD - Nouveautés	L'autre maison[enregistrement vidéo] =Another house /réalisation, Mathieu Roy ; scénario, Mathieu Roy, Michael Ramsey.	5	3	https://nelligandecouverte.ville.montreal.qc.ca/iii/encore/record/C__Rb2429537?lang=frc
Bibliothèque de Rosemont	Adultes - Romans	L'appel de l'ange :roman /Guillaume Musso.	5	3	https://nelligandecouverte.ville.montreal.qc.ca/iii/encore/record/C__Rb2116710?lang=frc
Bibliothèque de Rosemont	Adultes - DVD - Nouveautés	Les amours imaginaires[enregistrement vidéo] =Heartbeats /scénario et réalisation, Xavier Dolan.	5	2	https://nelligandecouverte.ville.montreal.qc.ca/iii/encore/record/C__Rb2465045?lang=frc
Bibliothèque Marc-Favreau	Adultes - Tablettes numériques	Tablette iPad [Marc-Favreau]	23	18	https://nelligandecouverte.ville.montreal.qc.ca/iii/encore/record/C__Rb2433402?lang=frc
Bibliothèque Marc-Favreau	Adultes - Romans	Une relation dangereuse /Douglas Kennedy ; traduit de l'américain par Bernard Cohen.	10	1	https://nelligandecouverte.ville.montreal.qc.ca/iii/encore/record/C__Rb1346813?lang=frc
Bibliothèque Marc-Favreau	Jeunes - DVD	Le jour des corneilles[enregistrement vidéo] /réalisation, Jean-Christophe Dessaint ; scénario, Amandine Taffin.	6	2	https://nelligandecouverte.ville.montreal.qc.ca/iii/encore/record/C__Rb2379293?lang=frc
Bibliothèque Marc-Favreau	Adultes - DVD	Prisonniers[enregistrement vidéo] =Prisoners /réalisation, Denis Villeneuve ; scénario, Aaron Guzikowski.	6	2	https://nelligandecouverte.ville.montreal.qc.ca/iii/encore/record/C__Rb2431762?lang=frc
Bibliothèque Marc-Favreau	Adultes - DVD	Arnaque américaine[enregistrement vidéo] =American hustle /réalisation, David O. Russell ; scénario, Eric Warren Singer, David O. Russell.	6	2	https://nelligandecouverte.ville.montreal.qc.ca/iii/encore/record/C__Rb2446637?lang=frc
Bibliothèque Marc-Favreau	Adultes - DVD	Ombline[enregistrement vidéo] /scénario et réalisation, Stéphane Cazes.	6	2	https://nelligandecouverte.ville.montreal.qc.ca/iii/encore/record/C__Rb2404473?lang=frc
Bibliothèque Marc-Favreau	Adultes - DVD	Le démantèlement[enregistrement vidéo] =The auction /scénario et réalisation, Sébastien Pilote.	6	3	https://nelligandecouverte.ville.montreal.qc.ca/iii/encore/record/C__Rb2437918?lang=frc
Bibliothèque Marc-Favreau	Jeunes - DVD	Oz le magnifique[enregistrement vidéo] =Oz the great and powerful /réalisation, Sam Raimi ; scénario, Mitchell Kapner et David Lindsay-Abaire ; adaptation pour l'écran, Mitchell Kapner.	6	3	https://nelligandecouverte.ville.montreal.qc.ca/iii/encore/record/C__Rb2400315?lang=frc
Bibliothèque Marc-Favreau	Jeunes - Documentaires - Livres d'images	Les dinosaures /conçu et réalisé par Claude Delafosse et Gallimard jeunesse ; illustré par Donald Grant.	6	5	https://nelligandecouverte.ville.montreal.qc.ca/iii/encore/record/C__Rb1602310?lang=frc
Bibliothèque Marc-Favreau	Jeunes - DVD	Fantasia[enregistrement vidéo] ;Fantasia 2000 /Walt Disney Pictures ; directors, Ben Sharpsteen ... [et al.]	5	2	https://nelligandecouverte.ville.montreal.qc.ca/iii/encore/record/C__Rb2067570?lang=frc
Bibliothèque Marc-Favreau	Jeunes - Albums carton (cartonnés)	T'choupi aime maman /Thierry Courtin.	5	4	https://nelligandecouverte.ville.montreal.qc.ca/iii/encore/record/C__Rb1606850?lang=frc
Bibliothèque Marc-Favreau	Jeunes - Livres d'images (Albums)	Pénélope à la ferme :un livre animé /[texte de] Anne Gutman ; [illustrations de] Georg Hallensleben.	5	6	https://nelligandecouverte.ville.montreal.qc.ca/iii/encore/record/C__Rb1357140?lang=frc
Bibliothèque Marc-Favreau	Jeunes - Livres d'images (Albums)	Mimi va camper /Lucy Cousins.	5	5	https://nelligandecouverte.ville.montreal.qc.ca/iii/encore/record/C__Rb1374992?lang=frc
Bibliothèque Marc-Favreau	Jeunes - DVD	Histoire de jouets 2[enregistrement vidéo] =Toy story 2 /direction, John Lasseter, Lee Unkrich, Ash Brannon ; screenplay, Andrew Stanton ... [et al.].	5	2	https://nelligandecouverte.ville.montreal.qc.ca/iii/encore/record/C__Rb2252481?lang=frc
Bibliothèque Marc-Favreau	Adultes - DVD	Je suis Bruce Lee[enregistrement vidéo] =I am Bruce Lee /réalisation, Pete McCormack.	5	1	https://nelligandecouverte.ville.montreal.qc.ca/iii/encore/record/C__Rb2356539?lang=frc
Bibliothèque Marc-Favreau	Adultes - DVD	Inch'Allah[enregistrement vidéo] /scénario et réalisation, Anaïs Barbeau-Lavalette.	5	2	https://nelligandecouverte.ville.montreal.qc.ca/iii/encore/record/C__Rb2401813?lang=frc
Bibliothèque Marc-Favreau	Jeunes - DVD	Opération noisettes[enregistrement vidéo] =The nut job /réalisation, Peter Lepeniotis ; histoire, Daniel Woo, Peter Lepeniotis ; scénario, Lorne Cameron, Peter Lepeniotis.	5	2	https://nelligandecouverte.ville.montreal.qc.ca/iii/encore/record/C__Rb2444888?lang=frc
Bibliothèque Marc-Favreau	Jeunes - DVD	Amis pour la vie[enregistrement vidéo] =Best friends forever /réalisation, Peter Svatek.	5	4	https://nelligandecouverte.ville.montreal.qc.ca/iii/encore/record/C__Rb2435705?lang=frc
Bibliothèque Marc-Favreau	Jeunes - BD	Les légendaires.5,Coeur du passé /Patrick Sobral.	5	6	https://nelligandecouverte.ville.montreal.qc.ca/iii/encore/record/C__Rb1431559?lang=frc
Bibliothèque Marc-Favreau	Jeunes - BD	Alien Chantilly /scénario et dessin, Midam.	5	6	https://nelligandecouverte.ville.montreal.qc.ca/iii/encore/record/C__Rb1248217?lang=frc
Bibliothèque du Vieux-Saint-Laurent	Adultes - BD	Les aventures de Tintin. 1-8	8	8	https://nelligandecouverte.ville.montreal.qc.ca/iii/encore/record/C__Rb2488088?lang=frc
Bibliothèque du Vieux-Saint-Laurent	Adultes - Documentaires	Conduire un véhicule de promenade /[publication réalisée par la Société de l'assurance automobile du Québec ; recherche et rédaction, Michèle Jean et Micheline Briand avec la collaboration de Diane Hamel... et al.]	7	14	https://nelligandecouverte.ville.montreal.qc.ca/iii/encore/record/C__Rb1427841?lang=frc
Bibliothèque du Vieux-Saint-Laurent	Jeunes - DVD / Blu-Ray	Le légendaire Mickey de cristal[enregistrement vidéo] =Quest for the crystal Mickey.	6	3	https://nelligandecouverte.ville.montreal.qc.ca/iii/encore/record/C__Rb2395627?lang=frc
Bibliothèque du Vieux-Saint-Laurent	Adultes - Documentaires	Driver's handbook /[prepared by the Société de l'assurance automobile du Québec ; updated version researched and written by personnel in the Vice présidence à la sécurité routière ;  collaboration with the Ministère des Transports du Québec ; project coordination, Guillaume Beaurivage ; illustrations, Jean-Michel Girard ; updated translation, Donya Gulak, Sarah Lefebvre].	6	10	https://nelligandecouverte.ville.montreal.qc.ca/iii/encore/record/C__Rb2449207?lang=frc
Bibliothèque du Vieux-Saint-Laurent	Adultes - Documentaires	Driving a passenger vehicle /[publication prepared by the Société de l'assurance automobile du Québec ; researched and written by Michèle Jean and Micheline Briand with the cooperation of Diane Hamel ... et al. ; English translation, Elizabeth Doyle].	6	16	https://nelligandecouverte.ville.montreal.qc.ca/iii/encore/record/C__Rb1435747?lang=frc
Bibliothèque du Vieux-Saint-Laurent	Jeunes - DVD / Blu-Ray	Le réveil des gardiens[enregistrement vidéo] =Rise of the guardians /réalisation, Peter Ramsey ; scénario, David Lindsay-Abaire.	6	4	https://nelligandecouverte.ville.montreal.qc.ca/iii/encore/record/C__Rb2384896?lang=frc
Bibliothèque du Vieux-Saint-Laurent	Adultes - Documentaires	California's best trips :35 amazing road trips /written and researched by Sara Benson, Nate Cavalieri, Beth Kohn.	5	1	https://nelligandecouverte.ville.montreal.qc.ca/iii/encore/record/C__Rb2378941?lang=frc
Bibliothèque du Vieux-Saint-Laurent	Jeunes - DVD / Blu-Ray	Let's learn.1,2,3s[videorecording] /Nickelodeon.	5	3	https://nelligandecouverte.ville.montreal.qc.ca/iii/encore/record/C__Rb2381003?lang=frc
Bibliothèque du Vieux-Saint-Laurent	Jeunes - DVD / Blu-Ray	The Berenstain Bears. Playdates[enregistrement vidéo]	5	4	https://nelligandecouverte.ville.montreal.qc.ca/iii/encore/record/C__Rb2373608?lang=frc
Bibliothèque du Vieux-Saint-Laurent	Jeunes - DVD / Blu-Ray	Le conte de fées de Minnie[enregistrement vidéo] =Minnie-Rella.	5	3	https://nelligandecouverte.ville.montreal.qc.ca/iii/encore/record/C__Rb2439458?lang=frc
Bibliothèque du Vieux-Saint-Laurent	Jeunes - DVD / Blu-Ray	L'ère de glace.Un Noël préhistorique[enregistrement vidéo] =Ice age.A mammoth Christmas special /réalisation, Karen Disher.	5	2	https://nelligandecouverte.ville.montreal.qc.ca/iii/encore/record/C__Rb2273305?lang=frc
Bibliothèque du Vieux-Saint-Laurent	Jeunes - DVD / Blu-Ray	Détestable moi[enregistrement vidéo] =Despicable me /réalisation, Pierre Coffin, Chris Renaud ; scénario, Ken Daurio, Cinco Paul ; histoire de Sergio Pablos.	5	4	https://nelligandecouverte.ville.montreal.qc.ca/iii/encore/record/C__Rb1986414?lang=frc
Bibliothèque du Vieux-Saint-Laurent	Adultes - DVD / Blu-Ray	Le hobbit, la désolation de Smaug[enregistrement vidéo] =The hobbit, the desolation of Smaug /réalisation, Peter Jackson ; scénario, Fran Walsh ... [et al.].	5	2	https://nelligandecouverte.ville.montreal.qc.ca/iii/encore/record/C__Rb2450023?lang=frc
Bibliothèque du Vieux-Saint-Laurent	Jeunes - Aide aux devoirs	Je lis et je comprends :cahier de compréhension de lecture /Lucie Rivest ; collaboration, Hélène Morasse ; [illustrations, Hélène Lafond].	5	6	https://nelligandecouverte.ville.montreal.qc.ca/iii/encore/record/C__Rb1983920?lang=frc
Bibliothèque du Vieux-Saint-Laurent	Jeunes - DVD / Blu-Ray	L'ère de glace.La dérive des continents[enregistrement vidéo] =Ice age.Continental drift /réalisation, Steve Martino, Michael Thurmeier ; scénario, Michael Berg, Jason Fuchs.	5	4	https://nelligandecouverte.ville.montreal.qc.ca/iii/encore/record/C__Rb2364682?lang=frc
Bibliothèque du Vieux-Saint-Laurent	Jeunes - DVD / Blu-Ray	Détestable moi 2[enregistrement vidéo] =Despicable me 2 /réalisation, Pierre Coffin, Chris Renaud ; scénario, Ken Daurio, Cinco Paul.	5	3	https://nelligandecouverte.ville.montreal.qc.ca/iii/encore/record/C__Rb2430182?lang=frc
Bibliothèque du Vieux-Saint-Laurent	Jeunes - Romans	Geronimo, l'as du volant /Geronimo Stilton ; [illustrations d'Alessandro Muscillo ; traduction de Marianne Faurobert].	5	2	https://nelligandecouverte.ville.montreal.qc.ca/iii/encore/record/C__Rb2453991?lang=frc
Bibliothèque du Vieux-Saint-Laurent	Jeunes - DVD / Blu-Ray	Fraisinette.1[enregistrement vidéo]	5	2	https://nelligandecouverte.ville.montreal.qc.ca/iii/encore/record/C__Rb2449627?lang=frc
Bibliothèque du Vieux-Saint-Laurent	Adultes - DVD / Blu-Ray	Hunger games.L'embrasement[enregistrement vidéo] =The Hunger games.Catching fire /réalisation, Francis Lawrence ; scénario, Simon Beaufoy, Michael de Bruyn.	4	2	https://nelligandecouverte.ville.montreal.qc.ca/iii/encore/record/C__Rb2444855?lang=frc
Bibliothèque du Vieux-Saint-Laurent	Adultes - Romans	Noële aux Quatre Vents :roman /Dominique Saint-Alban.	4	2	https://nelligandecouverte.ville.montreal.qc.ca/iii/encore/record/C__Rb1381272?lang=frc
Bibliothèque du Boisé	Adultes - Tablettes numériques	Tablette iPad [Du Boisé]	293	12	https://nelligandecouverte.ville.montreal.qc.ca/iii/encore/record/C__Rb2415133?lang=frc
Bibliothèque du Boisé	Jeunes - Aide aux devoirs	Pas de problème!.Mathématique, 1re[-6e] année : exercices de résolution de problèmes : 1er[-3e] cycle /Pierrette Tranquille, Françoise Tchou ; [illustrations, Michel Grant].	21	23	https://nelligandecouverte.ville.montreal.qc.ca/iii/encore/record/C__Rb1409837?lang=frc
Bibliothèque du Boisé	Tout-petits - DVD / Blu-Ray	Care-Bears.Super Cuddly[videorecording].	11	12	https://nelligandecouverte.ville.montreal.qc.ca/iii/encore/record/C__Rb2313939?lang=frc
Bibliothèque du Boisé	Jeunes - Aide aux devoirs	Je lis et je comprends :cahier de compréhension de lecture /Lucie Rivest ; collaboration, Hélène Morasse ; [illustrations, Hélène Lafond].	8	12	https://nelligandecouverte.ville.montreal.qc.ca/iii/encore/record/C__Rb1983920?lang=frc
Bibliothèque du Boisé	Jeunes - Aide aux devoirs	Croque-dictées :exercices et dictées /[Diane Boileau ; illustrations, Christine Battuz].	7	6	https://nelligandecouverte.ville.montreal.qc.ca/iii/encore/record/C__Rb1447349?lang=frc
Bibliothèque du Boisé	Tout-petits - DVD / Blu-Ray	Dora's Easter adventure[videorecording] /created by Chris Gifford, Valerie Walsh Valdes and Eric Weiner ; directed by George Chialtas and Allan Jacobsen.	7	3	https://nelligandecouverte.ville.montreal.qc.ca/iii/encore/record/C__Rb2289077?lang=frc
Bibliothèque du Boisé	Tout-petits - DVD / Blu-Ray	Thomas & friends.Steam team collection[enregistrement vidéo] /created by Britt Allcroft ; directed by Greg Tiernan.	6	8	https://nelligandecouverte.ville.montreal.qc.ca/iii/encore/record/C__Rb2281486?lang=frc
Bibliothèque du Boisé	Jeunes - BD - Fiction	Geronimo Stilton.11,Le mystère de la tour Eiffel /Geronimo Stilton ; [scénario de Leonardo Favia ; illustrations, Ennio Bufi ; traduction par Claude Dubois].	6	4	https://nelligandecouverte.ville.montreal.qc.ca/iii/encore/record/C__Rb2419148?lang=frc
Bibliothèque du Boisé	Jeunes - Aide aux devoirs	Croque-mots :cahier d'activités /France Choquette, Mario Ducharme.	6	9	https://nelligandecouverte.ville.montreal.qc.ca/iii/encore/record/C__Rb1447353?lang=frc
Bibliothèque du Boisé	Tout-petits - DVD / Blu-Ray	Le spectacle de gymnastique[enregistrement vidéo] =Fantastic gymnastics adventure.	6	2	https://nelligandecouverte.ville.montreal.qc.ca/iii/encore/record/C__Rb2339667?lang=frc
Bibliothèque du Boisé	Tout-petits - DVD / Blu-Ray	La fête dansante et autres aventures[enregistrement vidéo] =[Dance party and other adventures].	6	2	https://nelligandecouverte.ville.montreal.qc.ca/iii/encore/record/C__Rb2274433?lang=frc
Bibliothèque du Boisé	Tout-petits - DVD / Blu-Ray	Dora célèbre la fête des Rois![enregistrement vidéo] =Dora celebrates Three Kings Day!	6	2	https://nelligandecouverte.ville.montreal.qc.ca/iii/encore/record/C__Rb2263299?lang=frc
Bibliothèque du Boisé	Tout-petits - DVD / Blu-Ray	Thomas & friends[enregistrement vidéo] :Thomas and the jet engine|	6	2	https://nelligandecouverte.ville.montreal.qc.ca/iii/encore/record/C__Rb2285544?lang=frc
Bibliothèque du Boisé	Jeunes - DVD / Blu-Ray	High School Musical.Nouveau mixage[enregistrement vidéo] =High School Musical.Remix /produced by Don Schain ; written by Peter Barsocchini ; directed by Kenny Ortega.	6	4	https://nelligandecouverte.ville.montreal.qc.ca/iii/encore/record/C__Rb2252116?lang=frc
Bibliothèque du Boisé	Tout-petits - DVD / Blu-Ray	Let's learn colors[videorecording].	6	4	https://nelligandecouverte.ville.montreal.qc.ca/iii/encore/record/C__Rb2408754?lang=frc
Bibliothèque du Boisé	Jeunes - DVD / Blu-Ray	Le légendaire Mickey de cristal[enregistrement vidéo] =Quest for the crystal Mickey.	6	4	https://nelligandecouverte.ville.montreal.qc.ca/iii/encore/record/C__Rb2395627?lang=frc
Bibliothèque du Boisé	Adultes - Collection multilingue	Er tong shi wan ge wei shen me	6	3	https://nelligandecouverte.ville.montreal.qc.ca/iii/encore/record/C__Rb2458079?lang=frc
Bibliothèque du Boisé	Jeunes - DVD / Blu-Ray	Scooby-Doo!.13 histoires effrayantes autour du monde[enregistrement vidéo] =Scooby-Doo!13 spooky tales around the world.	6	5	https://nelligandecouverte.ville.montreal.qc.ca/iii/encore/record/C__Rb2331858?lang=frc
Bibliothèque du Boisé	Jeunes - Documentaires	Kabobs for kids /Janna DeVore ; photographs by Zac Williams.	5	1	https://nelligandecouverte.ville.montreal.qc.ca/iii/encore/record/C__Rb2289785?lang=frc
Bibliothèque du Boisé	Adultes - Documentaires	10-10-10 :10 minutes, 10 mois et 10 ans : la règle infaillible pour concrétiser vos rêves /Suzy Welch ; traduit de l'anglais (États-Unis) par Pascal Loubet.	5	1	https://nelligandecouverte.ville.montreal.qc.ca/iii/encore/record/C__Rb1990410?lang=frc
Bibliothèque de Pointe-aux-Trembles	Adultes - Nouveautés	Mensonges sur le Plateau Mont-Royal.2,La biscuiterie : roman historique /Michel David.	8	9	https://nelligandecouverte.ville.montreal.qc.ca/iii/encore/record/C__Rb2436372?lang=frc
Bibliothèque de Pointe-aux-Trembles	Jeunes - Jeux	La course aux fromages[jeu] :2 à 4 joueurs : 4 à 8 ans.	7	1	https://nelligandecouverte.ville.montreal.qc.ca/iii/encore/record/C__Rb1379036?lang=frc
Bibliothèque de Pointe-aux-Trembles	Adultes - Romans québécois	Mensonges sur le Plateau Mont-Royal.1,Un mariage de raison : roman historique /Michel David.	6	8	https://nelligandecouverte.ville.montreal.qc.ca/iii/encore/record/C__Rb2403174?lang=frc
Bibliothèque de Pointe-aux-Trembles	Adultes - Romans québécois	Les héritiers du fleuve.1,1887-1893 /Louise Tremblay-D'Essiambre.	5	10	https://nelligandecouverte.ville.montreal.qc.ca/iii/encore/record/C__Rb2404543?lang=frc
Bibliothèque de Pointe-aux-Trembles	Jeunes - DVD	La princesse du Festifruit[enregistrement vidéo] :aventures à Fraisi-Paradis/réalisation, Karen Hyden.	5	3	https://nelligandecouverte.ville.montreal.qc.ca/iii/encore/record/C__Rb2330579?lang=frc
Bibliothèque de Pointe-aux-Trembles	Adultes - Romans québécois	La grange d'en haut.1,Faut marier Héléna /Micheline Dalpé.	5	4	https://nelligandecouverte.ville.montreal.qc.ca/iii/encore/record/C__Rb2405824?lang=frc
Bibliothèque de Pointe-aux-Trembles	Adultes - Nouveautés	Les héritiers du fleuve.3,1918-1929 /Louise Tremblay-D'Essiambre.	5	9	https://nelligandecouverte.ville.montreal.qc.ca/iii/encore/record/C__Rb2441946?lang=frc
Bibliothèque de Pointe-aux-Trembles	Jeunes - BD	Les nombrils.6,Un été trop mortel! /[illustrations de] Delaf & [texte de] Dubuc.	5	3	https://nelligandecouverte.ville.montreal.qc.ca/iii/encore/record/C__Rb2423736?lang=frc
Bibliothèque de Pointe-aux-Trembles	Jeunes - BD	Geronimo Stilton.6,Qui a volé la Joconde? /Geronimo Stilton ; [scénario de Demetrio Bargellini ; illustrations, Giuseppe Facciotto ; traduction par Claude Dubois].	4	3	https://nelligandecouverte.ville.montreal.qc.ca/iii/encore/record/C__Rb2250455?lang=frc
Bibliothèque de Pointe-aux-Trembles	Adultes - Nouveautés	Violence à l'origine /Martin Michaud.	4	4	https://nelligandecouverte.ville.montreal.qc.ca/iii/encore/record/C__Rb2477972?lang=frc
Bibliothèque de Pointe-aux-Trembles	Adultes - Nouveautés	Terminus radieux :roman /Antoine Volodine.	4	2	https://nelligandecouverte.ville.montreal.qc.ca/iii/encore/record/C__Rb2467918?lang=frc
Bibliothèque de Pointe-aux-Trembles	Jeunes - BD	Les nombrils.1,Pour qui tu te prends? /[illustrations de] Delaf ; [texte de] Dubuc.	4	4	https://nelligandecouverte.ville.montreal.qc.ca/iii/encore/record/C__Rb1418076?lang=frc
Bibliothèque de Pointe-aux-Trembles	Jeunes - DVD	Les Schtroumpfs.2[enregistrement vidéo] =The Smurfs. 2 /directed by Raja Gosnell.	4	2	https://nelligandecouverte.ville.montreal.qc.ca/iii/encore/record/C__Rb2428798?lang=frc
Bibliothèque de Pointe-aux-Trembles	Jeunes - Premières lectures	Les amours de Lulu /texte, Lucie Papineau ; illustrations, Catherine Lepage.	4	4	https://nelligandecouverte.ville.montreal.qc.ca/iii/encore/record/C__Rb1317615?lang=frc
Bibliothèque de Pointe-aux-Trembles	Jeunes - DVD	Les avions[enregistrement vidéo] =Planes /réalisation, Klay Hall ; histoire de John Lasseter, Klay Hall, Jeffrey M. Howard ; scénario, Jeffrey M. Howard.	4	2	https://nelligandecouverte.ville.montreal.qc.ca/iii/encore/record/C__Rb2413924?lang=frc
Bibliothèque de Pointe-aux-Trembles	Jeunes - Albums carton (cartonnés)	Clic, crac-- c'est le loup? /Jean Maubille.	4	3	https://nelligandecouverte.ville.montreal.qc.ca/iii/encore/record/C__Rb1802216?lang=frc
Bibliothèque de Pointe-aux-Trembles	Adultes - Nouveautés	La veuve du boulanger :roman /Denis Monette.	4	3	https://nelligandecouverte.ville.montreal.qc.ca/iii/encore/record/C__Rb2466496?lang=frc
Bibliothèque de Pointe-aux-Trembles	Adultes - Documentaires	Essais :30 extraits et 6 essais /Montaigne ; édition présentée annotée et commentée par Jacques Vassevière.	4	1	https://nelligandecouverte.ville.montreal.qc.ca/iii/encore/record/C__Rb1583001?lang=frc
Bibliothèque de Pointe-aux-Trembles	Adultes - Documentaires	La lumière du monde /Christian Bobin ; paroles réveillées et recueillies par Lydie Dattas.	4	1	https://nelligandecouverte.ville.montreal.qc.ca/iii/encore/record/C__Rb1288841?lang=frc
Bibliothèque de Pointe-aux-Trembles	Adultes - Documentaires	Rendez-vous nomades /Sylvie Germain.	4	1	https://nelligandecouverte.ville.montreal.qc.ca/iii/encore/record/C__Rb2285682?lang=frc
Bibliothèque de Rivière-des-Prairies	Adultes - Cours de langue	L'anglais d'Amérique[ensemble multi-supports] /par David Applefield ; illustrations, J.-L. Goussé.	10	10	https://nelligandecouverte.ville.montreal.qc.ca/iii/encore/record/C__Rb1754566?lang=frc
Bibliothèque de Rivière-des-Prairies	Adultes - Cours de langue	L'espagnol d'aujourd'hui en 90 leçons[ensemble multi-supports] /María Jiménez et Justino Gracia Barrón.Titre de la couv.: L'espagnol d'aujourd'hui en 90 leçons et en 90 jours.	7	7	https://nelligandecouverte.ville.montreal.qc.ca/iii/encore/record/C__Rb1109479?lang=frc
Bibliothèque de Rivière-des-Prairies	Adultes - Documentaires	Relations des Jésuites [1611-1672]contenant ce qui s'est passé de plus remarquable dans les missions des Pères de la Compagnie de Jésus dans la Nouvelle-France.	6	6	https://nelligandecouverte.ville.montreal.qc.ca/iii/encore/record/C__Rb1164157?lang=frc
Bibliothèque de Rivière-des-Prairies	Jeunes - BD - Fiction	Max et Lili veulent être gentils /[texte de] Dominique de Saint Mars ; [illustrations de] Serge Bloch.	6	4	https://nelligandecouverte.ville.montreal.qc.ca/iii/encore/record/C__Rb2273577?lang=frc
Bibliothèque de Rivière-des-Prairies	Adultes - Documentaires	Scott 2014 standard postage stamp catalogue /editor, James E. Kloetzel.	6	6	https://nelligandecouverte.ville.montreal.qc.ca/iii/encore/record/C__Rb2388135?lang=frc
Bibliothèque de Rivière-des-Prairies	Jeunes - BD - Fiction	--taisez-vous! /Anne Guillard.	5	2	https://nelligandecouverte.ville.montreal.qc.ca/iii/encore/record/C__Rb2367617?lang=frc
Bibliothèque de Rivière-des-Prairies	Jeunes - BD - Fiction	Game over, the origins /scénario et dessin, Midam ; couleurs, Angèle et Madeline Feuillat.	5	3	https://nelligandecouverte.ville.montreal.qc.ca/iii/encore/record/C__Rb2396102?lang=frc
Bibliothèque de Rivière-des-Prairies	Jeunes - BD - Fiction	Lili est harcelée à l'école /[texte de] Dominique de Saint Mars ; [illustrations de] Serge Bloch.	5	3	https://nelligandecouverte.ville.montreal.qc.ca/iii/encore/record/C__Rb2318320?lang=frc
Bibliothèque de Rivière-des-Prairies	Jeunes - Romans ado 	Le journal d'Aurélie Laflamme.8,Les pieds sur terre /India Desjardins ; [illustrations, Josée Tellier].	5	5	https://nelligandecouverte.ville.montreal.qc.ca/iii/encore/record/C__Rb2254514?lang=frc
Bibliothèque de Rivière-des-Prairies	Jeunes - BD - Fiction	Waterminator /scénario et dessin, Midam.	4	4	https://nelligandecouverte.ville.montreal.qc.ca/iii/encore/record/C__Rb1289072?lang=frc
