Nom Bibliothèque	Secteur	Titre	Nombre de prêt	Nombre de document	Lien URL
Bibliothèque de La Petite-Patrie	Adultes - Disques compacts	Symphonies nos 5, 6, 7, 8, 10, 11 ,12, 15, Song for the forests[sound recording] /Shostakovitch.	5	5	https://nelligandecouverte.ville.montreal.qc.ca/iii/encore/record/C__Rb1513153?lang=frc
Bibliothèque de La Petite-Patrie	Adultes - DVD	Le bonheur des autres[enregistrement vidéo] =The happiness of others /scénario et réalisation, Jean-Philipe Pearson.	4	2	https://nelligandecouverte.ville.montreal.qc.ca/iii/encore/record/C__Rb2279877?lang=frc
Bibliothèque de La Petite-Patrie	Adultes - Nouveautés	Fanette.7,Honneur et disgrâce :roman /Suzanne Aubry.	4	3	https://nelligandecouverte.ville.montreal.qc.ca/iii/encore/record/C__Rb2450788?lang=frc
Bibliothèque de La Petite-Patrie	Jeunes - Aide aux devoirs	Tandem :deux compétences essentielles au primaire : français, production écrite, mathématique, résolution de problèmes, 1re[-6e] année /Françoise Tchou et Pierrette Tranquille ; illustration de l'intérieur, Michel Grant et Frédéric Fontaine.	4	6	https://nelligandecouverte.ville.montreal.qc.ca/iii/encore/record/C__Rb1837633?lang=frc
Bibliothèque de La Petite-Patrie	Jeunes - Aide aux devoirs	Plus de 30 tests pour se préparer et réussir!.Français /Colette Laberge.	4	6	https://nelligandecouverte.ville.montreal.qc.ca/iii/encore/record/C__Rb2251879?lang=frc
Bibliothèque de La Petite-Patrie	Adultes - Documentaires	Espagnol d'Amérique latine[ensemble multi-supports] :guide de conversation et dictionnaire /Berlitz ; [direction de la publication, Sheryl Olinsky Borg].	4	3	https://nelligandecouverte.ville.montreal.qc.ca/iii/encore/record/C__Rb1831637?lang=frc
Bibliothèque de La Petite-Patrie	Adultes - Nouveautés	À feu et à sang :roman /Françoise Bourdin.	4	2	https://nelligandecouverte.ville.montreal.qc.ca/iii/encore/record/C__Rb2449279?lang=frc
Bibliothèque de Rosemont	Jeunes - Jeux	Croque-carotte[jeu] :5 à 99 ans, 2 à 4 joueurs	16	1	https://nelligandecouverte.ville.montreal.qc.ca/iii/encore/record/C__Rb1289644?lang=frc
Bibliothèque de Rosemont	Jeunes - DVD	Calimero.Le dinosaure de l'île rose[enregistrement vidéo].	9	4	https://nelligandecouverte.ville.montreal.qc.ca/iii/encore/record/C__Rb2365337?lang=frc
Bibliothèque de Rosemont	Adultes - Documentaires	Guide de la route /[publication réalisée par la Société de l'assurance automobile du Québec].	8	14	https://nelligandecouverte.ville.montreal.qc.ca/iii/encore/record/C__Rb2448995?lang=frc
Bibliothèque de Rosemont	Adultes - CD-ROM	Instant immersion, 33 languages[ressource électronique] :the ultimate in multi-language learning from Arabic to Zulu!	6	17	https://nelligandecouverte.ville.montreal.qc.ca/iii/encore/record/C__Rb1380564?lang=frc
Bibliothèque de Rosemont	Adultes - DVD - Nouveautés	Ripoux.3[enregistrement vidéo] /réalisation, Claude Zidi ; scénario, Claude Zidi, Simon Mickaël, Didier Kaminka.	5	2	https://nelligandecouverte.ville.montreal.qc.ca/iii/encore/record/C__Rb2460788?lang=frc
Bibliothèque de Rosemont	Adultes - Documentaires	New french with ease[kit] /by Anthony Bulger ; with the editorial assistance of Jean-Loup Chérel ; illustrated by Jean-Louis Goussé.	5	5	https://nelligandecouverte.ville.montreal.qc.ca/iii/encore/record/C__Rb1320630?lang=frc
Bibliothèque de Rosemont	Adultes - DVD - Nouveautés	Maintenant, c'est ma vie[enregistrement vidéo] =How I live now /réalisation, Kevin Macdonald ; scénario, Jeremy Brock, Penelope Skinner et Tony Grisoni.	5	1	https://nelligandecouverte.ville.montreal.qc.ca/iii/encore/record/C__Rb2448616?lang=frc
Bibliothèque de Rosemont	Adultes - DVD	P.-S.- Je t'aime[enregistrement vidéo] =P.S. I love you /réalisation, Richard LaGravenese ; scénario, Richard LaGravenese, Steven Rogers.	5	2	https://nelligandecouverte.ville.montreal.qc.ca/iii/encore/record/C__Rb1599024?lang=frc
Bibliothèque de Rosemont	Jeunes - DVD	Fanfreluche me raconte--[enregistrement vidéo].	5	13	https://nelligandecouverte.ville.montreal.qc.ca/iii/encore/record/C__Rb1395168?lang=frc
Bibliothèque de Rosemont	Jeunes - Jeux	Coco crazy![jeu].	5	1	https://nelligandecouverte.ville.montreal.qc.ca/iii/encore/record/C__Rb1952456?lang=frc
Bibliothèque de Rosemont	Adultes - DVD	Yoga relaxation[enregistrement vidéo] /avec Lyne St-Roch.	5	3	https://nelligandecouverte.ville.montreal.qc.ca/iii/encore/record/C__Rb1394917?lang=frc
Bibliothèque de Rosemont	Adultes - Documentaires	L'anglais[ensemble multi-supports] /par Anthony Bulger ; illustrations de J.-L. Goussé.	5	15	https://nelligandecouverte.ville.montreal.qc.ca/iii/encore/record/C__Rb1346786?lang=frc
Bibliothèque de Rosemont	Jeunes - BD	Quelle chouchoute! /dessins, William ; scénario, Cazenove & William.	5	6	https://nelligandecouverte.ville.montreal.qc.ca/iii/encore/record/C__Rb2067970?lang=frc
Bibliothèque de Rosemont	Adultes - DVD - Nouveautés	L'autre maison[enregistrement vidéo] =Another house /réalisation, Mathieu Roy ; scénario, Mathieu Roy, Michael Ramsey.	5	3	https://nelligandecouverte.ville.montreal.qc.ca/iii/encore/record/C__Rb2429537?lang=frc
Bibliothèque de Rosemont	Jeunes - DVD	Histoire de jouets2[enregistrement vidéo] =Toy story2 /direction, John Lasseter, Lee Unkrich, Ash Brannon ; screenplay, Andrew Stanton ... [et al.].	5	2	https://nelligandecouverte.ville.montreal.qc.ca/iii/encore/record/C__Rb1834680?lang=frc
Bibliothèque de Rosemont	Adultes - Documentaires	Conduire un véhicule de promenade /[publication réalisée par la Société de l'assurance automobile du Québec ; recherche et rédaction, Michèle Jean et Micheline Briand avec la collaboration de Diane Hamel... et al.]	5	18	https://nelligandecouverte.ville.montreal.qc.ca/iii/encore/record/C__Rb1427841?lang=frc
Bibliothèque de Rosemont	Jeunes - DVD - Nouveautés	Cendrillon[enregistrement vidéo] =Cinderella /réalisation, Wilfred Jackson, Hamilton Luske, Clyde Geronimi ; scénario, Bill Peed ... [et al.].	5	2	https://nelligandecouverte.ville.montreal.qc.ca/iii/encore/record/C__Rb2453189?lang=frc
Bibliothèque de Rosemont	Jeunes - Nouveautés	Kurogane girl & the alpaca prince.1 /Kokoro Natsume ; [traduction de Julie Gerriet].	5	2	https://nelligandecouverte.ville.montreal.qc.ca/iii/encore/record/C__Rb2468208?lang=frc
Bibliothèque de Rosemont	Adultes - Romans	Concerto à la mémoire d'un ange :[nouvelles] /Éric-Emmanuel Schmitt.	5	3	https://nelligandecouverte.ville.montreal.qc.ca/iii/encore/record/C__Rb1924304?lang=frc
Bibliothèque de Rosemont	Jeunes - BD	Un air de famille /dessins, William ; scénario, Cazenove & William.	5	5	https://nelligandecouverte.ville.montreal.qc.ca/iii/encore/record/C__Rb1586374?lang=frc
Bibliothèque Marc-Favreau	Adultes - DVD - Coffret	Basic instinct[videorecording] :director's cut /written by Joe Eszterhas ; directed by Paul Verhoeven.	18	1	https://nelligandecouverte.ville.montreal.qc.ca/iii/encore/record/C__Rb2273501?lang=frc
Bibliothèque Marc-Favreau	Adultes - Tablettes numériques	Tablette iPad [Marc-Favreau]	13	18	https://nelligandecouverte.ville.montreal.qc.ca/iii/encore/record/C__Rb2433402?lang=frc
Bibliothèque Marc-Favreau	Adultes - Romans	Une relation dangereuse /Douglas Kennedy ; traduit de l'américain par Bernard Cohen.	13	1	https://nelligandecouverte.ville.montreal.qc.ca/iii/encore/record/C__Rb1346813?lang=frc
Bibliothèque Marc-Favreau	Jeunes - BD	Dark, j'adore! /scénario et dessin, Midam.	6	4	https://nelligandecouverte.ville.montreal.qc.ca/iii/encore/record/C__Rb1396165?lang=frc
Bibliothèque Marc-Favreau	Jeunes - Jeux vidéo sur console	New super Mario Bros. U[ressource électronique (Wii U)].	6	5	https://nelligandecouverte.ville.montreal.qc.ca/iii/encore/record/C__Rb2369052?lang=frc
Bibliothèque Marc-Favreau	Jeunes - Documentaires - Livres d'images	Les saisons /illustré par Rémi Saillard ; écrit par Agnès Vandewiele.	6	9	https://nelligandecouverte.ville.montreal.qc.ca/iii/encore/record/C__Rb1399871?lang=frc
Bibliothèque Marc-Favreau	Jeunes - BD	Waterminator /scénario et dessin, Midam.	6	4	https://nelligandecouverte.ville.montreal.qc.ca/iii/encore/record/C__Rb1289072?lang=frc
Bibliothèque Marc-Favreau	Adultes - Jeux vidéo sur console	The legend of Zelda.Twilight princess[ressource électronique (Wii)].	6	3	https://nelligandecouverte.ville.montreal.qc.ca/iii/encore/record/C__Rb2270104?lang=frc
Bibliothèque Marc-Favreau	Jeunes - Jeux vidéo sur console	Super Mario galaxy[ressource électronique (Wii)].	6	4	https://nelligandecouverte.ville.montreal.qc.ca/iii/encore/record/C__Rb2111864?lang=frc
Bibliothèque Marc-Favreau	Adultes - Documentaires	Jour de souffrance :récit /Catherine Millet.	6	3	https://nelligandecouverte.ville.montreal.qc.ca/iii/encore/record/C__Rb1745913?lang=frc
Bibliothèque Marc-Favreau	Jeunes - DVD	Stella et Sacha.Une descente de rivière[enregistrement vidéo] =Stella and Sam.River ride /réalisation, Raymond Jafelice, David Merritt ; scénario, Robert Ardiel.	5	3	https://nelligandecouverte.ville.montreal.qc.ca/iii/encore/record/C__Rb2408990?lang=frc
Bibliothèque Marc-Favreau	Jeunes - DVD	Histoire de jouets.Angoisse au motel[enregistrement vidéo] =Toy story of terror! /scénario et réalisation, Angus MacLane.	5	2	https://nelligandecouverte.ville.montreal.qc.ca/iii/encore/record/C__Rb2466906?lang=frc
Bibliothèque Marc-Favreau	Jeunes - DVD	Épique[enregistrement vidéo] =Epic /réalisation, Chris Wedge ; scénario, James V. Hart ... [et al.].	5	2	https://nelligandecouverte.ville.montreal.qc.ca/iii/encore/record/C__Rb2413734?lang=frc
Bibliothèque Marc-Favreau	Jeunes - BD	Les légendaires.7,Aube et crépuscule /Patrick Sobral.	5	4	https://nelligandecouverte.ville.montreal.qc.ca/iii/encore/record/C__Rb1432955?lang=frc
Bibliothèque Marc-Favreau	Adultes - DVD	Double identité[enregistrement vidéo] =Face/Off /scénario, Mike Werb et Michael Colleary ; réalisé par John Woo.	5	1	https://nelligandecouverte.ville.montreal.qc.ca/iii/encore/record/C__Rb2337658?lang=frc
Bibliothèque Marc-Favreau	Jeunes - DVD	Aventures à Zambézie[enregistrement vidéo] =Adventures in Zambezia /réalisation, Wayne Thornley ; scénario, Andrew Cook ... [et al.].	5	2	https://nelligandecouverte.ville.montreal.qc.ca/iii/encore/record/C__Rb2408866?lang=frc
Bibliothèque Marc-Favreau	Jeunes - DVD	La fée pirate[enregistrement vidéo] =The pirate fairy /réalisation, Peggy Holmes.	5	2	https://nelligandecouverte.ville.montreal.qc.ca/iii/encore/record/C__Rb2449640?lang=frc
Bibliothèque Marc-Favreau	Jeunes - BD	Les légendaires.4,Le réveil du Kréa-Kaos /Patrick Sobral	5	4	https://nelligandecouverte.ville.montreal.qc.ca/iii/encore/record/C__Rb1414019?lang=frc
Bibliothèque Marc-Favreau	Adultes - DVD	Gabrielle[enregistrement vidéo] /scénario et réalisation, Louise Archambault.	5	2	https://nelligandecouverte.ville.montreal.qc.ca/iii/encore/record/C__Rb2433162?lang=frc
Bibliothèque Marc-Favreau	Jeunes - Documentaires	Dauphins, baleines et cachalots /Éric Demay.	5	5	https://nelligandecouverte.ville.montreal.qc.ca/iii/encore/record/C__Rb1606833?lang=frc
Bibliothèque du Vieux-Saint-Laurent	Adultes - DVD / Blu-Ray	Star wars, the complete saga[enregistrement vidéo] =Star wars, l'intégrale de la saga.	12	6	https://nelligandecouverte.ville.montreal.qc.ca/iii/encore/record/C__Rb2270425?lang=frc
Bibliothèque du Vieux-Saint-Laurent	Jeunes - DVD / Blu-Ray	Le réveil des gardiens[enregistrement vidéo] =Rise of the guardians /réalisation, Peter Ramsey ; scénario, David Lindsay-Abaire.	8	4	https://nelligandecouverte.ville.montreal.qc.ca/iii/encore/record/C__Rb2384896?lang=frc
Bibliothèque du Vieux-Saint-Laurent	Adultes - Documentaires	Guide de la route /[recherche et rédaction de la mise à jour, Sandra Gauthier avec la collaboration du personnel du Service des usagers de la route ; réalisé par la Société de l'assurance automobile du Québec en collaboration avec le Service de l'exploitation du Ministère des transports ; illustrations, Jean-Michel Girard].	8	14	https://nelligandecouverte.ville.montreal.qc.ca/iii/encore/record/C__Rb1821505?lang=frc
Bibliothèque du Vieux-Saint-Laurent	Adultes - Documentaires	Guide de la route /[publication réalisée par la Société de l'assurance automobile du Québec].	7	10	https://nelligandecouverte.ville.montreal.qc.ca/iii/encore/record/C__Rb2448995?lang=frc
Bibliothèque du Vieux-Saint-Laurent	Adultes - Documentaires	Driving a passenger vehicle /[publication prepared by the Société de l'assurance automobile du Québec ; researched and written by Michèle Jean and Micheline Briand with the cooperation of Diane Hamel ... et al. ; English translation, Elizabeth Doyle].	7	16	https://nelligandecouverte.ville.montreal.qc.ca/iii/encore/record/C__Rb1435747?lang=frc
Bibliothèque du Vieux-Saint-Laurent	Adultes - Documentaires	Driver's handbook /[prepared by the Société de l'assurance automobile du Québec ; updated version researched and written by personnel in the Vice présidence à la sécurité routière ;  collaboration with the Ministère des Transports du Québec ; project coordination, Guillaume Beaurivage ; illustrations, Jean-Michel Girard ; updated translation, Donya Gulak, Sarah Lefebvre].	6	10	https://nelligandecouverte.ville.montreal.qc.ca/iii/encore/record/C__Rb2449207?lang=frc
Bibliothèque du Vieux-Saint-Laurent	Jeunes - DVD / Blu-Ray	L'ère de glace.La fonte[enregistrement vidéo] =Ice age.The meltdown /réalisation, Carlos Saldanha ; scénario, Peter Gaulke, Gerry Swallow, Jim Hecht.	6	3	https://nelligandecouverte.ville.montreal.qc.ca/iii/encore/record/C__Rb1491209?lang=frc
Bibliothèque du Vieux-Saint-Laurent	Jeunes - DVD / Blu-Ray	L'ère de glace.La dérive des continents[enregistrement vidéo] =Ice age.Continental drift /réalisation, Steve Martino, Michael Thurmeier ; scénario, Michael Berg, Jason Fuchs.	6	4	https://nelligandecouverte.ville.montreal.qc.ca/iii/encore/record/C__Rb2364682?lang=frc
Bibliothèque du Vieux-Saint-Laurent	Adultes - Documentaires	Driver's handbook /[prepared by the Société de l'assurance automobile du Québec in cooperation with the Service de l'exploitation of Transport Québec ; researched and written by Sandra Gauthier with the cooperation of Service des usagers de la route ; English translation, Elizabeth Doyle].	5	16	https://nelligandecouverte.ville.montreal.qc.ca/iii/encore/record/C__Rb1821723?lang=frc
Bibliothèque du Vieux-Saint-Laurent	Jeunes - BD	Princesse Sakura.12 /Arina Tanemura ; [traduction, Marie-Saskia Raynal].	5	2	https://nelligandecouverte.ville.montreal.qc.ca/iii/encore/record/C__Rb2422565?lang=frc
Bibliothèque du Vieux-Saint-Laurent	Jeunes - DVD / Blu-Ray	Let's learn.1,2,3s[videorecording] /Nickelodeon.	5	5	https://nelligandecouverte.ville.montreal.qc.ca/iii/encore/record/C__Rb2381003?lang=frc
Bibliothèque du Vieux-Saint-Laurent	Jeunes - BD	Les légendaires.15,Amour mortel /Patrick Sobral.	5	3	https://nelligandecouverte.ville.montreal.qc.ca/iii/encore/record/C__Rb2361786?lang=frc
Bibliothèque du Vieux-Saint-Laurent	Jeunes - DVD / Blu-Ray	L'élève Ducobu[enregistrement vidéo] /réalisation, Philippe de Chauveron ; scénario, Philippe de Chauveron, Marc de Chauveron.	5	2	https://nelligandecouverte.ville.montreal.qc.ca/iii/encore/record/C__Rb2314049?lang=frc
Bibliothèque du Vieux-Saint-Laurent	Jeunes - DVD / Blu-Ray	Les Schtroumpfs[enregistrement vidéo] =The Smurfs /réalisation, Raja Gosnell ; histoire, J. David Stem, David N. Weiss ; scénario, J. David Stem ... [et al.].	5	3	https://nelligandecouverte.ville.montreal.qc.ca/iii/encore/record/C__Rb2274179?lang=frc
Bibliothèque du Vieux-Saint-Laurent	Jeunes - DVD / Blu-Ray	Le vieil homme et la mer[enregistrement vidéo] =The old man and the sea /scénario et réalisation, Aleksandr Petrov.	5	2	https://nelligandecouverte.ville.montreal.qc.ca/iii/encore/record/C__Rb1455582?lang=frc
Bibliothèque du Vieux-Saint-Laurent	Adultes - DVD / Blu-Ray	Les monuments men[enregistrement vidéo] =The monuments men /réalisation, George Clooney ; scénario, George Clooney, Grant Heslov.	5	1	https://nelligandecouverte.ville.montreal.qc.ca/iii/encore/record/C__Rb2455094?lang=frc
Bibliothèque du Vieux-Saint-Laurent	Adultes - DVD / Blu-Ray	Hunger games[enregistrement vidéo] :l'embrasement = The Hunger games : catching fire /réalisation, Francis Lawrence ; scénario, Simon Beaufoy, Michael de Bruyn.	5	2	https://nelligandecouverte.ville.montreal.qc.ca/iii/encore/record/C__Rb2440675?lang=frc
Bibliothèque du Vieux-Saint-Laurent	Jeunes - DVD / Blu-Ray	Chat perché[enregistrement vidéo] =Out on a limb /réalisation, Philippe Vidal ; développé par Philippe Vidal, Robert Réa, Steve Balissat.	5	3	https://nelligandecouverte.ville.montreal.qc.ca/iii/encore/record/C__Rb2412595?lang=frc
Bibliothèque du Vieux-Saint-Laurent	Adultes - Documentaires	Conduire un véhicule de promenade /[publication réalisée par la Société de l'assurance automobile du Québec ; recherche et rédaction, Michèle Jean et Micheline Briand avec la collaboration de Diane Hamel... et al.]	5	15	https://nelligandecouverte.ville.montreal.qc.ca/iii/encore/record/C__Rb1427841?lang=frc
Bibliothèque du Vieux-Saint-Laurent	Jeunes - DVD / Blu-Ray	La planète au trésor[enregistrement vidéo] =Treasure planet /réalisation, John Musker, Ron Clements ; scénario, John Musker, Ron Clements, Rob Edwards.	5	3	https://nelligandecouverte.ville.montreal.qc.ca/iii/encore/record/C__Rb2344103?lang=frc
Bibliothèque du Boisé	Adultes - Tablettes numériques	Tablette iPad [Du Boisé]	207	12	https://nelligandecouverte.ville.montreal.qc.ca/iii/encore/record/C__Rb2415133?lang=frc
Bibliothèque du Boisé	Jeunes - Aide aux devoirs	Pas de problème!.Mathématique, 1re[-6e] année : exercices de résolution de problèmes : 1er[-3e] cycle /Pierrette Tranquille, Françoise Tchou ; [illustrations, Michel Grant].	14	23	https://nelligandecouverte.ville.montreal.qc.ca/iii/encore/record/C__Rb1409837?lang=frc
Bibliothèque du Boisé	Jeunes - Aide aux devoirs	Je lis et je comprends :cahier de compréhension de lecture /Lucie Rivest ; collaboration, Hélène Morasse ; [illustrations, Hélène Lafond].	9	12	https://nelligandecouverte.ville.montreal.qc.ca/iii/encore/record/C__Rb1983920?lang=frc
Bibliothèque du Boisé	Adultes - Documentaires	Driver's handbook /[prepared by the Société de l'assurance automobile du Québec ; updated version researched and written by personnel in the Vice présidence à la sécurité routière ;  collaboration with the Ministère des Transports du Québec ; project coordination, Guillaume Beaurivage ; illustrations, Jean-Michel Girard ; updated translation, Donya Gulak, Sarah Lefebvre].	8	9	https://nelligandecouverte.ville.montreal.qc.ca/iii/encore/record/C__Rb2449207?lang=frc
Bibliothèque du Boisé	Tout-petits - DVD / Blu-Ray	Care-Bears.Super Cuddly[videorecording].	8	12	https://nelligandecouverte.ville.montreal.qc.ca/iii/encore/record/C__Rb2313939?lang=frc
Bibliothèque du Boisé	Jeunes - Romans enfants	Ma boîte à histoires /[texte de] Susie Morgenstern ; [illustrations de] Delphine Mach, Christine Roussey, Fabrice Turrier.	8	9	https://nelligandecouverte.ville.montreal.qc.ca/iii/encore/record/C__Rb1771408?lang=frc
Bibliothèque du Boisé	Adultes - Jeux vidéo sur console	FIFA world cup Brazil[ressource électronique (PlayStation 3)]	7	2	https://nelligandecouverte.ville.montreal.qc.ca/iii/encore/record/C__Rb2453984?lang=frc
Bibliothèque du Boisé	Adultes - Collection multilingue	When I feel angry	7	7	https://nelligandecouverte.ville.montreal.qc.ca/iii/encore/record/C__Rb2342390?lang=frc
Bibliothèque du Boisé	Adultes - Collection multilingue	Er tong shi wan ge wei shen me	6	3	https://nelligandecouverte.ville.montreal.qc.ca/iii/encore/record/C__Rb2458079?lang=frc
Bibliothèque du Boisé	Adultes - Documentaires	Conduire un véhicule de promenade /[publication réalisée par la Société de l'assurance automobile du Québec ; recherche et rédaction, Michèle Jean et Micheline Briand avec la collaboration de Diane Hamel... et al.]	6	9	https://nelligandecouverte.ville.montreal.qc.ca/iii/encore/record/C__Rb1427841?lang=frc
Bibliothèque du Boisé	Jeunes - Documentaires - Livres d'images	Max et Lili veulent des câlins /Dominique de Saint Mars ; [illustrations de] Serge Bloch.	6	3	https://nelligandecouverte.ville.montreal.qc.ca/iii/encore/record/C__Rb1239562?lang=frc
Bibliothèque du Boisé	Jeunes - Documentaires - Livres d'images	Lili veut un petit chat /Dominique de Saint Mars ; [illustrations de] Serge Bloch ; [inspiré par Astrapi].	6	3	https://nelligandecouverte.ville.montreal.qc.ca/iii/encore/record/C__Rb1286656?lang=frc
Bibliothèque du Boisé	Jeunes - Romans	Les vertes de Sydney /[illustrations de] Maxim Cyr & [texte de] Karine Gottot.	6	3	https://nelligandecouverte.ville.montreal.qc.ca/iii/encore/record/C__Rb2183886?lang=frc
Bibliothèque du Boisé	Jeunes - Aide aux devoirs	Croque-anglais /Suzanne Fournier, Charles Côté.	5	5	https://nelligandecouverte.ville.montreal.qc.ca/iii/encore/record/C__Rb1803929?lang=frc
Bibliothèque du Boisé	Jeunes - Documentaires - Livres d'images	Max aime les monstres /[texte de] Dominique de Saint Mars ; [illustrations de] Serge Bloch.	5	3	https://nelligandecouverte.ville.montreal.qc.ca/iii/encore/record/C__Rb1429287?lang=frc
Bibliothèque du Boisé	Jeunes - Documentaires - Livres d'images	Max veut se faire des amis /[texte de] Dominique de Saint Mars ; [illustrations de] Serge Bloch.	5	3	https://nelligandecouverte.ville.montreal.qc.ca/iii/encore/record/C__Rb1210208?lang=frc
Bibliothèque du Boisé	Tout-petits - DVD / Blu-Ray	Georges le petit curieux.2,Suivez ce singe[enregistrement vidéo] =Curious George.2,Follow that monkey /réalisation, Norton Virgien ; scénario, Chuck Tately.	5	2	https://nelligandecouverte.ville.montreal.qc.ca/iii/encore/record/C__Rb1932919?lang=frc
Bibliothèque du Boisé	Tout-petits - DVD / Blu-Ray	Pilotes et copilotes[enregistrement vidéo].	5	2	https://nelligandecouverte.ville.montreal.qc.ca/iii/encore/record/C__Rb2184106?lang=frc
Bibliothèque du Boisé	Jeunes - Documentaires - Livres d'images	Jérémy est maltraité /[texte de] Dominique de Saint Mars ; [illustrations de] Serge Bloch ; [inspiré par Astrapi].	5	3	https://nelligandecouverte.ville.montreal.qc.ca/iii/encore/record/C__Rb1222539?lang=frc
Bibliothèque du Boisé	Jeunes - DVD / Blu-Ray	La petite sirène[enregistrement vidéo] =The little mermaid /réalisation et scénario, John Musker, Ron Clements.	5	2	https://nelligandecouverte.ville.montreal.qc.ca/iii/encore/record/C__Rb2430219?lang=frc
Bibliothèque de Pointe-aux-Trembles	Adultes - Romans québécois	Les héritiers du fleuve.1,1887-1893 /Louise Tremblay-D'Essiambre.	11	11	https://nelligandecouverte.ville.montreal.qc.ca/iii/encore/record/C__Rb2404543?lang=frc
Bibliothèque de Pointe-aux-Trembles	Adultes - Nouveautés	Les héritiers du fleuve.3,1918-1929 /Louise Tremblay-D'Essiambre.	10	9	https://nelligandecouverte.ville.montreal.qc.ca/iii/encore/record/C__Rb2441946?lang=frc
Bibliothèque de Pointe-aux-Trembles	Adultes - Romans québécois	Les héritiers du fleuve.2,1898-1914 /Louise Tremblay-D'Essiambre.	9	9	https://nelligandecouverte.ville.montreal.qc.ca/iii/encore/record/C__Rb2410973?lang=frc
Bibliothèque de Pointe-aux-Trembles	Adultes - Nouveautés	Malphas.4,Grande liquidation /Patrick Senécal.	5	3	https://nelligandecouverte.ville.montreal.qc.ca/iii/encore/record/C__Rb2467018?lang=frc
Bibliothèque de Pointe-aux-Trembles	Adultes - Romans québécois	Souvenirs de la banlieue.6,Les jumeaux /Rosette Laberge.	5	4	https://nelligandecouverte.ville.montreal.qc.ca/iii/encore/record/C__Rb2419126?lang=frc
Bibliothèque de Pointe-aux-Trembles	Jeunes - BD	Les Simpson.La cabane des horreurs.2,Hoodoo voodoo brouhaha /[d'après des personnages créés par Matt Groening] ; scénario & dessin, Ty Templeton.	5	2	https://nelligandecouverte.ville.montreal.qc.ca/iii/encore/record/C__Rb1987011?lang=frc
Bibliothèque de Pointe-aux-Trembles	Jeunes - Mangas	One Piece.5,Pour qui sonne le glas /Eiichirô Oda ; [traduction, Sylvain Chollet].	5	1	https://nelligandecouverte.ville.montreal.qc.ca/iii/encore/record/C__Rb1332316?lang=frc
Bibliothèque de Pointe-aux-Trembles	Adultes - Nouveautés	Les héritiers du fleuve.4,1931-1939 /Louise Tremblay-D'Essiambre.	5	4	https://nelligandecouverte.ville.montreal.qc.ca/iii/encore/record/C__Rb2476200?lang=frc
Bibliothèque de Pointe-aux-Trembles	Jeunes - Mangas	One Piece.11,Le pire brigand de tout East-Blue /Eiichirô Oda ; [traduction, Sylvain Chollet].	5	2	https://nelligandecouverte.ville.montreal.qc.ca/iii/encore/record/C__Rb1611043?lang=frc
Bibliothèque de Pointe-aux-Trembles	Jeunes - Mangas	One Piece.6,La grande promesse /Eiichirô Oda ; [traduction, Sylvain Chollet].	5	2	https://nelligandecouverte.ville.montreal.qc.ca/iii/encore/record/C__Rb1332315?lang=frc
Bibliothèque de Pointe-aux-Trembles	Adultes - Romans	Fifty shades.1,Cinquante nuances de Grey :roman /E. L. James ; traduit de l'anglais par Denyse Beaulieu.	4	4	https://nelligandecouverte.ville.montreal.qc.ca/iii/encore/record/C__Rb2339552?lang=frc
Bibliothèque de Pointe-aux-Trembles	Jeunes - DVD	Monsieur Petit[enregistrement vidéo] /une production de Claude Berthier, d'après les personnages créés par Roger Hargreaves.	4	1	https://nelligandecouverte.ville.montreal.qc.ca/iii/encore/record/C__Rb2359241?lang=frc
Bibliothèque de Pointe-aux-Trembles	Adultes - Nouveautés	Fanette.7,Honneur et disgrâce :roman /Suzanne Aubry.	4	3	https://nelligandecouverte.ville.montreal.qc.ca/iii/encore/record/C__Rb2450788?lang=frc
Bibliothèque de Pointe-aux-Trembles	Jeunes - DVD	Les Schtroumpfs.2[enregistrement vidéo] =The Smurfs. 2 /directed by Raja Gosnell.	4	2	https://nelligandecouverte.ville.montreal.qc.ca/iii/encore/record/C__Rb2428798?lang=frc
