"annee","no-demande","description","participants","montant-net"
"2014","1312339","Soirée bénéfice - École primaire Terry Fox","D. De Cotis, R. Adams, J. Frédéric-Gauthier, G. Dumas, R. Khalil","175"
"2014","1310558","Événement bénéfice - Fondation Sir Wilfrid Laurier","V. Dufour, N. Borne, D. Hébert, V. Karidogiannis, R. Khalil","2250"
"2014","1313067","Soirée bénéfice - Hillcrest Academy Home & School Association","R. Adams, V. Karidogiannis, ","50"
"2014","1318145","Soirée Gala Dunamis - Chambre de Commerce et d'industrie de Laval","D. De Cotis, S. Desmeules, R. Adams, V. Dufour, C. Yoakim, G. Dumas, N. Borne, P. Anthian, V. Karidogiannis, Directeur cabinet du maire","1866,79"
"2014","1321392","Conférence Midi - Chambre de Commerce et d'industrie de Laval","10 billets non identifiés","484,85"
"2014","1317939","Soirée bénéfice - Lis avec moi","R. Adams,","125"
"2014","1316716","Activité de financement - Table de concertation de Laval en condition féminine","S. Desmeules, V. Dufour, A. Dib, J. Frédéric-Gauthier, C. Yoakim","125"
"2014","1319155","Soirée bénéfice - Théatre Bluff ","R. Adams, A. Dib","300"
"2014","1320577","Soirée bénéfice - Fondation du Centre Jeunesse de Laval","D. Hébert","150"
"2014","1320652","Soirée bénéfice - Oasis unite mobile d intervention","R. Adams","80"
"2014","1326484","Soirée bénéfice - Fondation scolaire de Laval","M. Demers, V. Dufour","500"
"2014","1343238","Soirée bénéfice - 5e Symposium sur les arts et la surdité de l'Association des Personnes Vivant avec une Surdité de Laval (APVSL)","R. Adams","100"
"2014","1340498","Déjeuner bénéfice - Club des petits dejeuners du Québec","D. De Cotis, S. Desmeules, R. Adams, V. Dufour, C. Yoakim, N. Borne, J. Coupal, A. Dib, G. Dumas, D. Hébert, V. Karidogiannis","1375"
"2014","1342017","Activité de financement - Société Canadienne du cancer","M. Demers, D. De Cotis, S. Desmeules, C. Yoakim, J. Coupal, G. Dumas, J. Frédéric-Gauthier, D. Hébert, R. Khalil, attachée politique","2250"
"2014","1335331","Pour assister aux assmblées du Conseil des villes de Trois-Rivières, Longueuil, Gatineau, Sherbrooke et Terrebonne.","C. Yoakim, consseile spécial du cabinet du maire","817,38"
"2014","1339719","Diner régimentaire mixte - 4e Bataillon du 22e Royal Régiment","S. Desmeules, G. Dumas","170"
"2014","1314082","Caucus des maires des grandes villes de la Fédération canadienne des municipalités les 25 et 26 février 2014 à Ottawa","M. demers","457,47"
"2014","1315874","Participation de MM. Marc Demers, maire, au Sommet sur le milieu municipal 2014 de l'UMQ, les 20 et 21 mars 2014 à Québec. ","M. demers","452,11"
"2014","1319207","Colloque 2014 «Big Data et Open Data au coeur de la ville intelligente» de l'ITIS (Institut technologies de l'information et Sociétés) qui aura lieu le 29 avril 2014, à Québec ","V. Dufour","527,19"
"2014","1322677","CT1322677 - Frais afférents : hébergements, repas, déplacements,etc. des 11 élus dans le cadre des Assises annuelles de l'UMQ du 20 au 25 mai 2014 à Lac Leamy, Gatineau ","M. Demers, D. De Cotis, R. Adams, S. Desmeules, V. Dufour, P. Anthian, N. Borne, G. Dumas, J. Frédéric-Gauthier, P. Galati, J. St-Jean, 3 membres du cabinet du maire","19064,3"
"2014","1324851","Participation de Mme Sandra Desmeules au Congrès annuel de la Fédération canadienne des municipalités du 28 mai au 2 juin 2014 à Niagara Falls, Ont. ","S. Desmeules","2692,51"
"2014","1332720","Participation de Mme Sandra Desmeules au conseil d'administration de la FCM qui aura lieu du 3 au 7 septembre 2014 à Saguenay. ","S. Desmeules","1082,62"
"2014","1334733","Inscription de M. Raynald Adams -15e Conférence annuelle du loisir municipal de l'Association québécoise du loisir municipal, le 9 octobre 2014, à Victoriaville","R. Adams","344,1"
"2014","1335677","Colloque des Entretiens Jacques Cartier: Intégration urbanisme/transport et mobilité: nouveaux projets, nouveaux outils, de l'AMT, les 6 et 7 octobre 2014, à Montréal ","V. Dufour","225,51"
"2014","1337119","Colloque des Entretiens Jacques Cartier: Intégration urbanisme / transport et mobilité: nouveaux projets, nouveaux outils, de l'AMT, qui se tiendra les 6 et 7 octobre 2014, à Montréal. ","D. Hébert","261,59"
"2014","1337121","Conférence canadienne sur la forêt urbaine, du 30 septembre au 3 octobre 2014, à Victoria, Colombie Britannique. ","V. Dufour","2310,07"
"2014","1338982","Inscription de M. Daniel Hébert - Journée de formation de l'Association québécoise d'urbanisme, les 24 et 25 octobre 2014, à Granby","D. Hébert","546,17"
"2014","1339705","Frais afférents de Mme Virginie Dufour - Forum 2014 - La rivière au coeur de nos villes - Fondation des lacs et rivières du Canada - les 15 et 16 octobre 2014, à Drummondville ","V. Dufour","239,19"
"2014","1340135","Participation de Mme Christiane Yoakim - Colloque Parce que l'avenir nous habite du Réseau québécois des OSBL d'habitation - les 23 et 24 octobre 2014, à Montréal ","C. Yoakim","138"
"2014","1340240","Colloque Vertech et Forum du développement durable du 4 au 7 novembre 2014 à Victoriaville ","V. Dufour","990,59"
"2014","1340394","Conseil d'administration de la Fédération canadienne des municipalités (FCM) du 18 au 21 novembre 2014 à Ottawa ","S. Desmeules","1075,43"
"2014","1342062","Frais d'inscription de Mme Virginie Dufour - Dévoilement officiel 2014 des Fleurons du Québec, le 30 octobre 2014","V. Dufour","129,64"
"2014","1332407","Formation individuelle sur la présidence de l'Institut sur la gouvernance d'organisations privées et publiques (16/09) pour M. David De Cotis, vice-président du Comité exécutif","D. De Cotis","2500"
"2014","1315479","Soirée-bénéfice de la Fondation de l'école alternative Le Baluchon(25/04)","V.Dufour","75"
"2015","1350357","Achat de 2 billets Cocktail de bienvenue 2015 (15 janvier 2015) Chambre de commerce et d'industrie de Laval","D. De Cotis, R. Khalil","52,49"
"2015","1347177","1 billet Souper hommage - La Fondation Culture et  Arts Visuels de Laval - le 21 novembre 2014","V. Dufour","100"
"2015","1352626","Achat d'un billet pour M. David De Cotis au déjeuner bénéfice de Transport 2000 Québec, le 9 février 2015","D. De Cotis","150"
"2015","1356419","Soirée bénéfice au profit de l'Association de Laval pour la déficience intellectuelle inc., le 8 mars 2015","R. Adams","100"
"2015","1356832","Achat de 7 billets pour les élus municipaux - Gala Dunamis de la Chambre de commerce et d'industrie de Laval, le 1er avril 2015","D. De Cotis, V. Dufour, C. Yoakim, G. Dumas, J. Frédéric-Gauthier, D. Hébert, R. Khalil","1396,34"
"2015","1356557","Achat d'un billet pour M. David De Cotis - Soirée bénéfice au profit de la Fondation Cité de la Santé, le 27 mars 2015","D. De Cotis","500"
"2015","1352430","Achat d'un billet pour M. Stéphane Boyer, conseiller municipal, à la Grande conférence du Conseil du bâtiment durable du Canada - Section du Québec du CBDCa, le 22 janvier 2015","S. Boyer","41,99"
"2015","1359758","Achat d'un billet pour Mme Virginie Dufour - Soirée bénéfice au profit du Centre d'action SIDA Montréal (femmes), le 2 mai 2015","V. Dufour","50"
"2015","1356427","Achat de 9 billets pour les élus municipaux - Soirée bénéfice du Club de soccer Chomedey inc. le 17 avril 2015","D. De Cotis, C. Yoakim, N. Borne, J. Coupal, A. Dib, J. Frédéric-Gauthier, D. Hébert, R. Khalil, V. Karidogiannis","900"
"2015","1356484","Achats de 2 billets (Marc Demers et Sandra Desmeules) - Soirée bénéfice au profit de la Fondation du Centre jeunesse de Laval et du Centre de réadaptation en dépendance Laval, le 30 avril 2015","M. Demers, S. Desmeules","300"
"2015","1361970","Achat de 2 billets pour Mmes Sandra Desmeules et Aline Dib - Dîner régimentaire du 4e Bataillon du Royal 22e Régiment, le 2 mai 2015","S. Desmeules, A. Dib","180"
"2015","1362494","Achat d'un billet  au nom de M. Marc Demers - Soirée bénéfice au profit de l'Association des personnes vivant avec une surdité de Laval (APVSL)","M. Demers ","85"
"2015","1362770","Achat de 2 billets (MM. Marc Demers et Raynald Adams) - Brunch bénéfice au profit de la Fondation de l'autisme, le 3 mai 2015","M. Demers, R. Adams","60"
"2015","1365437","Achat de deux billets (M. Marc Demers et Mme Christiane Yoakim) - Soirée bénéfice au profit de la Fondation scolaire de Laval qui aura lieu le 9 juin 2015","M. Demers, C. Yoakim","500"
"2015","1376103","Conseil d'administration de la FCM - Avion et frais afférents de Mme Sandra Desmeules ","S. Desmeules ","1541,48"
"2015","1380591","2e édition de la conférence Villes Intelligentes (Événements Les Affaires), qui aura lieu le 23 octobre 2015 | Inscription de M. Stéphane Boyer","S. Boyer","690,82"
"2015","1379149","Conférence Agora métropolitaine 2015 CMM « Aménager ensemble l'avenir du Grand Montréal » qui aura lieu le 5 octobre 2015 | Inscription et frais afférents de M. Stéphane Boyer ","S. Boyer","41,09"
"2015","1380819","Cocktail de la rentrée (CCIL) qui aura lieu le 14 octobre 2015 - Inscription de M. David De Cotis, vice-président du comité exécutif","D. De Cotis","28,35"
"2015","1380819","Rencontre VIP avec Devrun (CCIL) qui aura lieu le 14 octobre 2015 _ Inscription de M. David De Cotis, vice-président du comité exécutif","D. De Cotis","31,5"
"2015","1379149","Conférence Agora métropolitaine 2015 CMM « Aménager ensemble l'avenir du Grand Montréal » qui aura lieu le 5 octobre 2015 | Inscription et frais afférents de Mme Virginie Dufour ","V. Dufour","41,09"
"2015","1379149","Conférence Agora métropolitaine 2015 CMM « Aménager ensemble l'avenir du Grand Montréal » qui aura lieu le 5 octobre 2015 | Inscription et frais afférents de M. Ray Khalil ","R. Khalil","41,09"
"2015","1384943","Inscription de M. Stéphane Boyer, conseiller municipal | Réseautage_Rencontre VIP avec le gagnant Dunamis 2015 « Entreprise d'économie sociale » qui aura lieu le 18 novembre 2015 - Chambre de commerce et d'industrie de Laval","S. Boyer","31,5"
"2015","1383782","Achat de deux billets (150.00$/ch.) - ( MM Marc Demers et David De Cotis) - CT1383782 - Soirée bénéfice « J'ai marché sur la Lune! » au profit de la Fondation du Cosmodôme, le jeudi 5 novembre 2015, à Laval","M. Demers, D. De Cotis","300"
"2015","1385739","CT1385739 - Dîner de Noël de l'Association québécoise de la défense des droits des retraités Laval-Laurentides (2 billets : M. Marc Demers, maire de Laval et M. Paolo Galati, conseiller municipal) - 8 décembre 2015","M. Demers, P. Galati","80,95"
"2015","1353136","CT1353136 - Conseil d'administration de la Fédération canadienne des municipalités (FCM) du 4 au 7 mars 2015, à Burnaby (C.-B.) ","S. Desmeules","1865,57"
"2015","1352415","CT1352415 - Frais afférents de Mme Virginie Dufour et M. Vasilios Karidogiannis à la Conférence sur les collectivités durables 2015 de la FCM du 10 au 12 février 2015 à London, Ontario ","V. Dufour, V. Karidogiannis","3717,74"
"2015","1356985","CT1356985 - Participation de Mme Virginie Dufour et de M. Stéphane Boyer - Salon international des technologies environnementales AMERICANA du Réseau Environnement, du 17 au 19 mars 2015, à Montréal ","V. Dufour, S. Boyer","905,88"
"2015","1359686","CT1359686 - Inscriptions de M. Raynald Adams et de Mme Aline Dib - Colloque Carrefour action municipale et famille, du 6 au 9 mai 2015, à Montmagny","R. Adams, A. Dib","1362,23"
"2015","1362263","CT1362263 - Inscription de M. Raynald Adams - Colloque Les Arts et la Ville, du 1er au 4 juin 2015, à Dieppe, Nouveau-Brunswick","R. Adams ","288,72"
"2015","1363521","CT1363521 - Inscription de M. Gilbert Dumas - Colloque de l'Association québécoise des transports (AQTr) - Les mesures préférentielles pour bus: ouvrir la voie, le 21 mai 2015, à Montréal","G. Dumas","360,11"
"2015","1357205","CT1357205 - Conférence internationale Smart City Expo Montréal, du 25 au 27 mars 2015, à Montréal ","D. De Cotis, V. Dufour, S. Boyer","1617,73"
"2015","1362732","CT1362732 - Inscriptions (10 élus) - Assises annuelles de l'Union des municipalités du Québec, du 20 au 23 mai 2015, à Montréal","M. Demers, D. De Cotis, R. Adams, S. Demeules, V. Dufour, S. Boyer, C. Yoakim, R. Khalil, A. Revelakis, A. Lecompte","7025,75"
"2015","1362263","CT1362263 - Frais afférents de M. Raynald Adams - Colloque Les Arts et la Ville, du 1er au 4 juin 2015, à Dieppe, Nouveau-Brunswick ","R. Adams","1068,94"
"2015","1364309","DA1364309 - Frais afférents de Mme Sandra Desmeules - Congrès de la Fédération canadienne des municipalités (FCM), du 3 au 8 juin 2015, à Edmonton (Alberta) ","S. Desmeules","2933,04"
"2015","1377709","CT1377709 - Colloque « à pied, à vélo » des villes actives de Vélo Québec Association, du 23 et 24 septembre 2015, à Montréal - Inscription et frais afférents de Mme Virginie Dufour ","V. Dufour","385,71"
"2015","1377023","CT1377023 - Colloque annuel du Réseau québécois de Villes et Villages en santé qui aura lieu le 18 septembre 2015 ","R. Khalil","208,93"
"2015","1379371","CT1379371 - Colloque sur la gestion des matières résiduelles 2015 - Réseau Environnement - 6 au 8 octobre 2015, à Québec | Inscription et frais afférents de Mme Virginie Dufour ","V. Dufour","1070,55"
"2015","1383712","CT1383712 - Colloque l'entrepreneuriat au féminin pour les participations de Mme Christiane Yoakim, Mme Aline Dib et Mme Jocelyne Frédéric-Gauthier, Femmessor, le 4 novembre 2015 - CCIL","C. Yoakim, A. Dib, J. F.-Gauthier","314,96"
"2015","1383926","CT1383926 - Frais afférents de Mme Sandra Desmeules, membre du comité exécutif | Conseil d'administration - Fédération canadienne des municipalités, du 18 au 20 novembre 2015, à Ottawa ","S. Desmeules","731,61"
"2015","1388310","CT1388310 - Conférence sur les collectivités durables 2016 de la Fédération canadienne des municipalités du 9 au 11 février 2016 - Inscription de M. Nicholas Borne, membre associé du comité exécutif ","V. Dufour, N. Borne","1430"
"2015","1359815","CT1359815 - Inscriptions de Mme Virginie Dufour et de M. Daniel Hébert - Formation « Le CCU et l'acceptabilité sociale: défi ou déni? » de l'Association québécoise d'urbanisme, le 25 avril 2015, à Drummondville","V. Dufour, D. Hébert","482,94"
"2015","1378971","CT1378971 - Formation de l'Association québécoise d'urbanisme « Le CCU et les saines habitudes de vie » ","V. Dufour, D. Hébert","1426,56"
"2016","1388310","CT1388310 - Conférence sur les collectivités durables 2016 de la Fédération canadienne des municipalités du 9 au 11 février 2016 ","N. Borne, V. Dufour","1229,66"
"2016","1390767","CT1390767 Journée réflexion « Les conditions de réussite des projets de TOD » UQAM DEUT, Forum URBA 2015, 28 janvier 2016 - Mme Virginie Dufour, M. Stéphane Boyer et M. Daniel Hébert","V. Dufour, S. Boyer, D. Hébert","565,53"
"2016","1390771","CT1390771 - Soirée bénéfice « Montreal Backbeat Showband » - Fondation Sir-Wilfrid-Laurier - 21 janvier 2016 __ Achat de 10 billets (10x225$)","D. De Cotis, S. Desmeules, V. Dufour, N. Borne, A. Dib, G. Dumas, J. F-. Gauhier, P. Galati, R. Khalil","2250"
"2016","1391385","CT1391385 - Bal du 20e anniversaire de la Société Alzheimer Laval le 12 février 2016 (Achat d'une table VIP)","D. De Cotis, S. Desmeules, N. Borne, A. Dib, J. F.-Gauthier, P. Galati, D. Hébert, V. Karidogiannis, M. Poissant","4500"
"2016","1391440","CT1391440 - 11e édition déjeuner-bénéfice Transport 2000 Québec (Montréal) - 8 février 2016 -- Inscription de M. David De Cotis, vice-président du comité exécutif","D. De Cotis","150"
"2016","1394359","CT1394359 - Conseil d'administration de la Fédération canadienne des municipalités - 2 au 4 mars 2016 - Sherbrooke |  Mme Sandra Desmeules, membre du comité exécutif","S. Desmeules","298,29"
"2016","1394708","CT1394708 - Souper spectacle bénéfice édition 2016 - Maison des jeunes du Marigot et de Laval-Ouest | Billets de Mme Sandra Desmeules et M. Nicholas Borne","S. Desmeules, N. Borne","166,93"
"2016","1396132","CT1396132 - Soirée prestige « Amour à Venise »  au profit de l'Orchestre symphonique de Laval et de la Fondation Kovalev pour enfants, le 18 février 2016, Terrebonne  | Billet de M. Stéphane Boyer, conseiller municipal","S. Boyer","225"
"2016","1396324","CT1396324 - Caucus des grandes villes de l'Union des municipalités du Québec, du 18 au 19 février 2016, Lévis  |  M. Raynald Adams","R. Adams","391,05"
"2016","1397990","CT1397990 - 6e Colloque biennal « Parce que l'avenir nous habite » - Réseau québécois des OSBL d'habitation, du 12 au 15 avril 2016  |  Inscription et frais afférents de M. Nicholas Borne","N. Borne ","524,94"
"2016","1398677","CT1398677 - Colloque transport et sécurité maritime - Tronçon fluvial du Saint-Laurent ; Comité ZIP Jacques-Cartier - 13 avril 2016  |  Inscription et frais afférents de M. Stéphane Boyer","S. Boyer","100"
"2016","1399796","CT1399796 - Conférence - L'engagement renouvelé du Canada envers l'accueil, l'intégration et la réussite des immigrants - Chambre de commerce du Montréal métropolitain - Le 16 mars 2016  |  Inscription et frais afférents de Mme Aline Dib","A. Dib","162,73"
"2016","1400788","CT1400788 - 1ère édition des «Rendez-vous internationaux en management public et organisation du commerce» - Institut d'administration publique du Grand Montréal, du 21 au 22 mars 2016 | Inscription et  frais afférents de M. David De Cotis","D. De Cotis","839,9"
"2016","1401501","CT1401501- Dîner régimentaire du 4e Bataillon Royal 22e Régiment « 20e anniversaire de l'inauguration du manège militaire Charles Michel de Salaberry » - Le 23 avril 2016  |  Inscription de M. Nicholas Borne","N. Borne","163,02"
"2016","1401658","CT1401658 - 28e Colloque du Carrefour action municipale et famille - 3 juin 2016 - Inscription et frais afférents de Mme Aline Dib","A. Dib","87,7"
"2016","1402061","CT1402061 - Assises annuelles de l'Union des municipalités du Québec - 11 au 13 mai 2016  (10 élus)","M. Demers, R. Adams, S. Desmeules, V. Dufour, C. Yoakim, A. Dib, D. Hébert, V. Karidogiannis, A. Revelakis, M. Trottier","16645,28"
"2016","1405235","CT1405235 - Congrès annuel et salon professionnel de la Fédération canadienne des municipalités qui aura lieu du 1er au 6 juin 2016, à Winnipeg Manitoba | Inscription et frais afférents de Mme Sandra Desmeules","S. Desmeules","3875,37"
"2016","1406067","CT1406067 - Colloque Big Data - Finance Montréal - 11 mai 2016 | Inscription et frais afférents de Mme Virginie Dufour, membre du comité exécutif","V. Dufour","322,79"
"2016","1406599","15246 - Soirée bénéfice « Les légendes du Québec » du 5 mai 2016 - Lis avec moi - Représentant du maire : M. Raynald Adams - 1 billet","R. Adams","122,07"
"2016","1406601","2015-2016-23 / Soirée-bénéfice « Ensemble, c'est tout »  du Théâtre Bluff le 5 mai 2016 - Bluff Productions inc. - Représentante du maire : Mme Aline Dib, conseillère municipale - 1 billet souper/spectable","A. Dib","245,65"
"2016","1407392","CT1407392 - Événement « Bio International Convention » - Mission du maire à BIO 2016 - 5 au 8 juin 2016, à San Francisco ","M. Demers et ataché politique","3379,56"
"2016","1407516","CT1407516 - Souper pour le tournoi de golf-bénéfice de DIRA-Laval qui aura lieu le 6 juin 2016, à Terrebonne | Achat de billets (2) pour la présence de M. David De Cotis et Mme Aline Dib","D. De Cotis, A. Dib","140"
"2016","1410097","CT1410097 - Assemblée annuelle et congrès 2016 - Alliance des villes des Grands Lacs et du Saint-Laurent, du 15 au 18 juin 2016  ","V. Dufour","1985,87"
"2016","1410210","CT 1410210  23e édition de la Fête champêtre - Événement philanthropique annuel de levée de fonds - Fondation universitaire Armand-Frappier de l'INRS - 15 juin 2016  |  Achat d'un billet pour Mme Christiane Yoakim","C. Yoakim","525"
"2016","1410373","10e édition du tournoi de golf Hockey région Laval qui aura lieu le 19 août 2016 pour M. David De Cotis, vice-président du comité exécutif","D. De Cotis","50"
"2016","1412394","303499 Déjeuner-conférence - 14 juin 2016 - Chambre de commerce et d'industrie de Laval - Achat du billet de M. Marc Demers, maire","M. Demers","41,99"
"2016","1414502","#303245   Midi-Mag - Rencontre des Lauréats - Gaz Propane Monin - M. David De Cotis, représentant du maire - Chambre de commerce et d'industrie de Laval","D. De Cotis","31,5"
"2016","1415033","145 - Achat d'un billet pour M. Marc Demers pour le 30ième anniversaire du Centre communautaire Le Rendez-Vous des Aînés de Laval, le 27 mai 2016","M. Demers","55"
"2016","1416392","SD-2016-2613 / DA1416392 - Conseil d'administration de la Fédération canadienne des municipalités du 13 au 16 septembre 2016, à Oakville  |  Mme Sandra Desmeules","S. Desmeules","1016,71"
"2016","1418778","SD-2016-3046 Autoriser la participation de M. Nicholas Borne au Forum mondial de l'économie sociale et solidaire GSED2016, du 7 au 9 septembre 2016, à Montréal","N. Borne","786,7"
"2016","1419842","2016-08-17 Inscription à la rentrée judiciaire du Barreau de Laval - 25e anniversaire - 12 septembre 2016 - Barreau de Laval  |  Billet de M. Marc Demers, maire de Laval","M. Demers","50"
"2016","1421067","SD-2016-3419 / DA1421067 - Mission au Washington Smart Cities Week du 2016-09-26 au 2016-09-30 à Washington  |  MM. David De Cotis et Stéphane Boyer","D. De Cotis, S. Boyer","4796,1"
"2016","1423118","SD-2016-3777 Autoriser la participation de Mme Virginie Dufour et M. Daniel Hébert, à participer à la formation « La revitalisation d'un quartier patrimonial et l'intégration de l'urbanisme tactique » de l'Association québécoise d'urbanisme","V. Dufour, D. Hébert","524,94"
"2016","1423605","2016-09-21 Achat d'un billet pour Mme Sandra Desmeules - Souper-spectacle bénéfice du 20 octobre 2016 au profit de la Fondation du Centre jeunesse de Laval et du Centre de réadaptation en dépendance Laval","S. Desmeules  ","75"
"2016","1423649","SD-2016-3888 Autoriser la participation de Mme Virginie Dufour, membre du comité exécutif, au Colloque sur la Gestion des Matières Résiduelles au Québec, les 12 et 13 octobre 2016, à Laval - Réseau Environnement","V. Dufour","755,91"
"2016","1424617","SD-2016-4036/DA-1424617 - Forum de lattractivité du Grand Montréal | Inscription et frais afférents de Virginie Dufour","V. Dufour","309,69"
"2016","1425253","SD-2016-4123/ DA-1425253 - Symposium sur la Gestion de l'eau du Réseau Environnement, les 9 et 10 novembre 2016, à Laval |  Mme Virginie Dufour","V. Dufour","755,91"
"2016","1425620","28 septembre 2016 - Participation de M. Gilbert Dumas, conseiller municipal - 2e Dégustation Vins & Fromages le 30 septembre 2016 - Association des Personnes Vivant avec une Surdité de Laval","G. Dumas","100"
"2016","1428389","SD-2016-4636 / DA1448389  Autoriser la participation de M. Nicolas Borne, conseiller municipal, à titre de représentant du maire aux Journées annuelles de santé publique 2016 de l'INSP qui auront lieu les 21 et 22 novembre 2016, à Montréal","N. Borne","481,82"
"2016","1428391","SD-2016-4638 Autoriser la participation de Mme Sandra Desmeules, membre du comité exécutif, au conseil d'administration de la Fédération canadienne des municipalités qui aura lieu  du 22 au 25 novembre 2016, à Ottawa","S. Desmeules","1048,81"
"2016","1428410","SD-2016-4640 Autoriser la participation de M. Raynald Adams, membre du comité exécutif et Mme Aline Dib, conseillère municipale, au 12e Colloque francophone international Villes et Villages en Santé et des Villes-Santé de l'OMS23-24 nov.-16","R. Adams, A. Dib","507,77"
"2016","1429693","5442 Achat de billet non-membre pour M. David De Cotis, représentant du maire - Gala 2016 du 22 octobre 2016, Chambre de Commerce et d'industrie Canada-Liban","D. De Cotis","288,72"
"2016","1430218","SD-2016-5051 Autoriser la participation de Mme Sandra Desmeules, membre du comité exécutif, à la cérémonie des Prix d'excellence de l' Institut d'administration publique du Québec qui aura lieu le 1er décembre 2016, à Québec","S. Desmeules","223,46"
"2016","1432255","2016-11-22 Achat d'un billet pour Mme Christiane Yoakim , représentante du maire - Souper de noël Groupe de Loisirs La Relance - 4 décembre 2016","C. Yoakim","89,5"
"2016","1433570","264 Dîner de Noël du 6 décembre 2016 - AQDR Laval-Laurentides - Achat d'un billet pour M. Marc Demers","M. Demers","38"
"2017","1451028","SD-2017-2242 Autoriser la participation de M. Stéphane Boyer au Sommet international de la confiance dans les organisations, les 9 et 10 mai 2017 - Institut de la confiance dans les organisations","S. Boyer","34,66"
"2017","1440951","303697 Midi Mag « Embauche de personnes autistes » - 31 janvier 2017 - Chambre de commerce et d'industrie de Laval  |  Achat de 7 billets pour les conseillers municipaux","Divers conseillers","477,69"
"2017","1442324","SD-2017-731 Autoriser l'achat de billets pour la Soirée gastronomique 2017 - Maison des Soins Palliatifs de Laval - 16 février 2017, Laval","D. De Cotis, R. Adams, A. Dib, C. Yoakim, J. F-Gauthier, D. Hébert, P. Galati, R. Khalil, S. Boyer","4500"
"2017","1439126","SD-2017-318 Autoriser la participation de Mme Virginie Dufour à la formation « Le rôle des municipalités face aux changements climatiques » de l'Union des municipalités du Québec les 1er et 2 février 2017, à Québec","S. Dufour","249,86"
