No de dossier ,No de Resolution,Date,Objet,Montant1130942005,CE13 1726,2013-11-20,"1- d’autoriser la dépense relative au déplacement de MM. Michel Bissonnet, maire de l'arrondissement de Saint-Léonard et Maurice Cohen, conseiller d'arrondissement de Saint-Laurent, à Ottawa (Ontario), du 25 au 29 novembre 2013, afin d'assister aux réunions du conseil d'administration de laFédération canadienne des municipalités (FCM). 2- d'accorder une avance de fonds de 1 689,20 $ à M. Michel Bissonnet et de 1 574,20 $ à M. MauriceCohen;","3263,4"
1133445001,CE13 1747,2013-11-27,"1- d'autoriser une dépense de 479,70 $, taxes incluses, relative au déplacement de MM. Denis Coderre, maire de Montréal, et de Lionel Perez, membre du comité exécutif responsable des infrastructures, de la Commission des services électriques, de la gouvernance et de la démocratie ainsi que des relations gouvernementales, les 2 et 3 écembre 2013, à Québec, pour prendre part aux audiences  publiques de la Commission de l'agriculture, des pêcheries, de l'énergie et des ressources naturelles et aux audiences publiques de la Commission des institutions","479,7"
1130843003,CE13 1820,2013-12-11,"1- de ratifier la dépense de 101,18 $ relative au déplacement, les 24 et 25 novembre 2013, du maire de Montréal, M. Denis Coderre, à La Pocatière à l'occasion du dévoilement des nouvelles voitures AZUR du métro de Montréal;  ","101,18"
1144302001,CE14 0041,2014-01-15,"1- d'autoriser une dépense de 931,30 $ relative au déplacement de Mme Chantal Rouleau, membre du comité exécutif responsable de l’eau et des infrastructures de l’eau, les 16 et 17 janvier 2014, à Windsor (Ontario), afin de participer à la rencontre biannuelle de l’Alliance des villes des grands lacs et du Saint-Laurent; ","931,3"
1144310001,CE14 0042,2014-01-15,"1- d'autoriser une dépense de 468,36 $ relative au déplacement à Québec de MM. Denis Coderre, maire de Montréal et Pierre Desrochers, président du comité exécutif, les 20 et 21 janvier 2014, afin d'assister à une séance de travail organisée par la Régie des rentes du Québec dans le cadre de la réforme des systèmes de retraite;  ","468,36"
1143233001,CE14 0138,2014-01-29,"1- d'autoriser la dépense relative au déplacement de M. Harout Chitilian, vice-président du comité exécutif, responsable de la réforme administrative, de la Ville intelligente, des technologies de l'information et de la jeunesse, le 31 janvier 2014, à Toronto (Ontario), afin d'échanger avec le directeur général et des responsables de la performance organisationnelle pour un montant estimé à 780 $; ",780
1140843001,CE14 0237,2014-02-19,"1- de ratifier la dépense de 118,42 $ relative au déplacement de M. Denis Coderre, maire de Montréal, à Rimouski les 16 et 17 janvier 2014, dans le cadre de la tournée des régions du Québec;  ","118,42"
1140843002,CE14 0238,2014-01-19,"1- de ratifier la dépense de 121,87 $ relative au déplacement de M. Denis Coderre, maire de Montréal, à Trois-Rivières les 19 et 20 janvier 2014, dans le cadre de la tournée des régions du Québec; ","121,87"
1140942002,CE14 0272,2014-02-26,"1- d'autoriser la dépense relative au déplacement de MM. Michel Bissonnet, maire de l'arrondissement de Saint-Léonard, et Maurice Cohen, conseiller d'arrondissement de Saint-Laurent, à Thunder Bay (Ontario), du 5 au 8 mars 2014, afin d'assister aux réunions du conseil d'administration de la Fédération canadienne des municipalités (FCM); 2- d'accorder des avances de fonds de 1 751,90 $ à M. Bissonnet et de 1 751,90 $ à M. Cohen;  ","3503,8"
1140942003,CE14 0347,2014-03-12,"1- d'autoriser la dépense relative au déplacement de MM. Denis Coderre, maire de Montréal, Lionel Perez, membre du comité exécutif, et de Mme Anie Samson, vice-présidente du comité exécutif, à Québec, du 20 au 21 mars 2014, afin d'assister au Sommet municipal de l'Union des municipalités (UMQ) - Montant estimé à 1 122,85 $;  ","1122,85"
1140843003,CE14 0348,2014-03-12,"1- de ratifier la dépense relative au déplacement, à Sherbrooke, les 10 et 11 février 2014, de M. Denis Coderre, maire de Montréal, dans le cadre de la tournée des régions du Québec - Montant : 163,26 $; ","163,26"
1140843004,CE14 0349,2014-03-12,"1- de ratifier la dépense de 125,53 $ relative au déplacement du maire de Montréal, M. Denis Coderre, à Québec les 11 et 12 février 2014, dans le cadre d'une conférence de presse au cours de laquelle le ministre des Affaires municipales, des Régions et de l'Occupation du territoire et ministre des Transports a présenté les grandes lignes du projet de loi 73 concernant l'inspecteur général de la Ville de Montréal; ","125,53"
1144834001,CE14 0352,2014-03-12,"1- d'autoriser une dépense estimée à 7 323,49 $, relative au déplacement, du 12 au 15 mars 2014, de M. Denis Coderre, maire de Montréal, de M. Gilles Deguire, maire de Montréal-Nord, de Mmes Monica Ricourt et Nathalie Pierre-Antoine, conseillères d'arrondissement, afin de prendre part à une mission en Haïti ;  ","7323,49"
1140843005,CE14 0576,2014-04-16,"1- de ratifier la dépense de 219,98 $ relative au déplacement de M. Denis Coderre, maire de Montréal, les 25 et 26 février 2014 à Ottawa (Ontario), afin d'assister au Caucus des maires des grandes villes (CMGV) de la Fédération canadienne des municipalités (FCM); ","219,98"
1140843006,CE14 0577,2014-04-16,"1- de ratifier la dépense de 135,67 $ relative au déplacement de M. Denis Coderre, maire de Montréal, les 3 et 4 mars 2014, à Chicoutimi, dans le cadre de la tournée des régions du Québec; ","135,67"
1140942004,CE14 0719,2014-05-07,"1- d'autoriser la dépense estimée à 5 042,40 $ relative au déplacement de MM. Michel Bissonnet, maire de l'arrondissement Saint-Léonard, et Maurice Cohen, conseiller d'arrondissement de Saint-Laurent à Niagara Falls; 2- d'appuyer l'élection de M. Claude Dauphin, maire de l'arrondissement de Lachine, à titre de président sortant et membre du Conseil national d'administration ainsi que de MM. Michel Bissonnet et Maurice Cohen et de Mme Marie-Ève Brunet à titre de membres du Conseil national d'administration de la FCM pour l'année 2014-2015 et d'assumer les coûts reliés à leur participation aux différentes réunions; 3- d'accorder des avances de fonds aux montants de 2 521, 20 $ à M. Michel Bissonnet et de 2 521,20 $ à M. Maurice Cohen; ","5042,4"
1140843007,CE14 0758,2014-05-14,"1- de ratifier la dépense relative au déplacement de M. Denis Coderre, maire de Montréal, les 10 et 11 avril 2014, à Gatineau, dans le cadre de la tournée des régions du Québec - Montant : 262,14 $;  ","262,14"
1140942005,CE14 0759,2014-05-14,"1- d'autoriser la dépense relative au déplacement de MM. Denis Coderre, maire de Montréal, Lionel Perez, membre du comité exécutif et de Mme Anie Samson, vice-présidente du comité exécutif, au Centre des congrès Lac Lemay, à Gatineau, afin d'assister aux Assises annuelles de l'Union des municipalités du Québec (UMQ) qui auront lieu du 21 au 24 mai 2014 - Montant estimé à 5 512,06 $;  ","5512,06"
1140843008,CE14 0760,2014-05-14,"1- de ratifier la dépense relative au déplacement à New York, de M. Denis Coderre, maire de Montréal, du 12 au 15 avril 2014, dans le cadre d'une mission économique - Montant : 2 143,06 $; ","2143,06"
1141143002,CE14 0801,2014-05-21,"1- d’autoriser la dépense relative au déplacement de M. Lionel Perez, membre du comité exécutif, responsable des relations gouvernementales, du 29 mai au 2 juin 2014, à Niagara Falls (Ontario), afin d'assister au 77e Congrès annuel et salon professionnel de la Fédération canadienne des municipalités (FCM); 2 - d'accorder une avance de fonds au montant de 2 364,20 $; ","2364,2"
1140701001,CE14 0881,2014-06-04,"1- d'autoriser une dépense de 669,44 $ relative au déplacement de Mme Manon Gauthier, membre du comité exécutif, responsable de la culture, du patrimoine, du design, d'Espace pour la vie et du statut de la femme, à Alma (Québec), le 5 juin 2014, dans le cadre du 27e colloque annuel « Les Arts et la ville » ; ","669,44"
1143233003,CE14 0882,2014-06-04,"1- d'autoriser une dépense de 1 751,45 $ relative au déplacement de M. Harout Chitilian, vice-président du comité exécutif, responsable de la réforme administrative, de la Ville intelligente, des technologies de l'information et de la jeunesse, les 4, 5 et 6 juin 2014, à New York, afin d'assister au Summit 14 du Intelligent Community Forum; ","1751,45"
1144302002,CE14 0883,2014-06-04,"1- d'autoriser la dépense relative au déplacement de madame Chantal Rouleau, membre du comité exécutif responsable de l'eau et des infrastructures de l'eau, les 18, 19 et 20 juin 2014, à Thunder Bay en Ontario, afin de participer à la rencontre annuelle de l'Alliance des villes des grands lacs et du Saint-Laurent et d'appuyer la nomination du maire de Montréal au poste de secrétaire-trésorier au sein du conseil d'administration qui le mènera à la présidence de l'Alliance au cours du mandat 2016-2017; 2 - d'accorder une avance de fonds au montant de 1 338,60 $ ;  ","1338,6"
1140843009,CE14 1044,2014-06-25,"1- de ratifier une dépense de 2 125,30 $ relative au déplacement de M. Denis Coderre, maire de Montréal, du 9 au 17 mai 2014, dans le cadre d'une mission institutionnelle, économique et urbaine à Lyon, Paris et Bruxelles ; ","2125,3"
1144320002,CE14 1140,2014-07-30,"1- d'autoriser une dépense de  4456,56 $, relative au déplacement de Mme Manon Gauthier, membre du comité exécutif responsable de la culture, du patrimoine, du design, d'Espace pour la vie et du statut de la femme, à Édimbourg (Écosse), du 9 au 13 août 2014, pour participer au Sommet de la culture 2014; ","4456,56"
1140942007,CE14 1309,2014-08-20,"1- d'autoriser une dépense relative au déplacement, à Saguenay, de MM. Claude Dauphin, maire de l'arrondissement de Lachine, Michel Bissonnet, maire de l'arrondissement Saint-Léonard et Maurice Cohen, conseiller d'arrondissement de Saint-Laurent, et de Mme Marie-Eve Brunet, conseillère de l'arrondissement de Verdun pour un montant estimé 4 977,12 $; 2 - d'accorder des avances de fonds de 1 089,26 $ à Mme Marie-Eve Brunet, de 1 119,64 $ à M. Michel Bissonnet, de 1 381,92 à M. Claude Dauphin et de 1 386,30 $ à M. Maurice Cohen;  ","4977,12"
1140843011,CE14 1314,2014-08-20,"1- d'autoriser la dépense relative au déplacement à Québec, les 19 et 20 août 2014, de M. Denis Coderre, maire de Montréal, M. Pierre Desrochers, président du comité exécutif et de Mme Anie Samson, vice-présidente du comité exécutif, dans le cadre des consultations particulières et auditions publiques sur le projet de loi no 3 pour un montant estimé à 1 703 $;  ",1703
1144320003,CE14 1335,2014-08-27,"1- d'autoriser la dépense relative au déplacement, du 24 au 28 septembre 2014, de Mme Manon Gauthier, membre du comité exécutif responsable de la culture, du patrimoine, du design, de l'Espace pour la vie et du statut de la femme, à Chengdu (Chine) pour participer à la rencontre annuelle du Réseau des villes créatives de l'UNESCO, et du 29 septembre au 3 octobre à Buenos Aires (Argentine) dans le cadre de la 11e réunion de la Commission Culture de Cités et Gouvernements Locaux Unis (CGLU) pour un montant estimé à 4 977,52 $;  ","4977,52"
1140843010,CE14 1336,2014-08-27,"1- de ratifier la dépense relative au déplacement, du 3 au 8 août 2014, de M. Denis Coderre, maire de Montréal, dans le cadre d'une mission officielle au Japon pour un montant de 3 970,25 $;  ","3970,25"
1140843012,CE14 1429,2014-09-17,"1- d'autoriser une dépense au montant estimé de 1 200 $ pour le déplacement de deux membres du comité exécutif, Mme Chantal Rouleau et M. Réal Ménard, le 23 septembre 2014, afin de participer à la visite d'un centre de biométhanisation à Toronto et d'un centre de compostage à Guelph (Ontario); ",1200
1145016001,CE14 1463,2014-09-24,"1- d'autoriser une dépense au montant estimé de 3 760,26 $ pour le déplacement de M. Pierre Desrochers, président du comité exécutif, du 3 au 13 octobre 2014, pour assister au XIe Congrès mondial de Metropolis, sous le thème « Des villes pour tous », qui aura lieu à Hyderabad, en Inde; ","3760,26"
1143233004,CE14 1464,2014-09-24,"1- d'autoriser la dépense relative au déplacement, du 27 septembre au 2 octobre 2014, de M. Denis Coderre, maire de Montréal, et de M. Harout Chitilian, vice-président du comité exécutif, responsable de la réforme administrative, de la Ville intelligente, des technologies de l'information et de la jeunesse, à Los Angeles afin d'assister au CityLab Summit pour un montant estimé de 6 250 $;  ",6250
1141456001,CE14 1675,2014-11-05,"1- d'autoriser la dépense relative au déplacement de MM. Claude Dauphin, maire de l'arrondissement de Lachine et président sortant de la Fédération canadienne des municipalités (FCM), Maurice Cohen, conseiller d'arrondissement de Saint-Laurent, et de Mme Marie-Eve Brunet, conseillère d'arrondissement de Verdun, à Ottawa (Ontario) afin d'assister aux réunions du conseil d'administration de la FCM qui se tiendront du 18 au 21 novembre 2014, pour un montant estimé à 4 173,76 $; 2 - d'accorder des avances de fonds de 1 235,06 $ à Mme Marie-Eve Brunet, de 1 776,52 $ à M. Claude Dauphin et de 1 162,18 $ à M. Maurice Cohen;  ","4173,76"
1140843013,CE14 1676,2014-11-05,"1- de ratifier la dépense de 243,95 $ relative au déplacement à Québec, les 18 et 19 octobre 2014, de M. Denis Coderre, maire de Montréal, afin de prendre part à la Soirée Gala 100e anniversaire Royal 22e Régiment;  ","243,95"
1143905001,CE14 1733,2014-11-12,"1- d'autoriser la dépense relative au déplacement, du 15 au 22 novembre 2014, de Mme Anie Samson, vice-présidente du comité exécutif, responsable de la sécurité publique et des services aux citoyens, comme conférencière et modératrice au 11e Colloque du Centre international pour la prévention de la criminalité (CIPC) qui se tiendra à Palerme (Italie) pour un montant estimé à 578 $; ",578
1144302003,CE14 1758,2014-11-13,"1- d'autoriser une dépense d’un montant estimé à 3 283,72 $,.pour le déplacement de madame Chantal Rouleau, membre du comité exécutif responsable de l’eau et des infrastructures de l’eau, du 14 au 21 novembre 2014, à Séoul en Corée du Sud, afin de participer au « 2014 Inaugural Meeting of the Global Social Economy Forum (GSEF 2014) »;  ","3283,72"
1140843014,CE14 1930,2014-12-10,"1- d'autoriser une dépense estimée à 826,26 $ relative au déplacement de Mme Marie-Ève Brunet, conseillère d'arrondissement, au Congrès annuel et au Salon professionnel de la Fédération canadienne des municipalités qui se tiendra du 5 au 8 juin 2015 à Edmonton; ","826,26"
1140843015,CE14 1984,2014-12-17,"1- de ratifier une dépense de 640,03 $, relative au déplacement à Chicago, les 7 et 8 décembre 2014, de M. Denis Coderre, maire de Montréal, afin de prendre part aux événements commémorant le 70e anniversaire de la signature de la «Convention relative à l'aviation civile internationale» ;  ","640,03"
1151143001,CE15 0076,2015-01-14,"1- d’autoriser une dépense estimée à 387, 30 $, relative au déplacement à Québec, les 14 et 15 janvier 2015 de MM. Denis Coderre, maire de Montréal, et de Lionel Perez, membre du comité exécutif, responsable des infrastructures, de la Commission des services électriques, de la gouvernance, de la démocratie et des relations gouvernementales, pour prendre part aux auditions publiques de la Commission des institutions; ","387,3"
1151143002,CE15 0180,2015-02-04,"1- d'autoriser une dépense estimée à 933,56 $ relative au déplacement à Toronto (Ontario), les 4 et 5 février 2015, de M. Lionel Perez, membre du comité exécutif, responsable des infrastructures, de la Commission des services électriques, de la gouvernance, de la démocratie et des relations gouvernementales, afin d'assister au Caucus des maires des grandes villes (CMGV) de la Fédération canadienne des municipalités (FCM); ","933,56"
1151143003,CE15 0229,2015-02-11,"1- d'autoriser une dépense estimée à 222,83 $ relative au déplacement à Québec, les 10 et 11 février 2015, de M. Lionel Perez, membre du comité exécutif, responsable des infrastructures, de la Commission des services électriques, de la gouvernance, de la démocratie et des relations gouvernementales, pour prendre part aux auditions publiques de la Commission des relations avec les citoyens et de la Commission des transports et de l'environnement; ","222,83"
1154784004,CE15 0322,2015-02-25,"1- d'autoriser une dépense estimée à 9 034,93 $ relative au déplacement de MM. Claude Dauphin, maire de l'arrondissement de Lachine et président sortant de la Fédération canadienne des municipalités (FCM), Michel Bissonnet, maire de l'arrondissement de Saint-Léonard, Maurice Cohen, conseiller d'arrondissement de Saint-Laurent et de Mme Marie-Ève Brunet, conseillère d'arrondissement de Verdun, afin d'assister aux réunions du conseil d'administration de la FCM qui se tiendront du 4 au 7 mars 2015, à Burnaby (Colombie-Britannique); 2 - d'accorder des avances de fonds de 2 314,35 $ à M. Michel Bissonnet, de 2 436,54 $ à Mme Marie-Ève Brunet, de 2 302,15 $ à M. Maurice Cohen et de 1 981,89 $ à M. Claude Dauphin;  ","9034,93"
1150843002,CE15 0323,2015-02-25,"1- de ratifier la dépense de 235,67 $ relative au déplacement, les 28 et 29 janvier 2015, à Québec, de M. Denis Coderre, maire de Montréal, dans le cadre du Déjeuner des chefs d'entreprise du Carnaval de Québec; ","235,67"
1154310001,CE15 0324,2015-02-25,"1- d'autoriser la dépense estimée à 4 418,57 $ relative au déplacement de M. Russell Copeman, membre du comité exécutif, du 8 au 15 mars 2015, afin de se joindre à une délégation économique de Montréal dans le cadre du Marché international des professionnels de l'immobilier (MIPIM), à Cannes (France), et de participer à un événement de la Délégation générale du Québec à Paris (France); 2 - d'accorder une avance de fonds au montant de 3 000 $;  ","4418,57"
1140843016,CE15 0346,2015-03-04,"1- de ratifier la dépense de 2 733,33 $ relative au déplacement du 31 janvier au 5 février 2015, de M. Denis Coderre, maire de Montréal, dans le cadre d'une mission en Europe (Paris et Rome) suivie d'un arrêt à Toronto où il a pris part au Caucus des maires des grandes villes de la Fédération canadienne des municipalités; ","2733,33"
1150843001,CE15 0347,2015-03-04,"1- d'autoriser la dépense estimée à 2 182 $ relative au déplacement du 15 au 22 mars 2015, à Bilbao (Espagne), de Mme Manon Gauthier, membre du comité exécutif, dans le cadre du Sommet Culture de Cités et Gouvernements Locaux Unis (CGLU); ",2182
1150843003,CE15 0410,2015-03-11,"1- d'autoriser une dépense estimée à 4 376,41 $, relative au déplacement du 27 mars au 6 avril 2015, à Paris, de M. Pierre Desrochers, président du comité exécutif, afin de prendre part à la mission commerciale « Montréal@Paris »; 2 - d'accorder une avance de fonds de 3 500 $ à M. Pierre Desrochers; ","4376,41"
1153905002,CE15 0412,2015-03-11,"1- d'autoriser une dépense estimé à 800 $ relative au déplacement de Mme Anie Samson, vice-présidente du comité exécutif responsable de la sécurité publique et des services aux citoyens, du 15 mars au 22 mars 2015, à Paris, afin de prendre part comme membre du « panel » à la « Table ronde Canada-France » ;  ",800
1150843004,CE15 0753,2015-04-22,"1- de ratifier une dépense de 2 790,75 $ relative au déplacement, du 13 au 18 mars 2015, de M. Denis Coderre, maire de Montréal, dans le cadre d'une mission à Miami;  ","2790,75"
1150843005,CE15 0754,2015-04-22,"1- de ratifier une dépense de 1 067,63 $ relative au déplacement, les 24 et 25 mars 2015, de M. Denis Coderre, maire de Montréal, dans le cadre d'une mission à Toronto;  ","1067,63"
1154310002,CE15 0755,2015-04-22,"1- d'autoriser la dépense estimée à 1 138,26 $ relative au déplacement de M. Russell Copeman, membre du comité exécutif, du 30 avril au 1er mai 2015, à Winnipeg (Manitoba), afin de participer à la 47e édition annuelle du congrès national sur le logement et l'itinérance organisé par l'Association canadienne d'habitation et de rénovation urbaine (ACHRU);  ","1138,26"
1154784010,CE15 0816,2015-04-29,"1- d'autoriser une dépense estimée à 13 586,26 $ relative au déplacement de MM. Denis Coderre, maire de Montréal, Claude Dauphin, maire de l'arrondissement de Lachine, Michel Bissonnet, maire de l'arrondissement de Saint-Léonard et Maurice Cohen, conseiller d'arrondissement de Saint-Laurent, ainsi que de Mme Marie-Ève Brunet, conseillère d'arrondissement de Verdun, au Congrès annuel et salon professionnel 2015 de la Fédération canadienne des municipalités (FCM) qui se tiendra du 5 au 8 juin 2015 à Edmonton; 2 - d'appuyer l'élection de MM. Michel Bissonnet et Maurice Cohen et de Mme Marie-Ève Brunet à titre de membres du Conseil national d'administration de la FCM pour l'année 2015-2016 et d'assumer les coûts reliés à leur participation aux différentes réunions; 3 - d'accorder des avances de fonds aux montants de 2 930,44 $ à M. Claude Dauphin, de 3 243,92 $ à M. Michel Bissonnet, de 2 848,09 $ à M. Maurice Cohen et de 1 339,81 $ à Mme Marie-Ève Brunet. ","13586,26"
1150843008,CE15 0817,2015-04-29,"1- de ratifier la dépense de 6 119,07 $,  relative au déplacement, du 6 au 11 avril 2015, à Séoul (Corée du Sud), de M. Denis Coderre, maire de Montréal, afin de participer au Congrès mondial 2015 du Conseil international pour les initiatives écologiques locales (ICLEI - Local Governments for Sustainability); ","6119,07"
1150843006,CE15 0818,2015-04-29,"1- de ratifier la dépense de 737,23 $ relative au déplacement, du 29 au 31 mars 2015, à Lafayette (É. U.), de M. Denis Coderre, maire de Montréal, afin de participer au 80e Bureau exécutif de l'Association internationale des maires francophones (AIMF); ","737,23"
1150843009,CE15 0927,2015-05-13,"1- de ratifier une dépense au montant de 1 484,05 $ relative au déplacement de M. Denis Coderre, maire de Montréal, les 25 et 26 avril 2015, dans le cadre d'une mission à Washington, aux États-Unis; ","1484,05"
1150843007,CE15 0930,2015-05-13,"1- d'autoriser une dépense de 344,93 $, taxes incluses, pour l'achat d'un billet en vue de la participation de M. Harout Chitilian, vice-président du comité exécutif, aux 94e Assises annuelles de l'Union des municipalités du Québec (UMQ), qui se tiendront du 21 au 23 mai 2015, à Montréal;  ","344,93"
1150843010,CE15 0932,2015-05-13,"1- d'autoriser une dépense estimée à 9 558 $ relative au déplacement de M. Denis Coderre, maire de Montréal, et de M. Pierre Desrochers, président du comité exécutif, afin de prendre part à la Rencontre annuelle de METROPOLIS qui se tiendra à Buenos Aires (Argentine), du 18 au 21 mai 2015; ",9558
1150090001,CE15 0933,2015-05-13,"1- d'autoriser une dépense estimée à 2 315,57 $ relative au déplacement de M. Réal Ménard, membre du comité exécutif, du 17 au 20 mai 2015, à Paris, afin de participer à la rencontre internationale ayant pour thème « Végétaliser le bâti dans les villes denses : un nouveau modèle urbain? »; ","2315,57"
1150843011,CE15 1013,2015-05-27,"1- de ratifier la dépense de 988,38 $ relative au déplacement de M. Denis Coderre, maire de Montréal, du 3 au 5 mai 2015, en Abitibi, dans le cadre de la tournée des régions du Québec; ","988,38"
1153233002,CE15 1014,2015-05-27,"1- d'autoriser la dépense estimée à 475,67 $ relative au déplacement de M. Harout Chitilian, vice-président du comité exécutif, responsable de la réforme administrative, de la Ville intelligente, des technologies de l'information et de la jeunesse, les 28 et 29 mai 2015, à Ottawa, afin d'assister à la 3e Conférence internationale sur les données ouvertes; ","475,67"
1150843012,CE15 1017,2015-05-27,"1- d’autoriser une dépense estimé à 3 571,22 $ relative au déplacement de madame Manon Gauthier, membre du comité exécutif, afin de prendre part aux célébrations entourant l'intronisation de monsieur Dany Laferrière à l'Académie française, le 28 mai 2015; ","3571,22"
1154302001,CE15 1105,2015-06-03,"1- d'autoriser une dépense estimé à 1 767,89 $ relative au déplacement de madame Chantal Rouleau, membre du comité exécutif responsable de l’eau et des infrastructures de l’eau, du 16 au 19 juin 2015, à Sarnia en Ontario, afin de participer à la rencontre annuelle de l’Alliance des villes des Grands Lacs et du Saint-Laurent et d’appuyer la nomination du maire de Montréal au poste de vice-président au sein du conseil d’administration qui le mènera à la présidence de l’Alliance au cours du mandat 2016-2017; ","1767,89"
1150974001,CE15 1106,2015-06-03,"1- d'autoriser une dépense estimé à 3 661,65 $ relative au déplacement de M. Aref Salem, membre du comité exécutif, responsable du transport, du 5 au 11 juin 2015, à Milan en Italie, afin de participer au Congrès international de l'UITP (International Association of Public Transport); ","3661,65"
