No de dossier ,No de Resolution,Date,Objet,Montant
1112333001,CE11 0145,2011-02-09,"1- d'autoriser le déplacement, du 2 au 6 mars 2011, de M. Claude Dauphin, président du conseil et de M. Michel Bissonnet, membre du comité exécutif, afin d’assister à la réunion du conseil national d'administration de la Fédération canadienne des municipalités (FCM), qui aura lieu à Corner Brook (Terre-Neuve-et-Labrador); 2- d'accorder des avances de fonds aux montants de 1 602 $ à M. Dauphin et de 1 577,48 $ à M. Bissonnet; ","3179,48"
1110983001,CE11 0230,2011-02-23,"1- d’autoriser le déplacement, du 4 au 13 mars 2011, de M. Richard Deschamps, membre du comité exécutif, afin de diriger une délégation économique de Montréal dans le cadre du Marché international des professionnels de l'immobilier (MIPIM), à Cannes du 8 au 11 mars 2011, et afin de visiter un projet de développement urbain à Marseille ainsi qu'à participer à une journée de prospection d'investissements à Paris; 2- d'accorder une avance de fonds de 4 489,86 $ à cette fin;  ","4489,86"
1115287001,CE11 0288,2011-03-09,"1- de ratifier la dépense de 2 055,05 $ relative au déplacement de Monsieur Gérald Tremblay, maire de Montréal, dans le cadre du Sommet national de l'Infrastructure à Régina, les 26 et 27 janvier dernier. ","2055,05"
1112333002,CE11 0644,2011-05-04,"1- d'autoriser M. Claude Dauphin, maire de l'arrondissement de Lachine, à assister au Caucus des maires des grandes villes (CMGV) qui aura lieu à Halifax, Nouvelle-Écosse, le 2 juin 2011; 2- d'autoriser MM. Claude Dauphin, maire de l'arrondissement de Lachine, Michel Bissonnet, membre du comité exécutif et Maurice Cohen, conseiller de l'arrondissement de Saint-Laurent, à assister au 74e Congrès annuel et Expo municipaleMC de la Fédération canadienne des municipalités (FCM) qui aura lieu à Halifax, Nouvelle-Écosse, du 3 au 6 juin 2011; 3- d'appuyer l'élection de M. Claude Dauphin, maire de l'arrondissement de Lachine, à titre de 2e vice-président et membre du conseil national d'administration ainsi que MM. Michel Bissonnet et Maurice Cohen à titre de membres du conseil national d'administration de la FCM pour l'année 2011-2012 et d'assumer les coûts reliés à leur participation aux différentes réunions; 4- d'accorder des avances de fonds aux montants de 3 089,59 $ à M. Claude Dauphin, de 2 760,16 $ à M. Michel Bissonnet et de 2 775,16 $ à M. Maurice Cohen; ","5535,32"
1110701001,CE11 0742,2011-05-18,"1- d’autoriser une dépense de 275 $ relative à la participation de madame Marie Cinq-Mars, mairesse de l'arrondissement d'Outremont et conseillère associée à la culture, au patrimoine et à la condition féminine, au 24e Colloque Les Arts et la Ville à Sainte-Thérèse, du 25 au 27 mai 2011; ",275
1114538002,CE11 0850,2011-06-08,"1- d’autoriser le déplacement de M. Alan DeSousa, vice-président du comité exécutif, afin de participer au conseil d'administration de l'Alliance des villes des Grands Lacs et du Saint-Laurent qui se tiendra à Niagara Falls les 15, 16 et 17 juin 2011; ",1675
1111143002,CE11 1133,2011-08-03,"1- d'autoriser le déplacement, du 6 au 11 septembre 2011, de MM. Claude Dauphin, maire de l'arrondissement de Lachine et Maurice Cohen, conseiller de l'arrondissement de Saint-Laurent, afin d'assister aux réunions du conseil national d'administration de la Fédération canadienne des municipalités (FCM), qui auront lieu à Nelson (Colombie-Britannique) ; 2- d'accorder des avances de fonds de 2 388,31 $ à M. Dauphin et de 2 388,31 $ à M. Cohen ;  ","4776,62"
1115287002,CE11 1366,2011-08-31,"1- de ratifier la dépense de 2 247,06 $, relative au déplacement de M. Gérald Tremblay, maire de Montréal, à Berlin, dans le cadre de la Coupe du monde féminine FIFA 2011 en Allemagne, du 25 au 27 juin 2011;  ","2247,06"
1115287004,CE11 1445,2011-09-14,"1- de ratifier une dépense de 452,83 $ relativement au déplacement de M. Gérald Tremblay, Maire de Montréal, en Haïti dans le cadre d'une mission à Port-au-Prince, du 10 au 13 juillet 2011; ","452,83"
1111143003,CE11 1555,2011-09-28,"1- d’autoriser le déplacement de M. Michel Bissonnet, membre du comité exécutif, au Centre des congrès de Québec afin d'assister aux 70e Assises annuelles de la Fédération Québécoise des Municipalités, les 28 et 29 septembre 2011;  ","611,06"
1111680002,CE11 1556,2011-09-28,"1- d'autoriser le déplacement de M. Gilles Deguire, membre du comité exécutif, afin d'assister au colloque « L'habitat adapté : modalités de production, de gestion et de soutien aux personnes » dans le cadre des Entretiens 2011 du Centre Jacques-Cartier, à Québec, du 3 au 5 octobre 2011; 2- d'autoriser le Service des finances à faire le nécessaire pour qu'une avance de fonds de 475,20 $ soit versée. Le compte de frais, accompagné des pièces justificatives, sera transmis au chef comptable du Service des finances dans les 15 jours ouvrables suivant le retour;  ","475,2"
1110983002,CE11 1562,2011-09-28,"1- d’autoriser une dépense estimée à 1 780 $ relative au déplacement de monsieur Richard Deschamps, vice-président du comité exécutif, afin de participer à la mission commerciale de l'Association des agences de publicité du Québec (AAPQ), à New York, les 4 et 5 octobre 2011;  ",1780
1110701002,CE11 1683,2011-10-19,"1- d’autoriser le déplacement de Mme Helen Fotopulos, membre du comité exécutif responsable de la culture, du patrimoine, du design et de la condition féminine, à Taipei, du 22 au 30 octobre 2011, en vue de sa participation à la mission commerciale réalisée dans le cadre du Taipei World Design Expo;  ","6209,37"
1110942001,CE11 1844,2011-11-16,"1- d'autoriser le déplacement de M. Claude Dauphin, maire de l'arrondissement de Lachine et 2e vice-président de la Fédération canadienne des municipalités (FCM), M. Michel Bissonnet, maire de l'arrondissement de Saint-Léonard et M. Maurice Cohen, conseiller de l'arrondissement de Saint-Laurent, aux réunions du conseil national d'administration de la Fédération canadienne des municipalités, à Ottawa (Ontario), du 28 novembre au 3 décembre 2011; 2- d'accorder des avances de fonds de 2 034,10 $ à M. Dauphin, de 912,70 $ à M. Bissonnet et de 1 747,75 $ à M. Cohen ; 3- d'imputer ces dépenses conformément aux informations financières inscrites au dossier.","4694,55"
1115287005,CE11 1849,2011-11-16,"1- d'autoriser le déplacement de madame Jane Cowell-Poitras, mairesse suppléante, afin de participer au congrès de Metropolis à Porto Alegre, Brésil, du 23 au 26 novembre 2011; 2- d'autoriser une dépense de 70 $ pour couvrir les frais de renouvellement d'urgence de son passeport, tous les autres frais étant assumés par Metropolis et l'Institut international de gestion des grandes métropoles;  ",70
1115287006,CE11 1951,2011-11-30,"1- de ratifier la dépense de 1 968,33 $ relative au déplacement, les 24 et 25 août 2011, de M. Gérald Tremblay, maire de Montréal, à New York, dans le cadre de la présentation des villes candidates en prévision de l'annonce de la ville retenue pour les Jeux mondiaux policiers et pompiers 2017;  ","1968,33"
1114538003,CE11 1957,2011-11-30,"1- d'autoriser une dépense estimée à 1 607,16 $, relative au déplacement de monsieur Alan DeSousa, vice-président du comité exécutif, afin de participer au conseil d'administration de l'Alliance des villes des Grands Lacs et du Saint-Laurent qui se tiendra à Chicago du 2 au 3 décembre 2011 ;  ","1607,16"
1115287007,CE11 2017,2011-12-07,"1- de ratifier la dépense de 3 733,53 $ relative au déplacement de M. Gérald Tremblay, maire de Montréal, à New York, afin de joindre le Conseil Consultatif pour la relance d'Haïti à l'occasion du Conseil Consultatif Présidentiel sur le Développement et l'Investissement du 20 au 21 septembre 2011;  ","3733,53"
1115287008,CE11 2100,2011-12-14,"1- de ratifier la dépense de 6 794,13 $ relative au déplacement, du 23 au 28 octobre 2011, de M. Gérald Tremblay, maire de Montréal, à Erevan, en Arménie, dans le cadre de la 31e Assemblée générale annuelle de l'Association internationale des maires francophones (AIMF) et d'échanges bilatéraux entre Erevan et Montréal; ","6794,13"
1115287009,CE11 2101,2011-12-14,"1- de ratifier la dépense de 5 460,21 $ relative au déplacement, du 15 au 19 novembre 2011, de M.  Gérald Tremblay, maire de Montréal, à Séoul, en Corée du Sud, dans le cadre de l'Assemblée générale du Réseau des villes créatives UNESCO, et à Busan, afin de prendre part à des échanges bilatéraux;  ","5460,21"
1113072002,CE12 0064,2012-01-18,"1-  d’autoriser une dépense estimée à 2 076,42 $  relative à la participation de Mme Jocelyn Ann Campbell, membre du comité exécutif, responsable du développement social et communautaire, de la famille et des aînés, au 4e Colloque international « Le droit de vieillir. Citoyenneté, intégration et participation politique des personnes âgées », qui aura lieu au Palais des Congrès de Dijon (France), du 22 au 28 janvier 2012 ;  ","2076,42"
1120942001,CE12 0094,2012-01-25,"1- d'autoriser le déplacement de M. Claude Dauphin, maire de l'arrondissement de Lachine et 2e vice président de la Fédération canadienne des municipalités (FCM), pour participer à la conférence et au salon sur les collectivités durables 2012 ainsi qu'à une rencontre des Officiers à Ottawa (Ontario), du 7 au 11 février 2012; 2- d'accorder une avance de fonds de 2 159,10 $ à M. Dauphin; ","2159,1"
1120701001,CE12 0164,2012-02-08,"1-  d'autoriser le déplacement de Mme Helen Fotopulos, membre du comité exécutif, responsable de la culture, du design, du patrimoine et de la condition féminine, à Neuville sur Vanne, en France, du 13 au 17 février 2012, afin de participer aux célébrations du 400e anniversaire de naissance de Paul Chomedey, Sieur de Maisonneuve; 2-  d’autoriser une dépense de 3 294,42 $ à cette fin;  ","3294,42"
1120942003,CE12 0234,2012-02-22,"1-  d'autoriser le déplacement de messieurs Claude Dauphin, maire de l'arrondissement de Lachine et 2e vice-président de la Fédération canadienne des municipalités (FCM), et Michel Bissonnet, membre du comité exécutif et maire de l'arrondissement de Saint-Léonard, à Kitchener (Ontario), du 7 au 10 mars 2012, afin de prendre part aux réunions du conseil national d'administration de la FCM; 2-  d’accorder une avance de fonds aux montants de 1 430,36 $ à monsieur Claude Dauphin et de 1 407,11 $ à monsieur Michel Bissonnet;","2837,47"
1121143001,CE12 0235,2012-02-22,"1-  d'autoriser le déplacement de monsieur Michel Bissonnet, membre du comité exécutif, responsable des affaires gouvernementales, à Québec, le 24 février 2012, afin d'assister à la Table Québec municipalités (TQM); 2-  d’autoriser une dépense de 445,43 $ à cette fin;  ","445,43"
1120983001,CE12 0236,2012-02-22,"1-  d’autoriser le déplacement, du 4 au 11 mars 2012, de monsieur Richard Deschamps, vice-président du comité exécutif, responsable du développement économique, afin de diriger une délégation économique de Montréal dans le cadre du Marché international des professionnels de l'immobilier (MIPIM), à Cannes du 5 au 9 mars 2011, ainsi qu'à participer à une journée de prospection d'investissements à Paris;  2-  d’accorder une avance de fonds au montant de 4 645 $ à monsieur Richard Deschamps;  ",4645
1125287001,CE12 0581,2012-04-25,"1-  de ratifier la dépense de 5 948,71 $ relative au déplacement de M. Gérald Tremblay, maire de Montréal, à Paris et à Bruxelles, du 27 février au 3 mars 2012, dans le cadre d'une mission économique à Paris et afin d’assister à la réunion du bureau exécutif de l'Association internationale des maires francophones (AIMF) à Bruxelles; ","5948,71"
1125287002,CE12 0582,2012-04-25,"1-  de ratifier la dépense de 4 427,30 $ relative au déplacement de M. Gérald Tremblay, maire de Montréal, à Chicago, du 7 au 9 mars 2012, afin d’assister à la 4e Table ronde de l'Organisation de coopération et de développement économique (OCDE) des maires et des ministres; ","4427,3"
1120701002,CE12 0683,2012-05-09,"1-  d'autoriser la dépense estimée à 755,11 $, relative à la participation de madame Marie Cinq Mars, mairesse de l'arrondissement d'Outremont et conseillère associée à la culture, au patrimoine et à la condition féminine, à la 25e édition du Colloque Les Arts et la Ville « Culture locale, passeport mondial, un enjeu d'avenir pour les collectivités », au Centre de congrès de Rouyn Noranda, du 15 au 18 mai 2012;  ","755,11"
1124538001,CE12 0684,2012-05-09,"1-  d'autoriser le déplacement de M. Alan DeSousa, vice-président du comité exécutif, à Québec, du 26 au 28 juin 2012, afin de participer au Conseil d'administration de l'Alliance des villes des Grands Lacs et du Saint-Laurent; 2-  d'accorder une avance de fonds au montant de 1 382 $ à M. Alan DeSousa; ",1382
1120942004,CE12 0685,2012-05-09,"1-  d'autoriser le déplacement de MM. Claude Dauphin, maire de l'arrondissement de Lachine, Michel Bissonnet, membre du comité exécutif, et Maurice Cohen, conseiller d'arrondissement de Saint Laurent, au 75e Congrès annuel et salon professionnel de la Fédération canadienne des municipalités (FCM) du 31 mai au 4 juin 2012, afin de participer à titre de membres du Conseil d'administration de la FCM à l'Assemblée générale de Saskatoon; 2-  d'autoriser leur participation aux réunions de la FCM de 2012-2013 à titre de membres du Conseil d'administration et d'assumer les coûts reliés à leur participation aux différentes réunions de l'année. Le montant estimé pour leur déplacement à Saskatoon : 10 393,34 $ (3 personnes); 3-  d'accorder des avances de fonds aux montants de 3 597,01 $ à M. Claude Dauphin, de 3 276,97 $ à M. Michel Bissonnet et de 3 519,36 $ à M. Maurice Cohen; ","10393,34"
1121143002,CE12 0687,2012-05-09,"1-  d'autoriser une dépense estimée à 1392,30 $, relative au déplacement de monsieur Michel Bissonnet, membre du comité exécutif, afin d'assister aux Assises annuelles de l’Union des municipalités du Québec, à Gatineau, du 10 au 11 mai 2012; ","1392,3"
1125287003,CE12 0723,2012-05-16,"1-  de ratifier la dépense de 1 269,52 $ relative au déplacement de M. Gérald Tremblay, maire de Montréal, à New York, le 23 avril 2012, dans le cadre de la réunion politique des autorités locales et régionales, préparatoire à la Conférence des Nations Unies sur le développement durable (Rio+20); ","1269,52"
1124538002,CE12 0904,2012-06-06,"1-  d'autoriser le déplacement de M. Alan DeSousa,  vice-président du comité exécutif, à Belo Horizonte, au Brésil, du 12 au 18 juin 2012, afin de participer au Congrès mondial de l'International Council for Local Environmental Initiatives (ICLEI); 2-  d'accorder une avance de fonds au montant de 3 088,33 $ à monsieur Alan DeSousa;  ","3088,33"
1125287004,CE12 1084,2012-06-27,"1-  de ratifier la dépense de 6 095,05 $ relative au déplacement, de M. Gérald Tremblay, maire de Montréal, aux Émirats Arabes Unis et au Qatar, du 29 avril au 4 mai 2012, à l'occasion d'une mission économique;  ","6095,05"
1123445001,CE12 1469,2012-09-05,"1-  d’autoriser la dépense relative au déplacement de M. Richard Deschamps, vice-président du comité exécutif, responsable des grands projets, du développement économique, des infrastructures, de la voirie, des services aux citoyens, du matériel roulant et des ateliers, à Regina (Sasketchewan), du 9 au 10 septembre 2012, afin de prendre part au « 2012 National Infrastructure Summit »; 2-  d'accorder une avance de fonds au montant de 1 800 $ à M. Richard Deschamps;  ",1800
1120701003,CE12 1518,2012-09-12,"1-  d'autoriser la dépense relative au déplacement de Mme Helen Fotopulos, membre du comité exécutif et responsable de la culture, du patrimoine et de la condition féminine, à l'occasion d'une double mission en Europe : à Göteborg (Suède), du 14 au 18 septembre 2012, afin de signer une entente en vue d'accueillir à Montréal, en 2017, le Sommet mondial de l'architecture, du design et de l'urbanisme et à Barcelone (Espagne), du 19 au 24 septembre 2012, pour y représenter Montréal au titre de ville étrangère invitée à La Mercè. Montant estimé : 6 058,15 $;  ","6058,15"
1121143003,CE12 1567,2012-09-19,"1-  d’autoriser le déplacement de monsieur Michel Bissonnet, membre du comité exécutif, au Centre des congrès de Québec, les 26 et 27 septembre 2012, afin d'assister aux 71es Assises annuelles de la Fédération Québécoise des Municipalités (FQM);  ","563,5"
1124310002,CE12 1602,2012-09-26,"1-  d'autoriser une dépense estimée à 3 560 $, relative au déplacement de Mme Manon Barbe, membre du comité exécutif, responsable des sports, des loisirs et des événements sportifs internationaux, au 5e Sommet de l'Union mondiale des Villes olympiques (UMVO), à Lausanne, en Suisse, du 28 septembre au 3 octobre 2012 ;  ",3560
1124538003,CE12 1638,2012-10-03,"1- d'autoriser le déplacement de  M. Alan DeSousa, vice-président du comité exécutif, afin de prendre part au Sommet sur les villes et la biodiversité qui se tiendra à Hyderabad en Inde, du 12 au 18 octobre 2012; 2- d'accorder une avance de fonds au montant de 2 733,44 $ à monsieur DeSousa; ","2733,44"
1120942005,CE12 1808,2012-10-31,"1- d'autoriser la dépense relative au déplacement, du 20 au 23 novembre 2012, de MM. Claude Dauphin, maire de l'arrondissement de Lachine et 1er vice-président de la Fédération canadienne des municipalités (FCM), Michel Bissonnet, membre du comité exécutif et maire de l'arrondissement de Saint-Léonard, et Maurice Cohen, conseiller de l'arrondissement de Saint-Laurent, afin de prendre part aux réunions du conseil national d'administration de la FCM à Ottawa (Ontario); 2- d'accorder des avances de fonds de 1 340,60 $ à M. Dauphin, de 947,90 $ à M. Bissonnet et de 1 560,20 $ à M. Maurice Cohen; .","3848,7"
1125287005,CE12 1920,2012-11-28,"1- de ratifier une dépense de 5 485,32 $ relative au déplacement, du 7 au 14 septembre 2012, de M. Gérald Tremblay, maire de Montréal, en Israël et en Cisjordanie dans le cadre d'une mission économique; ","5485,32"
1125287006,CE12 1921,2012-11-28,"1- de ratifier une dépense de 470,48 $ relative à l'annulation du déplacement de M. Gérald Tremblay, à titre de maire de Montréal, pour une mission à Lyon dans le cadre des Entretiens Jacques-Cartier du 15 au 23 novembre 2012;  ","470,48"
1130942001,CE13 0100,2013-01-30,"1- d'autoriser la dépense relative au déplacement, du 12 au 16 février 2013, de M. Claude Dauphin, maire de l'arrondissement de Lachine et 1er vice-président de la Fédération canadienne des municipalités (FCM), et de Mme Josée Duplessis, membre du comité exécutif responsable du développement durable, de l'environnement, des grands parcs et des espaces verts, pour participer à la conférence et au salon sur les collectivités durables 2013 de la FCM, à Windsor (Ontario) ; 2- d'accorder des avances de fonds au montant de 2 519,40 $ à M. Dauphin et de 2 453,89 $ à Mme Duplessis ; ","4973,29"
1130942002,CE13 0193,2013-02-20,"1- d’autoriser la dépense relative au déplacement, du 6 au 10 mars 2013, de M. Claude Dauphin, maire de l'arrondissement de Lachine et 1er vice-président de la Fédération canadienne des municipalités (FCM), de M. Michel Bissonnet, membre du comité exécutif et maire de l'arrondissement de Saint-Léonard, et de M. Maurice Cohen, conseiller de l'arrondissement de Saint-Laurent, afin de prendre part aux réunions du Conseil national d'administration de la FCM à Prince George (Colombie-Britannique); 2- d'accorder des avances de fonds de 2 105,95 $ à M. Dauphin, de 2 043,41 $ à M. Bissonnet et de 2 148,46 $ à M. Maurice Cohen;  ","6297,82"
1134310001,CE13 0227,2013-02-27,"1- d'autoriser le déplacement de M. Alain Tassé, membre du comité exécutif, du 6 au 17 mars 2013, afin de se joindre à une délégation économique de Montréal dans le cadre du Marché international des professionnels de l'immobilier (MIPIM), à Cannes (France), et de participer à un événement de la Délégation générale du Québec à Paris (France); 2- d'accorder une avance de fonds au montant de 2 841,89 $ à M. Alain Tassé;  ","2841,89"
1130701001,CE13 0272,2013-03-06,"1- d'autoriser la dépense relative au déplacement, du 11 au 17 mars 2013, de Mme Élaine Ayotte, membre du comité exécutif responsable de la culture, du patrimoine et du design, à Lyon et à Saint-Étienne (France) pour participer à des visites culturelles et prendre part à la «Biennale internationale design Saint-Étienne 2013»;
2- d'accorder une avance de fonds au montant de 1 214,95 $ à Mme Élaine Ayotte;  ","1214,95"
1130942003,CE13 0523,2013-04-24,"1- d'autoriser la dépense relative au déplacement, à Vancouver, de MM. Claude Dauphin, maire de l'arrondissement de Lachine, Michel Bissonnet, maire de l'arrondissement de Saint-Léonard et membre du comité exécutif, et Maurice Cohen, conseiller de l'arrondissement de Saint-Laurent, afin d’assister au 76e Congrès annuel et salon professionnel de la FCM qui aura lieu du 31 mai au 3 juin 2013; 2- d'appuyer l'élection de M. Claude Dauphin, maire de l'arrondissement de Lachine, à titre de président et membre du Conseil national d'administration ainsi que de MM. Michel Bissonnet et Maurice Cohen à titre de membres du Conseil national d'administration de la FCM pour l'année 2013-2014 et d'assumer les coûts reliés à leur participation aux différentes réunions; 3- d'accorder des avances de fonds aux montants de 3 272,87 $ à M. Dauphin, 3 272,87 $ à M. Michel Bissonnet et 3 272,87 $ à M. Maurice Cohen; 4- d’imputer cette dépense conformément aux informations financières inscrites au dossier décisionnel.","9818,61"
1130701002,CE13 0641,2013-05-15,"1- d'autoriser une dépense estimée à 557,30 $, relative au déplacement, du 21 au 22 mai 2013, de Mme Élaine Ayotte, membre du comité exécutif responsable de la culture, du patrimoine et du design, pour participer au conseil d'administration et aux activités entourant la 26e édition du colloque «Les Arts et la Ville», à Gatineau (Québec);  ","557,3"
1131143001,CE13 0642,2013-05-15,"1- d’autoriser une dépense estimée à 596,96 $, relative au déplacement de monsieur Michel Bissonnet, membre du comité exécutif, responsable des affaires gouvernementales, à Québec, les 16 et 17 mai 2013, afin d'assister à la Table Québec-municipalités (TQM);  ","596,96"
1131143002,CE13 0762,2013-05-29,"1-  d’autoriser une dépense additionnelle estimée à 606,49 $, relative à la participation de M. Michel Bissonnet, maire de l'arrondissement de Saint-Léonard et membre du comité exécutif, au 76e Congrès annuel et salon professionnel de la Fédération canadienne des municipalités (FCM) et au Caucus des maires des grandes villes (CMGV), du 29 mai au 3 juin 2013,  à Vancouver;  ","606,49"
1134302001,CE13 0823,2013-06-05,"1- d'autoriser le déplacement de Mme Josée Duplessis, membre du comité exécutif, afin de participer au conseil d'administration et au congrès de l'Alliance des villes des Grands Lacs et du Saint-Laurent qui se tiendra à Marquette, dans l’état du Michigan (États-Unis) du 19 au 21 juin 2013; 2- d'accorder une avance de fonds de 2 043,21 $ à Mme Duplessis;  ","2043,21"
1130843002,CE13 0833,2013-06-05,"1- d'autoriser une dépense estimée à 579,16 $, relative à la participation de Mme Élaine Ayotte, membre du comité exécutif responsable de la culture, du patrimoine et du design, à l'Assemblée générale des Nations Unies au nom de la Commission Culture de Cités et Gouvernements Locaux Unis (CGLU) qui se déroulera à New York (États-Unis), le 12 juin 2013;  ","579,16"
1130843001,CE13 0936,2013-06-19,"1- d'autoriser le déplacement de Mme Élaine Ayotte, membre du comité exécutif responsable de la culture, du patrimoine et du design, du 26 au 30 juin 2013, afin d’assister à la 10e rencontre de la Commission Culture de Cités et Gouvernements Locaux Unis (CGLU) qui se déroulera à Lille, en France; 2- d'accorder une avance de fonds au montant de 2 156,88 $ à Mme Ayotte;  ","2156,88"
1131294002,CE13 0975,2013-06-26,"1- de ratifier la dépense relative au déplacement de M. Michael Applebaum, maire de Montréal, à New York, du 26 avril au 29 avril 2013, dans le cadre d'une mission économique organisée en collaboration avec Montréal International;  ","1714,36"
1131294001,CE13 0985,2013-06-26,"1- de ratifier la dépense relative au déplacement, du 11 au 18 mai 2013, de M. Michael Applebaum, ex maire de Montréal, qui a pris part à une mission en Allemagne, au Danemark et en Suède;  ","9108,38"
1131143003,CE13 1221,2013-08-14,"1- d’autoriser la dépense relative au déplacement de M. Michel Bissonnet, membre du comité exécutif
et maire de l'arrondissement de Saint-Léonard, à Saint-Jean (Terre-Neuve-et-Labrador), du 4 au 7
septembre 2013, afin d'assister aux réunions du conseil d'administration de la Fédération canadienne
des municipalités (FCM); 2- d'accorder une avance de fonds au montant de 2 065,88 $ à M. Michel Bissonnet; ","2065,88"
