titre,date_debut,date_fin,type,service_publieur,lien
"Fermeture à ‌la‌ ‌circulation sur la rue Duchesne, entre les rues Marcel et Saint-Charles, Saint-Laurent",2024-12-16T14:54:50.699000,2025-04-15T15:54:50.699000,"Circulation et transport","Services des communications","https://montreal.ca/alertes/fermeture-a-la-circulation-sur-la-rue-duchesne-entre-les-rues-marcel-et-saintcharles-saintlaurent-20241216102436"
"Horaire spécial pour la piscine René-Goupil, le 16/12/2024, arrondissement de Villeray–Saint-Michel–Parc-Extension",2024-12-16T16:16:49.438000,2025-04-15T17:16:49.438000,"Parcs et bâtiments municipaux","Services des communications","https://montreal.ca/alertes/horaire-special-pour-la-piscine-renegoupil-le-16122024-arrondissement-de-villeraysaintmichelparcextension-20241216112552"
"Fermeture temporaire pour le Bureau Accès Montréal et le Comptoir des permis, le 16/12/2024, arrrondissement de Montréal-Nord",2024-12-16T16:43:59.349000,2025-04-15T17:43:59.349000,"Parcs et bâtiments municipaux","Services des communications","https://montreal.ca/alertes/fermeture-temporaire-pour-le-bureau-acces-montreal-et-le-comptoir-des-permis-le-16122024-arrrondissement-de-montrealnord-20241216114811"
"ERRATUM - Fermeture temporaire : Bureau Accès Montréal et le Comptoir des permis, le 16/12/2024, Montréal-Nord",2024-12-16T17:17:16.363000,2025-04-15T18:17:16.363000,"Parcs et bâtiments municipaux","Services des communications","https://montreal.ca/alertes/erratum-fermeture-temporaire-bureau-acces-montreal-et-le-comptoir-des-permis-le-16122024-montrealnord-20241216123448"
"Fermeture temporaire pour le Bureau Accès Montréal et le Comptoir des permis, le 16/12/2024, Rivière-des-Prairies–Pointe-aux-Trembles",2024-12-16T17:41:19.818000,2025-04-15T18:41:19.818000,"Parcs et bâtiments municipaux","Services des communications","https://montreal.ca/alertes/fermeture-temporaire-pour-le-bureau-acces-montreal-et-le-comptoir-des-permis-le-16122024-rivieredesprairiespointeauxtrembles-20241216124458"
"Coupure d'eau – Avenue Querbes, entre les avenues Lajoie et Van Horne – Arrondissement d'Outremont",2024-12-16T21:01:55.577000,2025-04-15T22:01:55.577000,"Eau et aqueduc","Services des communications","https://montreal.ca/alertes/coupure-deau-avenue-querbes-entre-les-avenues-lajoie-et-van-horne-arrondissement-doutremont-20241216160428"
"Fermeture de la circulation – Avenue Querbes, entre les avenues Lajoie et Van Horne – Arrondissement d'Outremont",2024-12-16T20:55:46.142000,2025-04-15T21:55:46.142000,"Circulation et transport","Services des communications","https://montreal.ca/alertes/fermeture-de-la-circulation-avenue-querbes-entre-les-avenues-lajoie-et-van-horne-arrondissement-doutremont-20241216160545"
"Panne électrique : centre d’hébergement d’urgence et conseils de prévention – 16/12/2024",2024-12-16T22:50:04.869000,2025-04-15T23:50:04.869000,"Parcs et bâtiments municipaux","Services des communications","https://montreal.ca/alertes/panne-electrique-centre-dhebergement-durgence-et-conseils-de-prevention-16122024-20241216175806"
"Fermeture de la circulation – Rue Saint-Denis, entre le boulevard De Maisonneuve et la rue Sainte-Catherine, arrondissement de Ville-Marie",2024-12-17T13:46:25.098000,2025-04-16T14:46:25.098000,"Circulation et transport","Services des communications","https://montreal.ca/alertes/fermeture-de-la-circulation-rue-saintdenis-entre-le-boulevard-de-maisonneuve-et-la-rue-saintecatherine-arrondissement-de-villemarie-20241217085029"
"Fermeture de la circulation – Boulevard Saint-Laurent, entre les rues Saint-Jacques et Notre-Dame Ouest – Arrondissement de Ville-Marie",2024-12-17T14:04:26.670000,2025-04-16T15:04:26.670000,"Circulation et transport","Services des communications","https://montreal.ca/alertes/fermeture-de-la-circulation-boulevard-saintlaurent-entre-les-rues-saintjacques-et-notredame-ouest-arrondissement-de-villemarie-20241217090450"
"Fermeture à ‌la‌ ‌circulation sur la rue Jean-Rivard et les 13e et 14e Avenues, Villeray-Saint-Michel-Parc-Extension",2024-12-17T17:13:13.316000,2025-04-16T18:13:13.316000,"Circulation et transport","Services des communications","https://montreal.ca/alertes/fermeture-a-la-circulation-sur-la-rue-jeanrivard-et-les-13e-et-14e-avenues-villeraysaintmichelparcextension-20241217122412"
"MISE À JOUR - Fermeture de la circulation – Boulevard Lasalle, entre les rues Hickson et Troy, arrondissement de Verdun",2024-12-12T20:26:11.726000,2025-04-11T21:26:11.726000,"Circulation et transport","Services des communications","https://montreal.ca/alertes/mise-a-jour-fermeture-de-la-circulation-boulevard-lasalle-entre-les-rues-hickson-et-troy-arrondissement-de-verdun-20241212152741"
"Horaire spécial pour la piscine Pierre-Lorange, le 17/12/2024, Arrondissement de Mercier-Hochelaga-Maisonneuve",2024-12-17T18:40:49.918000,2025-04-16T19:40:49.918000,"Parcs et bâtiments municipaux","Services des communications","https://montreal.ca/alertes/horaire-special-pour-la-piscine-pierrelorange-le-17122024-arrondissement-de-mercierhochelagamaisonneuve-20241217134216"
"Avis préventif d’ébullition d’eau – Rue du Notaire-Girard, rue Maricourt et rue Thierry, arrondissement de Saint-Léonard",2024-12-17T22:31:47.592000,2025-04-16T23:31:47.592000,"Urgence","Services des communications","https://montreal.ca/alertes/avis-preventif-debullition-deau-rue-du-notairegirard-rue-maricourt-et-rue-thierry-arrondissement-de-saintleonard-20241217174743"
"Fermeture de la circulation – Avenue McEachran, entre les avenues Bernard et Lajoie, le 18/12/2024, arrondissement d'Outremont",2024-12-18T19:06:32.437000,2025-04-17T20:06:32.437000,"Circulation et transport","Services des communications","https://montreal.ca/alertes/fermeture-de-la-circulation-avenue-mceachran-entre-les-avenues-bernard-et-lajoie-le-18122024-arrondissement-doutremont-20241218140838"
"Coupure d'eau – Avenue Morgan, entre les rues Sainte-Catherine Est et Adam, le 18/12/2024, arrondissement de Mercier-Hochelaga-Maisonneuve",2024-12-18T20:56:51.027000,2025-04-17T21:56:51.027000,"Eau et aqueduc","Services des communications","https://montreal.ca/alertes/coupure-deau-avenue-morgan-entre-les-rues-saintecatherine-est-et-adam-le-18122024-arrondissement-de-mercierhochelagamaisonneuve-20241218160011"
"Horaire spécial pour la piscine du Centre sportif de la Petite-Bourgogne, le 18/12/2024, arrondissement Le Sud-Ouest",2024-12-18T21:23:22.655000,2025-04-17T22:23:22.655000,"Parcs et bâtiments municipaux","Services des communications","https://montreal.ca/alertes/horaire-special-pour-la-piscine-du-centre-sportif-de-la-petitebourgogne-le-18122024-arrondissement-le-sudouest-20241218163517"
"Fin de la coupure d'eau – Avenue Morgan, et rue Adam, arrondissement de Mercier-Hochelaga-Mai",2024-12-19T12:10:01.617000,2025-04-18T13:10:01.617000,"Eau et aqueduc","Services des communications","https://montreal.ca/alertes/fin-de-la-coupure-deau-avenue-morgan-et-rue-adam-arrondissement-de-mercierhochelagamai-20241219071432"
"MISE À JOUR - Entraves à la circulation – Rue Sherbrooke Est, entre l'avenue Bourbonnière et la rue Viau",2024-12-13T14:12:52.260000,2025-04-12T15:12:52.260000,"Circulation et transport","Services des communications","https://montreal.ca/alertes/mise-a-jour-entraves-a-la-circulation-rue-sherbrooke-est-entre-lavenue-bourbonniere-et-la-rue-viau-20241213093434"
"Horaire spécial pour le Complexe Aquatique de Rosemont, arrondissement de Rosemont-La Petite-Patrie",2024-12-20T16:46:47.757000,2025-04-19T17:46:47.757000,"Parcs et bâtiments municipaux","Services des communications","https://montreal.ca/alertes/horaire-special-pour-le-complexe-aquatique-de-rosemont-arrondissement-de-rosemontla-petitepatrie-20241220120105"
"Entrave à la circulation – Avenue Decelles, entre le chemin de la Côte-des-Neiges et l'avenue Troie – Côte-des-Neiges–Notre-Dame-de-Grâce",2024-12-20T17:10:49.663000,2025-04-19T18:10:49.663000,"Circulation et transport","Services des communications","https://montreal.ca/alertes/entrave-a-la-circulation-avenue-decelles-entre-le-chemin-de-la-cotedesneiges-et-lavenue-troie-cotedesneigesnotredamedegrace-20241220134339"
"Avis préventif d’ébullition d’eau – Boulevard Gouin Ouest, du 17015 au 17195, arrondissement de Pierrefonds-Roxboro",2024-12-20T20:58:32.086000,2025-04-19T21:58:32.086000,"Urgence","Services des communications","https://montreal.ca/alertes/avis-preventif-debullition-deau-boulevard-gouin-ouest-du-17015-au-17195-arrondissement-de-pierrefondsroxboro-20241220161046"
"Enneigement des buttes de glissade dans certains parcs, dès le 22/12/2024, arrondissement de Mercier-Hochelaga-Maisonneuve",2024-12-20T20:23:51.340000,2025-04-19T21:23:51.340000,"Parcs et bâtiments municipaux","Services des communications","https://montreal.ca/alertes/enneigement-des-buttes-de-glissade-dans-certains-parcs-des-le-22122024-arrondissement-de-mercierhochelagamaisonneuve-20241221081712"
"PROLONGATION Entrave à la circulation – Avenue Decelles, entre le chemin de la Côte-des-Neiges et l'avenue Troie – CdN–NDG",2024-12-22T00:33:05.614000,2025-04-21T01:33:05.614000,"Circulation et transport","Services des communications","https://montreal.ca/alertes/prolongation-entrave-a-la-circulation-avenue-decelles-entre-le-chemin-de-la-cotedesneiges-et-lavenue-troie-cdnndg-20241221193652"
"Collectes du 25/12/2024 et du 01/01/2025 reportées, arrondissement de Rosemont–La Petite-Patrie",2024-12-20T14:58:58.490000,2025-04-19T15:58:58.490000,"Déchets et recyclage","Services des communications","https://montreal.ca/alertes/collectes-du-25122024-et-du-01012025-reportees-arrondissement-de-rosemontla-petitepatrie-20241223091314"
"Avis préventif d’ébullition d’eau – Rue Waverly et rue Chabanel Ouest – Arrondissement d'Ahuntsic-Cartierville",2024-12-24T03:29:58.265000,2025-04-23T04:29:58.265000,"Urgence","Services des communications","https://montreal.ca/alertes/avis-preventif-debullition-deau-rue-waverly-et-rue-chabanel-ouest-arrondissement-dahuntsiccartierville-20241223224205"
"Fermeture de la patinoire Bleu Blanc Bouge du parc Le Carignan, le 24-25/12/2024 – Arrondissement de Montréal-Nord",2024-12-24T13:57:55.183000,2025-04-23T14:57:55.183000,"Parcs et bâtiments municipaux","Services des communications","https://montreal.ca/alertes/fermeture-de-la-patinoire-bleu-blanc-bouge-du-parc-le-carignan-le-2425122024-arrondissement-de-montrealnord-20241224090224"
"RAPPEL – Horaire spécial de certaines collectes – Arrondissement d'Ahuntsic-Cartierville",2024-12-24T19:15:28.406000,2025-04-23T20:15:28.406000,"Déchets et recyclage","Services des communications","https://montreal.ca/alertes/rappel-horaire-special-de-certaines-collectes-arrondissement-dahuntsiccartierville-20241224142011"
"Coupure d'eau – Boulevard Métropolitain, entre le boulevard Ray-Lawson et la rue Pauline-Vanier – Arrondissement d'Anjou",2024-12-24T21:20:03.867000,2025-04-23T22:20:03.867000,"Eau et aqueduc","Services des communications","https://montreal.ca/alertes/coupure-deau-boulevard-metropolitain-entre-le-boulevard-raylawson-et-la-rue-paulinevanier-arrondissement-danjou-20241224164515"
"Entrave à la circulation – Boulevard Métropolitain, entre le boulevard Ray-Lawson et la rue Pauline-Vanier –  Arrondissement d'Anjou",2024-12-24T21:34:54.681000,2025-04-23T22:34:54.681000,"Circulation et transport","Services des communications","https://montreal.ca/alertes/entrave-a-la-circulation-boulevard-metropolitain-entre-le-boulevard-raylawson-et-la-rue-paulinevanier-arrondissement-danjou-20241224164525"
"Coupure d'eau – Boulevard Lacordaire, entre la rue Jarry Est et la rue des Galets – Arrondissement de Saint-Léonard",2024-12-25T21:13:15.571000,2025-04-24T22:13:15.571000,"Eau et aqueduc","Services des communications","https://montreal.ca/alertes/coupure-deau-boulevard-lacordaire-entre-la-rue-jarry-est-et-la-rue-des-galets-arrondissement-de-saintleonard-20241225162456"
"Avis préventif d’ébullition d’eau – Boulevard Lacordaire, entre la rue Jarry Est et la rue des Galets – Arrondissement de Saint-Léonard",2024-12-25T21:29:17.941000,2025-04-24T22:29:17.941000,"Urgence","Services des communications","https://montreal.ca/alertes/avis-preventif-debullition-deau-boulevard-lacordaire-entre-la-rue-jarry-est-et-la-rue-des-galets-arrondissement-de-saintleonard-20241225163359"
"Fin de l'avis préventif d’ébullition de l’eau – Boulevard Gouin Ouest, du 17015 au 17195 – Arrondissement de Pierrefonds-Roxboro",2024-12-26T20:24:55.054000,2025-04-25T21:24:55.054000,"Urgence","Services des communications","https://montreal.ca/alertes/fin-de-lavis-preventif-debullition-de-leau-boulevard-gouin-ouest-du-17015-au-17195-arrondissement-de-pierrefondsroxboro-20241226153137"
"Opérations de chargement de la neige dans l'arrondissement de Saint-Léonard, le 26/12/2024",2024-12-26T22:08:28.935000,2025-04-25T23:08:28.935000,"Déneigement","Services des communications","https://montreal.ca/alertes/operations-de-chargement-de-la-neige-dans-larrondissement-de-saintleonard-le-26122024-20241226184640"
"Horaire spécial pour la pataugeoire du Centre Père-Marquette, le 27/12/2024, arrondissement de Rosemont–La Petite-Patrie",2024-12-27T18:19:38.390000,2025-04-26T19:19:38.390000,"Parcs et bâtiments municipaux","Services des communications","https://montreal.ca/alertes/horaire-special-pour-la-pataugeoire-du-centre-peremarquette-le-27122024-arrondissement-de-rosemontla-petitepatrie-20241227133430"
"Fin de l'avis préventif d’ébullition de l’eau – Rue Waverly et rue Chabanel Ouest – Arrondissement d'Ahuntsic-Cartierville",2024-12-28T20:55:34.028000,2025-04-27T21:55:34.028000,"Urgence","Services des communications","https://montreal.ca/alertes/fin-de-lavis-preventif-debullition-de-leau-rue-waverly-et-rue-chabanel-ouest-arrondissement-dahuntsiccartierville-20241228155601"
"Fermeture de la circulation – Boulevard Métropolitain, entre boulevard Viau et boulevard Provencher, direction ouest – Arr. de Saint-Léonard",2024-12-29T16:04:09.364000,2025-04-28T17:04:09.364000,"Circulation et transport","Services des communications","https://montreal.ca/alertes/fermeture-de-la-circulation-boulevard-metropolitain-entre-boulevard-viau-et-boulevard-provencher-direction-ouest-arr-de-saintleonard-20241229111144"
"Avis préventif d’ébullition d’eau – 7171 rue Jean-Talon Est, arrondissement d'Anjou",2024-12-29T18:35:16.685000,2025-04-28T19:35:16.685000,"Urgence","Services des communications","https://montreal.ca/alertes/avis-preventif-debullition-deau-7171-rue-jeantalon-est-arrondissement-danjou-20241229133605"
"Coupure d'eau – Avenue Connaught, entre les avenues de Chester et Fielding, arrondissement de Côte-des-Neiges–Notre-Dame-de-Grâce",2024-12-29T20:01:34.684000,2025-04-28T21:01:34.684000,"Eau et aqueduc","Services des communications","https://montreal.ca/alertes/coupure-deau-avenue-connaught-entre-les-avenues-de-chester-et-fielding-arrondissement-de-cotedesneigesnotredamedegrace-20241229150655"
"Avis préventif de non-consommation d'eau  – 3303 à 3333 Chemin de la Côte-de-Liesse, arrondissement de Saint-Laurent",2024-12-29T21:21:01.798000,2025-04-28T22:21:01.798000,"Urgence","Services des communications","https://montreal.ca/alertes/avis-preventif-de-nonconsommation-deau-3303-a-3333-chemin-de-la-cotedeliesse-arrondissement-de-saintlaurent-20241229162323"
"Collectes du 1er janvier 2025 reportées, arrondissement de Rosemont–La Petite-Patrie",2024-12-26T14:16:54.510000,2025-04-25T15:16:54.510000,"Déchets et recyclage","Services des communications","https://montreal.ca/alertes/collectes-du-1er-janvier-2025-reportees-arrondissement-de-rosemontla-petitepatrie-20241230090618"
"Fin de l'avis préventif d’ébullition de l’eau – Rue du Notaire-Girard, rue Maricourt et rue Thierry, arrondissement de Saint-Léonard",2024-12-30T20:48:36.979000,2025-04-29T21:48:36.979000,"Urgence","Services des communications","https://montreal.ca/alertes/fin-de-lavis-preventif-debullition-de-leau-rue-du-notairegirard-rue-maricourt-et-rue-thierry-arrondissement-de-saintleonard-20241230155155"
"Fin de l'avis préventif d’ébullition de l’eau – Boulevard Lacordaire, entre la rue Jarry Est et la rue des Galets – Arr. de Saint-Léonard",2024-12-30T20:58:38.040000,2025-04-29T21:58:38.040000,"Urgence","Services des communications","https://montreal.ca/alertes/fin-de-lavis-preventif-debullition-de-leau-boulevard-lacordaire-entre-la-rue-jarry-est-et-la-rue-des-galets-arr-de-saintleonard-20241230155948"
"Avis préventif d’ébullition d’eau – Boulevard Métropolitain Est, arrondissement de Saint-Léonard",2024-12-30T22:37:29.567000,2025-04-29T23:37:29.567000,"Urgence","Services des communications","https://montreal.ca/alertes/avis-preventif-debullition-deau-boulevard-metropolitain-est-arrondissement-de-saintleonard-20241230174012"
"Coupure d'eau – 40 Avenue et rue Forsyth, arrondissement de Rivière-des-Prairies–Pointe-aux-Trembles",2024-12-31T17:32:42.693000,2025-04-30T18:32:42.693000,"Eau et aqueduc","Services des communications","https://montreal.ca/alertes/coupure-deau-40-avenue-et-rue-forsyth-arrondissement-de-rivieredesprairiespointeauxtrembles-20241231124317"
"Fin de l'avis préventif de non-consommation de l’eau –  3303 à 3333 Chemin de la Côte-de-Liesse, arrondissement de Saint-Laurent",2025-01-01T00:02:44.415000,2025-05-01T01:02:44.415000,"Urgence","Services des communications","https://montreal.ca/alertes/fin-de-lavis-preventif-de-nonconsommation-de-leau-3303-a-3333-chemin-de-la-cotedeliesse-arrondissement-de-saintlaurent-20241231190328"
"MISE À JOUR - Fermeture de la circulation – Avenue Fielding, entre les avenues Connaught et Trenholme – Côte-des-Neiges–Notre-de-Grâce",2024-12-29T19:52:50.723000,2025-04-28T20:52:50.723000,"Circulation et transport","Services des communications","https://montreal.ca/alertes/mise-a-jour-fermeture-de-la-circulation-avenue-fielding-entre-les-avenues-connaught-et-trenholme-cotedesneigesnotredegrace-20241229145822"
"Avis préventif d’ébullition d’eau – Boulevard Saint-Michel, entre rue Monselet et avenue Prieur Est, Villeray–Saint-Michel–Parc-Extension",2025-01-01T15:31:28.755000,2025-05-01T16:31:28.755000,"Urgence","Services des communications","https://montreal.ca/alertes/avis-preventif-debullition-deau-boulevard-saintmichel-entre-rue-monselet-et-avenue-prieur-est-villeraysaintmichelparcextension-20250101103448"
"MISE À JOUR - Entraves à la circulation – Rue Sherbrooke Est, entre l'avenue Bourbonnière et la rue Viau, RLPP et MHM",2024-12-19T19:15:49.546000,2025-04-18T20:15:49.546000,"Circulation et transport","Services des communications","https://montreal.ca/alertes/mise-a-jour-entraves-a-la-circulation-rue-sherbrooke-est-entre-lavenue-bourbonniere-et-la-rue-viau-rlpp-et-mhm-20250103095038"
"Fermetures à ‌la‌ ‌circulation sur l’avenue Louis-Hébert et la rue de Bellechasse, arrondissement Rosemont–La Petite-Patrie",2025-01-03T16:48:13.058000,2025-05-03T17:48:13.058000,"Circulation et transport","Services des communications","https://montreal.ca/alertes/fermetures-a-la-circulation-sur-lavenue-louishebert-et-la-rue-de-bellechasse-arrondissement-rosemontla-petitepatrie-20250103115352"
"Collecte des sapins de Noël  – Arrondissement d'Outremont",2025-01-04T17:13:26.725000,2025-05-04T18:13:26.725000,"Déchets et recyclage","Services des communications","https://montreal.ca/alertes/collecte-des-sapins-de-noel-arrondissement-doutremont-20250104121636"
"Avis préventif d’ébullition d’eau – Boulevard Olympia et Fleury, arrondissement Ahuntsic-Cartierville",2025-01-04T22:13:55.994000,2025-05-04T23:13:55.994000,"Urgence","Services des communications","https://montreal.ca/alertes/avis-preventif-debullition-deau-boulevard-olympia-et-fleury-arrondissement-ahuntsiccartierville-20250104171534"
"Coupure d'eau –  Rue de la Commune Est et Place Jacques Cartier, arrondissement de Ville-Marie",2025-01-05T11:53:04.507000,2025-05-05T12:53:04.507000,"Eau et aqueduc","Services des communications","https://montreal.ca/alertes/coupure-deau-rue-de-la-commune-est-et-place-jacques-cartier-arrondissement-de-villemarie-20250105065637"
"Fermeture de la circulation – Rue de la Commune Est et Place Jacques Cartier, arrondissement de Ville-Marie",2025-01-05T12:02:51.223000,2025-05-05T13:02:51.223000,"Circulation et transport","Services des communications","https://montreal.ca/alertes/fermeture-de-la-circulation-rue-de-la-commune-est-et-place-jacques-cartier-arrondissement-de-villemarie-20250105070506"
"ANNULÉ - Fermeture de la circulation – Avenue de Monkland, entre Grand boulevard et l'avenue Beaconsfield – Côte-des-Neiges–Notre-Dame-d...",2025-01-01T15:15:33.692000,2025-05-01T16:15:33.692000,"Circulation et transport","Services des communications","https://montreal.ca/alertes/annule-fermeture-de-la-circulation-avenue-de-monkland-entre-grand-boulevard-et-lavenue-beaconsfield-cotedesneigesnotredamed-20250101103524"
"Fermeture de la circulation – Rue Wellington, entre le passage Albert-Denault et la rue Gilberte-Dubé, arrondissement de Verdun",2024-12-18T16:48:41.115000,2025-04-17T17:48:41.115000,"Circulation et transport","Services des communications","https://montreal.ca/alertes/fermeture-de-la-circulation-rue-wellington-entre-le-passage-albertdenault-et-la-rue-gilbertedube-arrondissement-de-verdun-20250106091041"
"Entrave à la circulation – Rue Wellington, direction Ouest, entre la 4e Avenue et la 6e Avenue, arrondissement de Verdun",2025-01-06T14:49:21.882000,2025-05-06T15:49:21.882000,"Circulation et transport","Services des communications","https://montreal.ca/alertes/entrave-a-la-circulation-rue-wellington-direction-ouest-entre-la-4e-avenue-et-la-6e-avenue-arrondissement-de-verdun-20250106095344"
"Fermeture de la circulation – Rue Ouimet, entre les rues Leclair et Crawford, le 07/01/2025, arrondissement de Verdun",2025-01-06T18:37:09.402000,2025-05-06T19:37:09.402000,"Circulation et transport","Services des communications","https://montreal.ca/alertes/fermeture-de-la-circulation-rue-ouimet-entre-les-rues-leclair-et-crawford-le-07012025-arrondissement-de-verdun-20250106133949"
"Coupure d'eau – Boulevards Langelier, des Grandes-Prairies et Couture, arrondissement de Saint-Léonard",2025-01-07T13:40:59.229000,2025-05-07T14:40:59.229000,"Eau et aqueduc","Services des communications","https://montreal.ca/alertes/coupure-deau-boulevards-langelier-des-grandesprairies-et-couture-arrondissement-de-saintleonard-20250107085322"
"Avis préventif d’ébullition d’eau – Boulevards Langelier, des Grandes-Prairies et Couture, arrondissement de Saint-Léonard",2025-01-07T13:59:12.978000,2025-05-07T14:59:12.978000,"Urgence","Services des communications","https://montreal.ca/alertes/avis-preventif-debullition-deau-boulevards-langelier-des-grandesprairies-et-couture-arrondissement-de-saintleonard-20250107090356"
"Avis préventif d’ébullition d’eau – Rue Hochelaga et avenue Jeanne-d'Arc, arrondissement de Mercier–Hochelaga-Maisonneuve",2025-01-07T17:54:10.926000,2025-05-07T18:54:10.926000,"Urgence","Services des communications","https://montreal.ca/alertes/avis-preventif-debullition-deau-rue-hochelaga-et-avenue-jeannedarc-arrondissement-de-mercierhochelagamaisonneuve-20250107130314"
"Fermeture de la circulation – Rue Sherbrooke Est, entre l'avenue Papineau et la rue Cartier, du 10 au 14/01/2025, arr. de Ville-Marie",2025-01-07T21:27:53.266000,2025-05-07T22:27:53.266000,"Circulation et transport","Services des communications","https://montreal.ca/alertes/fermeture-de-la-circulation-rue-sherbrooke-est-entre-lavenue-papineau-et-la-rue-cartier-du-10-au-14012025-arr-de-villemarie-20250107163153"
"Fin de l'avis préventif d’ébullition de l’eau – Boulevard Métropolitain Est, arrondissement de Saint-Léonard",2025-01-08T11:40:56.053000,2025-05-08T12:40:56.053000,"Urgence","Services des communications","https://montreal.ca/alertes/fin-de-lavis-preventif-debullition-de-leau-boulevard-metropolitain-est-arrondissement-de-saintleonard-20250108064207"
"Fin de l'avis préventif d’ébullition de l’eau – Boulevard Lacordaire, entre la rue Jarry Est et la rue des Galets – Arr. de Saint-Léonard",2025-01-08T11:51:51.693000,2025-05-08T12:51:51.693000,"Urgence","Services des communications","https://montreal.ca/alertes/fin-de-lavis-preventif-debullition-de-leau-boulevard-lacordaire-entre-la-rue-jarry-est-et-la-rue-des-galets-arr-de-saintleonard-20250108065228"
"Fermeture de la circulation – Rue de la Montagne, entre boulevard De Maisonneuve Ouest et rue Sainte-Catherine Ouest – Arr. de Ville-Marie",2025-01-08T14:55:26.612000,2025-05-08T15:55:26.612000,"Circulation et transport","Services des communications","https://montreal.ca/alertes/fermeture-de-la-circulation-rue-de-la-montagne-entre-boulevard-de-maisonneuve-ouest-et-rue-saintecatherine-ouest-arr-de-villemarie-20250108100641"
"Fin de l'avis préventif d’ébullition de l’eau – Boulevard Olympia et Fleury, arrondissement Ahuntsic-Cartierville",2025-01-08T17:27:32.299000,2025-05-08T18:27:32.299000,"Urgence","Services des communications","https://montreal.ca/alertes/fin-de-lavis-preventif-debullition-de-leau-boulevard-olympia-et-fleury-arrondissement-ahuntsiccartierville-20250108122821"
"Fermeture de la circulation – Rue Parthenais, entre boulevard René-Lévesque Est et la rue Tansley – Arrondissement de Ville-Marie",2025-01-08T18:15:44.469000,2025-05-08T19:15:44.469000,"Circulation et transport","Services des communications","https://montreal.ca/alertes/fermeture-de-la-circulation-rue-parthenais-entre-boulevard-renelevesque-est-et-la-rue-tansley-arrondissement-de-villemarie-20250108132354"
