FID,CODE,BUP_NO_BUREA,BUP_NO_REGIO,BUP_NOM_REGIO,BUP_NOM_BUREA,TYPE,BUP_ADR_DGPF,BUP_ADR_QUEBE,BUP_NOM_MUNIC,BUP_CODE_POSTA,SHAPE
Bureaux_protection_faune.fid--36104af1_191566b56df_6fb8,31,02_04,2,Saguenay/Lac-Saint-Jean,Bureau local de Dolbeau-Mistassini,local,"58, rue Savard, Dolbeau-Mistassini, G8L 4L2","58, rue Savard, Dolbeau-Mistassini, G8L 4L2",Dolbeau-Mistassini,G8L4L2,POINT (-72.2033468110308 48.8887356654095)
Bureaux_protection_faune.fid--36104af1_191566b56df_6fb9,32,03_32,3,Capitale-Nationale/Chaudière-Appalaches,Bureau local de Saint-Raymond-de-Portneuf,local,"1012, Grand Rang,  Saint-Raymond, G3L 4J9","1012, Grand Rang,  Saint-Raymond, G3L 4J9",Saint-Raymond,G3L4J9,POINT (-71.8221352251428 46.8584086213794)
Bureaux_protection_faune.fid--36104af1_191566b56df_6fba,33,03_33,3,Capitale-Nationale/Chaudière-Appalaches,Bureau local de Québec,local,"395, 55e Rue Ouest, Québec, G1H 7M8","395, 55e Rue Ouest, Québec, G1H 7M8",Québec,G1H7M8,POINT (-71.2621956997382 46.8464722643969)
Bureaux_protection_faune.fid--36104af1_191566b56df_6fbb,34,03_35,3,Capitale-Nationale/Chaudière-Appalaches,Bureau local de Baie-Saint-Paul,local,"6, chemin de l'Équerre, Baie-Saint-Paul, G3Z 2Y7","6, chemin de l'Équerre, Baie-Saint-Paul, G3Z 2Y7",Baie-Saint-Paul,G3Z2Y7,POINT (-70.5224504435394 47.4478377069546)
Bureaux_protection_faune.fid--36104af1_191566b56df_6fbc,35,03_36,3,Capitale-Nationale/Chaudière-Appalaches,Bureau local de La Malbaie,local,"1915, boul. de Comporté, La Malbaie, G5A 1N9","1915, boul. de Comporté, La Malbaie, G5A 1N9",La Malbaie,G5A1N9,POINT (-70.1845920209662 47.676417169486)
Bureaux_protection_faune.fid--36104af1_191566b56df_6fbd,36,12,12,Capitale-Nationale/Chaudière-Appalaches,Direction de la protection de la faune de la Capitale-Nationale et de la Chaudière-Appalaches,regional,"8400, avenue Sous-le-Vent, Lévis, G6X 3S9","8400, avenue Sous-le-Vent, Lévis, G6X 3S9",Lévis,G6X3S9,POINT (-71.2736928073542 46.724263870831)
Bureaux_protection_faune.fid--36104af1_191566b56df_6fbe,37,12_32,12,Capitale-Nationale/Chaudière-Appalaches,Bureau local de Beauceville,local,"175, 181e rue, Beauceville, G5X 2S9","175, 181e rue, Beauceville, G5X 2S9",Beauceville,G5X2S9,POINT (-70.784733946168 46.2266576471636)
Bureaux_protection_faune.fid--36104af1_191566b56df_6fbf,38,12_34,12,Capitale-Nationale/Chaudière-Appalaches,Bureau local de Montmagny,local,"116, St-Jean-Baptiste Ouest, bureau D, Montmagny, G5V 3B9","116, St-Jean-Baptiste Ouest, Montmagny, G5V 3B9",Montmagny,G5V3B9,POINT (-70.5706776058579 46.9764068434612)
Bureaux_protection_faune.fid--36104af1_191566b56df_6fc0,39,12_35,12,Capitale-Nationale/Chaudière-Appalaches,Bureau local Laurier-Station,local,"186, boulevard Laurier Est,  Laurier-Station, G0S 1N0","186, boulevard Laurier Est,  Laurier-Station, G0S 1N0",Laurier-Station,G0S1N0,POINT (-71.6249625360122 46.5437145828832)
Bureaux_protection_faune.fid--36104af1_191566b56df_6fc1,40,12_36,12,Capitale-Nationale/Chaudière-Appalaches,Bureau local de Thetford Mines,local,"1065, rue du Parc, Thetford-Mines, G6H 1A2","1065, rue du Parc, Thetford-Mines, G6H 1A2",Thetford Mines,G6H1A2,POINT (-71.357207455545 46.0680075393172)
Bureaux_protection_faune.fid--36104af1_191566b56df_6fc2,41,04,4,Mauricie/Centre-du-Québec-Lanaudière,"Direction de la protection de la faune de la Mauricie, de Lanaudière et du Centre-du-Québec",regional,"100, rue Laviolette, bureau 207, Trois-Rivières, G9A 5S9","100, rue Laviolette, Trois-Rivières, G9A 5S9",Trois-Rivières,G9A5S9,POINT (-72.5390004619923 46.3442094423475)
Bureaux_protection_faune.fid--36104af1_191566b56df_6fc3,42,04_01,4,Mauricie/Centre-du-Québec-Lanaudière,Bureau local de Shawinigan (dessert aussi Trois-Rivières),local,"605, rue de la Station, Shawinigan, G9N 1V9","605, rue de la Station, Shawinigan, G9N 1V9",Shawinigan,G9N1V9,POINT (-72.7531584114045 46.5415486524005)
Bureaux_protection_faune.fid--36104af1_191566b56df_6fc4,43,04_02,4,Mauricie/Centre-du-Québec-Lanaudière,Bureau local de Saint-Alexis-des-Monts,local,"830, rue Sainte-Anne, 2e étage, Saint-Alexis-des-Monts, J0K 1V0","830, rue Sainte-Anne, Saint-Alexis-des-Monts, J0K 1V0",Saint-Alexis-des-Monts,J0K1V0,POINT (-73.1370915660127 46.4771171056315)
Bureaux_protection_faune.fid--36104af1_191566b56df_6fc5,44,04_07,4,Mauricie/Centre-du-Québec-Lanaudière,Bureau local de Parent (Saisonnier),local,"24, de la Forêt, Parent  G0X 3P0","24, de la Forêt, Parent  G0X 3P0",La Tuque,G0X3P0,POINT (-74.6522533062676 47.9016142906992)
Bureaux_protection_faune.fid--36104af1_191566b56df_6fc6,45,04_03,4,Mauricie/Centre-du-Québec-Lanaudière,Bureau local de La Tuque,local,"660, rue Joffre, La Tuque, G9X 4B4","660, rue Joffre, La Tuque, G9X 4B4",La Tuque,G9X4B4,POINT (-72.7784569797296 47.4358008079359)
Bureaux_protection_faune.fid--36104af1_191566b56df_6fc7,46,14_01,14,Mauricie/Centre-du-Québec-Lanaudière,Bureau local de Joliette,local,"1160, rue Notre-Dame, Joliette, J6E 3K4","1160, rue Notre-Dame, Joliette, J6E 3K4",Joliette,J6E3K4,POINT (-73.4507603134751 46.0160215004126)
Bureaux_protection_faune.fid--36104af1_191566b56df_6fc8,47,14_02,14,Mauricie/Centre-du-Québec-Lanaudière,Bureau local de Saint-Michel-des-Saints,local,"8081-A, rue Brassard, Saint-Michel-des-Saints, J0K 3B0","8081, chemin Brassard, Saint-Michel-des-Saints, J0K 3B0",Saint-Michel-des-Saints,J0K3B0,POINT (-73.9136409149329 46.6594481990037)
Bureaux_protection_faune.fid--36104af1_191566b56df_6fc9,48,17_01,17,Mauricie/Centre-du-Québec-Lanaudière,Bureau local de Victoriaville,local,"985, boulevard Pierre-Roux Est, Bureau 3, Victoriaville, G6T 1T8","985, boulevard Pierre-Roux Est, Victoriaville, G6T 1T8",Victoriaville,G6T1T8,POINT (-71.9456249043456 46.085824002804)
Bureaux_protection_faune.fid--36104af1_191566b56df_6fca,49,17_02,17,Mauricie/Centre-du-Québec-Lanaudière,Bureau local de Drummondville,local,"620, boulevard Saint-Joseph Ouest, Suite 3, Drummondville, J2E 1H5","620, boulevard Saint-Joseph Ouest, Drummondville, J2E 1H5",Drummondville,J2E1H5,POINT (-72.5366210941392 45.9068822764118)
Bureaux_protection_faune.fid--36104af1_191566b56df_6fcb,50,05,5,Estrie/Montréal/Montérégie,Direction de la protection de la faune de lEstrie et de Montréal-Montérégie,regional,"770, rue Goretti, Sherbrooke, J1E 3H4","770, rue Goretti, Sherbrooke, J1E 3H4",Sherbrooke,J1E3H4,POINT (-71.8949551128463 45.4121140691395)
Bureaux_protection_faune.fid--36104af1_191566b56df_6fcc,51,05_51,5,Estrie/Montréal/Montérégie,Bureau local de Lac-Mégantic,local,"3804, rue Laval,  Lac-Mégantic, G6B 1A4","3804, rue Laval,  Lac-Mégantic, G6B 1A4",Lac-Mégantic,G6B1A4,POINT (-70.9000129048657 45.5886564981534)
Bureaux_protection_faune.fid--36104af1_191566b56df_6fcd,52,05_52,5,Estrie/Montréal/Montérégie,Bureau local de Sherbrooke,local,"125, chemin Georges-Vallières, Sherbrooke, J1H 0B7","125, chemin Georges-Vallières, Sherbrooke, J1H 0B7",Sherbrooke,J1H0B7,POINT (-71.9714245874744 45.4246727520354)
Bureaux_protection_faune.fid--36104af1_191566b56df_6fce,53,16_01,16,Estrie/Montréal/Montérégie,Bureau local de Saint-Jean-sur-Richelieu ,local,"640, Dorchester, Suite 80, Saint-Jean-sur-Richelieu, J3B 5A4","640, Dorchester, Suite 80, Saint-Jean-sur-Richelieu, J3B 5A4",Saint-Jean-sur-Richelieu,J3B5A4,POINT (-73.270174661488 45.3201602587295)
Bureaux_protection_faune.fid--36104af1_191566b56df_6fcf,54,16_02,16,Estrie/Montréal/Montérégie,Bureau local de Sorel-Tracy ,local,"410, rue de Ramesay, Sorel-Tracy, J3P 8B3","410, rue de Ramesay, Sorel-Tracy, J3P 8B3",Sorel-Tracy,J3P8B3,POINT (-73.1082011433113 46.0279052398673)
Bureaux_protection_faune.fid--36104af1_191566b56df_6fd0,55,16_04,16,Estrie/Montréal/Montérégie,Bureau local de Salaberry-de-Valleyfield ,local,"5400 Avenue Pierre-Dansereau, Salaberry-de-Valleyfield J6S0M1","5400 Avenue Pierre-Dansereau, Salaberry-de-Valleyfield J6S0M1",Salaberry-de-Valleyfield,J6S0M1,POINT (-74.029166 45.288026)
Bureaux_protection_faune.fid--36104af1_191566b56df_6fd1,56,16_05,16,Estrie/Montréal/Montérégie,Bureau local de Granby,local,"329, rue Racine, Granby, J2G 3B6","329, rue Racine, Granby, J2G 3B6",Granby,J2G3B6,POINT (-72.7320026850427 45.4007833546839)
Bureaux_protection_faune.fid--36104af1_191566b56df_6fd2,57,07,7,Outaouais/Laurentides,"Direction de la protection de la faune de lOutaouais, de Laval et des Laurentides",regional,"16, Impasse de la Gare-Talon, RC 100, Gatineau, J8T 0B1","16, Impasse de la Gare-Talon, RC 100, Gatineau, J8T 0B1",Gatineau,J8T0B1,POINT (-75.6890244930528 45.481196907969)
Bureaux_protection_faune.fid--36104af1_191566b56df_6fd3,58,07_01,7,Outaouais/Laurentides,Bureau local de Gatineau ,local,"33, rue Jean Proulx, bureau RC 1, Gatineau, J8Z 1X1","33, rue Jean Proulx, Gatineau, J8Z 1X1",Gatineau,J8Z1X1,POINT (-75.7433221500482 45.4661101712537)
Bureaux_protection_faune.fid--36104af1_191566b56df_6fd4,59,07_02,7,Outaouais/Laurentides,Bureau local de Campbells Bay ,local,"1290-A Route 148 RR2, Campbell's Bay, J0X 1K0","1290-A Route 148, Campbell's Bay, J0X 1K0",Campbell's Bay,J0X1K0,POINT (-76.5960176323232 45.7253341766528)
Bureaux_protection_faune.fid--36104af1_191566b56df_6fd5,60,07_08,7,Outaouais/Laurentides,Bureau local de Maniwaki,local,"88, rue Roy, Maniwaki, J9E 2M5","88, rue Roy, Maniwaki, J9E 2M5",Maniwaki,J9E2M4,POINT (-75.973698717382 46.378608919069)
Bureaux_protection_faune.fid--36104af1_191566b56df_6fd6,61,07_09,7,Outaouais/Laurentides,Bureau local de Papineauville ,local,"208, Henri-Bourassa - C.P. 300, Papineauville, J0V 1R0","208, Henri-Bourassa, Papineauville, J0V 1R0",Papineauville,J0V1R0,POINT (-75.0165485629225 45.6197487061936)
Bureaux_protection_faune.fid--36104af1_191566b56df_6fd7,62,15_02,15,Outaouais/Laurentides,Bureau local de Saint-Jérôme,local,"999, rue Nobel, local 1.50B, Saint-Jérôme, J7Z 7A3","999, rue Nobel, Saint-Jérôme, J7Z 7A3",Saint-Jérôme,J7Z7A3,POINT (-73.9882257531132 45.7563935309624)
Bureaux_protection_faune.fid--36104af1_191566b56df_6fd8,63,15_03,15,Outaouais/Laurentides,Bureau local de Labelle,local,"5497, boulevard Curé-Labelle, Labelle, J0T 1H0","5497, boulevard Curé-Labelle, Labelle, J0T 1H0",Labelle,J0T1H0,POINT (-74.725163988518 46.2649713154894)
Bureaux_protection_faune.fid--36104af1_191566b56df_6fd9,64,15_04,15,Outaouais/Laurentides,Bureau local de Mont-Laurier,local,"435, rue Panet, Mont-Laurier, J9L 2Z9","435, rue Panet, Mont-Laurier, J9L 2Z9",Mont-Laurier,J9L2Z9,POINT (-75.4877203892529 46.5530729468304)
Bureaux_protection_faune.fid--36104af1_191566b56df_6fda,65,08,8,Abitibi-Témiscamingue,Direction de la protection de la faune de lAbitibi-Témiscamingue,regional,"70, avenue Québec, Rouyn-Noranda, J9X 6R1","70, avenue Québec, Rouyn-Noranda, J9X 6R1",Rouyn-Noranda,J9X6R1,POINT (-79.0276954119744 48.2416768995558)
Bureaux_protection_faune.fid--36104af1_191566b56df_6fdb,66,08_01,8,Abitibi-Témiscamingue,Bureau local de Rouyn-Noranda,local,"165, 7e Rue, Rouyn-Noranda, J9X 1Z8","165, 7e Rue, Rouyn-Noranda, J9X 1Z8",Rouyn-Noranda,J9X1Z8,POINT (-79.0163763758295 48.2481907568394)
Bureaux_protection_faune.fid--36104af1_191566b56df_6fdc,67,08_02,8,Abitibi-Témiscamingue,Bureau local de Ville-Marie,local,"23, rue Industrielle, Ville-Marie, J9V 1S3","23, rue Industrielle, Ville-Marie, J9V 1S3",Ville-Marie,J9V1S3,POINT (-79.4318547723337 47.3281186760942)
Bureaux_protection_faune.fid--36104af1_191566b56df_6fdd,68,08_03,8,Abitibi-Témiscamingue,Bureau local de Témiscaming,local,"31, chemin Du Ruisseau Gordon, C.P. 850, Témiscaming, J0Z 3R0","31, chemin Du Ruisseau Gordon, Témiscaming, J0Z 3R0",Témiscaming,J0Z3R0,POINT (-79.0926526391401 46.7239486277179)
Bureaux_protection_faune.fid--36104af1_191566b56df_6fde,69,08_04,8,Abitibi-Témiscamingue,Bureau local de La Sarre,local,"622, 2e rue Est, La Sarre, J9Z 2S5","622, 2e rue Est, La Sarre, J9Z 2S5",La Sarre,J9Z2S5,POINT (-79.2009316111865 48.7906325508348)
Bureaux_protection_faune.fid--36104af1_191566b56df_6fdf,70,08_05,8,Abitibi-Témiscamingue,Bureau local dAmos,local,"41, rue des Papetiers, Amos, J9T 0A4","41, rue des Papetiers, Amos, J9T 0A4",Amos,J9T0A4,POINT (-78.1499786648521 48.5608074617689)
Bureaux_protection_faune.fid--36104af1_191566b56df_6fe0,71,08_06,8,Abitibi-Témiscamingue,Bureau local de Val-dOr,local,"1155, rue des Foreurs, Val d'Or, J9P 6X9","1155, rue des Foreurs, Val d'Or, J9P 6X9",Val-d'Or,J9P6X9,POINT (-77.7918115451972 48.1117531508072)
Bureaux_protection_faune.fid--36104af1_191566b56df_6fe1,72,08_07,8,Abitibi-Témiscamingue,Bureau local de Senneterre,local,"481, 7e Avenue Ouest, C.P. 68, Senneterre, J0Y 2M0","481, 7e Avenue Ouest, Senneterre, J0Y 2M0",Senneterre,J0Y2M0,POINT (-77.2391867955924 48.3872921296345)
Bureaux_protection_faune.fid--36104af1_191566b56df_6fe2,73,09,9,Côte-Nord,Direction de la protection de la faune de la Côte-Nord,regional,"456, rue Arnaud, bureau 1.03, Sept-Iles, G4R 3B1","456, rue Arnaud, Sept-Iles, G4R 3B1",Sept-Îles,G4R3B1,POINT (-66.3863367696467 50.2050298361887)
Bureaux_protection_faune.fid--36104af1_191566b56df_6fe3,74,09_10,9,Côte-Nord,Bureau local de Schefferville (Saisonnier),local,"73, route 138, Forestville, G0T 1E0","73, route 138, Forestville, G0T 1E0",Forestville,G0T1E0,POINT (-69.0912353252357 48.7349432787473)
Bureaux_protection_faune.fid--36104af1_191566b56df_6fe4,75,09_20,9,Côte-Nord,Bureau local de Baie-Comeau,local,"20, boulevard Comeau, 1er étage, Baie-Comeau, G4Z 3A8","20, boulevard Comeau, Baie-Comeau, G4Z 3A8",Baie-Comeau,G4Z3A8,POINT (-68.196724408689 49.2174686118285)
Bureaux_protection_faune.fid--36104af1_191566b56df_6fe5,76,09_30,9,Côte-Nord,Bureau local de Sept-Îles,local,"585, boulevard Des Montagnais C.P. 150,  Sept-Îles, G4R 4K3","585, boulevard Des Montagnais, Sept-Îles, G4R 4K3",Sept-Îles,G4R5R2,POINT (-66.3791207541126 50.2367717499443)
Bureaux_protection_faune.fid--36104af1_191566b56df_6fe6,100,10_10,10,Nord-du-Québec,Bureau local de Kuujjuaq,local,"851, rue Kaivivik Circle, 2e étage, bureau A, C.P. 59, Kuujjuaq, J0M 1C0","851, rue Kaivivik Circle, 2e étage, bureau A, C.P. 59, Kuujjuaq, J0M 1C0",Kuujjuaq,J0M1C0,POINT (-68.402821 58.109141)
Bureaux_protection_faune.fid--36104af1_191566b56df_6fe7,1,09_40,9,Côte-Nord,Bureau local de Havre-Saint-Pierre,local,"1325, rue Boréale, Havre-Saint-Pierre, G0G 1P0","1325, rue Boréale, Havre-Saint-Pierre, G0G 1P0",Havre-Saint-Pierre,G0G1P0,POINT (-63.5925114763518 50.2428192075911)
Bureaux_protection_faune.fid--36104af1_191566b56df_6fe8,2,09_41,9,Côte-Nord,Bureau local de Port-Menier (Île-dAnticosti),local,"6, rue Tancrède-Girard C.P. 159, L' Île d'Anticosti, G0G 2Y0","6, rue Tancrède-Girard, L' Île d'Anticosti, G0G 2Y0",L'Île-d'Anticosti,G0G2Y0,POINT (-64.3491537521018 49.8167634121597)
Bureaux_protection_faune.fid--36104af1_191566b56df_6fe9,3,09_42,9,Côte-Nord,Bureau local de La Tabatière (Saisonnier),local,"6, chemin de la Carrière C.P. 50, Gros Mécatina, G0G 1T0","1  Chemin de la Carrière, Gros-Mécatina G0G1T0",Gros-Mécatina,G0G1T0,POINT (-58.9667343663072 50.8314507943141)
Bureaux_protection_faune.fid--36104af1_191566b56df_6fea,4,09_43,9,Côte-Nord,Bureau local de Lourdes-de-Blanc-Sablon (Saisonnier) ,local,"Case postale 249, Blanc-Sablon, G0G 1W0","1065 CAMILLE MARCOULX, LOURDES-DE-BLANC-SABLON QC   G0G 1W0",Blanc-Sablon,G0G1W0,POINT (-57.2038059611108 51.4134809934294)
Bureaux_protection_faune.fid--36104af1_191566b56df_6feb,5,10,10,Nord-du-Québec,Direction de la protection de la faune du Nord-du-Québec,regional,"951, boulevard Hamel, Chibougamau, G8P 2Z3","951, boulevard Hamel, Chibougamau, G8P 2Z3",Chibougamau,G8P2Z3,POINT (-74.3835448858886 49.9060548864903)
Bureaux_protection_faune.fid--36104af1_191566b56df_6fec,6,10_20,10,Nord-du-Québec,Bureau local de Radisson ,local,"149 A, rue Jolliet, C.P. 278, Radisson, J0Y 2X0","149 A, rue Jolliet, Radisson, J0Y 2X0",Gouvernement régional d'Eeyou Istchee Baie-James,J0Y2X0,POINT (-77.6225076933629 53.7938591817479)
Bureaux_protection_faune.fid--36104af1_191566b56df_6fed,7,10_21,10,Nord-du-Québec,Bureau local de Whapmagoostui/Kuujjuarapik,local,"1039, Tukimuaqtuk Street, C.P. 83, Kuujjuarapik, J0M 1G0","1039, Tukimuaqtuk Street, Kuujjuarapik, J0M 1G0",Kuujjuarapik,J0M1G0,POINT (-77.7549942341475 55.2811247305423)
Bureaux_protection_faune.fid--36104af1_191566b56df_6fee,8,10_22,10,Nord-du-Québec,Bureau local de Chisasibi ,local,"Commercial Center, Center Road, C.P. 839, Chisasibi, J0M 1E0","Center Road, Chisasibi, J0M 1E0",Chisasibi,J0M1E0,POINT (-78.8926672180895 53.7840900249913)
Bureaux_protection_faune.fid--36104af1_191566b56df_6fef,9,10_24,10,Nord-du-Québec,Bureau local dEastmain (Saisonnier),local,"41B , rue du Netaochekinn C.P. 94, Eastmain, J0M 1W0","41 , rue du Netaochekinn , Eastmain, J0M 1W0",Eastmain,J0M1W0,POINT (-78.5028686165038 52.2443464859917)
Bureaux_protection_faune.fid--36104af1_191566b56df_6ff0,10,10_30,10,Nord-du-Québec,Bureau local de Matagami,local,"18, rue Nottaway, C.P. 880, Matagami, J0Y 2A0","18, rue Nottaway, Matagami, J0Y 2A0",Matagami,J0Y2A0,POINT (-77.6242339570121 49.7615401472609)
Bureaux_protection_faune.fid--36104af1_191566b56df_6ff1,11,10_40,10,Nord-du-Québec,Bureau local de Chibougamau,local,"951, boulevard Hamel, Chibougamau, G8P 2Z3","951, boulevard Hamel, Chibougamau, G8P 2Z3",Chibougamau,G8P2Z3,POINT (-74.3835448858886 49.9060548864903)
Bureaux_protection_faune.fid--36104af1_191566b56df_6ff2,12,10_50,10,Nord-du-Québec,Bureau local de Lebel-sur-Quévillon,local,"1114 A, boul. Industriel, C.P. 278, Lebel-sur-Quévillon, J0Y 1X0","1114, boul. Industriel, Lebel-sur-Quévillon, J0Y 1X0",Lebel-sur-Quévillon,J0Y1X0,POINT (-76.9877847344704 49.0514480733359)
Bureaux_protection_faune.fid--36104af1_191566b56df_6ff3,13,10_42,10,Nord-du-Québec,Bureau local de Mistissini,local,"32  Amisk, Mistissini G0W1C0","32  Amisk, Mistissini G0W1C0",Mistissini,G0W1C0,POINT (-73.8711033328946 50.4183907589728)
Bureaux_protection_faune.fid--36104af1_191566b56df_6ff4,14,09_31,9,Côte-Nord,Bureau local de Schefferville (Saisonnier),local,"116, rue A.-P.-Low, Schefferville, G0G 2T0","116, rue A.-P.-Low, Schefferville, G0G 2T0",Schefferville,G0G2T0,POINT (-66.8216568060401 54.8027086287808)
Bureaux_protection_faune.fid--36104af1_191566b56df_6ff5,15,01,1,Bas-Saint-Laurent/Gaspésie/Îles-de-la-Madeleine,Direction de la protection de la faune du Bas-Saint-Laurent et de la GaspésieÎles-de-la-Madeleine,regional,"92, 2e Rue Ouest, bureau 207, Rimouski, G5L 8B3","92, 2e Rue Ouest, Rimouski, G5L 8B3",Rimouski,G5L8B3,POINT (-68.521463202604 48.4430889914015)
Bureaux_protection_faune.fid--36104af1_191566b56df_6ff6,16,01_01,1,Bas-Saint-Laurent/Gaspésie/Îles-de-la-Madeleine,Bureau local de Pointe-au-Père,local,"365, boulevard Sainte-Anne, Suite 1, Rimouski, G5M 1E8","365, boulevard Sainte-Anne, Rimouski, G5M 1E8",Rimouski,G5M1E8,POINT (-68.4852293106744 48.4958933686614)
Bureaux_protection_faune.fid--36104af1_191566b56df_6ff7,17,01_08,1,Bas-Saint-Laurent/Gaspésie/Îles-de-la-Madeleine,Bureau local de Causapscal,local,"558A, rue St-Jacques Nord, C.P. 68,  Causapscal, G0J 1J0","558, rue St-Jacques Nord, Causapscal, G0J 1J0",Causapscal,G0J1J0,POINT (-67.2393901726608 48.3699389439929)
Bureaux_protection_faune.fid--36104af1_191566b56df_6ff8,18,01_09,1,Bas-Saint-Laurent/Gaspésie/Îles-de-la-Madeleine,Bureau local de Témiscouata-sur-le-Lac,local,"748A, Montée du Détour, Témiscouata-sur-le-Lac, G0L 1X0","748, Montée du Détour, Témiscouata-sur-le-Lac, G0L 1X0",Témiscouata-sur-le-Lac,G0L1X0,POINT (-68.8105571646343 47.6162426582374)
Bureaux_protection_faune.fid--36104af1_191566b56df_6ff9,19,01_11,1,Bas-Saint-Laurent/Gaspésie/Îles-de-la-Madeleine,Bureau local de La Pocatière,local,"218, route 230 Ouest,  La Pocatière, G0R 1Z0","218, route 230 Ouest,  La Pocatière, G0R 1Z0",La Pocatière,G0R1Z0,POINT (-70.042996599502 47.361702152265)
Bureaux_protection_faune.fid--36104af1_191566b56df_6ffa,20,11_51,11,Bas-Saint-Laurent/Gaspésie/Îles-de-la-Madeleine,Bureau local de Sainte-Anne-des-Monts,local,"204 A, boulevard Sainte-Anne Ouest, Sainte-Anne-des-Monts, G4V 1R9","204 A, boulevard Sainte-Anne Ouest, Sainte-Anne-des-Monts, G4V 1R9",Sainte-Anne-des-Monts,G4V1R9,POINT (-66.4977492303811 49.1226601429396)
Bureaux_protection_faune.fid--36104af1_191566b56df_6ffb,21,11_52,11,Bas-Saint-Laurent/Gaspésie/Îles-de-la-Madeleine,Bureau local de Gaspé,local,"21, rue des Lilas, local 1.03, Gaspé, G4X 2L9","21, rue des Lilas, Gaspé, G4X 2L9",Gaspé,G4X2L9,POINT (-64.4876245570375 48.8032248785092)
Bureaux_protection_faune.fid--36104af1_191566b56df_6ffc,22,11_53,11,Bas-Saint-Laurent/Gaspésie/Îles-de-la-Madeleine,Bureau local de Chandler,local,"230 boul. René-Lévesque Est, Chandler, G0C 1K0","230 boul. René-Lévesque Est, Chandler, G0C 1K0",Chandler,G0C1K0,POINT (-64.6691382569601 48.350553187541)
Bureaux_protection_faune.fid--36104af1_191566b56df_6ffd,23,11_54,11,Bas-Saint-Laurent/Gaspésie/Îles-de-la-Madeleine,Bureau local de New Richmond,local,"308, chemin St-Edgar, New-Richmond, G0C 2B0","308, chemin St-Edgar, New-Richmond, G0C 2B0",New Richmond,G0C2B0,POINT (-65.8235815606876 48.1710246063141)
Bureaux_protection_faune.fid--36104af1_191566b56df_6ffe,24,11_55,11,Bas-Saint-Laurent/Gaspésie/Îles-de-la-Madeleine,Bureau local de Cap-aux-Meules (Saisonnier),local,"125, chemin du Parc, Cap-aux-Meules, G4T 1B3","125, chemin du Parc, Cap-aux-Meules, G4T 1B3",Les Îles-de-la-Madeleine,G4T1B3,POINT (-61.8571806439827 47.3803666966322)
Bureaux_protection_faune.fid--36104af1_191566b56df_6fff,25,11_56,11,Bas-Saint-Laurent/Gaspésie/Îles-de-la-Madeleine,Bureau local de Grande-Vallée,local,"52, rue St-François-Xavier - C.P. 186, Grande-Vallée, G0E 1K0","52, rue St-François-Xavier, Grande-Vallée, G0E 1K0",Grande-Vallée,G0E1K0,POINT (-65.1137411984895 49.2268162541487)
Bureaux_protection_faune.fid--36104af1_191566b56df_7000,26,01_02,11,Bas-Saint-Laurent/Gaspésie/Îles-de-la-Madeleine,Bureau local de Matane,local,"120, rue Fraser, Matane, G4W 3G7","120, rue Fraser, Matane, G4W 3G7",Matane,G4W3G7,POINT (-67.5384149271066 48.8506312980371)
Bureaux_protection_faune.fid--36104af1_191566b56df_7001,27,02,2,Saguenay/Lac-Saint-Jean,Direction de la protection de la faune du SaguenayLac-Saint-Jean,local,"3950, boul. Harvey, 4e étage,  Jonquière, G7X 8L6","3950, boul. Harvey, Jonquière, G7X 8L6",Saguenay,G7X8L6,POINT (-71.2554146077503 48.4145673479823)
Bureaux_protection_faune.fid--36104af1_191566b56df_7002,28,02_01,2,Saguenay/Lac-Saint-Jean,Bureau local de Chicoutimi ,local,"1281, rue Manic - Suite D, Chicoutimi, G7K 1A1","1281, rue Manic, Chicoutimi, G7K 1A1",Saguenay,G7K1A1,POINT (-71.1125596952467 48.3991271457384)
Bureaux_protection_faune.fid--36104af1_191566b56df_7003,29,02_02,2,Saguenay/Lac-Saint-Jean,Bureau local dAlma ,local,"801, ch. Du Pont Taché Nord, Local RC-04,  Alma, G8B 5B7","801, ch. Du Pont Taché Nord, Alma, G8B 5B7",Alma,G8B5B7,POINT (-71.6355404661194 48.5614337963567)
Bureaux_protection_faune.fid--36104af1_191566b56df_7004,30,02_03,2,Saguenay/Lac-Saint-Jean,Bureau local de Roberval,local,"580, avenue Roberval, Roberval, G8H 1J4","580, avenue Roberval, Roberval, G8H 1J4",Roberval,G8H1J4,POINT (-72.2290685591964 48.5106174868844)
