nom_bien,bien_id,url_rpcq,description_bien,synthese_historique,statut_juridique_princ,date_attri_stat_jurid_princ,categorie,autorite_protection,Wkt_Multipoint_XY,no_regn_admin,region_admin,municipalite,adresse,debut_construction,fin_construction,usage_princ,sous_usage,detenteur_photo,auteur_photo,licence_photo,date_licence_photo,url_photo,Wkt_pg_site_classe,maj_pg_site_classe,version_wkt_pg_date
Aqueduc de la Rivière-Saint-Pierre,93276,http://www.patrimoine-culturel.gouv.qc.ca/rpcq/detail.do?methode=consulter&id=93276&type=bien,"L'aqueduc de la Rivière-Saint-Pierre est un ouvrage d'ingénierie construit en 1843 et 1844 pour l'ancien canal de Beauharnois. La structure en pierre de taille est composée d'un tunnel voûté, d'entrées en forme d'arc surbaissé et de murs de soutènement disposés en aile. L'ensemble est situé dans un environnement rural du secteur de Saint-Timothée de la ville de Salaberry-de-Valleyfield, sur la rive sud du fleuve Saint-Laurent.

Ce bien est classé site patrimonial.","L'aqueduc de la Rivière-Saint-Pierre, construit en 1843 et 1844, fait partie de l'ancien canal de Beauharnois. Appartenant à la première génération de structures d'ingénierie au Québec et au Canada, ce dernier a été aménagé entre 1842 et 1845 et avait pour but de faciliter le transport fluvial, essentiel pour le peuplement, la défense et le développement économique de la vallée du Saint-Laurent et de la région des Grands Lacs.

En 1833, le gouvernement du Bas-Canada entreprend une réflexion sur la navigation entre Lachine et Cornwall. La décision de bâtir le canal de Beauharnois, sur la rive sud du fleuve Saint-Laurent, est prise en 1842 par Samuel Keefer (1811-1890), ingénieur en chef du bureau des Travaux publics du Canada-Uni. Cette décision est à la source de « l'affaire du canal de Beauharnois », un scandale politico-financier provoqué par la spéculation touchant les terrains concernés.

La construction du canal commence en juillet 1842. Frederick Preston Rubidge (1806-1897), ingénieur et architecte du bureau des Travaux publics du Canada-Uni, est l'auteur des plans. Pour le réaliser, environ 2 500 immigrants irlandais sont embauchés. Ils s'installent avec leur famille à proximité du chantier. Au printemps 1843, les travailleurs, insatisfaits de leurs conditions, fomentent une grève. Le 12 juin, une manifestation est réprimée dans la violence par l'armée. Plus de 18 morts et quelques dizaines de blessés sont dénombrés. C'est l'un des premiers conflits ouvriers au Québec et au Canada. Les activités reprennent à la fin de juin, sous la surveillance de 300 militaires.

Le canal est ouvert à la navigation en 1845. Neuf écluses permettent de franchir les 18 kilomètres de couloir. L'entrée supérieure est située à Valleyfield (actuellement Salaberry-de-Valleyfield). Elle domine de 24,8 mètres l'entrée inférieure, qui se trouve dans la paroisse Saint-Clément de Beauharnois (actuellement Beauharnois). Dix aqueducs, dont celui de la rivière Saint-Pierre, canalisent les rivières et l'écoulement des fossés sous le canal.

Second maillon du réseau de canalisation du Saint-Laurent après celui de Lachine, le canal de Beauharnois joue un rôle primordial dans l'ouverture du continent nord-américain à la navigation commerciale. Les activités portuaires et les aménagements hydrauliques qui lui sont reliés participent aussi au développement économique, et notamment manufacturier, de Valleyfield et des environs.

La capacité du canal (nombre et tonnage des navires) s'avère toutefois insuffisante. En 1891, le gouvernement fédéral décide de réaliser le canal de Soulanges, sur la rive nord du Saint-Laurent. Ouvert à la navigation en 1899, il relègue celui de Beauharnois à un rôle mineur.

En 1907, le canal de Beauharnois est fermé à la navigation. Sa portion ouest est louée par la Canadian Light and Power, qui aménage entre 1906 et 1911 une centrale hydroélectrique à Saint-Timothée. L'ancienne voie navigable sert de canal d'amenée d'eau depuis le lac Saint-François. Le fond est dragué et les parois sont démolies. En 1948, la centrale est achetée par Hydro-Québec, qui met un terme à ses opérations en 1951.

Le nouveau canal de Beauharnois, au sud du premier, est creusé à partir de 1929. Il fait partie de la voie maritime du Saint-Laurent, inaugurée en 1959. Ce réseau de canaux, qui relie les Grands Lacs et le Saint-Laurent à l'Atlantique, est un chef-d'oeuvre du génie civil. C'est aussi l'une des routes fluviales les plus achalandées au monde.

Dans les années 1960, l'ensemble du tracé de l'ancien canal de Beauharnois est remblayé, à l'exception de trois sections dans le centre-ville de Salaberry-de-Valleyfield. Les vestiges de l'entrée inférieure, située dans la ville de Beauharnois, sont en grande partie enfouis dans le sol. Quant à l'aqueduc de la Rivière-Saint-Pierre, c'est l'unique ouvrage encore intact de l'ancien canal.

L'aqueduc de la Rivière-Saint-Pierre est classé en 2000.",Classement,2000-10-26,Site patrimonial,Ministre de la Culture et des Communications,MULTIPOINT ((-73.987278 45.295250)),16,Montérégie,Salaberry-de-Valleyfield,,1843,1844,"Transport, communication et services publics",Ouvrages de régularisation et de traitement des eaux > Aqueducs,Ministère de la Culture et des Communications,Jérémie Dubé-Lavigne,©,2012,http://www.patrimoine-culturel.gouv.qc.ca/rpcq/document/?id=218153,"MULTIPOLYGON (((-73.9892652419999 45.2945845440001,-73.9897640489999 45.29515043,-73.9880651159999 45.2955930040001,-73.9877045039999 45.2957899300001,-73.9866301039999 45.2960641590001,-73.9855861409999 45.2962342260001,-73.9855017149999 45.29624798,-73.9844107849999 45.2965870100001,-73.9843916429999 45.296557007,-73.9830181359999 45.2970025020001,-73.982535949 45.2964499110001,-73.9832580649999 45.2962189720001,-73.9883181029999 45.294812225,-73.9892652419999 45.2945845440001)))",oui,2023-07-19
Calvaire d'Oka,93537,http://www.patrimoine-culturel.gouv.qc.ca/rpcq/detail.do?methode=consulter&id=93537&type=bien,"Le calvaire d'Oka est un chemin de croix formé de sept édicules érigés entre 1740 et 1742. Les petites chapelles, en moellons crépis, sont coiffées de toits en pavillon ou à deux versants. Elles sont dotées d'ouvertures cintrées ou rectangulaires. Les quatre premières chapelles bordent un sentier de montagne et les trois autres occupent le sommet. Le calvaire est situé au coeur du parc national d'Oka, dans la municipalité d'Oka. 

Ce bien est classé site patrimonial. Des objets patrimoniaux classés sont associés au lieu.","Après la fondation de Québec en 1608, plusieurs communautés religieuses s'installent en Nouvelle-France pour répandre la parole de Dieu auprès des autochtones, et leur conversion soulève des problèmes d'ordre linguistique et culturel. Ces communautés emploient diverses techniques de persuasion, dont la constitution de missions en territoire amérindien, la traduction de textes religieux en langues autochtones et l'élaboration d'une imagerie compréhensible par les Amérindiens et compatible avec leur culture. C'est en 1717 que la seigneurie du Lac-des-Deux-Montagnes est concédée aux Sulpiciens, qui y déménagent leur mission du Sault-au-Récollet. Ils y regroupent des Amérindiens de quatre nations : Algonquins, Nipissings, Agnies et Hurons. En 1733, la mission compte environ 560 Amérindiens résidants. Le calvaire d'Oka est érigé entre 1740 et 1742, à l'initiative du sulpicien Hamon Le Guen (1687-1761), dans le but d'évangéliser les Amérindiens de la mission. Au moment de leur construction, les chapelles sont dotées de tableaux français représentant des épisodes de la Passion du Christ. Ces peintures, maintenant conservées dans l'église paroissiale de L'Annonciation à Oka, sont rapidement remplacées par des bas-reliefs polychromes en bois, qui résistent mieux au climat québécois. Six bas-reliefs ont été sculptés par François Guernon dit Belleville (vers 1740-1817) en 1775 et 1776 et l'autre par l'un des membres de l'atelier des Écores en 1816. Les chapelles à flanc de colline, qui n'avaient ni mur ni vantaux en façade à l'origine, ont été modifiées et l'ensemble a été rénové à quelques reprises au fil des ans. 

Au Moyen Âge, le pèlerinage en Palestine est très prisé des chrétiens, qui reçoivent des indulgences pour la visite des Lieux saints. Les franciscains obtiennent la garde des Lieux saints au XIIIe siècle afin de guider les pèlerins et diffusent la dévotion au chemin de croix. Au XVe siècle, l'idée de recréer les lieux de la Passion dans un environnement naturel émerge, en raison du nombre restreint de fidèles pouvant faire le pèlerinage en Palestine. La dévotion du chemin de croix connaît son apogée au XVIIIe siècle avec la prédication du franciscain saint Léonard de Port-Maurice (1676-1751) qui, entre 1731 et 1751, aurait fait ériger plus de 500 chemins de croix en Europe. Le calvaire d'Oka est le plus ancien de ce type en Amérique et précède le célèbre chemin de croix d'Ouro Prêto (Brésil), commencé vers 1758.

À la suite de tensions survenues au sujet des droits de propriété de la seigneurie du Lac-des-Deux-Montagnes, les Amérindiens désertent progressivement le calvaire d'Oka après 1867. Il devient alors un lieu de pèlerinage important, dont la popularité connaît son apogée au tournant du XXe siècle. La construction d'un quai permet, à partir de 1872, de faire venir par bateaux à vapeur de nombreux pèlerins montréalais, à l'occasion de la fête de l'Exaltation de la Sainte-Croix, le 14 septembre. En 1889, les journaux mentionnent la présence à Oka, le jour du pèlerinage, d'une foule de 30 000 personnes. Au cours du XXe siècle, ce lieu de pèlerinage perd de la popularité pour ne recevoir que 5 000 personnes en 1948 et quelques centaines à la fin des années 1960. Les bas-reliefs sont retirés des chapelles en 1970 après avoir été la proie des vandales. À cette époque, les chapelles sont aussi en mauvais état.

Le calvaire d'Oka est classé en 1982, pour être ensuite restauré. 

Les bas-reliefs sont retirés des édicules en 1970. Ils sont classés en 1973 et conservés pendant plusieurs années dans la sacristie de l'église de L'Annonciation d'Oka. En 2004, des copies réalisées par le sculpteur Georges Vincelli sont installées dans les édicules. Les oeuvres originales sont acquises en 2011 par le Musée de la civilisation.",Classement,1982-11-04,Site patrimonial,Ministre de la Culture et des Communications,MULTIPOINT ((-74.064861 45.481972)),15,Laurentides,Oka,,1740,1742,Services et institutions,"Calvaires, croix de chemin et chemins de croix",,,,,,"MULTIPOLYGON (((-74.0754618439999 45.4759000120001,-74.077124824 45.4753961230001,-74.0781535119999 45.4750844600001,-74.0807010339999 45.474312577,-74.0813793989999 45.474107024,-74.0823707399999 45.4738066250001,-74.0835704049999 45.475219581,-74.0818443489999 45.4763601550001,-74.0818558109999 45.47873114,-74.0775382979999 45.481551218,-74.0752626219999 45.483037434,-74.0686699379999 45.4873603540001,-74.0669599739999 45.4884816380001,-74.0636919099999 45.490624429,-74.0584294569999 45.4876218530001,-74.0540337259999 45.484414041,-74.0546930129999 45.4840174810001,-74.0547308609999 45.4836334700001,-74.0534298969999 45.483435349,-74.0549327099999 45.4822746930001,-74.0558688929999 45.4820924380001,-74.0559712049999 45.482231218,-74.0565262879999 45.4821016830001,-74.0564660409999 45.4819277110001,-74.0587084879999 45.481153851,-74.0598659149999 45.4807379390001,-74.0625428769999 45.479746316,-74.0708869799999 45.477321578,-74.0731139849999 45.4766193680001,-74.0733386649999 45.476550532,-74.0753502109999 45.4759342170001,-74.0753973499999 45.475919773,-74.0754618439999 45.4759000120001)))",oui,2023-07-25
Domaine Cimon,92387,http://www.patrimoine-culturel.gouv.qc.ca/rpcq/detail.do?methode=consulter&id=92387&type=bien,"Le domaine Cimon est un ancien ensemble agricole aménagé à partir de la seconde moitié du XIXe siècle. La résidence, construite entre 1862 et 1870, est une maison québécoise d'influence néoclassique. La maison en pièce sur pièce lambrissée de planches à clins, de plan rectangulaire à un étage et demi, est coiffée d'un toit à deux versants retroussés protégeant un perron occupant toute la largeur de la façade avant. Les dépendances incluent un chalet-atelier, deux hangars et deux remises. À l'exception du chalet-atelier situé en retrait, ces bâtiments sont regroupés près de la maison. L'ensemble prend place sur un vaste terrain paysager, planté de nombreux arbustes et arbres matures. Le domaine Cimon, bordé à l'est par la rivière du Gouffre, est un îlot de nature dans le noyau villageois de la ville de Baie-Saint-Paul.

Ce bien est classé site patrimonial. La protection s'applique à la maison, aux dépendances ainsi qu'au terrain.","Le domaine Cimon est inclus dans une ancienne propriété agricole vendue en 1852 par le Séminaire de Québec au marchand André Cimon (1777-1853). Connue sous le nom de ferme Saint-Aubin, celle-ci est sise entre la rivière du Gouffre et le bras du Nord-Ouest. Peu après 1852, la propriété est donnée en héritage à Marie-Anne Zoé Clément (morte en 1869), épouse du médecin René Bédard (mort en 1876). À ce moment, aucun bâtiment n'y est encore érigé. Le couple fait vraisemblablement construire la maison entre 1862 et 1870. 

En 1878, la propriété, incluant la maison et ses dépendances, est vendue au cultivateur Éphrem Gauthier dit Larouche (mort en 1898). Son beau-fils François-Xavier Cimon (mort en 1941), qui hérite par la suite du domaine, se lie d'amitié avec le peintre portraitiste américain Frederick Porter Vinton (1846-1911). Vers 1900, Cimon lui loue une partie de sa terre pour la construction d'un atelier de peinture. À la suite du départ de Vinton, l'atelier est préservé et régulièrement occupé par des artistes attirés par les beautés de Charlevoix. 

Clarence Gagnon (1881-1942), artiste québécois renommé s'étant illustré comme graveur, peintre et illustrateur, était très attaché à cette région. Entre ses nombreux séjours en Europe, il passe beaucoup de temps à Baie-Saint-Paul, où il occupe l'atelier des Cimon. Plusieurs de ses oeuvres bien connues représentent la région. D'autres artistes viennent séjourner au domaine à l'invitation de Gagnon, dont Marc-Aurèle Fortin (1888-1970), René Richard (1895-1982) et plusieurs membres du Groupe des Sept, tels qu'Alexander Young Jackson (1882-1974), Francis Hans Johnston (1888-1949), Arthur Lismer (1885-1969) et Edwin Headley Holgate (1892-1977). 

Le peintre Richard a pour sa part occupé le domaine pendant de nombreuses années. Important artiste canadien, il a exprimé dans son oeuvre la beauté sauvage du Grand Nord canadien et de Charlevoix. Originaires de Suisse, Richard et sa famille immigrent au Canada en 1909. Il passe son enfance à Cold Lake, dans le nord de l'Alberta, où il apprend les métiers de trappeur et de coureur des bois. Il découvre très tôt un intérêt pour le dessin et la peinture. Aussi, en 1927, part-il pour la France avec l'espoir de réaliser son rêve de devenir peintre. Installé à Paris, il s'inscrit à l'Académie de la Grande Chaumière. Toutefois, c'est sa rencontre avec Clarence Gagnon qui s'avère déterminante. Ce dernier devient son mentor et son grand ami. Après avoir passé trois ans à Paris, Richard rentre au Canada. Il reprend ses activités de piégeage, mais sans abandonner son travail de création. Au cours de ses expéditions, il réalise plusieurs pochades. En 1936, il renoue avec Gagnon qui est rentré au pays. Encouragé par ce dernier à visiter Baie-Saint-Paul, Richard prend pension au domaine des Cimon en 1939. Il y fait la rencontre de Blanche Cimon, la fille du propriétaire, qu'il épouse en 1942 et avec qui il s'établit sur le domaine paternel dont elle a hérité. L'artiste installe son atelier dans la maison, au-dessus de la cuisine d'été. Sur le terrain, il effectue des aménagements paysagers et profite du point de vue exceptionnel sur la rivière du Gouffre et le paysage montagneux. Au fil des années, le couple se départit de quelques lots, mais conserve l'essentiel de la propriété. De nature solitaire, Richard est demeuré toute sa vie à distance des cercles artistiques. Vers la fin des années 1960, il a rédigé ses mémoires qui ont été édités plus tard sous le titre de « René Richard, ma vie passée ». Sa vie et son parcours artistique ont inspiré à Gabrielle Roy (1909-1983), auteure et amie, son roman « La Montagne secrète », publié en 1961. Richard a illustré l'édition de luxe parue en 1975.

Le domaine Cimon est classé en 1977, déclassé puis reclassé en 1981. L'ancienne résidence abrite aujourd'hui une galerie d'art où sont exposées des oeuvres de René Richard.",Classement,1981-12-02,Site patrimonial,Ministre de la Culture et des Communications,MULTIPOINT ((-70.506056 47.443028)),03,Capitale-Nationale,Baie-Saint-Paul,58 rue Saint-Jean-Baptiste¤50 rue Saint-Jean-Baptiste,vers 1862,vers 1870,"Fonction résidentielle¤Fonction culturelle et récréative, loisir¤Fonction résidentielle",Maisons rurales et urbaines¤Autres activités culturelles¤Bâtiments paradomestiques,Ministère de la Culture et des Communications,Jean-François Rodrigue,©,2008,http://www.patrimoine-culturel.gouv.qc.ca/rpcq/document/?id=249553,"MULTIPOLYGON (((-70.5064783729999 47.4432483300001,-70.5064129029999 47.443266469,-70.5063436149999 47.4432919330001,-70.5062809699999 47.4433665510001,-70.5061959599999 47.4434869030001,-70.5051935479999 47.4436419740001,-70.5052979969999 47.4435210600001,-70.5054214999999 47.4433540240001,-70.5054335849999 47.443337678,-70.5055400159999 47.4431708450001,-70.5055959229999 47.4430584560001,-70.5062340139999 47.4429831460001,-70.5065567309999 47.4429478700001,-70.5066486419999 47.442932737,-70.5068444599999 47.442900497,-70.506958859 47.4428607770001,-70.5068394079999 47.442954091,-70.5068110529999 47.44307595,-70.5067838449999 47.443140531,-70.5067404129999 47.443186772,-70.5066904159999 47.4432100230001,-70.5064783729999 47.4432483300001)))",oui,2023-01-20
