nom_bien,bien_id,url_rpcq,description_bien,synthese_historique,statut_juridique_princ,date_attri_stat_jurid_princ,categorie,autorite_protection,Wkt_Multipoint_XY,no_regn_admin,region_admin,municipalite,adresse,debut_construction,fin_construction,usage_princ,sous_usage,detenteur_photo,auteur_photo,licence_photo,date_licence_photo,url_photo,Wkt_pg_site_classe,maj_pg_site_classe,version_wkt_pg_dateSite archéologique de la Chapelle-Notre-Dame-de-Bon-Secours,197101,http://www.patrimoine-culturel.gouv.qc.ca/rpcq/detail.do?methode=consulter&id=197101&type=bien,"Le site archéologique de la Chapelle-Notre-Dame-de-Bon-Secours est un terrain et un ensemble de vestiges dont les plus anciens remontent au Sylvicole moyen ancien (de 2400 à 1500 ans avant aujourd'hui). Le sous-sol du site renferme notamment des éléments associés à une occupation amérindienne, dont des traces de pieux et celles d'un foyer. Il recèle aussi des vestiges de l'époque de la fondation de Montréal, tels que ceux de la chapelle érigée en 1675. D'autres éléments témoignent des fonctions domestique, religieuse, militaire, scolaire et d'entreposage du lieu au cours de l'histoire. Une chapelle et un musée s'élèvent aujourd'hui sur ce terrain. Le site archéologique de la Chapelle-Notre-Dame-de-Bon-Secours présente un périmètre formant un « L » et sa superficie est d'environ 1 450 mètres carrés. Il est notamment bordé par les rues de la Commune, Bonsecours et Saint-Paul, dans l'arrondissement Ville-Marie de la ville de Montréal.

Ce bien est classé site patrimonial. La chapelle qui s'y trouve est classée immeuble patrimonial. Les 402 objets les plus significatifs qui ont été extraits du site sont classés objets patrimoniaux. Le bien est compris dans le périmètre du site patrimonial de Montréal.

Un site inscrit à l'Inventaire des sites archéologiques du Québec est associé au lieu.","La première occupation du site archéologique de la Chapelle-Notre-Dame-de-Bon-Secours remonte vraisemblablement au Sylvicole moyen ancien, soit la période qui s'étend de 2400 à 1500 ans avant aujourd'hui. Le lieu est occupé à différentes époques avant l'arrivée des Européens.

Ville-Marie est fondée en 1642. Marguerite Bourgeoys (1620-1700) s'y établit en 1653, dans le but d'y fonder une communauté religieuse enseignante non cloîtrée, qui prendra le nom de congrégation de Notre-Dame de Montréal. Dès 1655, elle évoque son souhait de dédier à la Vierge une chapelle de pèlerinage près du fort. Vers 1657, des matériaux sont amassés pour la construction de la chapelle, mais le projet demeure sans suite jusqu'en 1670. À ce moment, un petit lieu de culte en bois est érigé à quelques centaines de pas à l'est des limites de Ville-Marie. En 1675, la chapelle de bois est remplacée par un bâtiment en pierre.

Le faubourg Bonsecours se développe au cours du dernier quart du XVIIe siècle et une grande proportion de sa population est composée d'artisans. Jacques Testard de Montigny (1663-1737), un officier, fait construire sa maison en bois tout près de la chapelle, en 1693. Il la fait reconstruire en pierre en 1724. 

En 1709, les autorités royales décident d'agrandir le secteur protégé par une palissade de bois. Cette dernière est accolée à l'abside de la chapelle, qui est de ce fait intégrée dans la ville.

De 1734 à 1737, le lieu de culte est aussi utilisé par les religieuses de l'Hôtel-Dieu. À la fin de l'année 1734, neuf hospitalières meurent d'une maladie contagieuse et sont inhumées sous la chapelle.

En 1754, un violent incendie détruit complètement la chapelle. La reconstruction du lieu de culte ne constitue pas une priorité pour le clergé catholique, qui doit composer avec le contexte économique et social difficile. L'incendie ayant aussi fait disparaître la maison Testard, la propriété est vendue et l'entrepôt surnommé « La Friponne » y est construit en 1759.

Au cours des années 1760, les autorités britanniques envisagent d'acquérir des terrains dans le quartier Bonsecours, y compris celui de la chapelle, pour y construire des casernes pour les militaires, mais ce projet ne se concrétise pas.

En 1771, les Sulpiciens, la fabrique de Notre-Dame de Montréal et les paroissiens décident de reconstruire la chapelle. La cérémonie de bénédiction de la chapelle se déroule le 30 juin 1773. Les dimensions du nouveau lieu de culte sont d'environ vingt et un mètres sur quatorze, s'y ajoute un choeur polygonal d'environ dix mètres sur neuf. Un corps de logis contigu à la chapelle est construit en 1784 et 1785. L'école Bonsecours y ouvre ses portes en novembre 1838.

À la fin du XIXe siècle, la chapelle centenaire est mise au goût du jour. Une nouvelle façade est érigée contre l'ancienne et un décor peint remplace le décor sculpté de 1823. En 1893, un nouveau bâtiment est construit à la place de l'ancien corps de logis latéral, pour accueillir l'école Bonsecours. Il conserve cette vocation jusqu'en 1968.

En 1950, le premier musée Marguerite-Bourgeoys est aménagé dans la voûte sous le choeur de la chapelle, dans la foulée de la béatification de la fondatrice.

Des travaux visant à réaménager le musée dans l'ancienne école Bonsecours et à modifier le sous-sol pour accueillir des espaces de rangement et divers locaux sont amorcés à la fin de l'année 1996. Deux découvertes majeures sont rapidement faites, soit des vestiges de la préhistoire et les ruines de la chapelle incendiée en 1754. Les travaux sont revus afin de permettre la mise en valeur de ce riche patrimoine archéologique et une stratégie de fouille est établie. D'autres fouilles archéologiques sont effectuées en 2005.

Le site archéologique de la Chapelle-Notre-Dame-de-Bonsecours est classé en 2014, ainsi que les 402 objets les plus significatifs qui en ont été extraits. La chapelle et trois objets patrimoniaux qui lui sont associés sont classés au même momen",Classement,2014-11-10,Site patrimonial,Ministre de la Culture et des Communications,MULTIPOINT ((-73.551061 45.509805)),06,Montréal,Montréal,rue de la Commune Est¤ rue Saint-Paul Est,,,Non applicable,Non applicable,Andréane Beloin,,Creative Commons 4.0 (by),2019,http://www.patrimoine-culturel.gouv.qc.ca/rpcq/document/?id=286720,"MULTIPOLYGON (((-73.5510175089999 45.5101034800001,-73.5508900879999 45.5100727050001,-73.5507200029999 45.5100281200001,-73.5507989469999 45.5098775450001,-73.5509131829999 45.5096613680001,-73.5513751479999 45.5097782660001,-73.5513064539999 45.5099938330001,-73.5510497019999 45.5099612960001,-73.5510175089999 45.5101034800001)))",oui,2022-08-08
Site archéologique de la Métabetchouane,93572,http://www.patrimoine-culturel.gouv.qc.ca/rpcq/detail.do?methode=consulter&id=93572&type=bien,"Le site archéologique de la Métabetchouane est l'emplacement d'un établissement préhistorique amérindien et d'un poste de traite en fonction durant les Régimes français et anglais. Le site se compose d'un vaste terrain dégagé et au relief plat d'une superficie d'environ 2 000 mètres carrés. Il présente les vestiges d'une cheminée en pierre et les traces carbonisées d'un mur en bois et torchis. Le site archéologique se situe sur la rive ouest de la rivière Métabetchouane, sur une pointe de terre s'avançant dans le lac Saint-Jean, et fait partie de la municipalité de Chambord.

Ce bien est classé site patrimonial.","Le site archéologique de la Métabetchouane est occupé depuis 2000 ans avant aujourd'hui (période du Sylvicole moyen ancien). La présence amérindienne se traduit par des campements saisonniers où l'on pratique la chasse, la cueillette et la pêche. Cette occupation est possiblement continue, et ce, jusqu'à la période historique où les premiers contacts sont établis entre les Amérindiens et les Européens.    

En 1647, la maladie frappe durement les Amérindiens circulant sur le territoire du Saguenay-Lac-Saint-Jean. Ils requièrent les services du père jésuite Jean De Quen (1603-1659) qui se rend auprès des malades au cours de l'été. De Quen devient ainsi le premier Européen à visiter la région. Les Jésuites font d'autres incursions en ce territoire dans les années suivantes, avant la fondation, en 1676, d'un poste de traite et d'une mission à l'embouchure de la rivière Métabetchouane. La pointe de terre s'avançant dans le lac Saint-Jean sur laquelle sont implantés le poste et la mission constitue un emplacement propice : ce lieu est connu et fréquenté par les Amérindiens, sa topographie en fait un petit havre naturel à l'abri des vagues et des vents, et il se trouve à la confluence d'importantes voies de communication empruntées par les Amérindiens.

Le poste de la Métabetchouane est rattaché à la Traite de Tadoussac, établie par le gouverneur Jean de Lauson (vers 1584-1666) en 1652. La Traite de Tadoussac, également nommée Ferme du roi, peut être définie comme le privilège exclusif de chasse, de pêche et de commerce sur un certain territoire. Ces terres faisaient partie du Domaine du roi, c'est-à-dire qu'elles n'étaient pas concédées pour la colonisation et que les profits tirés de leur exploitation revenaient en principe au roi. La concession de la Traite de Tadoussac était adjugée aux enchères à un particulier ou à une compagnie qui en avait la jouissance pour un temps donné. Les comptoirs, qui occupent des endroits stratégiques en bordure d'un cours d'eau important, servent au troc des fourrures avec les Amérindiens ainsi qu'à l'entreposage, au triage et à l'emballage des pelleteries avant qu'elles soient acheminées vers les centres administratifs de la traite ou vers l'Europe.

Le poste de la Métabetchouane dépend quant à lui du poste de Chicoutimi, devenu le poste central du Domaine du roi. Combinant les fonctions de poste et de mission, l'établissement a regroupé une maison, une chapelle et une croix, construites dès 1676. Cependant, ce poste est abandonné en 1697 ou en 1700, principalement en raison de son incapacité à rivaliser avec la forte concurrence. 
 
Après la Conquête (1760), le système de la Traite de Tadoussac est maintenu par les autorités britanniques et un nouveau poste est érigé à l'embouchure de la Métabetchouane. En 1802, il passe aux mains de la Compagnie du Nord-Ouest, puis dans celles de la Compagnie de la Baie d'Hudson en 1821. Le site est finalement abandonné en 1880 au profit d'un établissement situé à Pointe-Bleue (Mashteuiatsh). 

Les premières recherches archéologiques sur ce site remontent aux années 1960. De nouvelles fouilles sont effectuées en 1983. Des recherches plus récentes (2000 à 2002) ont également fait ressortir la richesse archéologique de cet emplacement. Les vestiges architecturaux découverts correspondent à la base en pierre d'une cheminée associée à des murs carbonisés faits de bois et de torchis.

Le site archéologique de la Métabetchouane est classé en 1988.",Classement,1988-06-01,Site patrimonial,Ministre de la Culture et des Communications,MULTIPOINT ((-71.967444 48.422000)),02,Saguenay--Lac-Saint-Jean,Chambord,,1676,1676,Fonction commerciale,Postes de traite,,,,,,"MULTIPOLYGON (((-71.9663815169999 48.4225010260001,-71.9662609769999 48.4223406310001,-71.9661988049999 48.4221633700001,-71.9662164999999 48.4219759480001,-71.966256885 48.4218525480001,-71.9662828759999 48.421773133,-71.9664811139999 48.421611484,-71.9665280069999 48.421559341,-71.9665631519999 48.4215202610001,-71.9666618379999 48.4214105250001,-71.9666789169999 48.4213133790001,-71.9666776049999 48.4211217930001,-71.9669383599999 48.4211632210001,-71.9670970009999 48.421188424,-71.9673184599999 48.4212236070001,-71.9674624579999 48.4212464840001,-71.9676871799999 48.421282186,-71.9678796739999 48.4213127670001,-71.968244824 48.421370778,-71.968475699 48.4214073400001,-71.9686619219999 48.421433306,-71.9689033339999 48.4214595720001,-71.9690787609999 48.421473527,-71.9692006019999 48.4214807130001,-71.9693769819999 48.421487508,-71.9688644009999 48.4225346710001,-71.9684620309999 48.423273711,-71.9671125579999 48.4229901480001,-71.967098442 48.422973664,-71.9668166239999 48.422724509,-71.9666626799999 48.422632638,-71.9665093579999 48.422600119,-71.9663815169999 48.4225010260001)))",oui,2023-01-08
Site archéologique de la Pointe-du-Buisson,92788,http://www.patrimoine-culturel.gouv.qc.ca/rpcq/detail.do?methode=consulter&id=92788&type=bien,"Le site archéologique de la Pointe-du-Buisson correspond à un lieu d'établissement amérindien saisonnier de pêche habité régulièrement pendant cinq millénaires. Son territoire s'étend sur une superficie de 21 hectares, sur un plateau recouvert d'une érablière à caryers. Un espace déboisé occupe l'extrémité de la pointe qui inclut un laboratoire-réserve, un pavillon d'interprétation et un jardin de fossiles. Le site englobe une pointe bordée de rapides formés par la confluence de la rivière des Outaouais, du fleuve Saint-Laurent et du lac Saint-Louis. Il fait partie du secteur Melocheville de la municipalité de Beauharnois. 

Ce bien est classé site patrimonial. Il est inscrit à l'Inventaire des sites archéologiques du Québec.","En raison des forts rapides qui le bordent, le site de la Pointe-du-Buisson est un lieu de portage nécessaire et une halte idéale avant de poursuivre sa route. Ce facteur naturel et les ressources halieutiques qu'il engendre ont considérablement favorisé l'occupation du site depuis ses débuts. Bien qu'il révèle quelques traces de la période de l'Archaïque laurentien (6000-4200 ans AA), c'est à la période suivante, à l'Archaïque post-laurentien (4200-3000 AA), que des vestiges plus tangibles témoignent d'occupations domestiques amérindiennes, notamment par la présence d'une maison multifamiliale à trois foyers. Une influence des traditions culturelles dites de Lamoka et Susquehanna est perceptible à cette époque à travers l'outillage lithique trouvé sur le site. Ces traditions sont interprétées par plusieurs archéologues comme résultant de l'avancée de groupes amérindiens peuplant alors les régions plus méridionales. Les outils (harpons, hameçons, poids de filet) et les restes fauniques trouvés démontrent une économie marquée par l'exploitation du poisson de rivière.   

Au Sylvicole inférieur (3000-2400 AA), les occupants de la Pointe-du-Buisson adoptent l'usage de la poterie, tandis que l'outillage lithique est dominé par une pierre particulière nommée chert Onondaga, provenant notamment du sud de l'Ontario, que l'on se procure par l'intermédiaire de réseaux d'échanges. Cette période est aussi la seule où les habitants ont aménagé des sépultures directement sur le site. Les dépouilles carbonisées et accompagnées d'offrandes ont été recouvertes d'ocre rouge et de dalles en pierre. Le Sylvicole moyen (2400-1000 AA), surtout au cours de ses cinq derniers siècles, constitue l'époque où le site est le plus intensément fréquenté. Les habitants y ont mis au point un type de céramique et ont exploité intensivement les ressources halieutiques. Ils ont ainsi pu adopter un mode de vie semi-sédentaire et séjourner sur place de la fin de l'hiver jusqu'à l'automne. À la période suivante, les Amérindiens se sédentarisent complètement et développent une économie de production horticole. Toutefois, la culture des plantes (courge, haricot, tournesol, tabac) ou de céréales (maïs) ne semble pas avoir été faite directement sur le site. En outre, au Sylvicole supérieur (1000-500 AA), la Pointe-du-Buisson sert de lieu de campement pour les expéditions de pêche menées par les Iroquoiens vivant dans des villages du Haut-Saint-Laurent. 

De nombreux objets de traite ont été trouvés à la Pointe-du-Buisson, témoignant des premiers contacts entre Amérindiens et Européens. Faisant partie de la seigneurie de Beauharnois, le site à la période historique semble le lieu d'une occupation surtout marquée par la visite de groupes amérindiens de la région ainsi que par des Européens s'y arrêtant lors d'expéditions. Des documents historiques relatent jusqu'au XIXe siècle une présence autochtone venue pratiquer la pêche dans les environs. 

Entre 1910 et 1965, s'instaure une pêche commerciale qui prendra fin au moment de la construction d'un barrage hydroélectrique. La même année, des recherches de terrain confirment le potentiel archéologique du site.

Le site archéologique de la Pointe-du-Buisson est classé en 1975. Il a également été désigné Lieu historique national du Canada par le gouvernement fédéral en 2006. De 1977 à 2000, une trentaine de saisons de fouilles sur le terrain sont dirigées par les archéologues du Département d'anthropologie de l'Université de Montréal dans le cadre de son école de fouilles. Le Parc archéologique de la Pointe-du-Buisson, ouvert en 1986, poursuit une mission didactique en permettant au public de découvrir ce patrimoine unique mis au jour par les archéologues.",Classement,1975-10-07,Site patrimonial,Ministre de la Culture et des Communications,MULTIPOINT ((-73.966667 45.318611)),16,Montérégie,Beauharnois,333 rue Émond,,,Non applicable,Non applicable,,,,,,"MULTIPOLYGON (((-73.9650272319999 45.3186774060001,-73.9649943489999 45.3186492610001,-73.9649614679999 45.3186211160001,-73.9648754979999 45.3185332800001,-73.9647877319999 45.3184228550001,-73.9647590159999 45.318384639,-73.9646543519999 45.3183161220001,-73.9645358209999 45.3182711540001,-73.9644430819999 45.3182295430001,-73.9643503409999 45.3181879320001,-73.9642801859999 45.3181395990001,-73.9642213339999 45.3180839660001,-73.9641719219999 45.318029154,-73.9640774739999 45.3179780340001,-73.9640485989999 45.3179628930001,-73.9639862649999 45.3179200930001,-73.9639117049999 45.3178867060001,-73.9638332569999 45.3178404770001,-73.9637356969999 45.3177904920001,-73.9636422649999 45.3177499350001,-73.9635147319999 45.3177158450001,-73.9634003359999 45.3176772990001,-73.9632859399999 45.3176387520001,-73.9631973419999 45.317599826,-73.963039836 45.3175814670001,-73.9629601349999 45.3175849620001,-73.9628503729999 45.3175335010001,-73.9627571319999 45.317513094,-73.9625979819999 45.3175104960001,-73.9624397469999 45.3175095240001,-73.9622559649999 45.3175000750001,-73.9621279369999 45.31748337,-73.9620278259999 45.317443456,-73.9619277149999 45.317403541,-73.9618846999999 45.3173765230001,-73.9619128799999 45.3173366570001,-73.961944619 45.3173028890001,-73.961976337 45.3172230520001,-73.9619956879999 45.3171647340001,-73.9620041139999 45.317099742,-73.9620145589999 45.316834064,-73.9620264889999 45.3167438880001,-73.9620057819999 45.3166200410001,-73.9619693229999 45.3165403790001,-73.9619518369999 45.3164187290001,-73.9619359289999 45.3163134930001,-73.9619146369999 45.3162509090001,-73.9617397519999 45.316060457,-73.9633563949999 45.3163191130001,-73.9633798949999 45.3163227670001,-73.9633998319999 45.316325835,-73.9634196899999 45.316328856,-73.9634395389999 45.3163318460001,-73.9634594139999 45.316334806,-73.9634792819999 45.316337735,-73.9634992479999 45.316340644,-73.9635191509999 45.3163435120001,-73.9635389719999 45.316346336,-73.9635588029999 45.316349131,-73.9635787739999 45.3163519130001,-73.9635987839999 45.3163546680001,-73.9636187159999 45.3163573790001,-73.9636386379999 45.316360058,-73.9636585849999 45.316362708,-73.9636785109999 45.3163653240001,-73.9636985469999 45.316367922,-73.963718593 45.3163704880001,-73.9637384819999 45.316373002,-73.9637584549999 45.316375496,-73.9637785709999 45.3163779760001,-73.963798558 45.3163804060001,-73.9638186279999 45.316382816,-73.9638386179999 45.316385182,-73.9638585389999 45.3163875110001,-73.9638787059999 45.316389836,-73.9638987169999 45.31639211,-73.9639188099999 45.3163943630001,-73.9639388359999 45.3163965740001,-73.9639588549999 45.3163987560001,-73.9639790439999 45.3164009220001,-73.9639990779999 45.3164030400001,-73.9640191279999 45.316405128,-73.9640392629999 45.3164071940001,-73.9640593789999 45.3164092250001,-73.9640794379999 45.3164112190001,-73.9640995789999 45.31641319,-73.9641197249999 45.3164151280001,-73.9641398779999 45.3164170360001,-73.9641600269999 45.3164189110001,-73.9641801149999 45.3164207490001,-73.9642002859999 45.3164225630001,-73.964220441 45.316424344,-73.9642406119999 45.3164260940001,-73.9642607889999 45.3164278130001,-73.9642808939999 45.316429494,-73.9643010809999 45.3164311510001,-73.9643211879999 45.3164327690001,-73.9643413749999 45.3164343640001,-73.9643617289999 45.316435938,-73.9643818509999 45.3164374610001,-73.9644019849999 45.3164389560001,-73.9644222699999 45.3164404300001,-73.9644424639999 45.3164418650001,-73.9644626109999 45.3164432650001,-73.9644828319999 45.31644464,-73.9645031259999 45.3164459870001,-73.9645233539999 45.3164472970001,-73.9645435029999 45.3164485720001,-73.9645637319999 45.3164498200001,-73.9645839649999 45.316451037,-73.9646042719999 45.3164522270001,-73.9646245949999 45.3164533840001,-73.9646447569999 45.3164545020001,-73.9646649189999 45.3164555880001,-73.9646852529999 45.316456653,-73.964705578 45.3164576840001,-73.96472567 45.3164586720001,-73.9647459219999 45.3164596390001,-73.9647663389999 45.3164605800001,-73.9647865939999 45.316461481,-73.9648067729999 45.3164623490001,-73.9648271199999 45.3164631920001,-73.9648474649999 45.3164640020001,-73.9648676489999 45.316464775,-73.964887916 45.3164655210001,-73.9649081899999 45.3164662340001,-73.9649285359999 45.316466919,-73.9649488859999 45.3164675720001,-73.9649690119999 45.3164681860001,-73.9649892869999 45.316468775,-73.9650097169999 45.3164693360001,-73.965029995 45.31646986,-73.9650502769999 45.3164703530001,-73.9650705589999 45.3164708150001,-73.9650908379999 45.316471246,-73.9651111989999 45.3164716460001,-73.9651314829999 45.3164720140001,-73.9651517689999 45.3164723500001,-73.9651720559999 45.3164726540001,-73.9651923419999 45.3164729280001,-73.9652127049999 45.316473171,-73.9652330719999 45.3164733820001,-73.9652661939999 45.3164736720001,-73.9677306289999 45.3178383960001,-73.9677345369999 45.3178499130001,-73.9677391979999 45.3179029710001,-73.9678281559999 45.3179836130001,-73.9681010489999 45.3186886030001,-73.9680995109999 45.3187161310001,-73.9681074269999 45.3187419540001,-73.9681003429999 45.3187750970001,-73.9680982219999 45.3188241540001,-73.9680203269999 45.318922005,-73.9679733009999 45.3189764480001,-73.9679130399999 45.3190673620001,-73.967852778 45.319158277,-73.9678064999999 45.319209862,-73.9677602219999 45.3192614480001,-73.9676930039999 45.3193887450001,-73.967699906 45.319519637,-73.9676588259999 45.3196059030001,-73.9676038969999 45.3196619570001,-73.9675069839999 45.3197137800001,-73.9673564249999 45.3198559510001,-73.9672959619999 45.3199797290001,-73.9671496869999 45.3201402890001,-73.9670785569999 45.3201945180001,-73.9668486589999 45.320237352,-73.9667311159999 45.3202391900001,-73.9666058769999 45.320239782,-73.9665038729999 45.3202016750001,-73.9664879859999 45.3201093530001,-73.9664902989999 45.3200315290001,-73.9665320699999 45.3199380250001,-73.966522757 45.319867619,-73.9664872029999 45.319819765,-73.9663590679999 45.3197491480001,-73.9662513649999 45.3196707000001,-73.9661157339999 45.3195530570001,-73.9660016099999 45.31942968,-73.9659657399999 45.3193381010001,-73.9658873379999 45.3192461940001,-73.9657800429999 45.3192210830001,-73.9656974209999 45.3192156200001,-73.9656091579999 45.319261924,-73.9654935289999 45.3192522840001,-73.9653580149999 45.3191588920001,-73.9652723249999 45.3190994610001,-73.9652154619999 45.3190752570001,-73.9650520849999 45.319039993,-73.9650255419999 45.319011865,-73.9650151839999 45.3189918500001,-73.9650195859999 45.3189511790001,-73.9650463339999 45.318885519,-73.9650585999999 45.3188533860001,-73.9650764489999 45.3188059650001,-73.9650697289999 45.3187343230001,-73.9650272319999 45.3186774060001)))",oui,2023-03-31
