nom_bien,bien_id,url_rpcq,description_bien,synthese_historique,statut_juridique_princ,date_attri_stat_jurid_princ,categorie,autorite_protection,Wkt_Multipoint_XY,no_regn_admin,region_admin,municipalite,adresse,debut_construction,fin_construction,usage_princ,sous_usage,detenteur_photo,auteur_photo,licence_photo,date_licence_photo,url_photo,Wkt_pg_site_classe,maj_pg_site_classe,version_wkt_pg_dateSite patrimonial de la Chute-Montmorency,93580,http://www.patrimoine-culturel.gouv.qc.ca/rpcq/detail.do?methode=consulter&id=93580&type=bien,"Le site patrimonial de la Chute-Montmorency est un territoire naturel comportant des constructions à vocation touristique et récréative. 

Ce bien est classé site patrimonial. Il est constitué de la rivière et de la chute, haute de 84 mètres, d'éléments hydriques et géomorphologiques exceptionnels ainsi que d'aménagements, de structures, de bâtiments et de vestiges d'établissements agricoles du XVIIe siècle, de maisons de ferme du XVIIIe siècle, d'activités industrielles du XIXe et d'activités touristiques des XIXe et XXe siècles. Le site s'étend sur deux niveaux formés par une importante faille, soit le plateau de la rivière Montmorency et le bassin de la chute, à la hauteur du fleuve Saint-Laurent. L'escarpement est partiellement boisé.

La portion du site en amont de la chute forme un corridor long de plus de 2 km constitué de la rivière et de ses rives boisées. Elle présente des phénomènes géomorphologiques tels qu'un champ de dolines, des marmites, des dépôts de blocs erratiques, la chute des Marches-Naturelles, haute de 19 mètres et harnachée par des installations hydroélectriques, et l'entrée du réseau des grottes de Courville. À la limite nord, le site comprend les vestiges d'un moulin à scie. À cet endroit, son tracé bifurque vers l'est sur près de 1 km pour englober le lit fossilifère de la rivière Ferrée de même que l'entrée du réseau des grottes de Boischatel. Les eaux des rivières Ferrée et Montmorency sont captées par ces réseaux de grottes et forment des résurgences en plusieurs endroits.

Le secteur entre la chute et l'embouchure de la rivière couvre environ 1 km carré et englobe le parc de la Chute-Montmorency. À l'ouest de la chute, il comprend le manoir Montmorency, ses dépendances et la chute de la Dame Blanche, formée par les résurgences des grottes de Courville. Cette portion compte également les vestiges de moulins et des premières installations hydroélectriques. À l'est, il inclut un escarpement de schiste, une cédrière, des maisons datant du XVIIIe siècle ainsi qu'une redoute britannique reconstituée. Ce secteur offre des points de vue spectaculaires sur les environs.

Situé sur la rive nord du fleuve Saint-Laurent, face à l'île d'Orléans, le site patrimonial de la Chute-Montmorency est à 12 km du centre-ville de Québec. Il chevauche l'arrondissement municipal de Beauport de la ville de Québec et la municipalité de Boischatel, dont la frontière est constituée par la chute et la rivière Montmorency. Six sites archéologiques connus sont associés au lieu, qui comprend également deux immeubles patrimoniaux cités, soit les maisons Vézina (vers 1720) et Claude-Gilbert-et-Claire-Gagnon.","Le site de la Chute-Montmorency, où se concentrent une variété de phénomènes géologiques et naturels, porte les traces des activités humaines qui s'y sont déroulées.

Pendant la préhistoire, l'emplacement est fréquenté par les Amérindiens comme lieu de pêche. En 1542, Jean Fonteneau dit Alfonse (1484-1544), pilote de l'expédition de Jean-François de La Rocque de Roberval (vers 1500-1560), est le premier à utiliser la chute comme point de repère. C'est toutefois Samuel de Champlain (vers 1570-1635) qui la nomme, en 1603, en l'honneur de Charles de Montmorency (1537-1612), amiral de France.

Le territoire entourant la rivière et la chute est l'un des premiers lieux de peuplement de la Nouvelle-France. La rivière sert en effet de limite entre deux des premières seigneuries concédées, celles de Beauport (1634) et Beaupré (1636). Le secteur est alors utilisé à des fins agricoles.

Pendant le siège de Québec (1759), la rivière et la chute forment la frontière entre les campements des Français de Louis-Joseph de Montcalm (1712-1759) et des Britanniques de James Wolfe (1727-1759). Le 26 juillet, des Amérindiens dirigés par Charles-Michel Mouet de Langlade (vers 1729-1800 ou 1801) surprennent un détachement britannique commandé par Wolfe qui tente de traverser la rivière. Le 31 juillet, la bataille de Montmorency se déroule à l'ouest de la chute. Les Français repoussent alors les Britanniques qui risquent un débarquement dans la baie de Beauport.

Sous le Régime anglais, le site acquiert une vocation de villégiature. En 1780, le gouverneur sir Frederick Haldimand (1718-1791) y fait ériger sa résidence d'été, première villa palladienne au Canada et l'un des premiers domaines bourgeois de la région de Québec. Entre 1791 et 1794, la villa est louée au duc de Kent, le prince Edward Augustus (1767-1820), père de la reine Victoria (1819-1901). L'endroit est aussi visité par une population en quête de divertissement (glissade sur le pain de sucre, pique-niques) et plusieurs artistes attirés par son caractère sublime, dont James Peachey (mort en 1797), George Heriot (1759-1839) et Joseph Légaré (1795-1855). Ce lieu figure d'ailleurs parmi les sujets les plus illustrés au Québec et au Canada. Ses qualités attirent enfin quelques érudits, dont Henry David Thoreau (1817-1862) et sir James MacPherson Le Moine (1825-1912).

Entre 1797 et 1851, la villa est la propriété de Peter Patterson (1768-1851). En 1811, il achète le moulin à scie construit au pied de la chute par John Goudie (1775-1824). Dès ce moment, le bas de la chute vibre au rythme de cette industrie. George Benson Hall (1810-1876) habite la villa dès 1851 et exploite les moulins à scie qui resteront en activité jusqu'en 1892.

En septembre 1885, la Compagnie d'Éclairage Électrique de Québec et de Lévis met en service l'une des premières installations hydroélectriques au Québec, qui sert notamment à éclairer la terrasse Dufferin. La deuxième centrale Montmorency, aussi à l'avant-garde de la technologie de l'époque, est en fonction à partir de 1894. La centrale des Marches Naturelles est construite en 1905 à environ un kilomètre de la chute.

À partir des années 1880, le site acquiert une grande notoriété à des fins récréatives. L'hôtel Bureau et le Kent House Hotel, installé dans la villa en 1901, attirent les visiteurs. Le premier zoo québécois est créé en 1907. Un terrain de golf est aussi aménagé en 1915. 

En 1889, la Montmorency Cotton Manufacturing Company (plus tard la Dominion Textile) s'établit au pied de la chute. Un chemin de fer la relie à la ville. Ce complexe industriel ferme ses portes en 1985.

En 1954, la maison Montmorency est achetée par les Dominicains. En 1967, un parc est aménagé du côté est de la rivière par le gouvernement du Québec, qui acquiert le domaine six ans plus tard.

Le site patrimonial de la Chute-Montmorency est classé en 1994. Une partie du site est déclassée en 2004.",Classement,1994-12-15,Site patrimonial,Ministre de la Culture et des Communications,MULTIPOINT ((-71.144472 46.890222)),03,Capitale-Nationale,Boischatel¤Québec,,1800,1997,Non applicable,Non applicable,,,,,,"MULTIPOLYGON (((-71.1676294569999 46.9029534570001,-71.1670575709999 46.9028538470001,-71.1669539059999 46.902872894,-71.1676844639999 46.9022503030001,-71.1676323899999 46.9022193810001,-71.1675867039999 46.9022346090001,-71.167487719 46.9022669700001,-71.1673830229999 46.9022993310001,-71.1670611409999 46.9023729150001,-71.1669880919999 46.9023821950001,-71.1669048099999 46.9023914750001,-71.1668117739999 46.9023979,-71.1667560939999 46.9024045620001,-71.16662213 46.902413842,-71.1664344619999 46.9024256980001,-71.1661712229999 46.9024416820001,-71.1661233949999 46.9024426340001,-71.1660912729999 46.9024428720001,-71.1660619569999 46.9024443260001,-71.1660245879999 46.902444716,-71.1659972249999 46.902445905,-71.1659686789999 46.9024468060001,-71.1659108529999 46.9024609100001,-71.1658816419999 46.9024676180001,-71.1658623689999 46.9024740420001,-71.1658507089999 46.9024823710001,-71.1658369079999 46.902493554,-71.1658228699999 46.9025087830001,-71.1658100199999 46.9025244870001,-71.1657981229999 46.902541381,-71.1657937659999 46.9025495230001,-71.1657700449999 46.902583926,-71.16574399 46.9026181900001,-71.1657254309999 46.9026335380001,-71.1656965199999 46.902654596,-71.1656718929999 46.902669587,-71.165646551 46.902681365,-71.1656201389999 46.9026931430001,-71.1655949739999 46.902703047,-71.1655441159999 46.9027191980001,-71.165507353 46.902729192,-71.1654559569999 46.9027384720001,-71.1653936519999 46.902749069,-71.1653592319999 46.9027559610001,-71.1653074779999 46.9027620290001,-71.1652475159999 46.902768096,-71.1651807029999 46.902771197,-71.1651245689999 46.9027733550001,-71.1650686519999 46.9027735930001,-71.1649998849999 46.902769548,-71.1649394089999 46.902763613,-71.1649104179999 46.902760506,-71.1648773429999 46.902755271,-71.1648252329999 46.9027467050001,-71.1647907309999 46.90274028,-71.1647561599999 46.9027310210001,-71.1647354319999 46.9027248140001,-71.1647133979999 46.9027183890001,-71.1646964559999 46.90271225,-71.1646753269999 46.9027036370001,-71.1646541469999 46.9026936210001,-71.1646302119999 46.902682983,-71.1646102249999 46.9026737030001,-71.1645910939999 46.9026665170001,-71.1645679009999 46.9026582010001,-71.1645424099999 46.9026480050001,-71.1645060039999 46.9026367260001,-71.1644701699999 46.9026314440001,-71.164430766 46.9026261610001,-71.1644047819999 46.9026240200001,-71.164374801 46.902621878,-71.1643585249999 46.9026214500001,-71.1643408219999 46.9026213070001,-71.1643191219999 46.9026225920001,-71.16429353 46.902624841,-71.1642583029999 46.902627732,-71.1642337459999 46.902630302,-71.1641923439999 46.902636155,-71.1641732129999 46.9026385820001,-71.1641559379999 46.9026421510001,-71.1641362359999 46.902645578,-71.1641068259999 46.9026502890001,-71.1640901909999 46.9026539990001,-71.164085956 46.9026394740001,-71.1637086519999 46.9022813050001,-71.1635482569999 46.9021236180001,-71.1637865729999 46.9019022520001,-71.1644175639999 46.902230439,-71.1645504649999 46.9022995620001,-71.1649793259999 46.9022636190001,-71.1653764229999 46.902230338,-71.1656543919999 46.9022070390001,-71.1659323579999 46.902183741,-71.1662103279999 46.902160441,-71.1667006499999 46.9021193400001,-71.1669250859999 46.9021005260001,-71.1671895459999 46.9019760770001,-71.1671361189999 46.9016766930001,-71.1670924069999 46.9014317410001,-71.1682660569999 46.9012912410001,-71.1681576159999 46.900892523,-71.1673033099999 46.8999694600001,-71.1672713819999 46.8996225600001,-71.1665728579999 46.8989304790001,-71.1664250599999 46.8985674940001,-71.1657320529999 46.8980137350001,-71.1658558779999 46.8978418030001,-71.1650617729999 46.8972670790001,-71.1645899019999 46.8971010450001,-71.1628959459999 46.8957473310001,-71.1624335129999 46.895334275,-71.1607179359999 46.89453946,-71.1602338289999 46.8944834500001,-71.159236872 46.8950643570001,-71.1596084559999 46.8958118450001,-71.1600214249999 46.8970117200001,-71.1599433959999 46.8970464120001,-71.1590373139999 46.8974492630001,-71.1576848389999 46.8973019270001,-71.1574376819999 46.897275489,-71.156908498 46.8972188800001,-71.1566201249999 46.897126111,-71.1565079629999 46.8971204040001,-71.1561624309999 46.8969005880001,-71.1558578259999 46.8966913690001,-71.1558397139999 46.896690161,-71.155682968 46.8966797050001,-71.1555262219999 46.8966692480001,-71.1550615589999 46.8966382500001,-71.1547607889999 46.8966392280001,-71.1544610389999 46.8966344410001,-71.1540473849999 46.8966314690001,-71.154033894 46.8966286930001,-71.1537729499999 46.8965915250001,-71.1534989989999 46.8965525040001,-71.1531434159999 46.8965013200001,-71.1528038459999 46.8964164810001,-71.1525094739999 46.8963305500001,-71.1522182559999 46.8962396680001,-71.1522528109999 46.8961748610001,-71.1523036939999 46.8960949730001,-71.1519317639999 46.895994053,-71.1518848019999 46.8959747090001,-71.1516124299999 46.8959403960001,-71.1513643719999 46.8959091450001,-71.1511906019999 46.8958476800001,-71.1511562909999 46.89588152,-71.1506198959999 46.8955356700001,-71.1503308089999 46.8953489780001,-71.1498895279999 46.8950639940001,-71.1496938649999 46.8948567350001,-71.1494694739999 46.8946188740001,-71.1487880309999 46.8943460580001,-71.1486339889999 46.8942843730001,-71.1482955859999 46.8941488610001,-71.1482622419999 46.8941355090001,-71.1479355149999 46.8938975880001,-71.1477814169999 46.8937859600001,-71.1476279299999 46.8936739870001,-71.1474264229999 46.893521396,-71.1472687759999 46.8934020180001,-71.1471440669999 46.8933075830001,-71.1468195549999 46.893412745,-71.146813903 46.8933472960001,-71.1465105779999 46.8931184990001,-71.1471661349999 46.8929481440001,-71.1477013259999 46.8928109780001,-71.1476559709999 46.8927535020001,-71.1475998219999 46.8926885820001,-71.1475436729999 46.8926236610001,-71.1475033059999 46.8924902080001,-71.1475304599999 46.892436208,-71.147163524 46.8925672620001,-71.1467048909999 46.8927127010001,-71.1462709229999 46.892911139,-71.1458711929999 46.8931849830001,-71.1454313869999 46.8929980610001,-71.1453389689999 46.8929653910001,-71.1451755419999 46.8929045180001,-71.1447549629999 46.8928556230001,-71.1446481409999 46.8930083210001,-71.1445262689999 46.893179563,-71.1450093849999 46.8933524650001,-71.1449731099999 46.8934052880001,-71.1445008949999 46.8932207510001,-71.1444343759999 46.893319449,-71.14482813 46.8935697840001,-71.1446324759999 46.8936328490001,-71.1445158729999 46.893672532,-71.1443242349999 46.8937376740001,-71.1440457679999 46.8935148030001,-71.1418770469999 46.8918916480001,-71.1422984869999 46.8916404620001,-71.1425063199999 46.8915249010001,-71.1426619219999 46.8914383810001,-71.1426518579999 46.891423832,-71.1426797599999 46.89140416,-71.1429587689999 46.8912074400001,-71.1429056459999 46.891087348,-71.1428275789999 46.8909108660001,-71.1427514169999 46.890738689,-71.1426752539999 46.8905665120001,-71.1425762439999 46.8903426840001,-71.1424312709999 46.8900149460001,-71.1422529389999 46.8896117940001,-71.1417357119999 46.889861044,-71.1414292179999 46.8900087410001,-71.1411784549999 46.8896607090001,-71.1399726599999 46.8904209340001,-71.1399549839999 46.890432079,-71.1398330059999 46.890337904,-71.1390354009999 46.889728715,-71.1388597649999 46.889593613,-71.1388145259999 46.8895588130001,-71.1379511579999 46.8888946740001,-71.1382825059999 46.8887202490001,-71.1384743019999 46.8886192850001,-71.1387135859999 46.8884916260001,-71.1390093609999 46.8883261280001,-71.1392422209999 46.8881906300001,-71.1395473729999 46.8880057540001,-71.1397535579999 46.887875905,-71.1399384009999 46.8877559490001,-71.1401568889999 46.887609635,-71.1402826429999 46.887523108,-71.1370060089999 46.884121195,-71.1379747789999 46.8835524510001,-71.1393099719999 46.8828148910001,-71.1410780579999 46.881829499,-71.14119539 46.8821251300001,-71.1413914629999 46.8825451210001,-71.1416261219999 46.8829817320001,-71.1419521569999 46.883399426,-71.1428187309999 46.8843086080001,-71.1433464479999 46.884760987,-71.1448932849999 46.8830833550001,-71.1461019819999 46.883741576,-71.1467559289999 46.8835285920001,-71.1471303289999 46.883412971,-71.1478952309999 46.8831767570001,-71.1485939419999 46.8829609850001,-71.1487622659999 46.882909499,-71.149104442 46.8827928910001,-71.1493469209999 46.882693154,-71.1496668769999 46.882536282,-71.1501457419999 46.882259204,-71.1503929239999 46.8821169780001,-71.1507104549999 46.8819820780001,-71.1512431669999 46.8818287600001,-71.1514141799999 46.881782753,-71.1516823129999 46.8816982440001,-71.1513893369999 46.881959915,-71.1515290129999 46.8820325770001,-71.1506222519999 46.8828853950001,-71.150799892 46.8829184470001,-71.1515798959999 46.8822153250001,-71.1518441979999 46.8823582050001,-71.1517456329999 46.8824351260001,-71.1521817679999 46.8827879980001,-71.1522062719999 46.8830425360001,-71.1521177569999 46.8831168780001,-71.1520383399999 46.8832336820001,-71.1519195109999 46.8834074960001,-71.1517060369999 46.8836398480001,-71.1517242689999 46.8836959550001,-71.1517651859999 46.8838218710001,-71.1518255649999 46.8840076770001,-71.1518738439999 46.8841562440001,-71.1518854059999 46.8841956240001,-71.1519407039999 46.8843839790001,-71.1519959249999 46.8845720630001,-71.1520442059999 46.8847365110001,-71.1526259339999 46.8847130030001,-71.152745777 46.8847081590001,-71.1528356109999 46.8852254440001,-71.1528415029999 46.88525946,-71.1528659719999 46.885400706,-71.1529002929999 46.8855988120001,-71.1529029349999 46.8856140670001,-71.1528194069999 46.8856641390001,-71.1526073449999 46.8857925400001,-71.1521393439999 46.886071438,-71.1522835729999 46.8861798180001,-71.1522293579999 46.8868105060001,-71.1522839879999 46.88700814,-71.1523325139999 46.88784044,-71.1523371529999 46.8882071800001,-71.1523363289999 46.8882140480001,-71.1523354689999 46.888220914,-71.1523345719999 46.8882277770001,-71.1523336399999 46.8882346390001,-71.152332671 46.8882414970001,-71.152331666 46.888248354,-71.1523306249999 46.888255208,-71.1523295479999 46.8882620590001,-71.1523284349999 46.888268908,-71.1523272849999 46.8882757540001,-71.1523260999999 46.8882825960001,-71.1523248779999 46.888289436,-71.1523236209999 46.888296273,-71.1523223269999 46.8883031070001,-71.1523209979999 46.8883099370001,-71.1523196319999 46.8883167650001,-71.1523182309999 46.888323588,-71.1523167929999 46.8883304080001,-71.1523153199999 46.888337225,-71.15231381 46.8883440380001,-71.1523122649999 46.8883508470001,-71.1523106839999 46.8883576520001,-71.1523090669999 46.8883644530001,-71.1523074139999 46.8883712510001,-71.152305726 46.888378044,-71.1523040009999 46.8883848330001,-71.1523022409999 46.8883916170001,-71.1523004449999 46.8883983970001,-71.1522986139999 46.8884051730001,-71.1522967459999 46.888411944,-71.1522948429999 46.8884187100001,-71.1522929049999 46.8884254720001,-71.1522909299999 46.888432229,-71.1522889209999 46.888438981,-71.1522868749999 46.888445727,-71.1522847939999 46.8884524690001,-71.1522826779999 46.8884592060001,-71.1522805259999 46.888465937,-71.1522783379999 46.8884726630001,-71.1522761149999 46.8884793830001,-71.1522738569999 46.888486098,-71.1522715639999 46.888492807,-71.1522692349999 46.8884995110001,-71.1522668699999 46.8885062080001,-71.1522644709999 46.8885129000001,-71.1522620359999 46.8885195860001,-71.1522595659999 46.8885262650001,-71.1522570599999 46.8885329390001,-71.1522545199999 46.8885396060001,-71.1522518479999 46.8885480610001,-71.1522491399999 46.8885565090001,-71.152246396 46.8885649530001,-71.152243617 46.8885733910001,-71.1522408009999 46.888581823,-71.1522379499999 46.88859025,-71.1522350629999 46.8885986710001,-71.1522321409999 46.888607086,-71.1522291819999 46.8886154960001,-71.1522261879999 46.888623899,-71.1522231589999 46.8886322960001,-71.1522200929999 46.8886406880001,-71.1522169919999 46.8886490730001,-71.1522138559999 46.8886574520001,-71.152210684 46.888665824,-71.1522074759999 46.8886741910001,-71.1522042329999 46.888682551,-71.1522009549999 46.888690904,-71.1521976409999 46.888699251,-71.1521942909999 46.8887075910001,-71.1521909059999 46.8887159240001,-71.1521874859999 46.888724251,-71.1521840309999 46.888732571,-71.1521805399999 46.8887408830001,-71.1521770139999 46.8887491890001,-71.1521734529999 46.8887574880001,-71.1521698559999 46.8887657800001,-71.1521662239999 46.8887740640001,-71.1521625579999 46.8887823410001,-71.1521588559999 46.888790611,-71.1521551189999 46.888798873,-71.1521513459999 46.8888071280001,-71.1521475389999 46.8888153760001,-71.1521436969999 46.888823615,-71.1521398199999 46.8888318470001,-71.1521359079999 46.8888400710001,-71.152131961 46.8888482880001,-71.1521279799999 46.8888564960001,-71.152123963 46.8888646970001,-71.1521199119999 46.8888728890001,-71.1521158259999 46.888881074,-71.1521117049999 46.88888925,-71.1521075489999 46.8888974180001,-71.1521033589999 46.8889055770001,-71.1520991339999 46.888913728,-71.1520948749999 46.888921871,-71.1520905809999 46.8889300050001,-71.1520862519999 46.8889381310001,-71.1520818889999 46.8889462480001,-71.1520774919999 46.8889543560001,-71.1520730599999 46.8889624550001,-71.1520685939999 46.8889705460001,-71.1520640939999 46.8889786270001,-71.1520605419999 46.888985135,-71.1520569569999 46.888991634,-71.1520533379999 46.8889981240001,-71.152049685 46.8890046050001,-71.1520459979999 46.8890110780001,-71.1520422769999 46.889017541,-71.1520385229999 46.8890239950001,-71.1520347349999 46.8890304400001,-71.1520309129999 46.889036875,-71.1520270579999 46.8890433010001,-71.1520231699999 46.8890497180001,-71.1520192479999 46.8890561250001,-71.1520152919999 46.8890625220001,-71.1520113029999 46.8890689090001,-71.152007281 46.8890752870001,-71.1520032259999 46.889081655,-71.1519991369999 46.889088013,-71.1519950159999 46.889094361,-71.1519908609999 46.889100698,-71.151986673 46.889107026,-71.1519824519999 46.8891133430001,-71.1519781989999 46.8891196500001,-71.1519739119999 46.889125946,-71.1519695929999 46.8891322320001,-71.1519652399999 46.889138507,-71.1519608549999 46.8891447710001,-71.1519564379999 46.8891510240001,-71.151951988 46.8891572670001,-71.151947505 46.8891634990001,-71.15194299 46.88916972,-71.1519384419999 46.889175929,-71.1519338619999 46.8891821280001,-71.1519292499999 46.8891883150001,-71.1519246059999 46.8891944910001,-71.1519199289999 46.8892006550001,-71.1519152199999 46.889206808,-71.1519104789999 46.8892129490001,-71.1519057059999 46.889219079,-71.1519009009999 46.8892251970001,-71.1518960649999 46.8892313030001,-71.151891196 46.889237397,-71.1518862959999 46.8892434790001,-71.1518813639999 46.8892495490001,-71.1518763999999 46.8892556070001,-71.151871405 46.8892616530001,-71.1518663779999 46.889267686,-71.1518263109999 46.8893037540001,-71.1515325519999 46.8895681800001,-71.1513626229999 46.889709941,-71.1505234469999 46.8903671940001,-71.1499480149999 46.890813258,-71.1494531799999 46.891199665,-71.1494498499999 46.8912707380001,-71.1494013109999 46.8913953840001,-71.1492185519999 46.8917543860001,-71.149035722 46.891947659,-71.1488053929999 46.8920267010001,-71.1487771899999 46.8920919490001,-71.1486786519999 46.8922011010001,-71.1486166159999 46.8922349190001,-71.1486078769999 46.892307622,-71.148469744 46.8924718790001,-71.1484698209999 46.892506342,-71.1484523409999 46.892512368,-71.1484473129999 46.8925185370001,-71.1484422869999 46.8925247070001,-71.1484559499999 46.892566775,-71.1484731179999 46.8925808760001,-71.1484902869999 46.892594977,-71.1485645739999 46.8925789340001,-71.1489814709999 46.892306665,-71.1490413669999 46.8925412990001,-71.1491034159999 46.8927843640001,-71.1491516879999 46.8929734650001,-71.1493655639999 46.8930447060001,-71.1495900099999 46.8931194670001,-71.149896968 46.8932217120001,-71.1514408399999 46.8939455660001,-71.1515933049999 46.8940412300001,-71.1516908659999 46.8941611490001,-71.1522615389999 46.8948625800001,-71.1524834209999 46.8951275370001,-71.1539110979999 46.8953516820001,-71.1551576969999 46.8953088520001,-71.1560361939999 46.8950485390001,-71.1567673239999 46.8941765850001,-71.1584112929999 46.8934056400001,-71.1597711299999 46.893316095,-71.1603684039999 46.893275014,-71.1606998689999 46.8933005800001,-71.1623404669999 46.8934265730001,-71.1633175759999 46.8937018120001,-71.1633531799999 46.8939135300001,-71.1638788479999 46.8943245580001,-71.1639441199999 46.8943829630001,-71.1641191139999 46.894539556,-71.1646252379999 46.8949980620001,-71.1647291579999 46.8950919910001,-71.1649345949999 46.8952776790001,-71.1650916669999 46.8954196500001,-71.1652729239999 46.895583479,-71.1653534529999 46.8956562650001,-71.1653754659999 46.8957882300001,-71.1654194179999 46.8958764390001,-71.1655487499999 46.8959562050001,-71.1658100079999 46.8960784440001,-71.1659893579999 46.8962432660001,-71.1661699819999 46.8964074250001,-71.1663219259999 46.8965587610001,-71.1663581689999 46.896591517,-71.1664714899999 46.896706592,-71.1665172479999 46.8967344010001,-71.1666238599999 46.896818081,-71.1667344379999 46.8968957020001,-71.1669560029999 46.897051155,-71.1671819269999 46.897209741,-71.1671867859999 46.8972131520001,-71.1673474249999 46.8973286680001,-71.1675130189999 46.8974476230001,-71.1675264229999 46.897457257,-71.1676751999999 46.8975644910001,-71.1676947059999 46.897578862,-71.1678745749999 46.897711385,-71.1680544479999 46.8978439090001,-71.1682343209999 46.8979764310001,-71.1682964969999 46.89802224,-71.1683005389999 46.8980488130001,-71.1683067569999 46.898089703,-71.1683228709999 46.8981957440001,-71.1684739809999 46.8991907150001,-71.1685661739999 46.8992981800001,-71.1692832069999 46.900134419,-71.1688899619999 46.9001612160001,-71.1694208679999 46.9010894560001,-71.1694286569999 46.9011434960001,-71.1708424269999 46.90050976,-71.1709136209999 46.900969252,-71.1697570719999 46.9014876800001,-71.1696561129999 46.901532935,-71.1695703319999 46.9015713860001,-71.169495089 46.9016051130001,-71.1695984129999 46.901711817,-71.1697018849999 46.9018180200001,-71.1698117419999 46.9020029050001,-71.1698313219999 46.9020363540001,-71.1697282769999 46.9020887680001,-71.1696180719999 46.9021448250001,-71.1693508459999 46.9022807490001,-71.1694681729999 46.9023891090001,-71.1695637979999 46.9025374730001,-71.1686109299999 46.902674254,-71.1684839599999 46.90269248,-71.1685656889999 46.9027751040001,-71.1685937529999 46.90312141,-71.1676294569999 46.9029534570001)),((-71.1582393529999 46.9031140040001,-71.1580397159999 46.9020334910001,-71.1620297649999 46.9020439780001,-71.1622073489999 46.9021550590001,-71.1622883869999 46.902094198,-71.1630199489999 46.9020263620001,-71.1634023269999 46.9022217090001,-71.1636475669999 46.9024575000001,-71.1635077169999 46.9024867790001,-71.1629729189999 46.9024073590001,-71.1629374139999 46.9024100170001,-71.1629094549999 46.9024153710001,-71.1628859939999 46.902423991,-71.1628645429999 46.9024341090001,-71.1628437229999 46.9024445190001,-71.1628296009999 46.9024553990001,-71.1628125329999 46.9024728150001,-71.1627946229999 46.9024910910001,-71.1627663899999 46.9025144160001,-71.1627320979999 46.9025353950001,-71.1627155369999 46.9025430090001,-71.1626976829999 46.9025495130001,-71.1626771609999 46.9025527850001,-71.1626459299999 46.902556265,-71.1626152949999 46.9025599230001,-71.1625742489999 46.9025626000001,-71.1625409959999 46.9025641170001,-71.1624931689999 46.9025619750001,-71.1624523019999 46.902561113,-71.1624288039999 46.9025623030001,-71.1623913279999 46.9025649800001,-71.1623484979999 46.9025703330001,-71.1623145899999 46.9025810410001,-71.1622955549999 46.9025932360001,-71.1622693799999 46.902614353,-71.1622443959999 46.9026292250001,-71.1622174839999 46.9026358820001,-71.162190715 46.9026430200001,-71.1621196709999 46.9026671000001,-71.1620824499999 46.9026804960001,-71.1620402149999 46.9026929890001,-71.1619848979999 46.9027044680001,-71.1619203639999 46.9027247640001,-71.1618516419999 46.9027417680001,-71.1618195199999 46.9027459320001,-71.1617630069999 46.9027495010001,-71.161760033 46.9027506910001,-71.1617265389999 46.902751832,-71.1617058999999 46.9027524750001,-71.1616612849999 46.9027560440001,-71.1616131009999 46.902766752,-71.1616101269999 46.9027679420001,-71.1615559939999 46.9027697260001,-71.1615183549999 46.902769344,-71.1614602209999 46.9027709160001,-71.1614483239999 46.9027727010001,-71.1613997389999 46.9027884830001,-71.1613452629999 46.902803485,-71.1612969129999 46.9028171360001,-71.1612393769999 46.9028249,-71.1611489579999 46.9028475050001,-71.1611073169999 46.902855833,-71.1610442609999 46.9028927150001,-71.1609978619999 46.902922458,-71.1609538419999 46.9029557700001,-71.1609336169999 46.902980755,-71.160909822 46.903012877,-71.1608991139999 46.9030259640001,-71.1608693709999 46.9030735540001,-71.1608562839999 46.9030937790001,-71.1608408179999 46.903116384,-71.1608253509999 46.9031461270001,-71.1608086949999 46.9031841990001,-71.1607872799999 46.9032329780001,-71.1607492079999 46.9033186380001,-71.1607325519999 46.903359089,-71.1607158959999 46.9034014430001,-71.1606929949999 46.9034478230001,-71.1606745229999 46.9035207380001,-71.1606702099999 46.9035518250001,-71.1606598479999 46.9036033230001,-71.160651174 46.9036298720001,-71.1606416569999 46.903660329,-71.1606378489999 46.9036964970001,-71.1606321389999 46.9037364710001,-71.1606283319999 46.9037707360001,-71.1606131029999 46.9038354570001,-71.1606035849999 46.9038754320001,-71.1605921639999 46.9039477680001,-71.1605883429999 46.903999157,-71.1582393529999 46.9031140040001)))",oui,2023-03-31