nom_bien,bien_id,url_rpcq,description_bien,synthese_historique,statut_juridique_princ,date_attri_stat_jurid_princ,categorie,autorite_protection,Wkt_Multipoint_XY,no_regn_admin,region_admin,municipalite,adresse,debut_construction,fin_construction,usage_princ,sous_usage,detenteur_photo,auteur_photo,licence_photo,date_licence_photo,url_photo,Wkt_pg_site_classe,maj_pg_site_classe,version_wkt_pg_dateSite patrimonial des Ursulines-de-Trois-Rivières,156548,http://www.patrimoine-culturel.gouv.qc.ca/rpcq/detail.do?methode=consulter&id=156548&type=bien,"Le site patrimonial des Ursulines-de-Trois-Rivières est un ensemble conventuel de tradition catholique composé de bâtiments construits entre le tournant du XVIIIe siècle et la seconde moitié du XXe siècle. L'ensemble comprend : la maison Blanche (construite vers 1700, agrandie à plusieurs reprises), sa chapelle (construite entre 1713 et 1715, agrandie pour la dernière fois en 1897) et l'aile Saint-Joseph (entre 1870 et 1873); le pensionnat en pierre (1835 et 1836); le pensionnat du Sacré-Coeur (1882); la maison Rouge (1907); l'école normale (1908); et l'aile moderne du collège Marie-de-l'Incarnation (1961).

L'aile ouest de la maison Blanche, en maçonnerie crépie, présente un plan rectangulaire à deux étages et demi ainsi qu'un toit à deux versants droits surmonté d'un campanile. L'aile Saint-Joseph, plus récente, est dotée de caractéristiques semblables, mais est coiffée d'un toit mansardé. La chapelle, située près du centre du bâtiment, se distingue visuellement par sa façade en pierre non crépie et son dôme. Le pensionnat en pierre non crépie présente un plan rectangulaire à quatre étages incluant les combles et est couvert d'un toit à croupes. Le pensionnat du Sacré-Coeur, construit en brique rouge et affichant une ornementation abondante, présente un plan rectangulaire et est doté d'un avant-corps central. La maison Rouge et l'école normale sont aussi en brique rouge et sont coiffées d'un toit plat. L'aile moderne du collège se distingue par son plan en « Y » et son parement en brique de couleur chamois.

Les terrains formant l'ensemble comportent des jardins, de vastes surfaces gazonnées, des arbres et des stationnements. La section située immédiatement derrière la maison Blanche est entre autres occupée par un cimetière et un parterre fleuri constituant une cour plus intime. Le site occupe une large part d'un vaste îlot bordé par les rues des Ursulines, Sainte-Cécile, Hart et Saint-François-Xavier, près du fleuve Saint-Laurent, dans le coeur historique de la ville de Trois-Rivières. 

Cet ensemble est classé site patrimonial. La protection s'applique à l'extérieur des bâtiments et des structures, de même qu'aux terrains et aux aménagements paysagers. La maison Blanche, en incluant la chapelle, est classée immeuble patrimonial. Le périmètre du terrain inclut un site inscrit à l'Inventaire des sites archéologiques du Québec.

Le site patrimonial des Ursulines-de-Trois-Rivières est partiellement inclus dans le périmètre du site patrimonial de Trois-Rivières.","Le site patrimonial des Ursulines-de-Trois-Rivières est associé à l'une des communautés religieuses fondatrices de la Nouvelle-France. Des religieuses de l'ordre de Saint-Ursule s'établissent à Québec dès 1639 pour y ouvrir la première école pour filles de la colonie. En 1697, à la demande de Mgr Jean-Baptiste de La Croix de Chevrières de Saint-Vallier (1653-1727), évêque de Québec, trois ursulines de Québec fondent un monastère à Trois-Rivières et dotent la localité d'un premier établissement scolaire et d'un hôpital. Cette vocation hospitalière est inhabituelle pour les ursulines, qui, de manière générale, se consacrent uniquement à l'enseignement. 

La communauté s'établit dès le tout début du XVIIIe siècle dans un bâtiment érigé vers 1700 pour servir de résidence au gouverneur Claude de Ramezay (1659-1724). Ce couvent initial est agrandi à plusieurs reprises pour former l'actuelle maison Blanche, où se concentrent les activités des religieuses et leurs espaces de vie jusque dans les années 1830.

En plus de tenir un hôpital, les ursulines de Trois-Rivières se voient confier, en 1807, le soin des malades mentaux. À cette fin, une « loge des insensés » est bâtie en 1808. Seuls deux autres bâtiments de ce type sont connus à cette époque : l'un à Québec, l'autre à Montréal. Il s'agit d'une construction adjacente au monastère, comptant six loges aux fenêtres grillagées et aux portes doubles munies de verrous. À compter de 1845, les malades mentaux sont relogés à Beauport dans un asile nouvellement construit. La vocation hospitalière sera complètement abandonnée en 1886 en raison du manque de ressources.

À partir du deuxième tiers du XIXe siècle, plusieurs bâtiments s'ajoutent à la maison Blanche pour répondre au besoin grandissant d'espace des religieuses et de leur établissement scolaire. Ainsi, le pensionnat en pierre est inauguré en juin 1836. Le bâtiment de trois étages et demi est parfois attribué à l'abbé François-Xavier Noiseux (1748-1834), ou encore à François Routhier. Au tournant des années 1870, ce pensionnat est déjà trop petit. Pour libérer le rez-de-chaussée, qui est alors occupé par les élèves externes, un externat est érigé, de 1870 à 1873, et forme l'aile Saint-Joseph de la maison Blanche, à l'est de la chapelle.

Le pensionnat du Sacré-Coeur est pour sa part érigé en 1882, selon les plans de l'architecte Jean-Baptiste Bourgeois (1856-1930). L'architecture de cet immeuble doté d'une ornementation éclectique contraste avec celle, plus sobre, des autres bâtiments du site.

En 1897, la chapelle est agrandie selon les plans des frères Georges-Félix (1833-1901) et Joseph (1831-1901) Héroux. Le lieu de culte est notamment doté d'une nouvelle façade en pierre à bossage et d'un dôme.

La maison Rouge, destinée à loger les religieuses toujours de plus en plus nombreuses, est construite en 1907, selon les plans de l'architecte Charles Lafond. Elle doit son nom à la couleur de la brique de ses murs. 

Les religieuses de Trois-Rivières innovent dans le domaine de l'enseignement : elles ouvrent la première école normale pour fille de la Mauricie, en 1908. Le bâtiment consacré à cette fonction est aussi conçu par l'architecte Lafond. 

À compter de 1935, les Ursulines offrent aussi aux filles le cours classique, jusque-là réservé aux garçons, donnant ainsi naissance au collège Marie-de-l'Incarnation. L'aile moderne de celui-ci est érigée en 1961.

Le site patrimonial de Trois-Rivières, déclaré en 1964, inclut la maison Blanche.

En 1968, les Ursulines cessent d'offrir l'enseignement collégial. Le collège Marie-de-l'Incarnation devient une école primaire et secondaire privée. 

À partir de 2003, différentes interventions archéologiques permettent de documenter l'occupation du site depuis le XVIIe siècle et de localiser des bâtiments aujourd'hui disparus, comme la boulangerie et « la loge des insensés ».

Le site patrimonial des Ursulines-de-Trois-Rivières est classé en 2017.",Classement,2017-10-05,Site patrimonial,Ministre de la Culture et des Communications,MULTIPOINT ((-72.537038 46.345275)),04,Mauricie,Trois-Rivières,694 rue des Ursulines¤725 rue Hart¤165 rue Sainte-Cécile¤784 rue des Ursulines¤734 rue des Ursulines¤700 rue des Ursulines,,,Non applicable,Non applicable,Ministère de la Culture et des Communications,Olivier Thériault,©,2022,http://www.patrimoine-culturel.gouv.qc.ca/rpcq/document/?id=356678,"MULTISURFACE (CURVEPOLYGON (COMPOUNDCURVE ((-72.5355337159999 46.3451433710001,-72.5351087459999 46.344782427,-72.5351074259999 46.3447813290001,-72.5351061349999 46.3447802160001,-72.5351048709999 46.3447790880001,-72.5351036359999 46.344777945,-72.5351024299999 46.3447767870001,-72.5351012529999 46.3447756150001,-72.5351001059999 46.3447744280001,-72.5350989889999 46.3447732280001,-72.5350979009999 46.344772015,-72.5350968449999 46.3447707890001,-72.5350958189999 46.3447695510001,-72.5350948239999 46.3447683000001,-72.535093861 46.344767038,-72.5350929299999 46.344765764,-72.5350920299999 46.344764479,-72.5350911639999 46.344763184,-72.5350903289999 46.344761878,-72.5350895279999 46.344760562,-72.53508876 46.3447592370001,-72.5350880239999 46.3447579030001,-72.5350873229999 46.3447565610001,-72.5350866549999 46.3447552100001,-72.5350860209999 46.3447538510001,-72.535085422 46.3447524850001,-72.5350848559999 46.344751112,-72.5350843259999 46.3447497320001,-72.5350838289999 46.3447483470001,-72.5350833679999 46.3447469550001,-72.5350829419999 46.3447455580001,-72.5350825499999 46.344744156,-72.5350821939999 46.3447427500001,-72.5350818729999 46.34474134,-72.5350815879999 46.3447399250001,-72.5350813379999 46.344738508,-72.5350811229999 46.344737088,-72.5350809449999 46.3447356660001,-72.5350808009999 46.3447342410001,-72.5350806939999 46.344732815,-72.5350806229999 46.3447313890001,-72.5350805869999 46.344729961,-72.5350805859999 46.3447285330001,-72.535080622 46.3447271060001,-72.5350806939999 46.3447256790001,-72.5350808009999 46.344724253,-72.5350809439999 46.344722828,-72.535081122 46.3447214060001,-72.535081337 46.3447199860001,-72.5350815859999 46.3447185690001,-72.5350818719999 46.3447171540001,-72.5350821919999 46.344715744,-72.5350825479999 46.3447143380001,-72.5350829399999 46.3447129360001,-72.5350833659999 46.3447115390001,-72.5350838269999 46.3447101470001,-72.5350843229999 46.344708761,-72.5350848539999 46.3447073820001,-72.5350854189999 46.344706009,-72.5350860179999 46.3447046420001,-72.5350866519999 46.344703284,-72.5350873189999 46.3447019330001,-72.5350880209999 46.3447005900001,-72.5350887559999 46.3446992560001,-72.5350895239999 46.344697931,-72.5350903249999 46.3446966160001,-72.5350911589999 46.3446953100001,-72.5350920259999 46.3446940140001,-72.5350929249999 46.3446927300001,-72.5350938559999 46.3446914560001,-72.5350948189999 46.3446901930001,-72.5350958139999 46.3446889420001,-72.5350968389999 46.3446877040001,-72.5350978959999 46.3446864780001,-72.5350989829999 46.3446852640001,-72.5351000999999 46.3446840650001,-72.5351012469999 46.3446828780001,-72.5351024239999 46.3446817060001,-72.5351036299999 46.344680548,-72.5351048649999 46.344679404,-72.5351061279999 46.3446782760001,-72.5351074199999 46.3446771630001,-72.535108739 46.344676066,-72.5351100849999 46.3446749840001,-72.5351114579999 46.3446739190001,-72.5351128579999 46.3446728710001,-72.5351142839999 46.34467184,-72.5351157349999 46.3446708260001,-72.5351172119999 46.3446698290001,-72.5351187129999 46.3446688510001,-72.5351202389999 46.3446678910001,-72.5351217889999 46.344666949,-72.5359641249999 46.3441783870001,-72.5361382219999 46.3440933830001,-72.5365238269999 46.3439738600001,-72.5368404809999 46.3438951840001,-72.5368467069999 46.3438915350001,-72.5371107249999 46.3441192340001,-72.5372535739999 46.3440361230001,-72.5373967779999 46.344164435,-72.5373858279999 46.3441701740001,-72.5374479349999 46.3442289020001,-72.5375896869999 46.3443633990001,-72.5377553079999 46.3445208140001,-72.5380534729999 46.3443537640001,-72.5381576959999 46.3444517810001,-72.537749587 46.3446599050001,-72.5381268939999 46.3450147440001,-72.5380631259999 46.3450472640001,-72.5383600479999 46.345326501,-72.5385626589999 46.3452231730001,-72.5387172619999 46.3453597450001,-72.5387226369999 46.3453644950001,-72.5388639039999 46.345504959,-72.5389370639999 46.345643797,-72.5389958329999 46.3456982740001,-72.5384417669999 46.3460203370001,-72.5374008879999 46.3466253510001),CIRCULARSTRING (-72.5374008879999 46.3466253510001,-72.5373939203804 46.3466288921992,-72.5373912879999 46.346630055),CIRCULARSTRING (-72.5373912879999 46.346630055,-72.5373787562826 46.3466343104424,-72.5373712459999 46.346635979),CIRCULARSTRING (-72.5373712459999 46.346635979,-72.5373645348991 46.3466370700036,-72.5373577679999 46.346637732),CIRCULARSTRING (-72.5373577679999 46.346637732,-72.5373545102552 46.34663789675,-72.5373512489999 46.346637962),CIRCULARSTRING (-72.5373512489999 46.346637962,-72.5373454049963 46.3466378291891,-72.5373395769999 46.346637377),CIRCULARSTRING (-72.5373395769999 46.346637377,-72.5373360886084 46.3466370337964,-72.5373326149999 46.3466365640001),CIRCULARSTRING (-72.5373326149999 46.3466365640001,-72.5373295814821 46.3466360472731,-72.5373265659999 46.3466354340001),CIRCULARSTRING (-72.5373265659999 46.3466354340001,-72.5373233423504 46.3466346491461,-72.537320157 46.346633721),CIRCULARSTRING (-72.537320157 46.346633721,-72.5373155883217 46.3466323104239,-72.5373111069999 46.3466306430001),CIRCULARSTRING (-72.5373111069999 46.3466306430001,-72.5373079670164 46.3466293593569,-72.5373048859999 46.3466279400001),CIRCULARSTRING (-72.5373048859999 46.3466279400001,-72.5373009608736 46.3466258870755,-72.5372971589999 46.3466236140001),CIRCULARSTRING (-72.5372971589999 46.3466236140001,-72.5372954805191 46.3466225134761,-72.5372938309999 46.34662137),CIRCULARSTRING (-72.5372938309999 46.34662137,-72.5372915725816 46.34661969874,-72.5372893759999 46.3466179470001),(-72.5372893759999 46.3466179470001,-72.5355337159999 46.3451433710001))))",oui,2022-08-08
Site patrimonial du Banc-de-Pêche-de-Paspébiac,93319,http://www.patrimoine-culturel.gouv.qc.ca/rpcq/detail.do?methode=consulter&id=93319&type=bien,"Le site patrimonial  du Banc-de-Pêche-de-Paspébiac est un complexe industriel de pêche à la morue aménagé du XVIIIe au XXe siècle. Cet établissement se compose de douze bâtiments (huit en bois de facture vernaculaire, deux en pierre de facture simple et deux de facture plus moderne) et d'une structure en béton. Il comporte une poudrière de pierre (1788); trois « cook-room » et le hangar Robin (début XIXe siècle); un entrepôt de la compagnie Le Boutillier (entre 1845 et 1850); un hangar à farine, une charpenterie et une forge (avant 1870); un « office » de pierre (fin du XIXe siècle); une usine à poisson et un frigo (XXe siècle) ainsi qu'une ancienne chambre forte de béton. Le complexe industriel est situé sur le barachois de Paspébiac, dans la ville du même nom.

Ce bien est classé site patrimonial. Un site inscrit à l'Inventaire des sites archéologiques du Québec est associé au lieu.","Le site patrimonial du Banc-de-Pêche-de-Paspébiac est d'abord fréquenté par les Amérindiens. Des Basques et des Français pêchent probablement près de la côte dès le XVIe siècle. Il est possible que des postes soient aménagés par les pêcheurs au XVIIe siècle. En 1707, la seigneurie de Paspébiac est concédée à Pierre Haimard (1674-1724), marchand, juge prévôt de la seigneurie Notre-Dame-des-Anges et substitut du procureur général au Conseil supérieur. Son beau-fils Louis Gosselin s'établit à Paspébiac et y fait construire les infrastructures nécessaires à l'exploitation des ressources halieutiques. En 1758, les diverses installations utilisées pour les activités de pêche ainsi que le domaine seigneurial sont détruits par les troupes britanniques. 

Les activités reprennent en 1767, quand Charles Robin (1743-1824) vient faire la pêche et le séchage de la morue sur le barachois de Paspébiac, dans la baie des Chaleurs. Robin retourne à Jersey en 1778, au moment où l'établissement de Paspébiac est la proie de corsaires durant la guerre d'Indépendance américaine. Aussi ne subsiste-t-il aucun bâtiment témoignant de cette période d'activité.

Charles Robin revient à Paspébiac en 1783, après la fondation de la compagnie portant son nom. Il met en place un système de gestion basé sur le crédit et le paiement en nature. Le complexe de pêche prend rapidement de l'envergure et plusieurs bâtiments sont érigés pour la compagnie Charles Robin, puis pour la compagnie Le Boutillier fondée en 1833 par l'un des employés des Robin.

La poudrière en pierre est bâtie en 1788, à une époque où la compagnie Robin est en pleine expansion, et elle constitue aujourd'hui le plus ancien bâtiment de l'ensemble. Deux des trois « cook-room » auraient été érigés vers 1800. À l'origine, on y prépare et sert les repas aux engagés de la compagnie Robin mais par la suite, au XXe siècle, ils sont utilisés comme entrepôts puis comme salles à manger pour les employés de l'usine de transformation de poisson adjacente. L'entrepôt de la compagnie Le Boutillier est construit entre 1845 et 1850. Cette imposante construction de bois, qui sert à la transformation de la morue, demeure l'un des plus intéressants bâtiments du site. Le hangar à farine, la charpenterie et la forge, quant à eux, ont été bâtis avant 1870. La charpenterie et la forge servent à l'entretien de l'équipement de pêche et emploient plusieurs artisans spécialisés de la baie des Chaleurs ou de Paspébiac. L'« office », en pierre comme la poudrière, aurait été érigé pour servir de bureau à la compagnie Le Boutillier. Le bâtiment est ensuite transformé en usine d'extraction d'huile de foie de morue. Quant à l'usine à poisson et au frigo, ce sont des constructions du XXe siècle.

À la suite de l'apparition des coopératives de pêcheurs à partir des années 1920, la compagnie Robin change de vocation. Elle exploite désormais des magasins généraux. En 1964, un incendie détruit la plupart des 70 bâtiments encore debout.

Le site patrimonial du Banc-de-Pêche-de-Paspébiac est classé en 1981 afin de préserver les bâtiments qui ont échappé à l'incendie. Depuis, plusieurs immeubles ont été restaurés et accueillent un centre d'interprétation de l'histoire de l'industrie de la pêche en Gaspésie.",Classement,1981-07-17,Site patrimonial,Ministre de la Culture et des Communications,MULTIPOINT ((-65.254250 48.021194)),11,Gaspésie--Îles-de-la-Madeleine,Paspébiac,3e Rue,,,Production et extraction de richesses naturelles,Pêcheries fixes,Ministère de la Culture et des Communications,Jean-François Rodrigue,©,2008,http://www.patrimoine-culturel.gouv.qc.ca/rpcq/document/?id=354539,"MULTIPOLYGON (((-65.2589760383803 48.0237767809983,-65.2580479023161 48.0238137148782,-65.2573981871475 48.0238542915978,-65.2561769875222 48.023929267469,-65.2560002908639 48.0239980983869,-65.2557213394251 48.0240358139803,-65.2550009249617 48.0226742821752,-65.2547653856935 48.0222291298065,-65.2547872928864 48.0219581687181,-65.2532416473015 48.0212495727412,-65.2523722633383 48.0208195848024,-65.251139198158 48.0200338979372,-65.2508761919685 48.01975560965,-65.2499002695112 48.0190001822913,-65.2513076861641 48.018321409167,-65.2525012930053 48.0192324758353,-65.2536565457794 48.0198473023715,-65.253373361894 48.0200649231983,-65.253755523056 48.0202023753139,-65.2543910543009 48.0196915963895,-65.2566151274717 48.0209592929346,-65.2564579021206 48.0212033339504,-65.25597886153 48.0214489826266,-65.2561047865953 48.0215879638221,-65.2573281262665 48.0220248907432,-65.2572631937435 48.0221871321581,-65.2575687994677 48.0222846195734,-65.2580838345033 48.022370709647,-65.2594713404335 48.0227657217108,-65.2600626151561 48.0229061195794,-65.2611821361996 48.0233575824898,-65.2616449567376 48.0234492114284,-65.2624109092025 48.0235419530472,-65.2592873241672 48.0236708329769,-65.2589760383803 48.0237767809983)))",non,2013-03-27
